Khu vực,Tiêu đề,Giá (triệu),Diện tích (m²),Giá/m² (triệu),Vị trí,Ngày đăng,Cắt lỗ?,Link
Hà Đông,"(Góc độc quyền) tìm mua căn hộ 3PN (117m2), slot xe, hướng ĐN - Với 8.5 tỷ (có thương lượng)",8500.0,111.4,76.3016157989228,P. Mỗ Lao (P. Hà Đông mới),Đăng hôm nay,,https://batdongsan.com.vn/ban-can-ho-chung-cu-phuong-mo-lao-seasons-avenue/goc-doc-quyen-tim-mua-3pn-117m2-slot-xe-huong-dn-voi-8-5-ty-co-thuong-luong-pr44316185
Hà Đông,"Bán CC đẹp 2PN 2WC tại CT4B Xa La, 5,2 tỷ, 67,8 m2",5200.0,67.8,76.69616519174042,P. Phúc La (P. Hà Đông mới),Đăng hôm nay,,https://batdongsan.com.vn/ban-can-ho-chung-cu-pho-phung-hung-1-phuong-phuc-la-khu-do-thi-moi-xa-la/ban-cc-dep-2pn-2wc-tai-ct4b-5-2-ty-69-8-m2-pr45090624
Hà Đông,"Bán căn penthouse 70m² giá tốt. Nhà hướng mát, cực thoáng mùa hè",2550.0,70.0,36.42857142857143,P. Kiến Hưng,Đăng hôm nay,,https://batdongsan.com.vn/ban-can-ho-chung-cu-phuong-kien-hung-khu-do-thi-thanh-ha-muong-thanh/mua-he-en-mua-huongthoang-mat-pr45269794
Hà Đông,"Bán CC CT4C 2PN, full nội thất đẹp, nhiều tiện ích tại KĐT Xa La, 3,7 tỷ, 52,3m2 LH0973 705 ***",3700.0,52.3,70.74569789674952,P. Phúc La (P. Hà Đông mới),Đăng hôm qua,,https://batdongsan.com.vn/ban-can-ho-chung-cu-pho-phung-hung-1-phuong-phuc-la-khu-do-thi-moi-xa-la/ban-cc-ct4c-2pn-full-noi-that-ep-nhieu-tien-ich-tai-k-t-3-7-ty-52-3m2-lh-0973705776-pr45235126
Hà Đông,Độc quyền duplex An Bình Homeland giá chỉ từ 10 tỷ,10000.0,135.0,74.07407407407408,P. Dương Nội,Đăng hôm qua,,https://batdongsan.com.vn/ban-can-ho-chung-cu-phuong-duong-noi-an-binh-homeland/oc-quyen-duplex-gia-chi-tu-10-ty-pr45295497
Hà Đông,"Bán căn hộ 65m2 view hồ Thiên Nga, công viên cây xanh, nội thất đẹp, giá tốt nhất0982 155 ***",3100.0,65.0,47.69230769230769,P. Kiến Hưng,Đăng hôm qua,,https://batdongsan.com.vn/ban-can-ho-chung-cu-phuong-kien-hung-khu-do-thi-thanh-ha-muong-thanh/ban-65m-view-thien-nga-cong-vien-cay-xanh-noi-that-ep-gia-tot-nhat-0982155548-pr45290679
Hà Đông,"CHÍNH CHỦ CẦN BÁN CĂN HỘ 50,9m 2PN-2VS FULL NỘI THẤT - THIẾT BỊ",4100.0,50.9,80.55009823182712,P. Kiến Hưng,Đăng hôm qua,,https://batdongsan.com.vn/ban-can-ho-chung-cu-duong-hoang-cong-phuong-kien-hung-mipec-city-view/chinh-chu-ban-50-9m-2pn-2vs-full-noi-that-thiet-bi-pr45288657
Hà Đông,Độc quyền quỹ căn chuyển nhượng giá siêu tốt Parc Regent - Parkcity Hanoi,12950.0,111.0,116.66666666666667,P. La Khê (P. Dương Nội mới),Đăng 2 ngày trước,,https://batdongsan.com.vn/ban-can-ho-chung-cu-phuong-la-khe-parc-regent/doc-quyen-quy-chuyen-nhuong-gia-sieu-tot-parkcity-hanoi-pr44845038
Hà Đông,"Bán căn 2228 CT1, 103m2, chung cư The Pride - Hà Đông, Hà Nội",6800.0,102.8,66.147859922179,P. La Khê (P. Hà Đông mới),Đăng 2 ngày trước,,https://batdongsan.com.vn/ban-can-ho-chung-cu-duong-to-huu-phuong-la-khe-the-pride/ban-2228-ct1-103m2-ha-ong-ha-noi-pr45245706
Hà Đông,"Chính chủ bán căn góc 3 ngủ full nội thất mới, nhà thiết kế hiện đại, sang trọng.",4600.0,80.0,57.5,P. Kiến Hưng,Đăng 3 ngày trước,,https://batdongsan.com.vn/ban-can-ho-chung-cu-phuong-kien-hung-khu-do-thi-thanh-ha-muong-thanh/chinh-chu-ban-goc-3-ngu-full-noi-that-moi-nha-thiet-ke-hien-ai-sang-trong-pr45275678
Hà Đông,Độc quyền quỹ căn cần bán giá tốt nhất tại chung cư Park Kiara với giá tốt nhất,9300.0,82.0,113.41463414634147,P. La Khê (P. Dương Nội mới),Đăng 3 ngày trước,,https://batdongsan.com.vn/ban-can-ho-chung-cu-duong-le-trong-tan-phuong-la-khe-park-kiara/doc-quyen-quy-can-ban-gia-tot-nhat-tai-voi-gia-tot-nhat-pr42118287
Hà Đông,CĂN HỘ HIẾM - GIÁ ĐẦU TƯ NGAY MẶT PHỐ TRẦN PHÚ  NGUYỄN TRÃI | 79m2 | 2PN | CHỈ HƠN 5 TỶ,5380.0,79.0,68.10126582278481,P. Văn Quán (P. Hà Đông mới),Đăng 3 ngày trước,,https://batdongsan.com.vn/ban-can-ho-chung-cu-duong-tran-phu-phuong-van-quan-15/hiem-gia-au-tu-ngay-mat-pho-nguyen-trai-79m2-2pn-chi-hon-5-ty-pr45268592
Hà Đông,"Em Minh chuyên quỹ hàng Kepler Land Hà Đông, quỹ căn lớn, giá tốt nhất thị trường",4650.0,46.0,101.08695652173913,P. Mỗ Lao (P. Hà Đông mới),Đăng 4 ngày trước,,https://batdongsan.com.vn/ban-can-ho-chung-cu-duong-vu-trong-khanh-phuong-mo-lao-thap-doi-kepler-land/em-minh-chuyen-chuyen-nhuong-ha-ong-quy-a-dang-gia-tot-nhat-thi-truong-pr45168608
Hà Đông,Chính chủ em cần bán chung cư HH2E Xuân Mai 71.6m2 sổ đỏ giá 4.55 tỷ nôi thất cực đẹp,4550.0,71.6,63.54748603351956,P. Dương Nội,Đăng 4 ngày trước,,https://batdongsan.com.vn/ban-can-ho-chung-cu-duong-to-huu-phuong-duong-noi-xuan-mai-sparks-tower/chinh-chu-em-ban-hh2e-71-6m2-so-o-gia-4-55-ty-that-cuc-ep-pr45263104
Hà Đông,"Chính chủ bán căn hộ đẹp, view đẹp, ban công siêu rộng",18700.0,145.19,128.7967490874027,P. La Khê (P. Dương Nội mới),Đăng 5 ngày trước,,https://batdongsan.com.vn/ban-can-ho-chung-cu-phuong-la-khe-parc-regent/chinh-chu-ban-ep-view-ep-ban-cong-sieu-rong-pr45257704
Hà Đông,Quỹ Căn Giá Tốt Hiện Đang Bán Tại Chung Cư Park Kiara - Khu Đô Thị Park City Hà Nội,,60.0,,P. La Khê (P. Dương Nội mới),Đăng 6 ngày trước,,https://batdongsan.com.vn/ban-can-ho-chung-cu-duong-le-trong-tan-phuong-la-khe-park-kiara/ban-gap-penhouse-200m2-trang-bi-day-du-noi-that-dep-o-kiara-pr42511495
Hà Đông,Em Tuyết đang có quỹ căn chuyển nhượng tòa KEPLER LAND giá cực tốt,,45.6,,P. Mỗ Lao (P. Hà Đông mới),Đăng 1 tuần trước,,https://batdongsan.com.vn/ban-can-ho-chung-cu-phuong-mo-lao-thap-doi-kepler-land/em-tuyet-ang-co-quy-chuyen-nhuong-toa-gia-cuc-tot-pr45245146
Hà Đông,"Bán căn 91.6m2 view hồ Văn Quán, bàn giao quý 1/2026",5600.0,91.6,61.1353711790393,P. Văn Quán (P. Thanh Liệt mới),Đăng 1 tuần trước,,https://batdongsan.com.vn/ban-can-ho-chung-cu-duong-tran-phu-phuong-van-quan-grand-sunlake/ban-92m-view-ban-giao-quy-1-2025-pr44235668
Hà Đông,Cập nhật quỹ căn chuyển nhượng đang bán RẺ nhất tại The Pride - Tố Hữu - Hà Đông,,102.0,,P. La Khê (P. Hà Đông mới),Đăng 1 tuần trước,,https://batdongsan.com.vn/ban-can-ho-chung-cu-duong-to-huu-phuong-la-khe-the-pride/cap-nhat-quy-chuyen-nhuong-2-3pn-moi-nhat-ha-dong-pr42668745
Hà Đông,"Bán căn góc 3PN 2VS DT: 115.6m2 tại Usilk City, giá 7,55 tỷ",7550.0,115.6,65.31141868512111,P. La Khê (P. Dương Nội mới),Đăng hôm nay,,https://batdongsan.com.vn/ban-can-ho-chung-cu-duong-to-huu-phuong-la-khe-usilk-city/ban-goc-3pn-2vs-dt-115-6m2-tai-gia-7-55-ty-pr45305362
Hà Đông,"Bán 05 Căn CC Usilk Văn Khê - 100m 3Pn full đồ, tầng đẹp, hướng mát, có lốt xe. Giá chỉ hơn 6 tỷ",6350.0,100.0,63.5,P. La Khê (P. Hà Đông mới),Đăng hôm nay,,https://batdongsan.com.vn/ban-can-ho-chung-cu-phuong-la-khe/cc-ban-05-cc-usilk-van-100m-3pn-full-o-tang-ep-huong-mat-co-not-xe-gia-chi-hon-6-ty-pr45296077
Tây Hồ,"PKD CĐT thông báo! Quỹ căn 2PN, 3PN, 4PN, Duplex - Heritage West Lake view Hồ Tây giá tốt. T03/2026",,180.0,,·P. Phú Thượng (P. Hồng Hà mới),Đăng hôm qua,,https://batdongsan.com.vn/ban-can-ho-chung-cu-duong-lac-long-quan-phuong-phu-thuong-1-heritage-west-lake/pkd-cdt-thong-bao-quy-2pn-3pn-4pn-duplex-view-tay-gia-tot-t03-2025-pr42291037
Tây Hồ,"Duy nhất 1 căn Duplex view trọn Sông Hồng, Cầu Nhật Tân giá đợt đầu Noble Tây Hồ tầng đẹp",27800.0,147.7,188.21936357481383,·P. Phú Thượng,Đăng 4 ngày trước,,https://batdongsan.com.vn/ban-can-ho-chung-cu-phuong-phu-thuong-1-noble-crystal-tay-ho/duy-nhat-1-duplex-view-tron-song-hong-cau-nhat-tan-gia-ot-au-tang-ep-pr45263041
Tây Hồ,Duy nhất căn Sky Villa sân vườn đẳng cấp nhất Noble Tây Hồ được vận hành 5* bởi WorldHotels,61000.0,285.0,214.03508771929825,·P. Phú Thượng,Đăng 6 ngày trước,,https://batdongsan.com.vn/ban-can-ho-chung-cu-phuong-phu-thuong-1-noble-crystal-tay-ho/duy-nhat-sky-villa-san-vuon-ang-cap-nhat-uoc-van-hanh-5-boi-worldhotels-pr45256011
Tây Hồ,"Bán căn 3 ngủ Sunshine Riverside - 92,7m2 - Giá: 8.8 tỷ - View nội khu + bể bơi - Sổ đỏ",8800.0,92.7,94.92988133764833,P. Phú Thượng,Đăng hôm nay,,https://batdongsan.com.vn/ban-can-ho-chung-cu-duong-vo-chi-cong-phuong-phu-thuong-1-sunshine-riverside/ban-3-ngu-92-7m2-gia-9-3-ty-view-noi-khu-be-boi-so-do-pr44869064
Tây Hồ,Bán căn 3 ngủ - 99.1m2 Sunshine Riverside - 2 ban công - Tầng trung view sông + cầu NT + nội khu,9600.0,99.1,96.87184661957619,P. Phú Thượng,Đăng hôm nay,,https://batdongsan.com.vn/ban-can-ho-chung-cu-phuong-phu-thuong-1-sunshine-riverside/ban-3-ngu-100m2-2-ban-cong-tang-trung-view-song-cau-nt-noi-khu-pr44899618
Tây Hồ,"Bán căn 3 ngủ Sunshine Riverside - 83,8 m2 - Tầng trung view sông + Cầu Nhật Tân - 8,2 tỷ (full đồ)",8200.0,83.8,97.85202863961814,P. Phú Thượng,Đăng hôm nay,,https://batdongsan.com.vn/ban-can-ho-chung-cu-phuong-phu-thuong-1-sunshine-riverside/ban-3-ngu-83-8-m2-tang-trung-view-song-cau-nhat-tan-8-4-ty-full-o-pr45186649
Tây Hồ,Bán căn 81.7 m2 Sunshine Riverside - View cầu + sông - Full đồ rời đầy đủ - Sổ đỏ - 8.3 tỷ,8300.0,81.7,101.59118727050183,P. Phú Thượng (P. Hồng Hà mới),Đăng hôm nay,,https://batdongsan.com.vn/ban-can-ho-chung-cu-duong-vo-chi-cong-phuong-phu-thuong-1-sunshine-riverside/ban-82m2-view-cau-song-full-do-roi-day-du-so-do-nhinh-8-ty-pr44982836
Tây Hồ,Bán căn Sunshine Riverside - 64.1m2 thông thủy - 2 ngủ view sông - Giá: 7.04tỷ (Sổ đỏ) - tầng cao,7040.0,64.1,109.82839313572543,P. Phú Thượng,Đăng hôm qua,,https://batdongsan.com.vn/ban-can-ho-chung-cu-phuong-phu-thuong-1-sunshine-riverside/ban-64-1m2-thong-thuy-2-ngu-view-song-gia-7-04ty-so-o-tang-cao-pr45266265
Tây Hồ,"Bán căn chung cư 72,9 m2 tại Tây Hồ Riverview, view sông Hồng đẹp - thoáng mát. Sổ đỏ trao tay",6500.0,72.9,89.16323731138546,P. Phú Thượng (P. Hồng Hà mới),Đăng hôm qua,,https://batdongsan.com.vn/ban-can-ho-chung-cu-pho-thuong-thuy-phuong-phu-thuong-1-tay-ho-river-view/chinh-chu-ban-72-9-m2-toa-riverview-song-hong-dep-thoang-mat-pr43748578
Tây Hồ,"Bán căn 4 ngủ Sunshine Riverside (Tây Hồ) - full đồ đẹp - 120.7 m2 thông thuỷ giá: 12,5 tỷ (sổ đỏ)",12500.0,120.7,103.56255178127589,P. Phú Thượng (P. Hồng Hà mới),Đăng 2 ngày trước,,https://batdongsan.com.vn/ban-can-ho-chung-cu-duong-vo-chi-cong-phuong-phu-thuong-1-sunshine-riverside/ban-4-ngu-tay-full-do-dep-120-7-m2-thong-thuy-gia-12-5-ty-so-do-pr44304506
Tây Hồ,"Bán Penthouse Sunshine Riverside - 209,1 m2 - Sổ đỏ - Nhà cơ bản - View Hồ Tây - Giá: 20,5 tỷ",20500.0,209.1,98.03921568627452,P. Phú Thượng,Đăng 2 ngày trước,,https://batdongsan.com.vn/ban-can-ho-chung-cu-duong-vo-chi-cong-phuong-phu-thuong-1-sunshine-riverside/ban-penthouse-209-1-m2-so-do-nha-co-ban-view-tay-gia-20-5-ty-pr45071394
Tây Hồ,Bán căn hộ tầng cao CT13B Ciputra - view trường quốc tế UNIS - đối diện Lotte Mall,5900.0,66.6,88.58858858858859,P. Phú Thượng,Đăng 2 tuần trước,,https://batdongsan.com.vn/ban-can-ho-chung-cu-phuong-phu-thuong-1-khu-do-thi-nam-thang-long-ciputra/ban-tang-cao-ct13b-view-truong-quoc-te-unis-doi-dien-lotte-mall-pr44868008
Tây Hồ,"Bán căn hộ 3pn 2wc full nội thất, chung cư tại D. El Dorado II, 14 tỷ 86 m2, giá ưu đãi",14000.0,86.0,162.7906976744186,·P. Xuân La (P. Xuân Đỉnh mới),Đăng 6 ngày trước,,https://batdongsan.com.vn/ban-can-ho-chung-cu-duong-vo-chi-cong-phuong-xuan-la-d-el-dorado-ii/ban-tai-14-9-ty-86-m2-gia-uu-dai-pr44569538
Tây Hồ,Căn hộ duplex hàng NG đợt 1 giá nội bộ Noble Tây Hồ tầng siêu vip LH nhận thông tin ngay,24000.0,132.0,181.8181818181818,·P. Phú Thượng,Đăng 6 ngày trước,,https://batdongsan.com.vn/ban-can-ho-chung-cu-phuong-phu-thuong-1-noble-crystal-tay-ho/duplex-hang-ng-ot-1-gia-noi-bo-tang-sieu-vip-lh-nhan-thong-tin-ngay-pr45255935
Tây Hồ,"Chính chủ căn hộ chung cư tầng 9 Ciputra Hà Nội view thẳng Lotte, 54m2, 2PN, 1WC hot hot",4700.0,54.0,87.03703703703704,·P. Phú Thượng,Đăng 6 ngày trước,,https://batdongsan.com.vn/ban-can-ho-chung-cu-duong-vo-chi-cong-phuong-phu-thuong-1-khu-do-thi-nam-thang-long-ciputra/chinh-chu-tang-9-ha-noi-86-trieu-m2-54m2-2pn-1wc-pr45099214
Tây Hồ,"Căn duplex 3PN 132m2 ban công Đông Nam, giá 24 tỷ, toà Noble Crystal Tây Hồ quản lý bởi WorldHotels",24000.0,132.0,181.8181818181818,·P. Phú Thượng (P. Hồng Hà mới),Đăng 1 tuần trước,,https://batdongsan.com.vn/ban-can-ho-chung-cu-duong-vo-chi-cong-phuong-phu-thuong-1-noble-crystal-tay-ho/duplex-3pn-132m2-ban-ong-nam-gia-24-ty-toa-quan-ly-boi-worldhotels-pr45156801
Tây Hồ,Quỹ căn tầng đẹp giá tốt chung cư The Reflection Westlake Tây Hồ liên hệ:0822 238 ***,,60.0,,P. Phú Thượng (P. Hồng Hà mới),Đăng hôm nay,,https://batdongsan.com.vn/ban-can-ho-chung-cu-duong-vo-chi-cong-phuong-phu-thuong-1-the-reflection-west-lake/quy-tang-ep-gia-tot-westlake-tay-lien-he-0822238686-pr45220058
Tây Hồ,"Sự kiện Cất nóc liên hệ Chủ đầu tư Celestine WestLake chiết khấu 11%, chỉ đóng 20% nhận nhà, sổ đỏ",18400.0,117.8,156.19694397283533,P. Phú Thượng (P. Hồng Hà mới),Đăng hôm nay,,https://batdongsan.com.vn/ban-can-ho-chung-cu-phuong-phu-thuong-1-celestine-westlake/chu-dau-tu-chinh-thuc-ra-hang-2-3-ngu-dep-nhat-tay-ch-khau-10-0-ls-pr43946422
Tây Hồ,"Cập nhật quỹ căn tháng 3 và chính sách bán hàng, căn hộ Celestine Westlake view Hồ Tây hiếm",,110.0,,P. Phú Thượng (P. Tây Hồ mới),Đăng hôm nay,,https://batdongsan.com.vn/ban-can-ho-chung-cu-duong-vo-chi-cong-phuong-phu-thuong-1-celestine-westlake/cap-nhat-quy-thang-3-va-chinh-sach-ban-hang-view-tay-hiem-pr45302007
Tây Hồ,"Mở bán đợt 1 căn hộ studio, 1PN, 2PN, 3PN, penthouse The Reflection 699 Lạc Long Quân của cđt Kusto",,30.0,,P. Phú Thượng (P. Hồng Hà mới),Đăng hôm nay,,https://batdongsan.com.vn/ban-can-ho-chung-cu-duong-vo-chi-cong-phuong-phu-thuong-1-the-reflection-west-lake/mo-ban-ot-1-studio-1pn-2pn-3pn-penthouse-699-lac-long-quan-cua-c-t-kusto-pr45181205
Tây Hồ,Mở bán sky villa Noble Crystal Tây Hồ 280m2 view Hồ Tây và Sông Hồng cầu Nhật Tân về đêm,58000.0,280.0,207.14285714285714,P. Phú Thượng,Đăng hôm qua,,https://batdongsan.com.vn/ban-can-ho-chung-cu-duong-nguyen-van-huyen-phuong-phu-thuong-1-noble-crystal-tay-ho/ban-sky-villa-sunshine-river-280m-view-cau-nhat-tan-ve-dem-lh0369398998-pr26938120
Tây Hồ,"Chính chủ bán căn chung cư Vườn Đào, Lạc Long Quân, Tây Hồ. 126,2m2, 3PN - Full nội thất cao cấp",13880.0,126.2,109.98415213946117,P. Phú Thượng (P. Tây Hồ mới),Đăng hôm qua,,https://batdongsan.com.vn/ban-can-ho-chung-cu-duong-lac-long-quan-phuong-phu-thuong-1-khu-do-thi-vuon-dao/chinh-chu-ban-ao-tay-126-2m2-3pn-full-noi-that-cao-cap-pr45294343
Tây Hồ,Suất ngoại giao căn Duplex 4PN Noble Crystal Tây Hồ vị trí view đẹp giá tốt nhất hiện nay,37120.0,220.5,168.34467120181407,P. Phú Thượng,Đăng hôm qua,,https://batdongsan.com.vn/ban-can-ho-chung-cu-phuong-phu-thuong-1-noble-crystal-tay-ho/suat-ngoai-giao-duplex-4pn-vi-tri-view-ep-gia-tot-nhat-hien-nay-pr45292396
Tây Hồ,Tưng bừng cất nóc công bố quỹ căn giá tốt nhất tại Celestine Westlake view Hồ Tây T3/2026,13600.0,85.0,160.0,P. Phú Thượng (P. Tây Hồ mới),Đăng hôm qua,,https://batdongsan.com.vn/ban-can-ho-chung-cu-duong-vo-chi-cong-phuong-phu-thuong-1-celestine-westlake/quy-mat-chua-tung-bo-cuoi-cung-tai-view-tay-t12-2025-pr44697931
Tây Hồ,"Bán và bàn giao căn hộ tinh hoa Tây Hồ, đơn vị quản lý Soho & Heritage 677 Lạc Long Quân thông báo",,94.0,,P. Phú Thượng (P. Hồng Hà mới),Đăng hôm qua,,https://batdongsan.com.vn/ban-can-ho-chung-cu-duong-lac-long-quan-phuong-phu-thuong-1-heritage-west-lake/ban-va-ban-giao-tinh-hoa-tay-don-vi-ly-soho-677-thong-bao-pr44398971
Tây Hồ,"Chính chủ bán CH 1PN đẳng cấp tại Noble Crystal Tây Hồ Tây, Ciputra",12500.0,76.0,164.47368421052633,P. Phú Thượng,Đăng 2 ngày trước,,https://batdongsan.com.vn/ban-can-ho-chung-cu-phuong-phu-thuong-1-noble-crystal-tay-ho/chinh-chu-ban-ch-1pn-ang-cap-tai-tay-ciputra-pr45285995
Tây Hồ,"Căn hộ Ciputra DT 153m2 04PN BC Đông Nam, đủ đồ giá rẻ 13.3 tỷ. LH em Hường0936 670 ***",13300.0,153.0,86.9281045751634,P. Phú Thượng,Đăng 2 ngày trước,Có,https://batdongsan.com.vn/ban-can-ho-chung-cu-phuong-phu-thuong-1-khu-do-thi-nam-thang-long-ciputra/dt-153m-04pn-bc-ong-u-o-gia-re-13-3-ty-lh-em-huong-0936-670-899-pr45284018
Tây Hồ,QUỸ CĂN GIÁ TỐT 2PN - 3PN VIEW HÔ TÂY + STARLAKE TẠI HDI TÂY HỒ (VÕ CHÍ CÔNG). CÓ SLOT OTO. SẴN SỔ,8000.0,73.0,109.58904109589041,P. Xuân La (P. Xuân Đỉnh mới),Đăng 2 ngày trước,,https://batdongsan.com.vn/ban-can-ho-chung-cu-phuong-xuan-la-tay-ho-residence/hdi-vo-chi-cong-ban-goc-3pn-107-2m2-tang-cao-view-tron-so-lau-dai-gia-1x-ty-pr44825778
Tây Hồ,"Cập nhật danh sách bán căn hộ Ciputra KĐT Nam Thăng Long mới nhất tháng 032026 - hàng đẹp, giá tốt",13000.0,123.0,105.6910569105691,P. Phú Thượng,Đăng 2 ngày trước,,https://batdongsan.com.vn/ban-can-ho-chung-cu-duong-lac-long-quan-phuong-phu-thuong-1-khu-do-thi-nam-thang-long-ciputra/cap-nhat-bang-gia-ban-kdt-moi-nhat-3-2024-lh-pr39356340
Bắc Từ Liêm,"Chính chủ Sunshine City cần bán: 2 ngủ: 8,3tỷ, 3 ngủ: 9 tỷ - Duplex: 15 tỷ - SĐT:0981 757 ***",9000.0,90.0,100.0,·P. Đông Ngạc (P. Phú Thượng mới),Đăng 2 ngày trước,,https://batdongsan.com.vn/ban-can-ho-chung-cu-phuong-dong-ngac-sunshine-city/chinh-chu-ban-2-ngu-8-3-ty-3-ngu-9-ty-duplex-15-ty-s-t-0981-757-285-pr45281678
Bắc Từ Liêm,"Căn chuyển nhượng chung cư Sunshine City Ciputra tháng 3/2026 - 3PN giá 8,x tỷ",8300.0,80.0,103.75,·P. Đông Ngạc (P. Phú Thượng mới),Đăng 4 ngày trước,,https://batdongsan.com.vn/ban-can-ho-chung-cu-phuong-dong-ngac-sunshine-city/quy-chuyen-nhuong-ciputra-thang-12-2025-3pn-gia-9ty-pr44709300
Bắc Từ Liêm,Bán căn 3 phòng ngủ An Bình City giá cực tốt trong phân khúc,8900.0,90.0,98.88888888888889,Phường Cổ Nhuế 1 (P. Phú Diễn mới),Đăng hôm nay,,https://batdongsan.com.vn/ban-can-ho-chung-cu-duong-pham-van-dong-phuong-co-nhue-1-thanh-pho-giao-luu/ban-3-ngu-an-binh-city-gia-cuc-tot-trong-phan-khuc-pr45302504
Bắc Từ Liêm,Căn hộ 2 + 1 hướng Đông Nam tòa S6 giá 9.6 tỷ sổ đỏ tầng trung đẹp chung cư Sunshine City,9600.0,86.0,111.62790697674419,P. Đông Ngạc (P. Phú Thượng mới),Đăng hôm qua,,https://batdongsan.com.vn/ban-can-ho-chung-cu-phuong-dong-ngac-sunshine-city/2-1-huong-ong-nam-toa-s6-gia-9-6-ty-so-o-tang-trung-ep-city-pr45271596
Bắc Từ Liêm,Bán căn hộ CT4 Thái Hà Bộ Công An,6100.0,70.0,87.14285714285714,Phường Cổ Nhuế 2 (P. Đông Ngạc mới),Đăng hôm nay,,https://batdongsan.com.vn/ban-can-ho-chung-cu-duong-pham-van-dong-phuong-co-nhue-2-nha-o-cho-can-bo-chien-sy-bo-cong-an/ban-ct4-thai-ha-an-pr45119063
Bắc Từ Liêm,Bán căn Sunshine City - 103.8 m2 - căn góc 3 ngủ - view nội khu + bể bơi - giá: 10.3 tỷ (sổ đỏ),10300.0,103.8,99.22928709055877,P. Đông Ngạc (P. Phú Thượng mới),Đăng hôm nay,,https://batdongsan.com.vn/ban-can-ho-chung-cu-duong-pham-van-dong-phuong-dong-ngac-sunshine-city/ban-103-8-m2-goc-3-ngu-view-noi-khu-be-boi-gia-10-5-ty-so-do-pr44687705
Bắc Từ Liêm,Bán căn góc 3 ngủ Sunshine City - 97.6m2 - tầng cao - View Sân Golf Ciputra toà S56 - Đông Nam,11150.0,97.6,114.24180327868854,P. Đông Ngạc (P. Phú Thượng mới),Đăng hôm nay,,https://batdongsan.com.vn/ban-can-ho-chung-cu-duong-pham-van-dong-phuong-dong-ngac-sunshine-city/ban-goc-3-ngu-98m2-tang-cao-view-san-golf-ciputra-gia-12-2-ty-nam-pr45011583
Bắc Từ Liêm,"Bán căn 3 phòng ngủ Sunshine City toà S5, giá rẻ nhất thị trường chỉ 10 tỷ",10000.0,98.0,102.04081632653062,P. Đông Ngạc (P. Phú Thượng mới),Đăng hôm nay,Có,https://batdongsan.com.vn/ban-can-ho-chung-cu-phuong-dong-ngac-sunshine-city/ban-3-ngu-toa-s5-6-gia-re-nhat-thi-truong-chi-10-ty-pr45070546
Bắc Từ Liêm,Bán căn góc 3 phòng ngủ 105m2 Sunshine City tầng cao view Sông Hồng - giá 12 tỷ sổ đỏ sang tên,12000.0,105.0,114.28571428571429,P. Đông Ngạc (P. Phú Thượng mới),Đăng hôm nay,,https://batdongsan.com.vn/ban-can-ho-chung-cu-phuong-dong-ngac-sunshine-city/ban-goc-3-ngu-105m2-tang-cao-view-song-hong-gia-10-ty-so-do-sang-ten-pr43782343
Bắc Từ Liêm,"Bán căn duplex full đồ Sunshine City 157.4m2 view thành phố - giá 16,9 tỷ sổ đỏ sang tên",16900.0,157.4,107.3697585768742,P. Đông Ngạc (P. Phú Thượng mới),Đăng hôm nay,,https://batdongsan.com.vn/ban-can-ho-chung-cu-phuong-dong-ngac-sunshine-city/ban-duplex-full-do-160m2-view-thanh-pho-gia-16-9-ty-so-do-sang-ten-pr44975820
Bắc Từ Liêm,"Bán căn 2 ngủ full đồ Sunshine City tầng trung giá 8,3 tỷ - sổ đỏ sang tên",8300.0,72.4,114.64088397790054,P. Đông Ngạc (P. Phú Thượng mới),Đăng hôm nay,,https://batdongsan.com.vn/ban-can-ho-chung-cu-phuong-dong-ngac-sunshine-city/ban-2-ngu-full-do-tang-trung-gia-8-5-ty-so-do-sang-ten-pr44904319
Bắc Từ Liêm,"Bán căn góc 3 ngủ full đồ Sunshine City tầng cao giá 11,5 tỷ - Sổ đỏ sang tên",11500.0,104.0,110.57692307692308,P. Đông Ngạc (P. Phú Thượng mới),Đăng hôm nay,,https://batdongsan.com.vn/ban-can-ho-chung-cu-phuong-dong-ngac-sunshine-city/ban-goc-3-ngu-full-o-tang-cao-gia-11-5-ty-so-o-sang-ten-pr45290217
Bắc Từ Liêm,"Bán căn góc 3 ngủ full đồ Sunshine City 99,5m2 giá 10,5 tỷ sổ đỏ sang tên",10500.0,99.5,105.52763819095478,P. Đông Ngạc (P. Phú Thượng mới),Đăng hôm nay,,https://batdongsan.com.vn/ban-can-ho-chung-cu-phuong-dong-ngac-sunshine-city/ban-goc-3-ngu-full-o-98m2-gia-10-5-ty-so-o-sang-ten-pr45217852
Bắc Từ Liêm,"Cập nhật danh sách các căn hộ chuyển nhượng Goldmark City loại 2 - 3 & 4PN. Giá chỉ từ 6,5 tỷ",6600.0,86.0,76.74418604651163,P. Phú Diễn,Đăng hôm nay,,https://batdongsan.com.vn/ban-can-ho-chung-cu-duong-ho-tung-mau-phuong-phu-dien-goldmark-city/cap-nhat-danh-sach-cac-chuyen-nhuong-loai-2-3-4pn-gia-chi-tu-6-5-ty-pr45156211
Bắc Từ Liêm,"Bán gấp luôn căn hộ chung cư Goldmark 02PN - 83m2 và 03PN 94m2, 115m2, 130m2. LH0839 185 ***",6400.0,83.0,77.10843373493977,P. Phú Diễn,Đăng hôm nay,Có,https://batdongsan.com.vn/ban-can-ho-chung-cu-duong-ho-tung-mau-phuong-phu-dien-goldmark-city/ban-tu-83m2-99m-110m-121m2-160m2-gia-re-ban-gap-lh-pr40404982
Bắc Từ Liêm,E Chính cư dân GMC bán quỹ căn CHUNG CƯ và SÀN VĂN PHÒNG THƯƠNG MẠI GIÁ TỪ 5X TRIỆU/M. XEM NHÀ 24/7,6500.0,83.0,78.3132530120482,P. Phú Diễn,Đăng hôm nay,,https://batdongsan.com.vn/ban-can-ho-chung-cu-duong-ho-tung-mau-phuong-phu-dien-goldmark-city/ban-cat-lo-gia-tot-tai-gmc-tu-45-tr-m2-169m2-gia-7-ty-130m2-6-6-ty-114m2-6-ty-tro-vay-80-pr40907957
Bắc Từ Liêm,Bán nhanh căn hộ chung cư cao cấp Horizon - Ngoại Giao Đoàn,13000.0,108.0,120.37037037037037,P. Xuân Đỉnh,Đăng hôm qua,,https://batdongsan.com.vn/ban-can-ho-chung-cu-duong-xuan-tao-phuong-xuan-dinh-n03-t3-t4-ngoai-giao-doan/ban-nhanh-cao-cap-horizon-oan-pr45295190
Bắc Từ Liêm,Chuyên bán căn hộ cao cấp tháp đôi Hanjadin(NO1-T6 & T7) Ngoại Giao Đoàn - Giá tốt nhất thị trường,,105.0,,P. Xuân Tảo (P. Xuân Đỉnh mới),Đăng hôm qua,,https://batdongsan.com.vn/ban-can-ho-chung-cu-phuong-xuan-tao-n01-t7-ngoai-giao-doan/chinh-chu-ban-dt104m2-3pn-toa-no1-view-tron-tay-thoang-mat-gia-tot-pr40088970
Bắc Từ Liêm,"PKD Kosmo Tây Hồ thông báo! Quỹ chuyển nhượng chính chủ căn đẹp, tầng đẹp, giá tốt Tháng 3/2026",,118.0,,P. Xuân Tảo (P. Xuân Đỉnh mới),Đăng hôm qua,,https://batdongsan.com.vn/ban-can-ho-chung-cu-duong-xuan-la-phuong-xuan-tao-kosmo-tay-ho/pkd-thong-bao-quy-chuyen-nhuong-chinh-chu-ep-tang-ep-gia-tot-thang-3-2026-pr45212514
Bắc Từ Liêm,Cắt lỗ toàn bộ quỹ căn tháng 3 200 - 500 căn 2pn - 3pn - 4pn. Lh ngay e0987 833 ***,6400.0,84.0,76.19047619047619,P. Phú Diễn,Đăng hôm qua,Có,https://batdongsan.com.vn/ban-can-ho-chung-cu-duong-ho-tung-mau-phuong-phu-dien-goldmark-city/cap-nhat-quy-t7-2pn-3pn-4pn-gia-tot-nhat-thi-truong-lh-e-duong-pr43432014
Bắc Từ Liêm,"Tôi cần bán 2 căn hộ Goldmark City, căn 2PN 6,5tỷ và căn 3PN 8,3tỷ, có sổ đỏ, hỗ trợ vay bank",6500.0,83.0,78.3132530120482,P. Phú Diễn,Đăng 2 ngày trước,,https://batdongsan.com.vn/ban-can-ho-chung-cu-duong-ho-tung-mau-phuong-phu-dien-goldmark-city/toi-ban-2-goc-2-ngu-5-ty-100tr-va-goc-3-ngu-6-ty-100tr-co-so-do-pr41979496
Bắc Từ Liêm,Chọn lọc 30 căn hộ HH Thái Hà Epics Home & CBCS Bộ CA loại 2 & 3 phòng ngủ 70m2 - 144m2 giá cực tốt,6000.0,70.0,85.71428571428571,Phường Cổ Nhuế 2 (P. Đông Ngạc mới),Đăng 2 ngày trước,,https://batdongsan.com.vn/ban-can-ho-chung-cu-duong-pham-van-dong-phuong-co-nhue-2-nha-o-cho-can-bo-chien-sy-bo-cong-an/chon-loc-cac-43-cbcs-ca-thai-ha-constrexim-loai-2-3-pn-duplex-gia-tot-pr43122431
