Khu vực,Tiêu đề,Giá (triệu),Diện tích (m²),Giá/m² (triệu),Vị trí,Ngày đăng,Cắt lỗ?,Link
Thanh Trì,"Bán Căn hộ đẹp, nhiều tiện ích 3,22 tỷ, 47,3 m2 tại Căn hộ 1208 Tòa CT10A, Đại Thanh, Hà Nội",3220.0,47.3,68.07610993657505,X. Tả Thanh Oai (X. Đại Thanh mới),Đăng hôm qua,,https://batdongsan.com.vn/ban-can-ho-chung-cu-duong-phan-trong-tue-xa-ta-thanh-oai-chung-cu-dai-thanh/ban-ep-nhieu-tien-ich-3-22-ty-47-3-m2-tai-1208-toa-ct10a-ai-ha-noi-pr45268330
Thanh Trì,"Siêu hot! Chủ nhà cần tiền giảm sốc 300tr, căn 2PN 2VS (căn góc) 76.1m2 đẹp nhất dự án Eco Green",6050.0,76.1,79.5006570302234,X. Tân Triều (P. Thanh Liệt mới),Đăng 3 ngày trước,,https://batdongsan.com.vn/ban-can-ho-chung-cu-duong-nguyen-xien-xa-tan-trieu-eco-green-city/sieu-hot-chu-nha-tien-giam-soc-300tr-2-ngu-2vs-goc-76m2-dep-nhat-du-an-green-pr44839098
Thanh Trì,Chính chủ bán chung cư Eco Green 286 Nguyễn Xiển,6650.0,73.9,89.98646820027064,X. Tân Triều (P. Thanh Liệt mới),Đăng 1 tuần trước,,https://batdongsan.com.vn/ban-can-ho-chung-cu-duong-nguyen-xien-xa-tan-trieu-eco-green-city/chinh-chu-ban-286-xien-pr45202488
Thanh Trì,"Duy nhất 10 căn độc quyền 2PN và 2PN sân vườn, giá chỉ với 6,8tỷ trên/căn gọi ngay nhận thông tin",6800.0,76.3,89.1218872870249,TT. Văn Điển (P. Hoàng Liệt mới),Đăng 4 ngày trước,,https://batdongsan.com.vn/ban-can-ho-chung-cu-duong-ngoc-hoi-thi-tran-van-dien-greenera-southmark/2pn-khong-gian-song-chuan-cho-gia-dinh-tre-o-thuc-doc-ban-tai-southmark-pr45064013
Thanh Trì,"Chính chủ bán gấp căn hộ 67m2 tại Eco Green City, 6,1 tỷ, 2PN, 2WC, view đẹp",6100.0,67.0,91.04477611940298,X. Tân Triều (P. Thanh Liệt mới),Đăng 4 ngày trước,Có,https://batdongsan.com.vn/ban-can-ho-chung-cu-duong-nguyen-xien-xa-tan-trieu-eco-green-city/chinh-chu-ban-gap-67m2-tai-6-1-ty-2pn-2wc-view-ep-pr45254868
Thanh Trì,DUY NHẤT 1 CĂN 2PN tòa SM2 giá đợt đầu siêu rẻ tại Greenera Southmark Ngọc Hồi,6520.0,79.3,82.21941992433796,TT. Văn Điển (P. Hoàng Liệt mới),Đăng 1 tuần trước,,https://batdongsan.com.vn/ban-can-ho-chung-cu-duong-ngoc-hoi-thi-tran-van-dien-greenera-southmark/quy-hang-om-cua-cdt-duy-nhat-6-2n-toa-sm2-gia-dot-dau-sieu-re-hoi-pr45140492
Thanh Trì,"Chỉ 8x tr/m2, độc quyền căn 47m2 4 tỷ. Sẵn 1,2t ký HĐMB, vay 0% 24 tháng, ck tới 16%, Q tặng 400tr",4000.0,47.0,85.1063829787234,TT. Văn Điển (P. Hoàng Liệt mới),Đăng hôm qua,,https://batdongsan.com.vn/ban-can-ho-chung-cu-duong-ngoc-hoi-thi-tran-van-dien-greenera-southmark/chi-8x-tr-m2-oc-quyen-47m2-4-ty-san-1-2t-ky-h-mb-vay-0-24-thang-ck-toi-16-q-tang-400tr-pr45271308
Thanh Trì,"Chuẩn giá như ảnh: Bán căn 75m2 (2N2WC) giá 6.3 tỷ, sẵn sổ tại Eco Green City Nguyễn Xiển",6300.0,75.0,84.0,X. Tân Triều (P. Thanh Liệt mới),Đăng 2 ngày trước,,https://batdongsan.com.vn/ban-can-ho-chung-cu-duong-nguyen-xien-xa-tan-trieu-eco-green-city/chuan-gia-nhu-anh-ban-76m2-2n2wc-full-noi-that-san-so-tai-gia-6-5-ty-pr45214585
Thanh Trì,"Quỹ căn tháng 6-2025 Eco Green City, 67m2- 5.5tỷ, 75m2-6.1tỷ, 86m2-7.6tỷ, 95m2-8tỷ view thoáng mát",6100.0,75.0,81.33333333333333,X. Tân Triều (P. Thanh Liệt mới),Đăng 2 ngày trước,,https://batdongsan.com.vn/ban-can-ho-chung-cu-duong-nguyen-xien-xa-tan-trieu-eco-green-city/quy-thang-6-2025-67m2-4-5ty-75m2-5ty-86m2-6-2ty-95m2-6-5ty-view-thoang-mat-pr43242062
Thanh Trì,SM2.0910 giá tốt nhất dự án | hàng giai đoạn đầu biên độ sinh lời cao,6500.0,79.3,81.9672131147541,TT. Văn Điển (P. Hoàng Liệt mới),Đăng 2 ngày trước,,https://batdongsan.com.vn/ban-can-ho-chung-cu-duong-ngoc-hoi-thi-tran-van-dien-greenera-southmark/sm2-0910-gia-tot-nhat-du-an-hang-giai-doan-dau-bien-do-sinh-loi-cao-pr45109782
Thanh Trì,3PN dual - key Lavish | Linh hoạt cho đa thế hệ Tối ưu giá trị sinh lời,10000.0,124.5,80.32128514056225,TT. Văn Điển (P. Hoàng Liệt mới),Đăng 2 ngày trước,,https://batdongsan.com.vn/ban-can-ho-chung-cu-duong-ngoc-hoi-thi-tran-van-dien-greenera-southmark/sieu-pham-truc-vang-duy-nhat-2pn-dep-nhat-du-an-chinh-thuc-tai-xuat-pr44399571
Thanh Trì,Bán suất ngoại giao đặc biệt căn 3PN diện tích 105m2 giá chỉ hơn 63 triệu/m2 giảm sâu tới 260 triệu,6700.0,105.0,63.80952380952381,X. Tứ Hiệp (X. Thanh Trì mới),Đăng 3 ngày trước,,https://batdongsan.com.vn/ban-can-ho-chung-cu-duong-nguyen-bac-1-xa-tu-hiep-bluegem-tower/ban-suat-ngoai-giao-ac-biet-3pn-dien-tich-105-m2-gia-chi-63-trieu-m2-giam-sau-toi-260-trieu-pr45272154
Thanh Trì,"BQL gửi bán CH 67m2, 75m2, 86m2, 95m2 tòa EcoGreen. Full đồ, có sổ đỏ phù hợp ở lâu dài, Giá thật.",8300.0,95.0,87.36842105263158,X. Tân Triều (P. Thanh Liệt mới),Đăng 3 ngày trước,,https://batdongsan.com.vn/ban-can-ho-chung-cu-duong-nguyen-xien-xa-tan-trieu-eco-green-city/bql-gui-ban-ch-67m2-75m2-86m2-95m2-toa-ecogreen-full-o-co-so-o-phu-hop-o-lau-dai-gia-that-pr45271054
Thanh Trì,"Tôi cần bán chung cư Viện 103, Văn Quán 84m2, 2 phòng ngủ, 2 vs, giá tốt",4800.0,84.0,57.142857142857146,X. Tân Triều (P. Hà Đông mới),Đăng 3 ngày trước,,https://batdongsan.com.vn/ban-can-ho-chung-cu-duong-yen-xa-xa-tan-trieu-chung-cu-vien-103/toi-ban-103-gan-van-quan-112m2-3-ngu-2-vs-gia-tot-pr44105555
Thanh Trì,BÁN CHUNG CƯ TABUDEC PLAZA 3 PHÒNG NGỦ NỘI THẤT CAO CẤP TẦNG ĐẸP LH:0937 893 ***,7070.0,104.0,67.98076923076923,X. Tả Thanh Oai (X. Đại Thanh mới),Đăng 4 ngày trước,,https://batdongsan.com.vn/ban-can-ho-chung-cu-duong-phan-trong-tue-xa-ta-thanh-oai-tabudec-plaza/ban-3-phong-ngu-noi-that-cao-cap-tang-ep-lh-0937893286-pr45203746
Thanh Trì,"Căn hộ 3pn, 2vs BlueGem Tower, thiết kế tố ưu, view đẹp, ck 3%, quà tặng lên tới 350tr cho khách",,95.0,,X. Tứ Hiệp (X. Thanh Trì mới),Đăng 6 ngày trước,,https://batdongsan.com.vn/ban-can-ho-chung-cu-duong-nguyen-bac-1-xa-tu-hiep-bluegem-tower/93m2-3pn-2vs-thiet-ke-to-uu-view-dep-gia-tot-nhat-thi-truong-pr44997087
Thanh Trì,"Tôi chính chủ bán căn 2PN DT 75m2 Eco Green City, giá 5.8 tỷ bao phí, LH:0932 392 ***",5800.0,75.0,77.33333333333333,X. Tân Triều (P. Thanh Liệt mới),Đăng 6 ngày trước,,https://batdongsan.com.vn/ban-can-ho-chung-cu-duong-nguyen-xien-xa-tan-trieu-eco-green-city/chinh-chu-ban-2pn-dt68m2-ecogreen-gia-3-8-ty-bao-phi-lh-pr40831776
Thanh Trì,Quỹ căn ngoại giao 3PN mã 01B - mã 07B tầng đẹp. Nhận ngay gói chiết khấu VIP. LH0866 324 ***,5180.0,85.0,60.94117647058823,X. Tứ Hiệp (X. Thanh Trì mới),Đăng 1 tuần trước,,https://batdongsan.com.vn/ban-can-ho-chung-cu-duong-nguyen-bac-1-xa-tu-hiep-bluegem-tower/quy-ngoai-giao-2pn-3pn-4pn-tang-dep-nhan-ngay-goi-chiet-khau-vip-doc-quyen-lien-he-pr43845164
Thanh Trì,"Cắt lãi nhẹ trục 03B dự án BlueGem, giá bao rẻ nhất thị trường, 2 tháng nữa nhận nhà. LH0941 349 ***",6020.0,94.0,64.04255319148936,X. Tứ Hiệp (X. Thanh Trì mới),Đăng 1 tuần trước,,https://batdongsan.com.vn/ban-can-ho-chung-cu-duong-nguyen-bac-1-xa-tu-hiep-bluegem-tower/cat-lai-nhe-truc-03b-du-an-gia-bao-re-nhat-thi-truong-2-thang-nua-nhan-nha-lh-0941-349-888-pr45213466
Thanh Trì,Chính chủ bán CH Ecogreen 286 Nguyễn Xiển căn Penhosue duplex Hiếm bán 180m2 4Pn .LH:0987 362 ***,14300.0,180.0,79.44444444444444,X. Tân Triều (P. Thanh Liệt mới),Đăng hôm nay,,https://batdongsan.com.vn/ban-can-ho-chung-cu-duong-nguyen-xien-xa-tan-trieu-eco-green-city/ban-cc-286-75m2-2-ngu-full-do-tang-cao-view-thoang-gia-re-lh-pr42686311
Đông Anh,"Độc quyền bán căn hộ hạng sang Lumiere Essence Peak kế bên hồ 32ha Vinhomes Global Gate, Đông Anh",9490.0,65.9,144.0060698027314,·X. Đông Hội (X. Đông Anh mới),Đăng 2 ngày trước,,https://batdongsan.com.vn/ban-can-ho-chung-cu-duong-co-loa-xa-dong-hoi-vinhomes-global-gate/ban-cao-cap-lumiere-essence-peak-phan-khu-tinh-hoa-ong-anh-pr45277206
Đông Anh,"RẺ NHẤT THỊ TRƯỜNG CĂN 2PN 2WC 56M TÒA A2 MASTERI CỔ LOA TẦNG ĐẸP VIEW THOÁNG GIÁ 6,2TỶ",6200.0,56.0,110.71428571428571,X. Đông Hội (X. Đông Anh mới),Đăng hôm qua,,https://batdongsan.com.vn/ban-can-ho-chung-cu-duong-truong-sa-xa-dong-hoi-masteri-grand-avenue/re-nhat-thi-2pn-2wc-56m-toa-a2-co-loa-tang-ep-view-thoang-gia-6-2ty-pr45291594
Đông Anh,Bán căn hộ 3PN 2WC rẻ đẹp nhất dự án rất phù hợp mua đầu tư hoặc để ở toà Park thương mại,5150.0,82.1,62.72838002436054,X. Đông Hội (X. Đông Anh mới),Đăng hôm qua,,https://batdongsan.com.vn/ban-can-ho-chung-cu-duong-5-xa-dong-hoi-eurowindow-river-park/ban-3pn2wc-re-ep-nhat-du-an-rat-phu-hop-mua-au-tu-hoac-e-o-toa-thuong-mai-pr45179754
Đông Anh,Cực hiếm căn hộ mới tinh 4PN 4VS Eurowindow River Park 139m2. Giá chỉ 6.522tỷ nhà mới chưa sử dụng,6520.0,139.0,46.906474820143885,X. Đông Hội (X. Đông Anh mới),Đăng 6 ngày trước,,https://batdongsan.com.vn/ban-can-ho-chung-cu-duong-5-xa-dong-hoi-eurowindow-river-park/cuc-hiem-moi-tinh-4pn4vs-139m2-gia-chi-6-5-ty-nha-moi-chua-su-dung-pr45121797
Đông Anh,"Chính chủ bán căn 67,6m2 ban công ĐN full đồ, giá 4 tỷ 150 bao hết thuế phí căn 2PN 2WC",4150.0,67.6,61.3905325443787,X. Đông Hội (X. Đông Anh mới),Đăng 3 ngày trước,,https://batdongsan.com.vn/ban-can-ho-chung-cu-duong-5-xa-dong-hoi-eurowindow-river-park/chinh-chu-ban-77m2-ban-cong-dn-full-do-gia-4ty7-bao-het-thue-phi-2pn2wc-pr44867062
Đông Anh,"Cắt lỗ căn hộ 3 PN 82.1m2 Park 2 full đồ, giá 4,95 tỷ, giá rẻ nhất dự án",4950.0,82.1,60.29232643118149,X. Đông Hội (X. Đông Anh mới),Đăng 6 ngày trước,Có,https://batdongsan.com.vn/ban-can-ho-chung-cu-duong-5-xa-dong-hoi-eurowindow-river-park/chinh-chu-ban-2-ngu-67-6m2-toa-2-nha-moi-chua-su-dung-pr45252113
Đông Anh,"CĂN 2PN TRỤC 11 LUMIÈRE ESSENCE PEAK CỔ LOA | VIEW SÔNG | 64,M | GIÁ 7,25 TỶ",7250.0,64.1,113.10452418096725,X. Đông Hội (X. Đông Anh mới),Đăng hôm qua,,https://batdongsan.com.vn/ban-can-ho-chung-cu-duong-truong-sa-xa-dong-hoi-lumiere-essence-peak/2pn-truc-11-co-loa-view-song-64-m-gia-7-25-ty-pr45292106
Đông Anh,Tổng hợp quỹ căn giá tốt LUMIÈRE Essence Peak ngay sát hồ 32ha - Giá không chênh - CK 18% GTCH,7800.0,60.0,130.0,X. Đông Hội (X. Đông Anh mới),Đăng hôm qua,,https://batdongsan.com.vn/ban-can-ho-chung-cu-xa-dong-hoi-lumiere-essence-peak/mo-ban-2-toa-ngay-sat-32ha-gia-tu-130-trieu-chiet-khau-len-toi-18-gtch-pr44926862
Đông Anh,Căn 1PN view công viên Lumière Cổ Loa giá tốt,4510.0,41.5,108.67469879518072,X. Đông Hội (X. Đông Anh mới),Đăng 2 ngày trước,,https://batdongsan.com.vn/ban-can-ho-chung-cu-duong-truong-sa-xa-dong-hoi-lumiere-essence-peak/1pn-view-cong-vien-co-loa-gia-tot-pr45282029
Đông Anh,"Quỹ độc quyền Trục 18 hướng Đông Nam, trọn view Hồ 40ha, sông Hồng, Hồ Tây Giá RẺ. LH:0363 627 ***",,61.6,,X. Đông Hội (X. Đông Anh mới),Đăng 2 ngày trước,Có,https://batdongsan.com.vn/ban-can-ho-chung-cu-duong-truong-sa-xa-dong-hoi-lumiere-essence-peak/quy-oc-quyen-truc-18-huong-ong-nam-tron-view-40ha-song-hong-tay-gia-re-lh-0363627088-pr45284459
Đông Anh,CĂN HỘ 3PN THANG MÁY RIÊNG TRỤC 15 |GIÁ TỐT NHẤT LUMIÈRE ESSENCE PEAK | VIEW SÔNG,15740.0,100.5,156.61691542288557,X. Đông Hội (X. Đông Anh mới),Đăng 3 ngày trước,,https://batdongsan.com.vn/ban-can-ho-chung-cu-duong-truong-sa-xa-dong-hoi-lumiere-essence-peak/3pn-thang-may-rieng-truc-15-gia-tot-nhat-view-song-pr45276588
Đông Anh,"3PN 85,8m2 View sông trục 05A; Giá tốt 10,69tỷ LUMIÈRE Essence Peak tại Vinhomes Global Gate Cổ Loa",10690.0,85.8,124.5920745920746,X. Đông Hội (X. Đông Anh mới),Đăng 3 ngày trước,,https://batdongsan.com.vn/ban-can-ho-chung-cu-duong-truong-sa-xa-dong-hoi-lumiere-essence-peak/3pn-85-8m2-view-song-truc-05a-gia-tot-10-6-ty-tai-vinhomes-global-gate-co-loa-pr45276477
Đông Anh,"Căn hộ 3PN trục 05 111,9m2 giá tốt LUMIÈRE Essence Peak view đại lộ, thấp tầng 13,06 tỷ",13060.0,111.9,116.71134941912422,X. Đông Hội (X. Đông Anh mới),Đăng 3 ngày trước,,https://batdongsan.com.vn/ban-can-ho-chung-cu-duong-truong-sa-xa-dong-hoi-lumiere-essence-peak/3pn-truc-05-111-9m2-gia-tot-view-ai-lo-thap-tang-13-06-ty-pr45276532
Đông Anh,"3PN 85,8m2 view sông trục 15A; Giá tốt 10,35 tỷ LUMIÈRE Essence Peak tại Vinhomes Global Gate",10350.0,85.8,120.62937062937063,X. Đông Hội (X. Đông Anh mới),Đăng 3 ngày trước,,https://batdongsan.com.vn/ban-can-ho-chung-cu-duong-truong-sa-xa-dong-hoi-lumiere-essence-peak/3pn-85-8m2-view-song-truc-15a-gia-tot-10-35-ty-tai-vinhomes-global-gate-pr45276507
Đông Anh,Chuyển nhượng căn hộ Eurowindow River Park Park 3 giá chỉ từ 50 52 triệu/m² rẻ nhất thị trường,4000.0,77.0,51.94805194805195,X. Đông Hội (X. Đông Anh mới),Đăng 3 ngày trước,,https://batdongsan.com.vn/ban-can-ho-chung-cu-duong-5-xa-dong-hoi-eurowindow-river-park/chuyen-nhuong-park-3-gia-chi-tu-50-52-trieu-m-re-nhat-thi-truong-pr45217056
Đông Anh,"1N rẻ nhất dự án 4,47 tỷ, 41,5m2 trục 08A LUMIERE Essence Peak Cổ Loa",4470.0,41.5,107.71084337349397,X. Đông Hội (X. Đông Anh mới),Đăng 4 ngày trước,,https://batdongsan.com.vn/ban-can-ho-chung-cu-xa-dong-hoi-lumiere-essence-peak/1n-re-nhat-du-an-4-47-ty-41-5m2-truc-08a-co-loa-pr45098375
Đông Anh,"SIÊU PHẨM 1 ngủ ngoại giao Lumiere Essence Peak,view hồ, triển lãm, cầu Tứ Liên trục 16 siêu vip",7500.0,42.1,178.14726840855107,X. Đông Hội (X. Đông Anh mới),Đăng 4 ngày trước,,https://batdongsan.com.vn/ban-can-ho-chung-cu-xa-dong-hoi-lumiere-essence-peak/sieu-pham-1-ngu-ngoai-giao-view-trien-lam-cau-tu-lien-truc-16-sieu-vip-pr45264885
Đông Anh,Bán nhà hơn 1 tỷ xã Phúc Thịnh gần chợ Lắp Ghép,1580.0,40.0,39.5,TT. Đông Anh (X. Phúc Thịnh mới),Đăng 4 ngày trước,,https://batdongsan.com.vn/ban-can-ho-chung-cu-duong-quoc-lo-3-thi-tran-dong-anh-1-10/ban-nha-hon-1-ty-xa-phuc-thinh-gan-cho-lap-ghep-pr45193357
Đông Anh,"3PN 85,8m2 view sông trục 15A, giá tốt 10,87 tỷ LUMIÈRE Essence Peak tại Vinhomes Global Gate",10870.0,79.1,137.42098609355247,X. Đông Hội (X. Đông Anh mới),Đăng 6 ngày trước,,https://batdongsan.com.vn/ban-can-ho-chung-cu-xa-dong-hoi-lumiere-essence-peak/3pn-85-8m2-view-song-truc-15a-gia-tot-10-87-ty-tai-vinhomes-global-gate-pr45103874
Đông Anh,"Quỹ căn giá tốt The Cosmopolitan và The Continental M1, M2, M3, Y4, Y5 MIK Cổ Loa",,70.0,,X. Đông Hội (X. Đông Anh mới),Đăng 1 tuần trước,,https://batdongsan.com.vn/ban-can-ho-chung-cu-duong-co-loa-xa-dong-hoi-imperia-signature-co-loa/quy-chuyen-nhuong-vin-gia-rot-m1-m2-m3-y4-y5-pr44584178
Đông Anh,Em Ngọc - tổng hợp danh sách 100 căn hộ chủ nhà gửi bán gấp tại MIK Cổ Loa Đông Anh,,89.0,,X. Đông Hội (X. Đông Anh mới),Đăng 2 tuần trước,Có,https://batdongsan.com.vn/ban-can-ho-chung-cu-xa-dong-hoi-imperia-signature-co-loa/tin-hottong-hop-danh-sach-100-chu-nha-gui-ban-gap-tai-mik-anh-pr44099144
Đan Phượng,Quỹ Căn Nội Bộ Toà 22 Tầng Mở Bán Sớm. Giá 7xTr/m2. CK 14%. Vay 70% GTCH. Masterise Đan Phượng,5400.0,60.0,90.0,X. Tân Hội (X. Ô Diên mới),Đăng 3 ngày trước,,https://batdongsan.com.vn/ban-can-ho-chung-cu-duong-tay-thang-long-xa-tan-hoi-7-vinhomes-wonder-city/quy-noi-bo-ban-som-masterise-toa-16-22-tang-vay-70-gtch-du-an-dan-phuong-pr44717669
Đan Phượng,"Chuyển xuống mặt đất cần bán căn hộ 90m tòa CT2A KĐT Tân Tây Đô, full đồ, sổ đỏ lâu dài",,90.0,,X. Tân Lập (X. Ô Diên mới),Đăng 1 tuần trước,,https://batdongsan.com.vn/ban-can-ho-chung-cu-duong-quoc-lo-32-xa-tan-lap-24-khu-do-thi-moi-tan-tay-do/chuyen-xuong-mat-at-ban-90m-toa-ct2a-k-t-o-full-o-so-o-lau-dai-pr45246882
Đan Phượng,Căn hộ duplex tầng thấp Masteri Sky Quarter đẳng cấp sống như biệt thự trên không giá chỉ 10 tỷ,10000.0,176.0,56.81818181818182,X. Tân Hội (X. Ô Diên mới),Đăng hôm nay,,https://batdongsan.com.vn/ban-can-ho-chung-cu-xa-tan-hoi-7-masteri-sky-quarter/duplex-tang-thap-dang-cap-song-nhu-biet-thu-tren-khong-gia-chi-10-ty-pr44533905
Đan Phượng,"Quỹ căn 2 - 3 ngủ giá tốt nhất Vinhomes Đan Phượng chỉ từ 7x tr/m2, cơ hội đầu tư chắc thắng",4730.0,60.0,78.83333333333333,X. Tân Hội (X. Ô Diên mới),Đăng hôm qua,,https://batdongsan.com.vn/ban-can-ho-chung-cu-xa-tan-hoi-7-masteri-sky-quarter/quy-2-3-ngu-gia-tot-nhat-vinhomes-an-phuong-chi-tu-7x-tr-m2-co-au-tu-chac-thang-pr45165401
Đan Phượng,"Bán căn hộ chung cư 3PN đầy đủ nội thất, view đẹp giá tốt - Tân Tây Đô, 95m2, Đan Phượng, Hà Nội",,95.0,,X. Tân Lập (X. Ô Diên mới),Đăng hôm qua,,https://batdongsan.com.vn/ban-can-ho-chung-cu-duong-quoc-lo-32-xa-tan-lap-24-khu-do-thi-moi-tan-tay-do/ban-3pn-day-du-noi-that-view-dep-gia-tot-95m2-dan-phuong-ha-noi-pr43188421
Đan Phượng,"Tôi cần Bán căn góc 52,8m2-2PN - 2WC , view đông nam mát mẻ.toà XPHOMES Star - Tân Tây Đô.",,52.8,,X. Tân Lập (X. Ô Diên mới),Đăng hôm qua,,https://batdongsan.com.vn/ban-can-ho-chung-cu-duong-quoc-lo-32-xa-tan-lap-24-chung-cu-xphomes-tan-tay-do/ban-goc-59m2-2pn-2wc-toa-xphome-star-so-san-gia-ban-3-ty-1x-pr42385474
Đan Phượng,Chính chủ cần bán nhanh căn 3 ngủ toà CT2A KDT Tân Tây Đô. Thiết kế 3 ngủ xịn full đồ. Lh 098191588,5150.0,85.0,60.588235294117645,X. Tân Lập (X. Ô Diên mới),Đăng hôm qua,,https://batdongsan.com.vn/ban-can-ho-chung-cu-duong-quoc-lo-32-xa-tan-lap-24-khu-do-thi-moi-tan-tay-do/chinh-chu-ban-nhanh-3-ngu-toa-ct2a-kdt-thiet-ke-3-ngu-xin-full-lh-098191588-pr45038040
Đan Phượng,"GẤP Đổi nhà nên cần bán căn CC 52,8m2, view đẹp, tầng trung, có nội thất,sẵn sổ, giá chỉ nhỉnh 3tỷ",3450.0,52.8,65.3409090909091,X. Tân Lập (X. Ô Diên mới),Đăng hôm qua,,https://batdongsan.com.vn/ban-can-ho-chung-cu-duong-quoc-lo-32-xa-tan-lap-24-chung-cu-xphomes-tan-tay-do/gap-oi-nha-nen-ban-cc-52-8m2-view-ep-tang-trung-co-noi-that-san-so-gia-chi-nhinh-3ty-pr45291627
Đan Phượng,"BÁN CĂN GÓC 2 NGỦ XP HOMES STAR TÂN TÂY ĐÔ Diện tích 52,8m thiết kế 2 phòng ngủ, giá 3,x0979 898 ***",3790.0,52.9,71.64461247637051,X. Tân Lập (X. Ô Diên mới),Đăng hôm qua,,https://batdongsan.com.vn/ban-can-ho-chung-cu-duong-quoc-lo-32-xa-tan-lap-24-chung-cu-xphomes-tan-tay-do/ban-goc-2-ngu-xp-homes-star-o-dien-tich-52-8m-thiet-ke-2-phong-ngu-gia-3-x-0979898648-pr45290590
Đan Phượng,Chung cư Vinhomes Đan Phượng siêu phẩm chuẩn hạng sang của CĐT Masterise Homes sắp ra mắt,,45.0,,X. Tân Hội (X. Ô Diên mới),Đăng hôm qua,,https://batdongsan.com.vn/ban-can-ho-chung-cu-xa-tan-hoi-7-masteri-sky-quarter/vinhomes-dan-phuong-sieu-pham-chuan-hang-sang-cua-cdt-masterise-homes-sap-ra-mat-pr44546101
Đan Phượng,Mở bán tòa chung cư hạng sang cuối cùng của CĐT Masterise Homes tại Vinhomes Đan Phượng,5300.0,63.0,84.12698412698413,X. Tân Hội (X. Ô Diên mới),Đăng hôm qua,,https://batdongsan.com.vn/ban-can-ho-chung-cu-xa-tan-hoi-7-masteri-sky-quarter/mo-ban-2-toa-hang-sang-cua-masterise-homes-tai-vinhomes-dan-phuong-pr44577422
Đan Phượng,"Chính chủ gửi bán căn hộ chung cư tòa HHA, Xphomes, Tân Tây Đô, Ô Diên, HN",3950.0,62.0,63.70967741935484,X. Tân Lập (X. Ô Diên mới),Đăng hôm qua,,https://batdongsan.com.vn/ban-can-ho-chung-cu-duong-quoc-lo-32-xa-tan-lap-24-khu-do-thi-moi-tan-tay-do/chinh-chu-gui-ban-toa-hha-xphomes-o-dien-hn-pr44812859
Đan Phượng,"Chính chủ bán căn hộ chung cư Tân Tây Đô 77m2, full đồ sẵn ở",4700.0,77.0,61.03896103896104,X. Tân Lập (X. Ô Diên mới),Đăng hôm qua,,https://batdongsan.com.vn/ban-can-ho-chung-cu-duong-quoc-lo-32-xa-tan-lap-24-chung-cu-xphomes-tan-tay-do/chinh-chi-ban-77m2-full-san-o-pr44778542
Đan Phượng,Tôi chính chủ cần bán căn góc 90m2 3N 2VS toà xpHOMES Star full nội thất mới 100% chưa ai ở bao giờ,,90.0,,X. Tân Lập (X. Ô Diên mới),Đăng hôm qua,,https://batdongsan.com.vn/ban-can-ho-chung-cu-duong-quoc-lo-32-xa-tan-lap-24-chung-cu-xphomes-tan-tay-do/toi-chinh-chu-ban-goc-90m2-3n-2vs-toa-star-full-noi-that-moi-100-chua-ai-o-bao-gio-pr44923268
Đan Phượng,"CẦN BÁN CĂN GÓC 3 NGỦ, 3 VỆ SINH CHUNG CƯ TÂN TÂY ĐÔ.",,110.0,,X. Tân Lập (X. Ô Diên mới),Đăng hôm qua,,https://batdongsan.com.vn/ban-can-ho-chung-cu-duong-quoc-lo-32-xa-tan-lap-24-20/ban-goc-3-ngu-3-ve-sinh-tay-o-pr45234018
Đan Phượng,Hoàn thiện hồ sơ mua NOXH dự án tân lập mở bán tháng 5/2026 giá đẹp,,65.0,,X. Tân Lập (X. Ô Diên mới),Đăng 2 ngày trước,,https://batdongsan.com.vn/ban-can-ho-chung-cu-duong-quoc-lo-32-xa-tan-lap-24-khu-nha-o-xa-tan-lap-cienco-5/hoan-thien-so-mua-noxh-du-an-mo-ban-thang-5-2026-gia-ep-pr45150818
Đan Phượng,"Không lo được tài chính, cần bán lại căn 2 phòng ngủ, toà Sky Tower A. Chung cư Vin Đan Phượng",,60.0,,X. Tân Hội (X. Ô Diên mới),Đăng 2 ngày trước,,https://batdongsan.com.vn/ban-can-ho-chung-cu-duong-tay-thang-long-xa-tan-hoi-7-vinhomes-wonder-city/khong-lo-duoc-tai-chinh-ban-lai-2-phong-ngu-toa-sky-tower-a-vin-dan-phuong-pr44818935
Đan Phượng,"Ngộp bank! Cần bán lại căn 1N+, Toà Sky Tower A, hướng đẹp. Chung cư Masterise Đan Phượng",,44.0,,X. Tân Hội (X. Ô Diên mới),Đăng 2 ngày trước,Có,https://batdongsan.com.vn/ban-can-ho-chung-cu-xa-tan-hoi-7-masteri-sky-quarter/suat-ngoai-giao-duplex-dien-tich-167m2-gia-59-tr-m2-ky-cdt-masterise-dan-phuong-pr44717876
Đan Phượng,Quỹ căn Masteri - Vinhomes Đan Phượng. Tòa 22 tầng cuối cùng. Giá chỉ từ 7x triệu/m²,4690.0,67.0,70.0,X. Tân Hội (X. Ô Diên mới),Đăng 2 ngày trước,,https://batdongsan.com.vn/ban-can-ho-chung-cu-xa-tan-hoi-7-masteri-sky-quarter/vinhomes-dan-phuong-co-tot-nhat-booking-som-chon-dep-ck-16-an-han-toi-36-thang-pr44755109
Đan Phượng,Nhà ở xã hội Tân Lập- Nhà ở xã hội Ô DIÊN TÂN LẬP- DỰ KIẾN THU HỒ SƠ 1/5-15/5,,64.0,,X. Tân Lập (X. Ô Diên mới),Đăng 3 ngày trước,,https://batdongsan.com.vn/ban-can-ho-chung-cu-xa-tan-lap-24-khu-nha-o-xa-tan-lap-cienco-5/hoi-hoi-dien-du-kien-thu-so-1-5-15-5-pr45274604
