Khu vực,Tiêu đề,Giá (triệu),Diện tích (m²),Giá/m² (triệu),Vị trí,Ngày đăng,Cắt lỗ?,Link
Tây Hồ,"Chủ đầu tư chính thức ra hàng Celestine WestLake căn 2-3 ngủ đẹp nhất Hồ Tây, chiết khấu 10%, 0% LS",,84.0,,P. Phú Thượng (P. Hồng Hà mới),Đăng hôm qua,,https://batdongsan.com.vn/ban-can-ho-chung-cu-phuong-phu-thuong-1-celestine-westlake/chu-dau-tu-chinh-thuc-ra-hang-2-3-ngu-dep-nhat-tay-ch-khau-10-0-ls-pr43946422
Tây Hồ,Suất ngoại giao căn Duplex 4PN Noble Crystal Tây Hồ vị trí view đẹp giá tốt nhất hiện nay,37120.0,220.5,168.34467120181407,P. Phú Thượng,Đăng hôm qua,,https://batdongsan.com.vn/ban-can-ho-chung-cu-phuong-phu-thuong-1-noble-crystal-tay-ho/suat-ngoai-giao-duplex-4pn-vi-tri-view-ep-gia-tot-nhat-hien-nay-pr45292396
Tây Hồ,Quỹ căn tầng đẹp giá tốt chung cư The Reflection Westlake Tây Hồ liên hệ:0822 238 ***,,60.0,,P. Phú Thượng (P. Hồng Hà mới),Đăng hôm qua,,https://batdongsan.com.vn/ban-can-ho-chung-cu-duong-vo-chi-cong-phuong-phu-thuong-1-the-reflection-west-lake/quy-tang-ep-gia-tot-westlake-tay-lien-he-0822238686-pr45220058
Tây Hồ,Tưng bừng cất nóc công bố quỹ căn giá tốt nhất tại Celestine Westlake view Hồ Tây T3/2026,13600.0,85.0,160.0,P. Phú Thượng (P. Tây Hồ mới),Đăng hôm qua,,https://batdongsan.com.vn/ban-can-ho-chung-cu-duong-vo-chi-cong-phuong-phu-thuong-1-celestine-westlake/quy-mat-chua-tung-bo-cuoi-cung-tai-view-tay-t12-2025-pr44697931
Tây Hồ,"Bán và bàn giao căn hộ tinh hoa Tây Hồ, đơn vị quản lý Soho & Heritage 677 Lạc Long Quân thông báo",,94.0,,P. Phú Thượng (P. Hồng Hà mới),Đăng hôm qua,,https://batdongsan.com.vn/ban-can-ho-chung-cu-duong-lac-long-quan-phuong-phu-thuong-1-heritage-west-lake/ban-va-ban-giao-tinh-hoa-tay-don-vi-ly-soho-677-thong-bao-pr44398971
Tây Hồ,"CHÍNH CHỦ BÁN CH 1PN ĐẲNG CẤP TẠI NOBLE CRYSTAL  TÂY HỒ TÂY, CIPUTRA",12500.0,76.0,164.47368421052633,P. Phú Thượng,Đăng 2 ngày trước,,https://batdongsan.com.vn/ban-can-ho-chung-cu-phuong-phu-thuong-1-noble-crystal-tay-ho/chinh-chu-ban-ch-1pn-ang-cap-tai-tay-ciputra-pr45285995
Tây Hồ,"Căn hộ Ciputra DT 153m2 04PN BC Đông Nam, đủ đồ giá rẻ 13.3 tỷ. LH em Hường0936 670 ***",13300.0,153.0,86.9281045751634,P. Phú Thượng,Đăng 2 ngày trước,Có,https://batdongsan.com.vn/ban-can-ho-chung-cu-phuong-phu-thuong-1-khu-do-thi-nam-thang-long-ciputra/dt-153m-04pn-bc-ong-u-o-gia-re-13-3-ty-lh-em-huong-0936-670-899-pr45284018
Tây Hồ,Quỹ căn giá tốt 2PN - 3PN view Hồ Tây + Starlake tại HDI Tây Hồ (Võ Chí Công). Có slot ô tô. Sẵn sổ,8000.0,73.0,109.58904109589041,P. Xuân La (P. Xuân Đỉnh mới),Đăng 2 ngày trước,,https://batdongsan.com.vn/ban-can-ho-chung-cu-phuong-xuan-la-tay-ho-residence/hdi-vo-chi-cong-ban-goc-3pn-107-2m2-tang-cao-view-tron-so-lau-dai-gia-1x-ty-pr44825778
Tây Hồ,"Cập nhật danh sách bán căn hộ Ciputra KĐT Nam Thăng Long mới nhất tháng 032026 - hàng đẹp, giá tốt",13000.0,123.0,105.6910569105691,P. Phú Thượng,Đăng 2 ngày trước,,https://batdongsan.com.vn/ban-can-ho-chung-cu-duong-lac-long-quan-phuong-phu-thuong-1-khu-do-thi-nam-thang-long-ciputra/cap-nhat-bang-gia-ban-kdt-moi-nhat-3-2024-lh-pr39356340
Tây Hồ,Quỹ 30 căn hộ 1PN - 2PN - 3PN - PENTHOUSE Cần Bán tại chung cư The Prime Starlake - Tây Hồ Tây,16000.0,84.48,189.39393939393938,P. Xuân La (P. Xuân Đỉnh mới),Đăng 3 ngày trước,,https://batdongsan.com.vn/ban-can-ho-chung-cu-duong-vo-chi-cong-phuong-xuan-la-kdt-tay-ho-tay-starlake-ha-noi/quy-30-1pn-2pn-3pn-penthouse-ban-tai-the-prime-tay-pr45210776
Đống Đa,Chính chủ bán căn 3PN đồ đẹp Vinhomes Nguyễn Chí Thanh giá rẻ nhất thị trường. Liên hệ0372 004 ***,18000.0,120.0,150.0,P. Láng Thượng (P. Láng mới),Đăng hôm qua,Có,https://batdongsan.com.vn/ban-can-ho-chung-cu-duong-nguyen-chi-thanh-phuong-lang-thuong-vinhomes-nguyen-chi-thanh/chinh-chu-ban-2pn-do-dep-gia-re-nhat-thi-truong-lien-he-pr44292544
Đống Đa,"Quỹ cuối căn hộ 65-135m2 từ 2-4PN CC The Nestar 83 Hào Nam. Quỹ CĐT, sổ đỏ, full nội thất, slot xe",14000.0,90.0,155.55555555555554,P. Ô Chợ Dừa (P. Ô Chợ Dừa mới),Đăng 2 ngày trước,,https://batdongsan.com.vn/ban-can-ho-chung-cu-pho-hao-nam-phuong-o-cho-dua-the-terra-hao-nam/quy-cuoi-65-135m2-tu-2-4pn-cc-nestar-83-quy-c-t-so-full-noi-that-slot-xe-pr45279945
Đống Đa,"Chính chủ bán căn hộ cao cấp số 102 Thái Thịnh, căn góc 2 ban công, full nội thất mới 100%",12000.0,114.4,104.8951048951049,P. Thịnh Quang (P. Đống Đa mới),Đăng 4 ngày trước,,https://batdongsan.com.vn/ban-can-ho-chung-cu-pho-thai-thinh-phuong-thinh-quang-ha-thanh-plaza/chinh-chu-ban-cao-cap-so-102-goc-2-ban-cong-full-noi-that-moi-100-pr45195491
Đống Đa,"Bán tập thể Chùa Láng, Đống Đa 70m2 - 2PN - giá 4,1 tỷ - nhà đẹp ở luôn",4100.0,70.0,58.57142857142857,P. Láng Thượng (P. Láng mới),Đăng hôm nay,,https://batdongsan.com.vn/ban-can-ho-chung-cu-pho-chua-lang-phuong-lang-thuong-3/hoa-hau-chi-4-63-ty-tap-the-dong-da-2-thoang-so-to-70m2-2pn-nha-dep-pr44113276
Đống Đa,"Tập thể Phố Huỳnh Thúc Kháng, Đống Đa, lô góc, view phố, 80m2 3PN chủ nhiệt bán giá tốt 4,85 tỷ",4850.0,80.0,60.625,P. Láng Hạ (P. Đống Đa mới),Đăng hôm nay,,https://batdongsan.com.vn/ban-can-ho-chung-cu-duong-huynh-thuc-khang-phuong-lang-ha-3/sieu-pham-mat-pho-dong-da-lo-goc-view-pho-80m2-3pn-chi-5-13-ty-pr44851164
Đống Đa,Tập thể Phương Mai - Lương Định Của - 3PN 2WC - 3 mặt thoáng - ô tô đỗ cầu thang,4590.0,75.0,61.2,P. Phương Mai (P. Kim Liên mới),Đăng hôm nay,,https://batdongsan.com.vn/ban-can-ho-chung-cu-pho-luong-dinh-cua-phuong-phuong-mai-3/tap-the-inh-3pn-2wc-3-mat-thoang-o-to-o-cau-thang-pr45179896
Đống Đa,Tập thể phố Nguyễn Chí Thanh - 90m2 - 3PN - 2WC - view thoáng - oto vòng quanh - 6.3 tỷ,6300.0,90.0,70.0,P. Láng Thượng (P. Láng mới),Đăng hôm nay,,https://batdongsan.com.vn/ban-can-ho-chung-cu-duong-nguyen-chi-thanh-phuong-lang-thuong-3/tap-the-pho-90m2-3pn-2wc-view-thoang-oto-vong-quanh-6-3-ty-pr45200546
Đống Đa,"Tập thể Phương Mai, Đống Đa, tầng 1, ô tô đỗ, 60m2 2pn đẹp ở luôn giá 3,68 tỷ",3680.0,60.0,61.333333333333336,P. Phương Mai (P. Kim Liên mới),Đăng hôm nay,,https://batdongsan.com.vn/ban-can-ho-chung-cu-pho-phuong-mai-phuong-phuong-mai-3/nhinh-3-ty-tap-the-ong-a-tang-1-o-to-o-60m2-2pn-nha-ep-pr45224851
Đống Đa,"Tôi chủ nhà! Cần bán gấp căn hộ chung cư cao cấp 79 m2,2 PN tòa 165 Thái Hà, ban công Đông Nam",8950.0,79.0,113.29113924050633,P. Láng Hạ (P. Giảng Võ mới),Đăng hôm nay,Có,https://batdongsan.com.vn/ban-can-ho-chung-cu-pho-thai-ha-phuong-lang-ha-song-hong-park-view/toi-chu-nha-ban-gap-cao-cap-80-m2-2-pn-toa-165-ban-cong-dong-nam-pr45070690
Đống Đa,"Tập thể Kim Liên, Đống Đa, view phố, lô góc 90m2 3PN 3WC ở luôn giá 4,55 tỷ",4550.0,90.0,50.55555555555556,P. Kim Liên,Đăng hôm nay,,https://batdongsan.com.vn/ban-can-ho-chung-cu-pho-luong-dinh-cua-phuong-kim-lien-3/duplex-tap-the-ong-a-view-lo-goc-90m2-3pn-3wc-nha-ep-chi-4-55-ty-pr45184407
Đống Đa,"Bán căn hộ toà M5 Nguyễn Chí Thanh. Căn góc 149m2 3PN 2WC. Nhà ở luôn giá 12,2 tỷ",12200.0,149.0,81.87919463087249,P. Láng Hạ (P. Giảng Võ mới),Đăng hôm nay,,https://batdongsan.com.vn/ban-can-ho-chung-cu-duong-nguyen-chi-thanh-phuong-lang-ha-chung-cu-m5-nguyen-chi-thanh/ban-toa-goc-149m-3pn-2wc-nha-o-luon-gia-12-2-ty-pr45292668
Đống Đa,"Bán tập thể 2PN, 60m2 tại Tôn Đức Thắng, Văn Miếu, Đống Đa, giá ưu đãi 3,78 tỷ",3780.0,60.0,63.0,P. Văn Miếu - Quốc Tử Giám (P. Văn Miếu-quốc Tử Giám mới),Đăng hôm nay,,https://batdongsan.com.vn/ban-can-ho-chung-cu-pho-ton-duc-thang-phuong-van-mieu-quoc-tu-giam-3/ban-tap-the-2pn-60m2-tai-uc-ong-a-gia-uu-ai-3-78-ty-pr45224522
Đống Đa,"Bán tập thể Vĩnh Hồ, Đống Đa, 70m2 2PN ở luôn hàng hiếm giá 3,79 tỷ cực chất",3790.0,70.0,54.142857142857146,P. Thịnh Quang (P. Đống Đa mới),Đăng hôm nay,,https://batdongsan.com.vn/ban-can-ho-chung-cu-duong-vinh-ho-phuong-thinh-quang-3/ban-tap-the-2pn-1wc-tai-3-79-ty-70m2-hang-hiem-tai-gia-cuc-chat-pr45224363
Đống Đa,CĂN HỘ 2PN - 3PN VIEW 2 HỒ LỚN NHẤT PHƯỜNG ĐỐNG ĐA. SỔ ĐỎ LÂU DÀI. XEM NHÀ 24/7:0899 822 ***,,137.0,,P. Láng Hạ (P. Giảng Võ mới),Đăng 4 ngày trước,,https://batdongsan.com.vn/ban-can-ho-chung-cu-pho-lang-ha-phuong-lang-ha-green-diamond-93-lang-ha/cap-nhat-bang-hang-dot-2-voi-nhieu-2pn-3pn-lan-dau-tien-ra-hang-chinh-sach-hap-dan-pr37484807
Đống Đa,Bán Chung cư Cao Cấp TT quận Đống Đa,13500.0,125.0,108.0,P. Phương Mai (P. Kim Liên mới),Đăng 6 ngày trước,,https://batdongsan.com.vn/ban-can-ho-chung-cu-duong-truong-chinh-phuong-phuong-mai-capital-garden-102-truong-chinh/ban-cao-cap-tt-quan-dong-da-pr44652255
Đống Đa,"Bán căn hộ chung cư cao cấp Hà Thành Plaza số 102 Thái Thịnh, 114m2, 3 ngủ; full đồ, nội thất đẹp",11500.0,114.0,100.87719298245614,P. Thịnh Quang (P. Đống Đa mới),Đăng 1 tuần trước,,https://batdongsan.com.vn/ban-can-ho-chung-cu-pho-thai-thinh-phuong-thinh-quang-ha-thanh-plaza/ban-cao-cap-so-102-114m2-3-ngu-full-o-noi-that-ep-pr45243265
Đống Đa,Quỹ căn chuyển nhượng từ 1-2-3-4 phòng | sẵn sổ đỏ cập nhật liên tục tại Green Diamond 93 Láng Hạ,,86.0,,P. Láng Hạ (P. Giảng Võ mới),Đăng 1 tuần trước,,https://batdongsan.com.vn/ban-can-ho-chung-cu-pho-lang-ha-phuong-lang-ha-green-diamond-93-lang-ha/quy-chuyen-nhuong-tu-1-2-3-4-phong-san-so-do-cap-nhat-lien-tuc-tai-93-ha-pr42650757
Đống Đa,"QUỸ CĂN BÁN TẠI CHCC TÂN HOÀNG MINH - 36 HOÀNG CẦU 3PN, NT FULL, VIEW ĐẸP. LH:0906 961 ***",,135.0,,P. Ô Chợ Dừa (P. Ô Chợ Dừa mới),Đăng 1 tuần trước,,https://batdongsan.com.vn/ban-can-ho-chung-cu-pho-hoang-cau-phuong-o-cho-dua-d-le-pont-dor-hoang-cau/chinh-chu-ban-cao-cap-toa-tan-minh-dt-151m2-3-ngu-3-vs-full-do-11-9-ty-pr40367994
Đống Đa,Cần tiền bán nhanh 3 căn chung cư 34 t hoàng đạo thúy giá đầu tư,12700.0,131.0,96.94656488549619,P. Láng Hạ (P. Giảng Võ mới),Đăng 1 tuần trước,,https://batdongsan.com.vn/ban-can-ho-chung-cu-pho-lang-ha-phuong-lang-ha-green-diamond-93-lang-ha/ngoai-giao-140m-3pn-full-noi-that-93-trung-tam-ong-a-pr45231302
Đống Đa,"Quỹ 20 căn bán tại chung cư cao cấp Hateco Laroma, 2PN, 3PN, duplex, penthouse.0963 668 ***",,120.0,,P. Láng Thượng (P. Láng mới),Đăng 1 tuần trước,,https://batdongsan.com.vn/ban-can-ho-chung-cu-duong-huynh-thuc-khang-phuong-lang-thuong-hateco-laroma/quy-20-ban-tai-cao-cap-2pn-3pn-duplex-penthouse-12-ty-pr44518188
Đống Đa,Chính chủ bán 3 căn hộ tại Lancaster Lumianire 1152 Láng với diện tích 49m2-156m2-180m2 giá rẻ,,168.0,,P. Láng Thượng (P. Láng mới),Đăng 2 tuần trước,Có,https://batdongsan.com.vn/ban-can-ho-chung-cu-duong-lang-phuong-lang-thuong-lancaster-luminaire/chinh-chu-ban-3-tai-lumianire-1152-voi-dien-tich-49m2-156m2-180m2-gia-re-pr45194173
Đống Đa,"Bán căn hộ 88 Láng Hạ, Sky City: 101 m2, 2 PN + 1, 2 WC, nhà đẹp, thoáng, giá 12,3 tỷ",12300.0,101.0,121.78217821782178,P. Láng Hạ (P. Giảng Võ mới),Đăng hôm nay,,https://batdongsan.com.vn/ban-can-ho-chung-cu-pho-lang-ha-phuong-lang-ha-sky-city-towers-88-lang-ha/ban-88-108-m2-2-pn-1-2-wc-nha-dep-thoang-gia-13-ty-pr44769308
Đống Đa,"Bán căn hộ tòa nhà 102 Thái Thịnh, 115 m2, 3 PN, 2 phụ, nội thất, căn góc, hướng ĐN, giá 10.9 tỷ",10900.0,115.0,94.78260869565217,P. Thịnh Quang (P. Đống Đa mới),Đăng hôm nay,,https://batdongsan.com.vn/ban-can-ho-chung-cu-pho-thai-thinh-phuong-thinh-quang-ha-thanh-plaza/ban-toa-nha-102-115-m2-3-pn-2-phu-noi-that-goc-huong-dn-gia-9-6-ty-pr44143546
Đống Đa,"Bán căn hộ tòa nhà M5 - 91 Nguyễn Chí Thanh 149 m2, 3 PN, căn góc, nội thất, giá 12,2 tỷ",12200.0,149.0,81.87919463087249,P. Láng Hạ (P. Giảng Võ mới),Đăng hôm nay,,https://batdongsan.com.vn/ban-can-ho-chung-cu-duong-nguyen-chi-thanh-phuong-lang-ha-chung-cu-m5-nguyen-chi-thanh/ban-toa-nha-91-149-m2-3-pn-goc-noi-that-gia-12-9-ty-pr44995913
Đống Đa,"Bán nhanh CC Vinhomes Nguyễn Chí Thanh, 120m2, 3PN + 2WC, Láng Thượng, Đống Đa, HN",16800.0,120.0,140.0,P. Láng Thượng (P. Láng mới),Đăng hôm nay,,https://batdongsan.com.vn/ban-can-ho-chung-cu-duong-nguyen-chi-thanh-phuong-lang-thuong-vinhomes-nguyen-chi-thanh/ban-nhanh-cc-11-ty-vnd-85m2-2pn-2wc-dong-da-hn-pr44473266
Đống Đa,"Bán căn hộ 71 Nguyễn Chí Thanh Vườn Xuân 123m2, 3 PN, view hồ, giá 10,45 tỷ",10460.0,123.0,85.04065040650407,P. Láng Hạ (P. Giảng Võ mới),Đăng hôm nay,,https://batdongsan.com.vn/ban-can-ho-chung-cu-phuong-lang-ha-chung-cu-vuon-xuan-71-nguyen-chi-thanh/ban-71-95-m2-2-pn-co-the-sua-3-pn-view-gia-8-2-ty-pr44739331
Đống Đa,"Bán CH 3PN Vinhomes Nguyễn Chí Thanh, căn góc, hướng Đông Nam trục hiếm, view đẹp, nội thất đẹp",18000.0,128.0,140.625,P. Láng Thượng (P. Láng mới),Đăng hôm nay,,https://batdongsan.com.vn/ban-can-ho-chung-cu-duong-nguyen-chi-thanh-phuong-lang-thuong-vinhomes-nguyen-chi-thanh/ban-ch-3pn-goc-huong-ong-nam-truc-hiem-view-ep-noi-that-ep-pr45295224
Đống Đa,"Tập thể Kim Liên, khu B, T3, 60 m2 (30 m2 sổ), 2 ngủ, 4.x tỷ",4500.0,60.0,75.0,P. Kim Liên,Đăng hôm nay,,https://batdongsan.com.vn/ban-can-ho-chung-cu-pho-luong-dinh-cua-phuong-kim-lien-3/tap-the-khu-b-t3-60-m2-30-m2-so-2-ngu-4-x-ty-pr45296960
Đống Đa,"Bán căn hộ Vườn Xuân 71 Nguyễn Chí Thanh căn góc 3PN, nhà mới, ở ngay",10900.0,96.0,113.54166666666667,P. Láng Hạ (P. Giảng Võ mới),Đăng hôm nay,,https://batdongsan.com.vn/ban-can-ho-chung-cu-duong-nguyen-chi-thanh-phuong-lang-ha-chung-cu-vuon-xuan-71-nguyen-chi-thanh/ban-71-goc-3pn-nha-moi-o-ngay-pr45295037
Đống Đa,"Tập thể Chùa Bộc, lô góc, 80m2 (sổ 57 m2), 3 ngủ, 5.05 tỷ",5050.0,80.0,63.125,P. Trung Liệt (P. Kim Liên mới),Đăng hôm nay,,https://batdongsan.com.vn/ban-can-ho-chung-cu-pho-chua-boc-phuong-trung-liet-3/tap-the-lo-goc-80m2-so-57-m2-3-ngu-5-05-ty-pr45168817
Hai Bà Trưng,"Mua bán căn hộ Sunshine Garden giá rẻ: 1N: 4,6 tỷ, 3N: 8,3 tỷ , 4N: 10,5 tỷ - SĐT:0981 757 ***",8300.0,100.0,83.0,·P. Vĩnh Tuy (P. Vĩnh Tuy mới),Đăng hôm qua,Có,https://batdongsan.com.vn/ban-can-ho-chung-cu-duong-duong-van-be-phuong-vinh-tuy-sunshine-garden/mua-ban-gia-re-1ngu-3-8-ty-2ngu-6-ty-3ngu-6-7-ty-sdt-pr43654783
Hai Bà Trưng,Mua bán chung cư cao cấp giá rẻ Hà Nội Sunshine Garden cạnh Timescity Minh Khai - HBT -0812 395 ***,8700.0,114.0,76.3157894736842,·P. Vĩnh Tuy (P. Vĩnh Tuy mới),Đăng hôm qua,Có,https://batdongsan.com.vn/ban-can-ho-chung-cu-duong-duong-van-be-phuong-vinh-tuy-sunshine-garden/chinh-chu-ban-gap-hoa-hau-3pn-82m2-sunshinegarden-minh-khai-hbt-gia-chi-4-ty-lhe-pr39028867
Hai Bà Trưng,"Bán căn 1 ngủ giá 5,9 tỷ, 2N2WC giá 8,3 tỷ và quỹ căn bán 1,2,3 ngủ rẻ nhất Timescity:0943 358 ***",8400.0,83.0,101.20481927710843,·P. Vĩnh Tuy (P. Vĩnh Tuy mới),Đăng 2 ngày trước,,https://batdongsan.com.vn/ban-can-ho-chung-cu-duong-minh-khai-phuong-vinh-tuy-times-city/bang-gia-moi-nhat-thang-9-re-nhat-view-dep-san-so-ban-gap-lh-pr44039674
Hai Bà Trưng,"Tập thể Quỳnh Mai tầng 3 sổ 53,8m2 thực sử dụng 105m2 3N3 VSKK chỉ 5.55 tỷ ở sướng hơn chung cư",5550.0,105.0,52.857142857142854,P. Quỳnh Mai (P. Bạch Mai mới),Đăng hôm nay,,https://batdongsan.com.vn/ban-can-ho-chung-cu-phuong-quynh-mai/chinh-chu-ban-tap-the-nha-e6-tang-5-so-do-35-4m2-thuc-te-80m2-du-cong-nang-nhinh-3-ty-pr43572460
Hai Bà Trưng,"Bán nhà tại Phố Lò Đúc, 3,38 tỷ, 32m2, 2PN + 1 WC. View mặt phố",3380.0,23.7,142.61603375527426,P. Phạm Đình Hổ (P. Hai Bà Trưng mới),Đăng 2 ngày trước,,https://batdongsan.com.vn/ban-can-ho-chung-cu-pho-lo-duc-phuong-pham-dinh-ho-4/ban-nha-rieng-tai-uc-3-38-ty-32m2-2pn-1-wc-view-mat-pho-pr45143441
Hai Bà Trưng,Bán gấp căn 2 ngủ 2 vệ sinh cam kết có slot ô tô cố định như ảnh ở Times City. Liên hệ0943 358 ***,10300.0,76.0,135.52631578947367,P. Vĩnh Tuy (P. Vĩnh Tuy mới),Đăng 2 ngày trước,Có,https://batdongsan.com.vn/ban-can-ho-chung-cu-duong-minh-khai-phuong-vinh-tuy-times-city/ban-gap-2-ngu-2-ve-sinh-cam-ket-co-slot-oto-co-dinh-nhu-anh-o-lien-he-pr43857170
Hai Bà Trưng,"Hiếm, duplex mặt phố Lò Đúc - không gian thoáng - sân BBQ - 4PN - 2WC",5930.0,110.0,53.90909090909091,P. Đồng Nhân (P. Hai Bà Trưng mới),Đăng 1 tuần trước,,https://batdongsan.com.vn/ban-can-ho-chung-cu-pho-lo-duc-phuong-dong-nhan-4/hiem-duplex-mat-khong-gian-thoang-san-bbq-4pn-2wc-pr45014884
Hai Bà Trưng,Rao bán quỹ căn hộ giá tốt nhất Sunshine Garden - Vĩnh Tuy - Hai Bà Trưng - Cao Tuấn Anh0889 108 ***,9000.0,94.0,95.74468085106383,·P. Vĩnh Tuy (P. Vĩnh Tuy mới),Đăng 2 ngày trước,,https://batdongsan.com.vn/ban-can-ho-chung-cu-duong-duong-van-be-phuong-vinh-tuy-sunshine-garden/genz-land-chuyen-chuyen-nhuong-quy-da-dang-gia-tot-nhat-cho-khach-o-thuc-pr41938029
Hai Bà Trưng,"Quỹ căn hộ bán cắt lỗ sâu 2PN, 3PN tại Imperia 423 Minh Khai. LH0947 418 ***",,105.0,,P. Vĩnh Tuy (P. Vĩnh Tuy mới),Đăng 2 ngày trước,Có,https://batdongsan.com.vn/ban-can-ho-chung-cu-duong-minh-khai-phuong-vinh-tuy-imperia-sky-garden/quy-ban-cat-lo-sau-2pn-3pn-tai-423-lh-pr44198436
Hai Bà Trưng,"Trưởng phòng kinh doanh bán gấp quỹ căn chuyển nhượng 423 Minh Khai 2PN, LH xem nhà0913 484 ***",6000.0,74.83,80.18174528932246,P. Vĩnh Tuy (P. Vĩnh Tuy mới),Đăng 2 ngày trước,Có,https://batdongsan.com.vn/ban-can-ho-chung-cu-duong-minh-khai-phuong-vinh-tuy-imperia-sky-garden/ban-gap-quy-chuyen-nhuong-423-2pn-3pn-lh-xem-nha-truc-tiep-091348-40-47-pr25522422
Hai Bà Trưng,Bán căn 2 phòng ngủ 87m² Park Hill Thiết kế 2 ngủ sáng 2 vệ sinh phòng khách rộng chủ nhà thiện chí,10700.0,87.0,122.98850574712644,P. Vĩnh Tuy (P. Vĩnh Tuy mới),Đăng 2 ngày trước,,https://batdongsan.com.vn/ban-can-ho-chung-cu-duong-minh-khai-phuong-vinh-tuy-times-city/ban-2-phong-ngu-87m-park-hill-thiet-ke-2-ngu-sang-2-ve-sinh-phong-khach-rong-chu-nha-thien-chi-pr45283001
Hai Bà Trưng,Quỹ căn hộ bán độc quyền giá rẻ Imperia Sky Garden Minh Khai - Em Cường0976 044 ***,10700.0,98.0,109.18367346938776,P. Vĩnh Tuy (P. Vĩnh Tuy mới),Đăng 2 ngày trước,Có,https://batdongsan.com.vn/ban-can-ho-chung-cu-duong-minh-khai-phuong-vinh-tuy-imperia-sky-garden/quy-ban-doc-quyen-gia-re-em-cuong-pr43596926
Hai Bà Trưng,"Quỹ căn hộ 1 - 2 - 3 - 4 phòng ngủ, Penthouse giá rẻ Sunshine Garden Minh Khai - E Cường0976 044 ***",8700.0,114.0,76.3157894736842,P. Vĩnh Tuy (P. Vĩnh Tuy mới),Đăng 4 ngày trước,Có,https://batdongsan.com.vn/ban-can-ho-chung-cu-duong-duong-van-be-phuong-vinh-tuy-sunshine-garden/ban-4pn-3wc-129m2-gia-chi-9ty-em-cuong-pr44336538
Hai Bà Trưng,Quỹ căn hộ giá rẻ dòng tiền lớn tại Sunshine Garden cạnh Timescity 1PN-4PN Phạm Minh Đức0982 869 ***,8300.0,116.0,71.55172413793103,P. Vĩnh Tuy (P. Vĩnh Tuy mới),Đăng 4 ngày trước,Có,https://batdongsan.com.vn/ban-can-ho-chung-cu-duong-duong-van-be-phuong-vinh-tuy-sunshine-garden/tong-hop-quy-gia-re-1pn-2pn-3pn-4pn-pham-minh-duc-pr44224546
Hai Bà Trưng,"Giá rẻ nhất - chính chủ gửi bán căn 2 ngủ tòa T09 - T11 giá rẻ 8,7 tỷ và quỹ căn 1-2-3-4 kèm theo",8700.0,83.0,104.81927710843374,P. Vĩnh Tuy (P. Vĩnh Tuy mới),Đăng 4 ngày trước,Có,https://batdongsan.com.vn/ban-can-ho-chung-cu-duong-minh-khai-phuong-vinh-tuy-times-city/gia-re-nhat-chinh-chu-gui-ban-2-ngu-toa-t08-gia-re-8-4-8-5-ty-va-quy-1-2-3-4-kem-theo-pr45114613
Hai Bà Trưng,Bán căn 2 phòng ngủ view thoáng 90m2 full đồ giá chỉ 9.9 tỷ. Quỹ căn có slot ô tô cập nhật T3/2026,9900.0,90.0,110.0,P. Vĩnh Tuy (P. Vĩnh Tuy mới),Đăng 1 tuần trước,,https://batdongsan.com.vn/ban-can-ho-chung-cu-duong-minh-khai-phuong-vinh-tuy-times-city/ban-2-phong-ngu-view-thoang-90m2-full-o-gia-chi-9-9-ty-quy-co-slot-o-to-cap-nhat-t3-2026-pr45243301
Hai Bà Trưng,Quỹ căn hộ chuyển nhượng độc quyền 1-2-3-4PN giá rẻ Times City tháng 03/2026 - Em Giang0971 255 ***,8800.0,83.0,106.02409638554217,P. Vĩnh Tuy (P. Vĩnh Tuy mới),Đăng 1 tuần trước,Có,https://batdongsan.com.vn/ban-can-ho-chung-cu-duong-minh-khai-phuong-vinh-tuy-times-city/quy-chuyen-nhuong-oc-quyen-1-2-3-4pn-gia-re-thang-03-2026-em-giang-0971255168-pr45224698
Hai Bà Trưng,Chính chủ bán căn hộ 2PN toà T9 Times City DT: 83m2 liên hệ:0947 189 ***xem nhà 24/7,10000.0,83.0,120.48192771084338,P. Vĩnh Tuy (P. Vĩnh Tuy mới),Đăng 1 tuần trước,,https://batdongsan.com.vn/ban-can-ho-chung-cu-duong-minh-khai-phuong-vinh-tuy-times-city/chinh-chu-ban-2pn-toa-t9-dt-83m-lien-he-0947-189-339-xem-nha-24-7-pr45218799
Hai Bà Trưng,"Chính chủ cần bán căn 2 ngủ toà S1, chung cư Hinode Minh Khai. Đã có sổ hồng, pháp lý rõ ràng.",11300.0,82.22,137.4361469228898,P. Minh Khai (P. Tương Mai mới),Đăng hôm qua,,https://batdongsan.com.vn/ban-can-ho-chung-cu-duong-minh-khai-phuong-minh-khai-hinode-city/chinh-chu-ban-2-ngu-toa-s1-a-co-so-hong-phap-ly-ro-rang-pr45295502
Hai Bà Trưng,"CẦN BÁN GẤP CĂN HỘ 3N TÒA KINH ĐÔ 93 LÒ ĐÚC, HAI BÀ TRƯNG. 116M2, TẦNG TRUNG, NT ĐẸP, NHỈNH 13 TỶ.",13500.0,116.0,116.37931034482759,P. Phạm Đình Hổ (P. Hai Bà Trưng mới),Đăng hôm qua,Có,https://batdongsan.com.vn/ban-can-ho-chung-cu-pho-lo-duc-phuong-pham-dinh-ho-toa-nha-93-lo-duc-kinh-do-tower/ban-gap-3n-o-93-uc-hai-ba-trung-116m2-tang-trung-nt-ep-nhinh-13-ty-pr45291947
Hai Bà Trưng,ban 1n time city ban công nam thoang,7000.0,57.0,122.80701754385964,P. Vĩnh Tuy (P. Vĩnh Tuy mới),Đăng 2 ngày trước,,https://batdongsan.com.vn/ban-can-ho-chung-cu-duong-minh-khai-phuong-vinh-tuy-times-city/ban-1n-time-ban-cong-nam-thoang-pr45285548
Hai Bà Trưng,"Bán căn hộ chung cư Green Pearl 378 Minh Khai, tầng 15 74m2 full nội thất. LH0977 605 ***",8400.0,74.0,113.51351351351352,P. Vĩnh Tuy (P. Vĩnh Tuy mới),Đăng 3 ngày trước,,https://batdongsan.com.vn/ban-can-ho-chung-cu-duong-minh-khai-phuong-vinh-tuy-green-pearl-378-minh-khai/ban-378-tang-15-74m-full-noi-that-lh-0977605588-pr45275240
Hai Bà Trưng,Cập nhật quỹ căn hộ chuyển nhượng giá rẻ nhất T1/2026 Sunshine Garden - Em Long0869 971 ***,8350.0,100.0,83.5,P. Vĩnh Tuy (P. Vĩnh Tuy mới),Đăng 5 ngày trước,Có,https://batdongsan.com.vn/ban-can-ho-chung-cu-duong-duong-van-be-phuong-vinh-tuy-sunshine-garden/quy-mua-ban-gia-re-t10-city-em-long-pr44227386
Hai Bà Trưng,Quỹ căn hộ chuyển nhượng giá tốt Imperia Sky Garden Minh Khai - Liên hệ em Hưng0971 629 ***,6780.0,60.0,113.0,P. Vĩnh Tuy (P. Vĩnh Tuy mới),Đăng 6 ngày trước,,https://batdongsan.com.vn/ban-can-ho-chung-cu-duong-minh-khai-phuong-vinh-tuy-imperia-sky-garden/quy-chuyen-nhuong-gia-tot-lien-he-em-hung-0971629027-pr45245261
Thanh Trì,Chính chủ để lại suất cán bộ 3PN mã 06A và 09B. Quà tặng tiền mặt 330 triệu. Hỗ trợ vay NH lãi 6.5%,,99.6,,X. Tứ Hiệp (X. Thanh Trì mới),Đăng hôm qua,,https://batdongsan.com.vn/ban-can-ho-chung-cu-duong-nguyen-bac-1-xa-tu-hiep-bluegem-tower/chinh-chu-e-lai-suat-bo-3pn-ma-06a-va-09b-qua-tang-tien-mat-330-trieu-tro-vay-nh-lai-6-5-pr45289005
Thanh Trì,Căn hộ 2PN tòa Seren không gian sống cân bằng giữa thiên nhiên & đô thị,6850.0,76.33,89.74191012707979,TT. Văn Điển (P. Hoàng Liệt mới),Đăng 2 ngày trước,,https://batdongsan.com.vn/ban-can-ho-chung-cu-duong-ngoc-hoi-thi-tran-van-dien-greenera-southmark/bo-doi-1pn-truc-dep-06-co-dau-tu-sinh-loi-an-ly-tuong-tai-southmark-pr44399330
Thanh Trì,"6,5 tỷ SH căn 3 ngủ 100m2 trung tâm Thanh Trì, vay tối đa 80% GTCH, LS 6,5% 12T, tặng 1 chỉ vàng",6500.0,100.0,65.0,X. Tứ Hiệp (X. Thanh Trì mới),Đăng 3 ngày trước,,https://batdongsan.com.vn/ban-can-ho-chung-cu-duong-nguyen-bac-1-xa-tu-hiep-bluegem-tower/6-5-ty-sh-3-ngu-100m2-trung-tam-thanh-tri-vay-toi-a-80-gtch-ls-6-5-12t-tang-1-chi-vang-pr45269901
Thanh Trì,"Chính chủ bán gấp căn hộ 67m2 tại Eco Green City, 6,1 tỷ, 2PN, 2WC, view đẹp",6100.0,67.0,91.04477611940298,X. Tân Triều (P. Thanh Liệt mới),Đăng 4 ngày trước,Có,https://batdongsan.com.vn/ban-can-ho-chung-cu-duong-nguyen-xien-xa-tan-trieu-eco-green-city/chinh-chu-ban-gap-67m2-tai-6-1-ty-2pn-2wc-view-ep-pr45254868
Thanh Trì,"Em Giang căn ngoại giao đặc biệt hiếm có, giá tốt nhất thị trường, hỗ trợ vay ngân hàng",7000.0,127.0,55.118110236220474,X. Tứ Hiệp (X. Thanh Trì mới),Đăng hôm nay,,https://batdongsan.com.vn/ban-can-ho-chung-cu-duong-tu-hiep-xa-tu-hiep-tecco-garden/em-giang-quy-ngoai-giao-dac-biet-hiem-co-gia-tot-nhat-thj-truong-tro-vay-ngan-hang-pr43874813
