Khu vực,Tiêu đề,Giá (triệu),Diện tích (m²),Giá/m² (triệu),Vị trí,Ngày đăng,Cắt lỗ?,Link
Hoài Đức,"Độc quyền bán Căn hộ cao cấp 2PN, 60m2 tầng trung, BC Đông Nam view công viên nội khu Imperia MIK",,60.0,,·X. An Khánh,Đăng hôm qua,,https://batdongsan.com.vn/ban-can-ho-chung-cu-duong-dai-lo-thang-long-xa-an-khanh-4-imperia-sky-park/ban-cc-2pn-60m2-tang-trung-gia-uu-ai-ha-noi-pr45277657
Hoài Đức,IMPERIA SKY PARK NAM AN KHÁNH  NHẬN BOOKING SỚM | CĂN HỘ CAO CẤP SỞ HỮU LÂU DÀI,5020.0,54.0,92.96296296296296,·X. An Khánh,Đăng hôm qua,,https://batdongsan.com.vn/ban-can-ho-chung-cu-duong-dai-lo-thang-long-xa-an-khanh-4-imperia-sky-park/nam-nhan-booking-som-cao-cap-so-huu-lau-dai-pr45290879
Hoài Đức,"MỞ BÁN CHUNG CƯ IMPERIA SKY PARK 1-2-3PN GẦN VINHOMES SMART CITY TÂY MỖ, CÁCH SVĐ MỸ ĐÌNH CHỈ 8PH",,42.0,,·X. An Khánh,Đăng hôm qua,,https://batdongsan.com.vn/ban-can-ho-chung-cu-duong-dai-lo-thang-long-xa-an-khanh-4-imperia-sky-park/mo-ban-1-2-3pn-ngay-canh-vinhomes-smart-city-tay-mo-cach-sv-my-inh-chi-7-phut-pr45253829
Hoài Đức,Chỉ từ 419tr sở hữu căn hộ MIK An Khánh cạnh Vinhomes Smart City. Liên hệ0888 999 ***,,28.0,,·X. An Khánh,Đăng 2 ngày trước,,https://batdongsan.com.vn/ban-can-ho-chung-cu-duong-dai-lo-thang-long-xa-an-khanh-4-imperia-sky-park/chi-tu-419tr-so-huu-mik-canh-vinhomes-smart-city-lien-he-0888999819-pr45254080
Hoài Đức,Anh chị quan tâm dự án MIK An Khánh tuyệt đối đừng bỏ qua bài phân tích này,,68.0,,·X. An Khánh,Đăng 2 ngày trước,,https://batdongsan.com.vn/ban-can-ho-chung-cu-duong-dai-lo-thang-long-xa-an-khanh-4-imperia-sky-park/anh-chi-quan-tam-du-mik-tuyet-oi-ung-bo-qua-bai-phan-tich-nay-pr45271137
Hoài Đức,Chỉ từ hơn 400 triệu sở hữu căn hộ Imperia Sky Park - MIK An Khánh. Kí trực tiếp với CĐT MIK Group,,43.0,,·X. An Khánh,Đăng 2 ngày trước,,https://batdongsan.com.vn/ban-can-ho-chung-cu-duong-dai-lo-thang-long-xa-an-khanh-4-imperia-sky-park/chi-tu-hon-400trieu-so-huu-mik-ki-truc-tiep-voi-c-t-mik-group-pr45255208
Hoài Đức,Booking quỹ ngoại giao căn hộ cao cấp The Flame Vine HH03 Hinode Royal Park,,75.0,,·X. Di Trạch (X. Hoài Đức mới),Đăng 1 tuần trước,,https://batdongsan.com.vn/ban-can-ho-chung-cu-duong-vanh-dai-3-5-xa-di-trach-the-flame-vine/quy-ngoai-giao-cao-cap-hh03-hinode-royal-park-pr45239972
Hoài Đức,"Quỹ căn STUDIO, 1PN, 2PN+ độc quyền tại toà Imperia Sky Park Early Bird 15% tặng FULL đồ liền tường",,69.0,,·X. An Khánh,Đăng 1 tuần trước,,https://batdongsan.com.vn/ban-can-ho-chung-cu-duong-dai-lo-thang-long-xa-an-khanh-4-imperia-sky-park/quy-studio-1pn-2pn-oc-quyen-tai-toa-early-bird-15-tang-full-o-lien-tuong-pr45227678
Hoài Đức,RA MẮT CHUNG CƯ IMPERIA SKY PARK NAM AN KHÁNH,,28.0,,·X. An Khánh,Đăng 1 tuần trước,,https://batdongsan.com.vn/ban-can-ho-chung-cu-duong-dai-lo-thang-long-xa-an-khanh-4-imperia-sky-park/ra-mat-nam-khanh-pr45232497
Hoài Đức,Chỉ 95 triệu/m² cơ hội cuối cùng để mua Imperia Sky Park dòng căn Studio- 3PN- Sky Villa Metro số 5,14630.0,154.0,95.0,X. An Khánh,Đăng hôm nay,,https://batdongsan.com.vn/ban-can-ho-chung-cu-duong-dai-lo-thang-long-xa-an-khanh-4-imperia-sky-park/chi-90tr-m2-co-hoi-cuoi-cung-e-mua-dong-studio-3pn-villa-metro-so-5-pr45296635
Hoài Đức,Danh sách các căn hộ đang có nhu cầu chuyển nhượng giá tốt tại The Wisteria loại 2 & 3 phòng ngủ,6500.0,83.0,78.3132530120482,X. Di Trạch (X. Hoài Đức mới),Đăng hôm nay,,https://batdongsan.com.vn/ban-can-ho-chung-cu-duong-32-xa-di-trach-chung-cu-the-wisteria/danh-sach-cac-dang-co-nhu-cau-chuyen-nhuong-gia-tot-tai-loai-2-3-phong-ngu-pr45059737
Hoài Đức,Quỹ căn chuyển nhượng Wisteria: Xuân sang đón lộc - về nhà an cư,6200.0,83.0,74.6987951807229,X. Di Trạch (X. Hoài Đức mới),Đăng hôm nay,,https://batdongsan.com.vn/ban-can-ho-chung-cu-duong-32-xa-di-trach-chung-cu-the-wisteria/quy-chuyen-nhuong-xuan-sang-don-loc-ve-nha-an-cu-pr45050315
Hoài Đức,"Booking đợt đầu căn hộ chung cư The Flame Vine, giá dự kiến 70 triệu/m2, 70 m2, 2PN, 2WC",,70.0,,X. Di Trạch (X. Hoài Đức mới),Đăng hôm qua,,https://batdongsan.com.vn/ban-can-ho-chung-cu-duong-vanh-dai-3-5-xa-di-trach-the-flame-vine/ban-ot-au-70-trieu-m2-70-m2-2pn-2wc-pr45287926
Hoài Đức,Đại lý Seven Realty đã và đang nhận được rất nhiều lượt booking của dự án Imperia Sky Park,6180.0,65.0,95.07692307692308,X. An Khánh,Đăng 2 ngày trước,,https://batdongsan.com.vn/ban-can-ho-chung-cu-duong-dai-lo-thang-long-xa-an-khanh-4-imperia-sky-park/ai-ly-seven-realty-a-va-ang-nhan-uoc-rat-nhieu-luot-booking-cua-du-park-pr45188539
Hoài Đức,CĂN HỘ CHUNG CƯ TẠI HOÀI ĐỨC TÀI CHÍNH CHỈ TỪ 2 TỶ TẠI DỰ ÁN THE FLAME VINE HINODE ROYAL PARK,,73.0,,X. Di Trạch (X. Hoài Đức mới),Đăng 2 ngày trước,,https://batdongsan.com.vn/ban-can-ho-chung-cu-duong-quoc-lo-32-xa-di-trach-hinode-royal-park/tai-hoai-uc-tai-chinh-chi-tu-2-ty-tai-du-an-the-flame-vine-park-pr45240675
Hoài Đức,BOOKING SỚM - ĐÚNG ĐẠI LÝ - CHỌN CĂN ĐẸP - IMPERIA SKY PARK,,55.0,,X. An Khánh,Đăng 3 ngày trước,,https://batdongsan.com.vn/ban-can-ho-chung-cu-duong-dai-lo-thang-long-xa-an-khanh-4-imperia-sky-park/booking-som-ung-ai-ly-chon-ep-park-pr45274547
Thanh Trì,Quỹ căn 3N trước khi bàn giao T6. Giá nhỉnh 6 tỷ . Ck 3% . Quà tặng 110tr,,100.0,,·X. Tứ Hiệp (X. Thanh Trì mới),Đăng hôm nay,,https://batdongsan.com.vn/ban-can-ho-chung-cu-duong-nguyen-bac-1-xa-tu-hiep-bluegem-tower/quy-3n-truoc-khi-ban-giao-t6-gia-nhinh-6-ty-ck-3-qua-tang-110tr-pr45304034
Thanh Trì,Mở bán đợt cuối quỹ ngoại giao căn 3PN BlueGem Tower giá 63.8 triệu/m2 full VAT trực tiếp CĐT,6700.0,105.0,63.80952380952381,X. Tứ Hiệp (X. Thanh Trì mới),Đăng hôm nay,,https://batdongsan.com.vn/ban-can-ho-chung-cu-duong-nguyen-bac-1-xa-tu-hiep-bluegem-tower/mo-ban-dot-cuoi-quy-ngoai-giao-3pn-blue-gem-gia-62-trieu-m2-full-vat-truc-tiep-cdt-pr44716087
Thanh Trì,Chính chủ để lại suất cán bộ 3PN mã 06A và 09B. Quà tặng tiền mặt 330 triệu. Hỗ trợ vay NH lãi 6.5%,,99.6,,X. Tứ Hiệp (X. Thanh Trì mới),Đăng hôm qua,,https://batdongsan.com.vn/ban-can-ho-chung-cu-duong-nguyen-bac-1-xa-tu-hiep-bluegem-tower/chinh-chu-e-lai-suat-bo-3pn-ma-06a-va-09b-qua-tang-tien-mat-330-trieu-tro-vay-nh-lai-6-5-pr45289005
Thanh Trì,"Chính chủ bán gấp căn hộ 67m2 tại Eco Green City, 6,1 tỷ, 2PN, 2WC, view đẹp",6100.0,67.0,91.04477611940298,X. Tân Triều (P. Thanh Liệt mới),Đăng 4 ngày trước,Có,https://batdongsan.com.vn/ban-can-ho-chung-cu-duong-nguyen-xien-xa-tan-trieu-eco-green-city/chinh-chu-ban-gap-67m2-tai-6-1-ty-2pn-2wc-view-ep-pr45254868
Thanh Trì,"Em Giang căn ngoại giao đặc biệt hiếm có, giá tốt nhất thị trường, hỗ trợ vay ngân hàng",7000.0,127.0,55.118110236220474,X. Tứ Hiệp (X. Thanh Trì mới),Đăng hôm nay,,https://batdongsan.com.vn/ban-can-ho-chung-cu-duong-tu-hiep-xa-tu-hiep-tecco-garden/em-giang-quy-ngoai-giao-dac-biet-hiem-co-gia-tot-nhat-thj-truong-tro-vay-ngan-hang-pr43874813
Thanh Trì,"CT8B Căn hộ chung cư 66m2 tầng trung, ban công Đông Nam mát mẻ",4250.0,66.0,64.39393939393939,X. Tả Thanh Oai (X. Đại Thanh mới),Đăng hôm nay,,https://batdongsan.com.vn/ban-can-ho-chung-cu-duong-phan-trong-tue-xa-ta-thanh-oai-chung-cu-dai-thanh/ct8b-66m2-tang-trung-ban-cong-ong-nam-mat-me-pr45276649
Thanh Trì,"Bán Căn hộ đẹp, nhiều tiện ích 3,22 tỷ, 47,3 m2 tại Căn hộ 1208 Tòa CT10A, Đại Thanh, Hà Nội",3220.0,47.3,68.07610993657505,X. Tả Thanh Oai (X. Đại Thanh mới),Đăng hôm qua,,https://batdongsan.com.vn/ban-can-ho-chung-cu-duong-phan-trong-tue-xa-ta-thanh-oai-chung-cu-dai-thanh/ban-ep-nhieu-tien-ich-3-22-ty-47-3-m2-tai-1208-toa-ct10a-ai-ha-noi-pr45268330
Thanh Trì,Chính chủ bán chung cư Eco Green 286 Nguyễn Xiển,6650.0,73.9,89.98646820027064,X. Tân Triều (P. Thanh Liệt mới),Đăng 1 tuần trước,,https://batdongsan.com.vn/ban-can-ho-chung-cu-duong-nguyen-xien-xa-tan-trieu-eco-green-city/chinh-chu-ban-286-xien-pr45202488
Thanh Trì,Căn hộ 2PN tòa Seren không gian sống cân bằng giữa thiên nhiên & đô thị,6850.0,76.33,89.74191012707979,TT. Văn Điển (P. Hoàng Liệt mới),Đăng 2 ngày trước,,https://batdongsan.com.vn/ban-can-ho-chung-cu-duong-ngoc-hoi-thi-tran-van-dien-greenera-southmark/bo-doi-1pn-truc-dep-06-co-dau-tu-sinh-loi-an-ly-tuong-tai-southmark-pr44399330
Thanh Trì,"6,5 tỷ SH căn 3 ngủ 100m2 trung tâm Thanh Trì, vay tối đa 80% GTCH, LS 6,5% 12T, tặng 1 chỉ vàng",6500.0,100.0,65.0,X. Tứ Hiệp (X. Thanh Trì mới),Đăng 3 ngày trước,,https://batdongsan.com.vn/ban-can-ho-chung-cu-duong-nguyen-bac-1-xa-tu-hiep-bluegem-tower/6-5-ty-sh-3-ngu-100m2-trung-tam-thanh-tri-vay-toi-a-80-gtch-ls-6-5-12t-tang-1-chi-vang-pr45269901
Thanh Trì,"Duy nhất 10 căn độc quyền 2PN và 2PN sân vườn, giá chỉ với 6,8tỷ trên/căn gọi ngay nhận thông tin",6800.0,76.3,89.1218872870249,TT. Văn Điển (P. Hoàng Liệt mới),Đăng 4 ngày trước,,https://batdongsan.com.vn/ban-can-ho-chung-cu-duong-ngoc-hoi-thi-tran-van-dien-greenera-southmark/2pn-khong-gian-song-chuan-cho-gia-dinh-tre-o-thuc-doc-ban-tai-southmark-pr45064013
Thanh Trì,"Chính chủ bán gấp căn hộ 67m2 tại Eco Green City, 6,1 tỷ, 2PN, 2WC, view đẹp",6100.0,67.0,91.04477611940298,X. Tân Triều (P. Thanh Liệt mới),Đăng 4 ngày trước,Có,https://batdongsan.com.vn/ban-can-ho-chung-cu-duong-nguyen-xien-xa-tan-trieu-eco-green-city/chinh-chu-ban-gap-67m2-tai-6-1-ty-2pn-2wc-view-ep-pr45254868
Thanh Trì,"Quỹ căn Ecogreen tháng 3. Các căn DT: 55m2 (4,6 tỷ). 67m2 (5,7 tỷ), 75m2 (6 tỷ), 95m2 ( 8,2 tỷ),...",6000.0,75.0,80.0,X. Tân Triều (P. Thanh Liệt mới),Đăng hôm nay,,https://batdongsan.com.vn/ban-can-ho-chung-cu-duong-nguyen-xien-xa-tan-trieu-eco-green-city/quy-ecogreen-thang-3-cac-dt-55m2-4-6-ty-67m2-5-7-ty-75m2-6-ty-95m2-8-2-ty-pr45304249
Thanh Trì,"Bán gấp 5 căn hộ 55m2 67m2, 75m2, 86m2, 95m2 giá tốt, ko chào ảo tại Eco Green City. Lh:0975 226 ***",5900.0,75.0,78.66666666666667,X. Tân Triều (P. Thanh Liệt mới),Đăng hôm nay,Có,https://batdongsan.com.vn/ban-can-ho-chung-cu-duong-nguyen-xien-xa-tan-trieu-eco-green-city/ban-gap-4-55m2-67m2-86m2-95m2-tai-ecogreen-gia-tu-2-6-ty-lh-pr39131730
Thanh Trì,MỞ BÁN CHUNG CƯ CT14 - FLORIA HỒNG HÀ ECOCITY. LH:0963 805 ***,80.0,63.0,1.2698412698412698,X. Tứ Hiệp (X. Thanh Trì mới),Đăng hôm nay,,https://batdongsan.com.vn/ban-can-ho-chung-cu-xa-tu-hiep-hong-ha-eco-city/mo-ban-ct14-floria-ecocity-lh-0963805921-pr45299201
Thanh Trì,Cần bán căn hộ 2 ngủ đẹp - đủ đồ - giá rẻ chuẩn chủ nhà báo tại chung cư Viện 103 KDT Văn Quán,5300.0,82.5,64.24242424242425,X. Tân Triều (P. Hà Đông mới),Đăng hôm nay,Có,https://batdongsan.com.vn/ban-can-ho-chung-cu-duong-yen-xa-xa-tan-trieu-chung-cu-vien-103/ban-2-ngu-ep-u-o-gia-re-chuan-chu-nha-bao-tai-103-kdt-van-quan-pr45297887
Thanh Trì,"Chỉ 8x tr/m2, độc quyền căn 47m2 4 tỷ. Sẵn 1,2t ký HĐMB, vay 0% 24 tháng, ck tới 16%, Q tặng 400tr",4000.0,47.0,85.1063829787234,TT. Văn Điển (P. Hoàng Liệt mới),Đăng hôm qua,,https://batdongsan.com.vn/ban-can-ho-chung-cu-duong-ngoc-hoi-thi-tran-van-dien-greenera-southmark/chi-8x-tr-m2-oc-quyen-47m2-4-ty-san-1-2t-ky-h-mb-vay-0-24-thang-ck-toi-16-q-tang-400tr-pr45271308
Thanh Trì,"Chuẩn giá như ảnh: Bán căn 75m2 (2N2WC) giá 6.3 tỷ, sẵn sổ tại Eco Green City Nguyễn Xiển",6300.0,75.0,84.0,X. Tân Triều (P. Thanh Liệt mới),Đăng 2 ngày trước,,https://batdongsan.com.vn/ban-can-ho-chung-cu-duong-nguyen-xien-xa-tan-trieu-eco-green-city/chuan-gia-nhu-anh-ban-76m2-2n2wc-full-noi-that-san-so-tai-gia-6-5-ty-pr45214585
Thanh Trì,"Quỹ căn tháng 6-2025 Eco Green City, 67m2- 5.5tỷ, 75m2-6.1tỷ, 86m2-7.6tỷ, 95m2-8tỷ view thoáng mát",6100.0,75.0,81.33333333333333,X. Tân Triều (P. Thanh Liệt mới),Đăng 2 ngày trước,,https://batdongsan.com.vn/ban-can-ho-chung-cu-duong-nguyen-xien-xa-tan-trieu-eco-green-city/quy-thang-6-2025-67m2-4-5ty-75m2-5ty-86m2-6-2ty-95m2-6-5ty-view-thoang-mat-pr43242062
Thanh Trì,SM2.0910 giá tốt nhất dự án | hàng giai đoạn đầu biên độ sinh lời cao,6500.0,79.3,81.9672131147541,TT. Văn Điển (P. Hoàng Liệt mới),Đăng 2 ngày trước,,https://batdongsan.com.vn/ban-can-ho-chung-cu-duong-ngoc-hoi-thi-tran-van-dien-greenera-southmark/sm2-0910-gia-tot-nhat-du-an-hang-giai-doan-dau-bien-do-sinh-loi-cao-pr45109782
Thanh Trì,3PN dual - key Lavish | Linh hoạt cho đa thế hệ Tối ưu giá trị sinh lời,10000.0,124.5,80.32128514056225,TT. Văn Điển (P. Hoàng Liệt mới),Đăng 2 ngày trước,,https://batdongsan.com.vn/ban-can-ho-chung-cu-duong-ngoc-hoi-thi-tran-van-dien-greenera-southmark/sieu-pham-truc-vang-duy-nhat-2pn-dep-nhat-du-an-chinh-thuc-tai-xuat-pr44399571
Thanh Trì,Bán suất ngoại giao đặc biệt căn 3PN diện tích 105m2 giá chỉ hơn 63 triệu/m2 giảm sâu tới 260 triệu,6700.0,105.0,63.80952380952381,X. Tứ Hiệp (X. Thanh Trì mới),Đăng 3 ngày trước,,https://batdongsan.com.vn/ban-can-ho-chung-cu-duong-nguyen-bac-1-xa-tu-hiep-bluegem-tower/ban-suat-ngoai-giao-ac-biet-3pn-dien-tich-105-m2-gia-chi-63-trieu-m2-giam-sau-toi-260-trieu-pr45272154
Thanh Trì,"BQL gửi bán CH 67m2, 75m2, 86m2, 95m2 tòa EcoGreen. Full đồ, có sổ đỏ phù hợp ở lâu dài, Giá thật.",8300.0,95.0,87.36842105263158,X. Tân Triều (P. Thanh Liệt mới),Đăng 3 ngày trước,,https://batdongsan.com.vn/ban-can-ho-chung-cu-duong-nguyen-xien-xa-tan-trieu-eco-green-city/bql-gui-ban-ch-67m2-75m2-86m2-95m2-toa-ecogreen-full-o-co-so-o-phu-hop-o-lau-dai-gia-that-pr45271054
Thanh Trì,"Tôi cần bán chung cư Viện 103, Văn Quán 84m2, 2 phòng ngủ, 2 vs, giá tốt",4800.0,84.0,57.142857142857146,X. Tân Triều (P. Hà Đông mới),Đăng 3 ngày trước,,https://batdongsan.com.vn/ban-can-ho-chung-cu-duong-yen-xa-xa-tan-trieu-chung-cu-vien-103/toi-ban-103-gan-van-quan-112m2-3-ngu-2-vs-gia-tot-pr44105555
Thanh Trì,BÁN CHUNG CƯ TABUDEC PLAZA 3 PHÒNG NGỦ NỘI THẤT CAO CẤP TẦNG ĐẸP LH:0937 893 ***,7070.0,104.0,67.98076923076923,X. Tả Thanh Oai (X. Đại Thanh mới),Đăng 4 ngày trước,,https://batdongsan.com.vn/ban-can-ho-chung-cu-duong-phan-trong-tue-xa-ta-thanh-oai-tabudec-plaza/ban-3-phong-ngu-noi-that-cao-cap-tang-ep-lh-0937893286-pr45203746
Ba Đình,"Hiếm! Bán căn hộ tập thể 260 Đội Cấn Ba Đình 85m2 sử dụng, 3PN, 2 ban công thoáng, khu dân trí cao",6900.0,55.0,125.45454545454545,·P. Liễu Giai (P. Ngọc Hà mới),Đăng hôm qua,,https://batdongsan.com.vn/ban-can-ho-chung-cu-duong-doi-can-phuong-lieu-giai-2/ban-nha-tap-the-khu-260-trung-tam-ba-dinh-85m2-su-dung-3-ngu-2-ban-cong-thoang-pr45129588
Ba Đình,Vinhomes Metropolis 29 Liễu Giai giá 175tr/m2 (ngày 10/03/2026) em Trà0913 809 ***,24000.0,110.0,218.1818181818182,P. Ngọc Khánh (P. Giảng Võ mới),Đăng 3 ngày trước,,https://batdongsan.com.vn/ban-can-ho-chung-cu-pho-lieu-giai-phuong-ngoc-khanh-vinhomes-metropolis-lieu-giai/29-gia-175tr-m2-ngay-12-09-2025-em-tra-pr43995377
Ba Đình,"Quỹ căn cần bán gấp Vinhomes Metropolis 1PN, 2PN, 3PN, 4PN, giá tốt, xem nhà 24/7, LH0987 709 ***",34000.0,146.0,232.87671232876713,P. Ngọc Khánh (P. Giảng Võ mới),Đăng 2 tuần trước,Có,https://batdongsan.com.vn/ban-can-ho-chung-cu-pho-lieu-giai-phuong-ngoc-khanh-vinhomes-metropolis-lieu-giai/quy-can-ban-gap-thang-1-2024-1-4pn-re-nhat-thi-truong-xem-nha-24-7-lh-mr-hung-pr38868617
Ba Đình,Chính chủ bán căn hộ tập thể Thành Công,8000.0,42.3,189.12529550827423,P. Thành Công (P. Giảng Võ mới),Đăng 2 ngày trước,,https://batdongsan.com.vn/ban-can-ho-chung-cu-duong-nguyen-hong-phuong-thanh-cong-2/chinh-chu-ban-tap-the-cong-pr45258785
Ba Đình,"Hiếm! Tập thể tầng 1 Đào Tấn, full nội thất 2 mặt thoáng 100m2 sử dụng - 2PN riêng - 2WC",5900.0,48.0,122.91666666666667,P. Ngọc Khánh (P. Giảng Võ mới),Đăng 3 ngày trước,,https://batdongsan.com.vn/ban-can-ho-chung-cu-duong-dao-tan-phuong-ngoc-khanh-2/hiem-tap-the-tang-1-full-noi-that-2-mat-thoang-2pn-rieng-2wc-khep-kin-pr44956152
Ba Đình,"Hiếm! Căn hộ TT khu 7,2ha Vĩnh Phúc - tầng thấp - ban công rộng - 2PN - 2WC",4690.0,70.0,67.0,P. Vĩnh Phúc (P. Ngọc Hà mới),Đăng 1 tuần trước,,https://batdongsan.com.vn/ban-can-ho-chung-cu-duong-vinh-phuc-phuong-vinh-phuc-2/hiem-tt-khu-7-2ha-tang-thap-ban-cong-rong-2pn-2wc-pr45100689
Ba Đình,Căn hộ tầng 3 - 7.2ha Vĩnh Phúc - Ba Đình - 2 ngủ 65m2 - phân lô - ô tô đỗ,4650.0,65.0,71.53846153846153,P. Vĩnh Phúc (P. Ngọc Hà mới),Đăng 1 tuần trước,,https://batdongsan.com.vn/ban-can-ho-chung-cu-duong-vinh-phuc-phuong-vinh-phuc-2/tang-3-7-2ha-ba-inh-2-ngu-65m2-phan-lo-o-to-o-pr45157310
Ba Đình,Bán căn hộ tập thể DT 80m Tầng 2 sửa đep đủ nội thất gần hồ Thành Công chợ Thành Công quận Ba Đình,5500.0,80.0,68.75,P. Thành Công (P. Giảng Võ mới),Đăng hôm nay,,https://batdongsan.com.vn/ban-can-ho-chung-cu-phuong-thanh-cong/ban-tap-the-dt-80m-tang-2-sua-ep-u-noi-that-gan-cho-quan-ba-inh-pr45303071
Ba Đình,"Bán gấp quỹ 30 căn hộ chung cư cao cấp Vinhome Metropolis, 2PN-3PN, tầng cao, view hồ.0963 668 ***",,110.0,,P. Ngọc Khánh (P. Giảng Võ mới),Đăng 2 ngày trước,Có,https://batdongsan.com.vn/ban-can-ho-chung-cu-pho-lieu-giai-phuong-ngoc-khanh-vinhomes-metropolis-lieu-giai/ban-gap-quy-30-cao-cap-vinhome-2pn-3pn-tang-cao-view-0963668936-pr45280100
Ba Đình,"Bán căn góc CC 3PN, 3WC, 120m2 tầng cao view hồ đẹp Vinhomes Metropolis, giá tốt. LH0942 033 ***",,120.0,,P. Ngọc Khánh (P. Giảng Võ mới),Đăng 2 ngày trước,,https://batdongsan.com.vn/ban-can-ho-chung-cu-pho-lieu-giai-phuong-ngoc-khanh-vinhomes-metropolis-lieu-giai/ban-cc-4pn-3wc-140m2-tang-cao-view-dep-gia-tot-lh-pr44030810
Ba Đình,"Hai bác gửi bán căn hộ cao cấp Vinhomes Metropolis với mức giá cực tốt, nội thất full, sổ đỏ sẵn",,110.0,,P. Ngọc Khánh (P. Giảng Võ mới),Đăng 3 ngày trước,,https://batdongsan.com.vn/ban-can-ho-chung-cu-pho-lieu-giai-phuong-ngoc-khanh-vinhomes-metropolis-lieu-giai/chinh-chu-gui-ban-cao-cap-voi-muc-gia-cuc-tot-noi-that-full-so-do-san-pr45131281
Ba Đình,"Cực hiếm! CH 3PN tầng cao view Sông Hồng tại Aqua Central, nội thất cao cấp. Sổ đỏ. LH0965 666 ***",18500.0,120.0,154.16666666666666,P. Trúc Bạch (P. Ba Đình mới),Đăng 3 ngày trước,,https://batdongsan.com.vn/ban-can-ho-chung-cu-duong-yen-phu-phuong-truc-bach-ha-noi-aqua-central/ban-ch-3pn-tang-cao-view-song-hong-ban-full-that-cao-cap-so-o-lh-0965666331-pr45270715
Ba Đình,"Bán căn hộ tập thể Bắc Thành Công duplex, khu G, Đ. Nguyên Hồng, giá nhỉnh 10 tỷ (TL) - miễn TG",10090.0,51.0,197.84313725490196,P. Thành Công (P. Giảng Võ mới),Đăng 4 ngày trước,,https://batdongsan.com.vn/ban-can-ho-chung-cu-duong-nguyen-hong-phuong-thanh-cong-2/ban-tt-the-bac-duplex-gia-10-ty-thuong-luong-mien-tg-pr45143753
Ba Đình,Quỹ căn hộ cần chuyển nhượng giá tốt nhất - gọi xem nhà ngay hôm nay. Hotline0989 138 ***,11500.0,55.0,209.0909090909091,P. Ngọc Khánh (P. Giảng Võ mới),Đăng 1 tuần trước,,https://batdongsan.com.vn/ban-can-ho-chung-cu-pho-lieu-giai-phuong-ngoc-khanh-vinhomes-metropolis-lieu-giai/quy-chuyen-nhuong-gia-tot-nhat-goi-xem-nha-ngay-hom-nay-hotline-pr40396592
Ba Đình,"Quỹ căn chuyển nhượng từ 1PN, 2PN, 3PN| full NT, căn góc view hồ tại Diamond Park Plaza 16 Láng Hạ",7300.0,57.0,128.0701754385965,P. Thành Công (P. Giảng Võ mới),Đăng 1 tuần trước,,https://batdongsan.com.vn/ban-can-ho-chung-cu-pho-lang-ha-phuong-thanh-cong-diamond-park-plaza/cap-nhat-quy-ban-tai-16-1pn-3pn-gia-tot-nhat-thi-truong-pr43938296
Ba Đình,NHƯỢNG CĂN 2 3 và 4 NGỦ PENHOUSE NGUYÊN BẢN CĐT BÀN GIAO VIEW HỒ,,106.0,,P. Thành Công (P. Giảng Võ mới),Đăng 1 tuần trước,,https://batdongsan.com.vn/ban-can-ho-chung-cu-pho-lang-ha-phuong-thanh-cong-the-nelson-private-residences/quy-noi-bo-tang-dep-gia-niem-yet-chiet-khau-cao-cho-quy-khach-hang-trong-thang-12-pr41924361
Ba Đình,"Bán căn hộ chung cư 130 Đốc Ngữ, khu vực cực hiếm nhà bán, nhà đẹp ở ngay, khu dân trí cao",9600.0,98.0,97.95918367346938,P. Liễu Giai (P. Ngọc Hà mới),Đăng hôm nay,,https://batdongsan.com.vn/ban-can-ho-chung-cu-pho-doc-ngu-phuong-lieu-giai-2/ban-130-khu-vuc-cuc-hiem-nha-ban-nha-dep-o-ngay-khu-dan-tri-cao-pr44909308
Ba Đình,"Penthouse 280m2 full nội thất. Tầng trung, hướng mát. Và quỹ căn chuyển nhượng giá tốt",,280.0,,P. Thành Công (P. Giảng Võ mới),Đăng hôm nay,,https://batdongsan.com.vn/ban-can-ho-chung-cu-pho-lang-ha-phuong-thanh-cong-the-nelson-private-residences/penthouse-280m-full-noi-that-tang-trung-huong-mat-va-quy-chuyen-nhuong-gia-tot-pr45151301
Ba Đình,CH Vinhomes Metropolis - Liễu Giai sẵn sổ cập nhật liên tục,,280.0,,P. Ngọc Khánh (P. Giảng Võ mới),Đăng hôm nay,,https://batdongsan.com.vn/ban-can-ho-chung-cu-pho-lieu-giai-phuong-ngoc-khanh-vinhomes-metropolis-lieu-giai/quy-chuyen-nhuong-1-2-3-4-phong-ch-san-so-cap-nhat-lien-tuc-lh-pr45151293
Ba Đình,"Bán căn nhà tập thể tầng 2 khu Thành công , nhà đẹp",5450.0,35.0,155.71428571428572,P. Thành Công (P. Giảng Võ mới),Đăng hôm nay,,https://batdongsan.com.vn/ban-can-ho-chung-cu-duong-thanh-cong-phuong-thanh-cong-2/ban-nha-tap-the-tang-2-khu-nha-ep-pr45286457
Ba Đình,Anh chị cần bán CC Nelson LH e Vượng. E Vượng chuyên bán chuyển nhượng ở Nelson,,106.0,,P. Thành Công (P. Giảng Võ mới),Đăng hôm nay,,https://batdongsan.com.vn/ban-can-ho-chung-cu-pho-lang-ha-phuong-thanh-cong-the-nelson-private-residences/pkd-cdt-ban-cc-3pn-2wc-106m2-tai-ba-dinh-hn-pr42661010
Ba Đình,Chuyên chuyển nhượng toà Diamond Park Plaza tại 16 Láng Hạ 2PN giá tốt,,96.0,,P. Thành Công (P. Giảng Võ mới),Đăng hôm nay,,https://batdongsan.com.vn/ban-can-ho-chung-cu-pho-lang-ha-phuong-thanh-cong-diamond-park-plaza/ban-2pn-96m2-tai-11-9-ty-view-dep-ba-dinh-noi-pr42660861
Ba Đình,Chuyên Chuyển nhượng Grandeur Palace tại 138 Giảng Võ 1PN-2PN-3PN . Hỗ trợ a/c xem nhà Xuyên TẾT,,87.0,,P. Kim Mã (P. Ba Đình mới),Đăng hôm nay,,https://batdongsan.com.vn/ban-can-ho-chung-cu-pho-giang-vo-phuong-kim-ma-grandeur-palace-giang-vo/chuyen-chuyen-nhuong-tai-138-1pn-2pn-3pn-tro-a-c-xem-nha-xuyen-tet-pr45159779
Ba Đình,"Bán căn 2PN - 87m2 -The Nelson 29 Láng Hạ - Sổ đỏ trao tay - nhận nhà ở ngay -Tầng trung, Giá tốt.",,87.1,,P. Thành Công (P. Giảng Võ mới),Đăng hôm nay,,https://batdongsan.com.vn/ban-can-ho-chung-cu-pho-lang-ha-phuong-thanh-cong-the-nelson-private-residences/ban-2pn-29-tang-15-thoang-dep-gia-tot-nhan-nha-2025-pr43978797
Đan Phượng,Quỹ Căn Nội Bộ Toà 22 Tầng Mở Bán Sớm. Giá 7xTr/m2. CK 14%. Vay 70% GTCH. Masterise Đan Phượng,5400.0,60.0,90.0,X. Tân Hội (X. Ô Diên mới),Đăng 3 ngày trước,,https://batdongsan.com.vn/ban-can-ho-chung-cu-duong-tay-thang-long-xa-tan-hoi-7-vinhomes-wonder-city/quy-noi-bo-ban-som-masterise-toa-16-22-tang-vay-70-gtch-du-an-dan-phuong-pr44717669
Đan Phượng,"Quỹ căn 2 - 3 ngủ giá tốt nhất Vinhomes Đan Phượng chỉ từ 7x tr/m2, cơ hội đầu tư chắc thắng",4730.0,60.0,78.83333333333333,X. Tân Hội (X. Ô Diên mới),Đăng hôm nay,,https://batdongsan.com.vn/ban-can-ho-chung-cu-xa-tan-hoi-7-masteri-sky-quarter/quy-2-3-ngu-gia-tot-nhat-vinhomes-an-phuong-chi-tu-7x-tr-m2-co-au-tu-chac-thang-pr45165401
Đan Phượng,"Ngộp bank! Cần bán lại căn 1N+, Toà Sky Tower A, hướng đẹp. Chung cư Masterise Đan Phượng",,44.0,,X. Tân Hội (X. Ô Diên mới),Đăng hôm nay,Có,https://batdongsan.com.vn/ban-can-ho-chung-cu-xa-tan-hoi-7-masteri-sky-quarter/suat-ngoai-giao-duplex-dien-tich-167m2-gia-59-tr-m2-ky-cdt-masterise-dan-phuong-pr44717876
Đan Phượng,"Độc quyền căn 3 ngủ, 88m2, ký CĐT, hướng Tây tứ mệnh. Chung cư Masterise Đan Phượng",,88.0,,X. Tân Hội (X. Ô Diên mới),Đăng hôm nay,,https://batdongsan.com.vn/ban-can-ho-chung-cu-xa-tan-hoi-7-masteri-sky-quarter/doc-quyen-3-ngu-88m2-ky-cdt-huong-tay-tu-menh-masterise-dan-phuong-pr44818946
Đan Phượng,Cần bán căn góc 2 ngủ + view bể bơi tầng trung giá tốt nhất thị trường - Toà 16 tầng,,66.0,,X. Tân Hội (X. Ô Diên mới),Đăng hôm nay,,https://batdongsan.com.vn/ban-can-ho-chung-cu-duong-422-xa-tan-hoi-7-masteri-sky-quarter/ban-goc-2-ngu-view-be-boi-tang-trung-gia-tot-nhat-thi-truong-toa-16-tang-pr44790345
Đan Phượng,"Bán gấp căn góc toà CT1A Tân Tây Đô, 2PN - 2WC, sổ đỏ đầy đủ, full đồ đẹp. LH:0387 720 ***",,76.0,,X. Tân Lập (X. Ô Diên mới),Đăng hôm nay,Có,https://batdongsan.com.vn/ban-can-ho-chung-cu-duong-quoc-lo-32-xa-tan-lap-24-khu-do-thi-moi-tan-tay-do/ban-55m-toa-ct2a-so-san-full-de-lai-gia-ban-1-ty-4xx-lh-pr38900896
