Khu vực,Tiêu đề,Giá (triệu),Diện tích (m²),Giá/m² (triệu),Vị trí,Ngày đăng,Cắt lỗ?,Link
Bắc Từ Liêm,Danh sách các căn hộ đang có nhu cầu chuyển nhượng tại An Bình City loại 2 & 3 PN giá cực tốt,8200.0,90.0,91.11111111111111,Phường Cổ Nhuế 1 (P. Phú Diễn mới),Đăng 2 ngày trước,,https://batdongsan.com.vn/ban-can-ho-chung-cu-duong-pham-van-dong-phuong-co-nhue-1-an-binh-city/phan-hang-group-chon-loc-cac-loai-2-3-pn-dang-nhu-cau-chuyen-nhuong-gia-tot-pr41790287
Bắc Từ Liêm,Danh Sách các căn hộ GreenStars loại 2 & 3 PN đang có nhu cầu chuyển nhượng giá tốt nhất thị trường,6100.0,66.8,91.31736526946108,Phường Cổ Nhuế 1 (P. Phú Diễn mới),Đăng 2 ngày trước,,https://batdongsan.com.vn/ban-can-ho-chung-cu-duong-pham-van-dong-phuong-co-nhue-1-green-stars/chon-loc-30-greenstars-loai-2-3-pn-dang-nhu-cau-chuyen-nhuong-gia-tot-nhat-thi-truong-pr44903723
Bắc Từ Liêm,"Độc quyền quỹ căn 2 - 3 - 4PN cần bán gấp sau Tết, ân hạn gốc 5 năm, tại Goldmark. LH:0399 028 ***",8300.0,94.0,88.29787234042553,P. Phú Diễn,Đăng 2 ngày trước,Có,https://batdongsan.com.vn/ban-can-ho-chung-cu-duong-ho-tung-mau-phuong-phu-dien-goldmark-city/doc-quyen-quy-2-3-4pn-ban-gap-cat-lo-tai-cap-nhat-hang-ngay-lh-pr40076519
Bắc Từ Liêm,"Cập nhật hàng ngày quỹ CH 2 - 3PN tại Green Stars bán gấp cắt lỗ sau tết, liên hệ: Mai0399 028 ***",5800.0,66.0,87.87878787878788,Phường Cổ Nhuế 1 (P. Phú Diễn mới),Đăng 2 ngày trước,Có,https://batdongsan.com.vn/ban-can-ho-chung-cu-duong-pham-van-dong-phuong-co-nhue-1-green-stars/cap-nhat-hang-ngay-quy-2-3pn-tai-star-ban-gap-lien-he-mai-pr39896407
Bắc Từ Liêm,"Cập nhật quỹ căn hộ 2 - 3PN tại CC Thái Hà - Bộ Công An cần bán gấp sau Tết, LH: Mai0399 028 ***",6100.0,70.0,87.14285714285714,Phường Cổ Nhuế 2 (P. Đông Ngạc mới),Đăng 2 ngày trước,Có,https://batdongsan.com.vn/ban-can-ho-chung-cu-duong-pham-van-dong-phuong-co-nhue-2-nha-o-cho-can-bo-chien-sy-bo-cong-an/cap-nhat-hang-ngay-quy-2-3pn-tai-cbcs-ban-gap-lh-mai-pr42827891
Bắc Từ Liêm,"Độc quyền quỹ căn hộ 2 - 3PN An Bình City cần bán gấp, cắt lỗ sâu, cần bán sau Tết, LH:0399 028 ***",8100.0,86.0,94.18604651162791,Phường Cổ Nhuế 1 (P. Phú Diễn mới),Đăng 2 ngày trước,Có,https://batdongsan.com.vn/ban-can-ho-chung-cu-duong-pham-van-dong-phuong-co-nhue-1-an-binh-city/tin-moi-nhat-cap-nhat-quy-3-2-ngu-ban-gap-trong-thang-12-lien-he-ngay-pr38770890
Bắc Từ Liêm,"Chính chủ bán căn góc 103m2 tòa S4 Sunshine city view nội khu giá 11,5tỷ",11500.0,103.0,111.6504854368932,P. Đông Ngạc (P. Phú Thượng mới),Đăng 3 ngày trước,,https://batdongsan.com.vn/ban-can-ho-chung-cu-phuong-dong-ngac-sunshine-city/chinh-chu-ban-goc-103m2-toa-s4-view-noi-khu-gia-11-5ty-pr45276861
Bắc Từ Liêm,"Bán căn 2 phòng ngủ Sunshine city giá chỉ 8,3 tỷ full nội thất",8300.0,73.0,113.6986301369863,P. Đông Ngạc (P. Phú Thượng mới),Đăng 3 ngày trước,,https://batdongsan.com.vn/ban-can-ho-chung-cu-phuong-dong-ngac-sunshine-city/ban-2-phong-ngu-gia-chi-8-3-ty-full-noi-that-pr45275058
Gia Lâm,"Bán căn hộ MetroPolitan 1PN + từ 3.3tỷ 2PN từ 3.85tỷ, 3PN view hồ từ 5.65tỷ, LH0911 269 ***",5990.0,89.5,66.92737430167598,·X. Dương Xá (X. Gia Lâm mới),Đăng hôm nay,,https://batdongsan.com.vn/ban-can-ho-chung-cu-xa-duong-xa-vinhomes-ocean-park-gia-lam/ban-metropolitan-studio-tu-2-35ty-1pn-tu-3-16ty-2pn-tu-3-85ty-3pn-tu-5-55ty-lh-pr44678951
Gia Lâm,"Quỹ căn khu Metro, TT tiến độ vào tiền ít từ 1-2 tỷ, bàn giao T1/2027, tiện ích cao cấp sang trọng",5650.0,83.0,68.07228915662651,·X. Dương Xá (X. Gia Lâm mới),Đăng hôm nay,,https://batdongsan.com.vn/ban-can-ho-chung-cu-xa-duong-xa-vinhomes-ocean-park-gia-lam/quy-khu-metro-tt-tien-do-vao-tien-it-tu-1-2-ty-ban-giao-t12-2026-tien-ich-cao-cap-sang-trong-pr44939376
Gia Lâm,"Quỹ căn Vinhomes Ocean Park cần bán giá rẻ, cắt lỗ gấp. Cam kết giá rẻ hơn thị trường 200-300tr/căn",,43.0,,·X. Dương Xá (X. Gia Lâm mới),Đăng hôm nay,Có,https://batdongsan.com.vn/ban-can-ho-chung-cu-xa-duong-xa-vinhomes-ocean-park-gia-lam/thanh-trung-group-quy-chinh-chu-gui-ban-phap-ly-ro-rang-hop-ly-nhat-pr39722407
Gia Lâm,SĐ sẵn két - Căn góc 2N2WC toà S203. DT tim tường 70m thông thuỷ 65m. Tầng 19 VIP không nồm ẩm,4950.0,65.0,76.15384615384616,X. Đa Tốn (X. Gia Lâm mới),Đăng hôm nay,,https://batdongsan.com.vn/ban-can-ho-chung-cu-xa-da-ton-the-sapphire-2-vinhomes-ocean-park/s-san-ket-goc-2n2wc-toa-s203-dt-tim-tuong-70m-thong-thuy-65m-tang-19-vip-ko-nom-am-pr45277132
Gia Lâm,Chính chủ bán căn hộ Masteri Waterfront Vinhomes Ocean Park | 47m2 | 1pn + | giá 3.9 tỷ luxury,3900.0,47.0,82.97872340425532,X. Đa Tốn (X. Gia Lâm mới),Đăng hôm nay,,https://batdongsan.com.vn/ban-can-ho-chung-cu-duong-quoc-lo-5b-xa-da-ton-masteri-waterfront/chinh-chu-ban-vinhomes-ocean-park-55m-2pn-2wc-gia-4-95-ty-luxury-pr44948641
Gia Lâm,"Cần tiền bán gấp căn Studio full đồ DT 33,5m2 giá cực chất 2,45 tỷ tại Vinhomes Ocean Park",2450.0,33.5,73.13432835820896,X. Đa Tốn (X. Gia Lâm mới),Đăng hôm nay,Có,https://batdongsan.com.vn/ban-can-ho-chung-cu-xa-da-ton-the-sapphire-1-vinhomes-ocean-park/tien-ban-gap-studio-full-do-dt-33-5m2-gia-cuc-chat-2-53-ty-tai-park-pr44862908
Gia Lâm,"Bán CC 1PN, 43,5m2 tại Vinhomes Ocean Park Gia Lâm, giá tốt 3,2 tỷ VND",3200.0,43.5,73.5632183908046,X. Đa Tốn (X. Gia Lâm mới),Đăng hôm nay,,https://batdongsan.com.vn/ban-can-ho-chung-cu-xa-da-ton-the-sapphire-2-vinhomes-ocean-park/ban-cc-1pn-43-5m2-tai-gia-lam-gia-tot-3-2-ty-vnd-pr44536686
Gia Lâm,"Studio gần toàn văn phòng dòng tiền tốt cần bán gấp, giá rẻ nhất thị trường",2250.0,27.7,81.2274368231047,X. Đa Tốn (X. Gia Lâm mới),Đăng hôm nay,Có,https://batdongsan.com.vn/ban-can-ho-chung-cu-xa-da-ton-the-sapphire-2-vinhomes-ocean-park/studio-gan-toan-van-phong-dong-tien-tot-ban-gap-gia-re-nhat-thi-truong-pr45262694
Gia Lâm,"Bán CH siêu hot 2PN, 1WC, 55.5m2 tại Vinhomes Ocean Park Gia Lâm, 3,7 tỷ",3700.0,55.5,66.66666666666667,X. Đa Tốn (X. Gia Lâm mới),Đăng hôm nay,,https://batdongsan.com.vn/ban-can-ho-chung-cu-xa-da-ton-the-sapphire-1-vinhomes-ocean-park/ban-ch-sieu-hot-2pn-1wc-54m2-tai-gia-lam-3-68-ty-pr44527997
Gia Lâm,"Chính chủ bán căn hộ 2pn 1wc S2.05 Vinhomes Ocean Park Gia Lâm, 55m2, giá 3.65 tỷ rẻ nhất TT",3650.0,55.0,66.36363636363636,X. Đa Tốn (X. Gia Lâm mới),Đăng hôm nay,,https://batdongsan.com.vn/ban-can-ho-chung-cu-xa-da-ton-the-sapphire-2-vinhomes-ocean-park/chinh-chu-ban-toa-s1-11-studio-gia-lam-30-5m-gia-2-42-ty-re-nhat-tt-pr44956847
Gia Lâm,Chính chủ bán gấp căn hộ 2PN2WC tòa S2.05 view thoáng Vinhomes Ocean Park | 63m2 | giá 4.15 tỷ,4150.0,63.0,65.87301587301587,X. Đa Tốn (X. Gia Lâm mới),Đăng hôm nay,Có,https://batdongsan.com.vn/ban-can-ho-chung-cu-xa-da-ton-the-sapphire-2-vinhomes-ocean-park/chinh-chu-ban-gap-2pn1wc-toa-s2-09-bc-dong-nam-55m2-gia-3-72-ty-pr44948337
Gia Lâm,"Chính chủ gửi bán nhanh căn 1PN + R1.032701 49m2, view biệt thự, giá 3.9 tỷ Vinhomes Ocean Park",3900.0,49.0,79.59183673469387,TT. Trâu Quỳ (X. Gia Lâm mới),Đăng hôm nay,,https://batdongsan.com.vn/ban-can-ho-chung-cu-duong-dong-du-1-thi-tran-trau-quy-the-zenpark/chinh-chu-ban-nhanh-1pn-r1-032701-49m2-view-biet-thu-gia-3-9-ty-vinhomes-ocean-park-pr44956427
Gia Lâm,"Chuyển vào Sài Gòn nên cần bán gấp căn 3PN, nội thất đẹp 2 ban công ĐN view siêu thoáng tầng đẹp",5100.0,74.8,68.18181818181819,X. Đa Tốn (X. Gia Lâm mới),Đăng hôm nay,Có,https://batdongsan.com.vn/ban-can-ho-chung-cu-xa-da-ton-the-sapphire-1-vinhomes-ocean-park/chuyen-vao-sai-gon-nen-ban-gap-3pn-noi-that-ep-2-ban-cong-n-view-sieu-thoang-tang-ep-pr45266760
Gia Lâm,Ban quản lý dự án Vinhomes quỹ 500 căn tháng 3 chính chủ giá tốt nhất thị trường studio 1PN 2PN 3PN,2950.0,43.0,68.6046511627907,·X. Dương Xá (X. Gia Lâm mới),Đăng hôm nay,,https://batdongsan.com.vn/ban-can-ho-chung-cu-duong-an-dao-xa-duong-xa-vinhomes-ocean-park-gia-lam/ban-quan-ly-du-quy-thang-12-chinh-chu-studio-1pn-2pn-3pn-mien-phi-trung-gian-pr44783891
Gia Lâm,"Quỹ căn độc quyền giá tốt view đẹp, sẵn sổ, hỗ trợ vay 70% xem nhà 24/7, miễn phí môi giới",2950.0,43.0,68.6046511627907,·X. Dương Xá (X. Gia Lâm mới),Đăng hôm nay,,https://batdongsan.com.vn/ban-can-ho-chung-cu-xa-duong-xa-vinhomes-ocean-park-gia-lam/quy-view-dep-chinh-chu-ban-cat-lo-tu-300tr-so-do-chinh-chu-mien-phi-mg-tro-vay-toi-70-pr39114589
Gia Lâm,QUỸ CĂN CẬP NHẬT MỚI NHẤT 2026 - PHÂN KHU SAPPHIRE VINHOMES OCEAN PARK,2200.0,27.0,81.48148148148148,·X. Dương Xá (X. Gia Lâm mới),Đăng hôm nay,,https://batdongsan.com.vn/ban-can-ho-chung-cu-xa-duong-xa-vinhomes-ocean-park-gia-lam/quy-cap-nhat-moi-nhat-2026-phan-khu-sapphire-park-pr45300074
Gia Lâm,Quỹ căn giá tốt nhất thị trường phân khu Masteri Water Front. Cập nhật mới nhất năm 2026,3550.0,43.0,82.55813953488372,·X. Đa Tốn (X. Gia Lâm mới),Đăng hôm nay,,https://batdongsan.com.vn/ban-can-ho-chung-cu-duong-quoc-lo-5b-xa-da-ton-masteri-waterfront/quy-gia-tot-nhat-thi-truong-phan-khu-water-front-cap-nhat-moi-nhat-nam-2026-pr45300069
Gia Lâm,"Tổng hợp quỹ căn The Zenpark, giá tốt nhất năm 2026",2500.0,27.0,92.5925925925926,·TT. Trâu Quỳ (X. Gia Lâm mới),Đăng hôm nay,,https://batdongsan.com.vn/ban-can-ho-chung-cu-duong-dong-du-1-thi-tran-trau-quy-the-zenpark/tong-hop-gia-tot-nhat-nam-2026-pr45233090
Gia Lâm,Chính chủ bán gấp căn studio tại tòa PR6 Vinhome Ocenpark1 full nội thất cao cấp- Q1/2027 nhận nhà,2220.0,27.5,80.72727272727273,·X. Đa Tốn (X. Gia Lâm mới),Đăng hôm qua,Có,https://batdongsan.com.vn/ban-can-ho-chung-cu-xa-da-ton-the-paris-vinhomes-ocean-park/chinh-chu-ban-gap-studio-tai-toa-pr6-vinhome-ocenpark1-full-noi-that-cao-cap-q1-2027-nhan-nha-pr45293467
Gia Lâm,"Quỹ căn 2 phòng ngủ giá tốt nhất Masteri Homes, sẵn khách thuê dòng tiền 14r/ tháng",4800.0,55.0,87.27272727272727,·X. Dương Xá (X. Gia Lâm mới),Đăng hôm qua,,https://batdongsan.com.vn/ban-can-ho-chung-cu-xa-duong-xa-vinhomes-ocean-park-gia-lam/quy-2-phong-ngu-tot-nhat-masteri-homes-san-khach-thue-dong-tien-14r-thang-pr45233099
Gia Lâm,Quỹ 500 căn hộ độc quyền chính chủ gửi bán giá tốt nhất tại Vinhomes Ocean Park! Miễn phí môi giới,3450.0,55.0,62.72727272727273,·X. Dương Xá (X. Gia Lâm mới),Đăng 2 ngày trước,,https://batdongsan.com.vn/ban-can-ho-chung-cu-xa-duong-xa-vinhomes-ocean-park-gia-lam/quy-500-oc-quyen-chinh-chu-gui-ban-tot-nhat-tai-mien-phi-moi-gioi-pr45210944
Gia Lâm,"Quỹ căn hộ bán cắt lỗ tại Vinhome Ocean Park, sẵn sổ sang tên, hỗ trợ vay 80%, full nội thất",3950.0,63.0,62.698412698412696,·X. Dương Xá (X. Gia Lâm mới),Đăng 2 ngày trước,Có,https://batdongsan.com.vn/ban-can-ho-chung-cu-xa-duong-xa-vinhomes-ocean-park-gia-lam/quy-ban-cat-lo-tai-vinhome-oceanpark-san-so-sang-ten-tro-vay-80-full-noi-that-pr45281792
Gia Lâm,"Căn hộ CC siêu hot tại Đa Tốn, 3,4 tỷ, 43,2 m2, 1PN, 1WC",3400.0,43.2,78.7037037037037,·X. Đa Tốn (X. Gia Lâm mới),Đăng 2 ngày trước,,https://batdongsan.com.vn/ban-can-ho-chung-cu-xa-da-ton/cc-sieu-hot-tai-a-3-4-ty-43-2-m2-1pn-1wc-pr45280762
Gia Lâm,"Quỹ căn phân khu Zurich, Beverly, Paris, London cập nhật giá tốt mới nhất năm 2026",3050.0,43.0,70.93023255813954,·X. Dương Xá (X. Gia Lâm mới),Đăng 5 ngày trước,,https://batdongsan.com.vn/ban-can-ho-chung-cu-xa-duong-xa-vinhomes-ocean-park-gia-lam/quy-phan-khu-zurich-beverly-paris-london-cap-nhat-tot-nhat-thang-10-2025-pr44277919
Gia Lâm,"Em Hằng gửi đến quý khách mua nhà tại Vinhomes Ocean Park 1 quỹ căn giá rẻ, tầng đẹp, view sẵn sổ",3650.0,55.0,66.36363636363636,·X. Dương Xá (X. Gia Lâm mới),Đăng 1 tuần trước,Có,https://batdongsan.com.vn/ban-can-ho-chung-cu-xa-duong-xa-vinhomes-ocean-park-gia-lam/em-hang-gui-den-quy-khach-mua-nha-tai-1-quy-re-tang-dep-view-san-so-pr43916626
Gia Lâm,"Siêu rẻ! Bán căn 2PN2WC toà M2 Masteri Waterfront giá chỉ 4.2 tỷ full đồ, tầng hợp lý, view thoáng",4200.0,56.0,75.0,X. Đa Tốn (X. Gia Lâm mới),Đăng hôm nay,,https://batdongsan.com.vn/ban-can-ho-chung-cu-duong-quoc-lo-5b-xa-da-ton-masteri-waterfront/sieu-re-ban-2pn2wc-toa-m2-gia-chi-4-2-ty-full-o-tang-hop-ly-view-thoang-pr45301434
Gia Lâm,SĐ sẵn két - Căn góc 2N2WC toà S203. DT tim tường 70m thông thuỷ 65m. Tầng 19 VIP không nồm ẩm,4950.0,65.0,76.15384615384616,X. Đa Tốn (X. Gia Lâm mới),Đăng hôm nay,,https://batdongsan.com.vn/ban-can-ho-chung-cu-xa-da-ton-the-sapphire-2-vinhomes-ocean-park/s-san-ket-goc-2n2wc-toa-s203-dt-tim-tuong-70m-thong-thuy-65m-tang-19-vip-ko-nom-am-pr45277132
Gia Lâm,"Căn hộ 1N+ 52m²  Ban công Tây Nam thoáng đẹp  Full nội thất cao cấp , độc quyền TPLand Việt Nam",,52.0,,X. Dương Xá (X. Gia Lâm mới),Đăng 4 ngày trước,,https://batdongsan.com.vn/ban-can-ho-chung-cu-xa-duong-xa-vinhomes-ocean-park-gia-lam/1n-52m-ban-cong-tay-nam-thoang-ep-full-noi-that-cao-cap-oc-quyen-tpland-viet-nam-pr45267623
Gia Lâm,"Siêu phẩm đập thông Masteri luxury duy nhất trên thị trường, độc quyền TPLand Việt Nam",15800.0,138.0,114.4927536231884,X. Đa Tốn (X. Gia Lâm mới),Đăng 4 ngày trước,,https://batdongsan.com.vn/ban-can-ho-chung-cu-duong-quoc-lo-5b-xa-da-ton-masteri-waterfront/sieu-pham-ap-thong-luxury-duy-nhat-tren-thi-truong-oc-quyen-tpland-viet-nam-pr45267546
Gia Lâm,Chính chủ Bán căn 2PN 2VS giá rẻ nhất Zurich full nội thất cao cấp chỉ 4.39tỷ,4390.0,56.5,77.69911504424779,X. Đa Tốn (X. Gia Lâm mới),Đăng 4 ngày trước,Có,https://batdongsan.com.vn/ban-can-ho-chung-cu-xa-da-ton-the-zurich-vinhomes-ocean-park/chinh-chu-ban-2pn2vs-gia-re-nhat-full-noi-that-cao-cap-4-390ty-pr45265337
Long Biên,"Bán căn ngoại giao Platinum Long Biên, căn hộ cao cấp bậc nhất thủ đô Long Biên",11780.0,76.0,155.0,·P. Long Biên,Đăng 3 ngày trước,,https://batdongsan.com.vn/ban-can-ho-chung-cu-duong-co-linh-phuong-long-bien-platinum-long-bien/ban-ngoai-giao-cao-cap-bac-nhat-thu-do-bien-pr44983775
Long Biên,"Bán xuất ngoại giao, căn hộ sắp bàn giao Ruby Riverside Long Biên, hàng hiếm",7150.0,65.0,110.0,P. Phúc Đồng (P. Phúc Lợi mới),Đăng hôm nay,,https://batdongsan.com.vn/ban-can-ho-chung-cu-pho-mai-phuc-phuong-phuc-dong-ruby-riverside/sap-ban-giao-long-bien-suat-ngoai-giao-uu-dai-trong-thang-1-pr44985025
Long Biên,"Sky Villa Noble Crystal Trực tiếp CĐT, CK 6%, tặng quà 1.2 tỷ, giá từ 150tr/m²,siêu phẩm giới hạn",,185.0,,P. Việt Hưng (P. Phúc Lợi mới),Đăng 3 ngày trước,,https://batdongsan.com.vn/ban-can-ho-chung-cu-phuong-viet-hung-2-noble-crystal-long-bien/sky-villa-truc-tiep-c-t-ck-6-tang-qua-1-2-ty-gia-tu-150tr-m-sieu-pham-gioi-han-pr45272193
Long Biên,"Chung cư Việt Hưng, Long Biên - 98m2",6370.0,96.5,66.01036269430051,P. Đức Giang (P. Việt Hưng mới),Đăng hôm nay,,https://batdongsan.com.vn/ban-can-ho-chung-cu-phuong-duc-giang-2-khu-do-thi-viet-hung/long-bien-98m2-6-18-ti-pr45292047
Long Biên,"Bán căn hộ 3PN, 2WC, 84,7m2 tại Lý Sơn, Bồ Đề, ngay Ngọc Thụy, Nguyễn Văn Cừ, Long Biên, 4,99 tỷ",4990.0,84.7,58.913813459268006,P. Bồ Đề,Đăng hôm nay,,https://batdongsan.com.vn/ban-can-ho-chung-cu-duong-ly-son-phuong-bo-de-9/ban-3pn-2wc-84-7m2-tai-ngay-ngoc-thuy-ng-van-long-bien-4-99-ty-pr44738544
Long Biên,"Bán chung cư Việt Hưng CT9. DT 84.6m2, 3 ngủ, 2VS. Lô góc tầng cao. Gần mặt phố Ngô Gia Tự",5490.0,84.6,64.8936170212766,P. Đức Giang (P. Việt Hưng mới),Đăng 1 tuần trước,,https://batdongsan.com.vn/ban-can-ho-chung-cu-duong-nguyen-cao-luyen-phuong-duc-giang-2-khu-do-thi-viet-hung/ban-ct9-dt-84m2-3-ngu-2vs-lo-goc-tang-gan-mat-pho-ngo-gia-tu-pr44923988
Long Biên,"Bán chung cư CT15 Green Park Việt Hưng. DT 100m2, 3 ngủ, 2VS, tầng đẹp, ban công Đông Nam",8500.0,100.0,85.0,P. Giang Biên (P. Việt Hưng mới),Đăng 1 tuần trước,,https://batdongsan.com.vn/ban-can-ho-chung-cu-duong-bui-thien-ngo-phuong-giang-bien-1-green-park-ct15-viet-hung/ban-dt-100m2-3-ngu-2vs-tang-dep-ban-cong-dong-nam-pr44523927
Long Biên,"Bán căn N01 72m2 full nội thất đẹp, thiết kế hiện đại, giá 7.99 tỷ bao phí, vào ở ngay cực hiếm!!!!",7990.0,72.0,110.97222222222223,P. Bồ Đề (P. Hồng Hà mới),Đăng 3 ngày trước,,https://batdongsan.com.vn/ban-can-ho-chung-cu-duong-nguyen-van-cu-1-phuong-bo-de-berriver-jardin-long-bien/ban-n01-72m2-full-noi-that-ep-thiet-ke-hien-ai-gia-7-99-ty-bao-phi-vao-o-ngay-cuc-hiem-pr45272053
Long Biên,"Mở bán đợt 1 - căn hộ cao cấp Platinum Long Biên sống đỉnh cao, kết nối vàng",7500.0,48.0,156.25,P. Long Biên,Đăng 4 ngày trước,,https://batdongsan.com.vn/ban-can-ho-chung-cu-duong-co-linh-phuong-long-bien-platinum-long-bien/mo-ban-dot-1-cao-cap-song-dinh-cao-ket-noi-vang-pr44985223
Long Biên,"Garden City, Long Biên - CC cao cấp Canal Park 3PN Căn góc 128m2, View bể bơi Đông Nam mát mẻ,Đủ NT",8600.0,128.0,67.1875,P. Thạch Bàn (P. Long Biên mới),Đăng 1 tuần trước,,https://batdongsan.com.vn/ban-can-ho-chung-cu-phuong-thach-ban-1-ha-noi-garden-city/tang-that-400tr-cao-cap-gaden-lo-goc-huong-mat-chu-nha-vao-da-nang-pr43155222
Long Biên,Mua bán chung cư Sunshine Green Iconic giá rẻ nhất thị trường từ studio|1PN|2PN|3PN|duplex|skyvilla,8000.0,85.0,94.11764705882354,P. Phúc Đồng (P. Phúc Lợi mới),Đăng hôm nay,Có,https://batdongsan.com.vn/ban-can-ho-chung-cu-phuong-phuc-dong-sunshine-green-iconic/anh-that-ban-3pn-116m2-nha-nguyen-ban-gia-11ty5-re-nhat-thi-truong-pr45014284
Long Biên,"BÁN CĂN HỘ TẦNG TRUNG CT10 KĐT VIỆT HƯNG, DT156M2, 4PN, 3VS, BÀN GIAO FULL NT, SĐCC, GIÁ 9,45 TỶ .",9450.0,156.0,60.57692307692308,P. Đức Giang (P. Việt Hưng mới),Đăng hôm nay,,https://batdongsan.com.vn/ban-can-ho-chung-cu-duong-ngo-gia-tu-phuong-duc-giang-2-khu-do-thi-viet-hung/ban-tang-trung-ct10-k-t-dt156m2-4pn-3vs-ban-giao-full-nt-s-cc-9-45-ty-pr45301466
Long Biên,Quỹ căn chuyển nhượng 1PN | 2PN | 3PN | Duplex - Skyvila Sunshine Green Iconic - E Long0869 971 ***,11600.0,108.0,107.4074074074074,P. Phúc Đồng (P. Phúc Lợi mới),Đăng hôm nay,,https://batdongsan.com.vn/ban-can-ho-chung-cu-phuong-phuc-dong-sunshine-green-iconic/quy-chuyen-nhuong-cat-lo-gia-re-nhat-thi-truong-tai-em-long-pr42164654
Long Biên,Quỹ căn hộ bán 1PN | 2PN | 3PN | Duplex - Sky Sunshine Green Iconic - Phúc Đồng Long Biên,12000.0,108.0,111.11111111111111,P. Phúc Đồng (P. Phúc Lợi mới),Đăng hôm nay,,https://batdongsan.com.vn/ban-can-ho-chung-cu-phuong-phuc-dong-sunshine-green-iconic/quy-ban-1pn-2pn-3pn-duplex-sky-long-bien-pr44998175
Long Biên,"Bán nhanh CH 77m2 Le Grand Jardin Sài Đồng giá 6,5 tỷ ban công ĐN, sẵn sổ, có hỗ trợ vay ngân hàng",6500.0,77.0,84.41558441558442,P. Phúc Đồng (P. Phúc Lợi mới),Đăng hôm nay,,https://batdongsan.com.vn/ban-can-ho-chung-cu-duong-huynh-van-nghe-phuong-phuc-dong-le-grand-jardin-sai-dong/ban-nhanh-ch-76m-gia-5-1-ty-ban-cong-dn-san-so-co-tro-vay-ngan-hang-pr43663344
Long Biên,HẠ CHÀO 300TR CHỈ CÒN HƠN 4 TỶ CĂN HỘ VIỆT HƯNG THANG MÁY 76M 2 PHÒNG NGỦ FULL NỘI THẤT CAO CẤP,4690.0,76.0,61.71052631578947,P. Đức Giang (P. Việt Hưng mới),Đăng hôm nay,,https://batdongsan.com.vn/ban-can-ho-chung-cu-phuong-duc-giang-2-khu-do-thi-viet-hung/ban-chcc-76m-2pn-2wc-goc-tang-cao-view-dep-gia-thoa-thuan-pr44840192
Long Biên,"RẺ NHẤT BẢNG HÀNG! Căn 77.5m2 (2PN, 2VS), tầng cao, đã có sổ đỏ. Giá 6.8x tỷ bao thuế phí",6900.0,77.5,89.03225806451613,P. Ngọc Thụy (P. Hồng Hà mới),Đăng hôm qua,,https://batdongsan.com.vn/ban-can-ho-chung-cu-phuong-ngoc-thuy-khai-son-city/hot-1-duy-nhat-77-5m-2pn-2vs-bc-dong-nam-view-thoang-vinh-vien-pr43906116
Long Biên,"Chính chủ cần bán căn 2PN - 89m2 tại Khai Sơn: Tầng cực đẹp, view sông, nội thất CĐT, giá 7 tỷ bp",7000.0,89.0,78.65168539325843,P. Ngọc Thụy (P. Bồ Đề mới),Đăng hôm qua,,https://batdongsan.com.vn/ban-can-ho-chung-cu-phuong-ngoc-thuy-khai-son-city/chinh-chu-ban-2pn-89m2-tai-tang-cuc-ep-view-song-noi-that-c-t-gia-6-9x-ty-bp-pr45254067
Long Biên,Quỹ căn 2PN - 3PN - 4PN giá tốt nhất Khai Sơn City - nhận nhà ở ngay - LH0902 161 ***,8800.0,120.0,73.33333333333333,P. Ngọc Thụy (P. Bồ Đề mới),Đăng hôm qua,,https://batdongsan.com.vn/ban-can-ho-chung-cu-phuong-ngoc-thuy-khai-son-city/quy-2pn-3pn-4pn-gia-tot-nhat-nhan-nha-o-ngay-lh-0902161056-pr45167862
Long Biên,"Trực tiếp CĐT: Căn 3PN Khai Sơn City, chiết khấu 9.5%, lãi 0% 15 tháng, QT 80tr",8200.0,96.8,84.7107438016529,P. Ngọc Thụy (P. Bồ Đề mới),Đăng hôm qua,,https://batdongsan.com.vn/ban-can-ho-chung-cu-phuong-ngoc-thuy-khai-son-city/ban-cc-valencia-do-thi-viet-hung-66m-2n2vs-gia-chi-3-040-ty-bc-dn-view-bt-vinhomes-pr42212630
Long Biên,"Quỹ căn góc đẹp nhất Khai Sơn, view hồ, tầng đẹp: 96m2, 3PN 2WC, ban công Đông Nam. Giá 8.x tỷ bp",8300.0,96.0,86.45833333333333,P. Ngọc Thụy (P. Bồ Đề mới),Đăng hôm qua,,https://batdongsan.com.vn/ban-can-ho-chung-cu-phuong-ngoc-thuy-khai-son-city/quy-goc-ep-nhat-view-tang-ep-96m2-3pn-2wc-ban-cong-ong-nam-gia-8-x-ty-bp-pr45232980
Long Biên,Bán căn CC HimLam Thạch Bàn đẹp nhất khu,4950.0,60.0,82.5,P. Thạch Bàn (P. Long Biên mới),Đăng hôm qua,,https://batdongsan.com.vn/ban-can-ho-chung-cu-duong-co-linh-phuong-thach-ban-1-him-lam-thach-ban-2/cc-himlam-ep-nhat-khu-pr45291887
Long Biên,Bán căn góc 97m2 ban công đông nam đẹp nhất khai sơn,8450.0,97.0,87.11340206185567,P. Ngọc Thụy (P. Bồ Đề mới),Đăng hôm qua,,https://batdongsan.com.vn/ban-can-ho-chung-cu-phuong-ngoc-thuy-khai-son-city/ban-goc-97m2-ban-cong-dong-nam-dep-nhat-son-pr44348611
Long Biên,Chính chủ bán căn 3N siêu đẹp view sông CC AQH,4800.0,65.0,73.84615384615384,P. Thượng Thanh (P. Việt Hưng mới),Đăng hôm qua,,https://batdongsan.com.vn/ban-can-ho-chung-cu-phuong-thuong-thanh-1-aqh-riverside/chinh-chu-ban-3n-sieu-ep-view-song-cc-aqh-pr45202807
Hoài Đức,"BOOKING NHẬN ƯU ĐÃI LỚN IMPERIA SKY PARK CẠNH VINHOMES SMART CITY, ĐỦ QUỸ CĂN STUDIO - SKY VILLAS",,52.5,,·X. An Khánh,Đăng hôm nay,,https://batdongsan.com.vn/ban-can-ho-chung-cu-duong-dai-lo-thang-long-xa-an-khanh-4-imperia-sky-park/booking-nhan-uu-ai-lon-canh-vinhomes-smart-city-u-quy-studio-villas-pr45156054
Hoài Đức,"IMPERIA SKY PARK MỞ BÁN TỪ MÓNG CĂN 2PN TỪ 55-68M2 VỐN TỰ CÓ CHỈ TỪ 1,5 TỶ MIỄN LÃI 24T- CK TỚI 15%",5100.0,55.0,92.72727272727273,·X. An Khánh,Đăng hôm nay,,https://batdongsan.com.vn/ban-can-ho-chung-cu-duong-dai-lo-thang-long-xa-an-khanh-4-imperia-sky-park/mo-ban-tu-mong-2pn-tu-55-68m2-von-tu-co-chi-tu-1-5-ty-mien-lai-24t-ck-toi-15-pr45299923
Hoài Đức,Quỹ 200 căn 2PN - 3PN kí trực tiếp Chủ đầu tư - Giá giai đoạn 1,,75.0,,·X. Di Trạch (X. Hoài Đức mới),Đăng hôm nay,,https://batdongsan.com.vn/ban-can-ho-chung-cu-duong-vanh-dai-3-5-xa-di-trach-the-flame-vine/quy-200-2pn-3pn-ki-truc-tiep-chu-au-tu-gia-giai-oan-1-pr45212757
Hoài Đức,Bán gấp căn 2 ngủ 83m2 - đã có sổ đỏ - view đẹp và thoáng - xem nhà 24/24,6300.0,83.0,75.90361445783132,X. Di Trạch (X. Hoài Đức mới),Đăng hôm nay,Có,https://batdongsan.com.vn/ban-can-ho-chung-cu-duong-32-xa-di-trach-chung-cu-the-wisteria/ban-gap-2-ngu-83m2-a-co-so-o-view-ep-va-thoang-xem-nha-24-24-pr45271737
Hoài Đức,Bán căn hộ 139m2 chung cư Wisteria - ban công Đông Nam - có hỗ trợ bank 70%,9100.0,139.0,65.46762589928058,X. Di Trạch (X. Hoài Đức mới),Đăng hôm qua,,https://batdongsan.com.vn/ban-can-ho-chung-cu-duong-32-xa-di-trach-chung-cu-the-wisteria/ban-138m2-ban-cong-ong-nam-co-tro-bank-70-pr45271497
Hoài Đức,"Bán nhanh căn hộ 2PN2VS toà Gemek 2 An Khánh view Vinsmart 66m2 chỉ 4,4 tỷ",4400.0,66.0,66.66666666666667,X. An Khánh,Đăng 2 ngày trước,,https://batdongsan.com.vn/ban-can-ho-chung-cu-duong-le-trong-tan-xa-an-khanh-4-gemek-premium/chinh-chu-ban-2pn2vs-toa-2-view-vinsmart-66m-chi-4-4-ty-pr45251955
Hoài Đức,Căn góc 3 ngủ - diện tích 114m2 - view đẹp hướng mát - có sổ đỏ,7600.0,114.0,66.66666666666667,X. Di Trạch (X. Hoài Đức mới),Đăng 6 ngày trước,,https://batdongsan.com.vn/ban-can-ho-chung-cu-duong-32-xa-di-trach-chung-cu-the-wisteria/goc-3-ngu-dien-tich-114m2-view-ep-huong-mat-co-so-o-pr45189866
Hoài Đức,Quỹ căn studio- 1PN-2PN-3PN tòa Sky1 và Sky2 không chênh kí trực tiếp chủ đầu tư MIK Group,4080.0,43.0,94.88372093023256,·X. An Khánh,Đăng hôm nay,,https://batdongsan.com.vn/ban-can-ho-chung-cu-duong-dai-lo-thang-long-xa-an-khanh-4-imperia-sky-park/quy-studio-1pn-2pn-3pn-toa-sky1-va-sky2-khong-chenh-ki-truc-tiep-chu-au-tu-mik-group-pr45179876
