Khu vực,Tiêu đề,Giá (triệu),Diện tích (m²),Giá/m² (triệu),Vị trí,Ngày đăng,Cắt lỗ?,Link
Hà Đông,"Bán đợt 1 chung cư aN Bình Homeland - 3 tầng 15,19,20 (cam kết giá tốt nhất thị trường),0917 136 ***",,67.0,,·P. Dương Nội,Đăng 2 ngày trước,,https://batdongsan.com.vn/ban-can-ho-chung-cu-phuong-duong-noi-an-binh-homeland/ban-ot-1-3-tang-15-19-20-cam-ket-gia-tot-nhat-thi-truong-0917136119-pr45206328
Hà Đông,"CHÍNH CHỦ BÁN CĂN HỘ 3PN MULBERRY LANE HÀ ĐÔNG 135M²  VIEW HỒ, SỔ ĐỎ, HỖ TRỢ KHÁCH MUA Ở VAY NH",,135.0,,·P. Mỗ Lao (P. Hà Đông mới),Đăng 6 ngày trước,,https://batdongsan.com.vn/ban-can-ho-chung-cu-phuong-mo-lao-mulberry-lane/chinh-chu-ban-3pn-ha-ong-135m-view-so-o-tro-khach-mua-o-vay-nh-pr45255319
Hà Đông,"FULL QUỸ CĂN ĐỘC QUYỀN, GIÁ TỐT NHẤT HH01 VÀ HH02 KEPLER HÀ ĐÔNG T3/2026, CHỈ TỪ 90TR/M2",,81.3,,P. Mỗ Lao (P. Hà Đông mới),Đăng hôm nay,,https://batdongsan.com.vn/ban-can-ho-chung-cu-phuong-mo-lao-thap-doi-kepler-land/full-quy-doc-quyen-gia-tot-nhat-hh01-va-hh02-du-an-ha-dong-t12-2025-chi-tu-80tr-m2-pr44689868
Hà Đông,"Bán căn 2228 CT1, 103m2, chung cư The Pride - Hà Đông, Hà Nội",6800.0,102.8,66.147859922179,P. La Khê (P. Hà Đông mới),Đăng 2 ngày trước,,https://batdongsan.com.vn/ban-can-ho-chung-cu-duong-to-huu-phuong-la-khe-the-pride/ban-2228-ct1-103m2-ha-ong-ha-noi-pr45245706
Hà Đông,"Chính chủ bán CC 3PN, 3WC, 8.3 tỷ - 158m2, 2 ban công rộng. CT12, KĐT Văn Phú - Hà Đông, Hà Nội",8300.0,158.0,52.53164556962025,P. Phú La (P. Kiến Hưng mới),Đăng hôm nay,,https://batdongsan.com.vn/ban-can-ho-chung-cu-duong-le-trong-tan-phuong-phu-la-khu-do-thi-moi-van-phu/chinh-chu-ban-cc-3pn-3wc-158m2-ct12-kdt-ha-dong-ha-noi-pr44466732
Hà Đông,"Tôi cần bán căn hộ 3PN Mulberry Lane, full nội thất, sổ hồng lâu dài, BC Đông Nam, giá 8.95 tỷ",8950.0,114.5,78.16593886462883,P. Mỗ Lao (P. Hà Đông mới),Đăng 2 ngày trước,,https://batdongsan.com.vn/ban-can-ho-chung-cu-phuong-mo-lao-mulberry-lane/chinh-chu-ban-3pn-full-noi-that-so-hong-lau-dai-bc-dong-nam-gia-8-99-ty-pr44942410
Hà Đông,Chính chủ bán CC căn góc 75m2 - 2PN 2WC full nội thất - 6.1tỷ - Hà Đông -0378 813 ***(chủ nhà),6100.0,75.0,81.33333333333333,P. La Khê (P. Hà Đông mới),Đăng 2 ngày trước,,https://batdongsan.com.vn/ban-can-ho-chung-cu-duong-to-huu-phuong-la-khe-the-pride/chinh-chu-ban-cc-goc-75m-2pn-2wc-full-noi-that-6-x-ty-ha-ong-037-88-131-88-chu-nha-pr45206050
Hà Đông,"Chính chủ - cần bán căn hộ DT 68m2, 2PN 2WC, toà CT6A - Xa La, Hà Đông. (Ảnh thật 100%)",4650.0,68.0,68.38235294117646,P. Phúc La (P. Hà Đông mới),Đăng 4 ngày trước,,https://batdongsan.com.vn/ban-can-ho-chung-cu-pho-phung-hung-1-phuong-phuc-la-khu-do-thi-moi-xa-la/chinh-chu-ban-dt-69m2-2pn-2wc-toa-ct6a-ha-dong-anh-that-100-pr44906745
Hà Đông,"Chủ nhà quyết tâm bán căn hộ 4 phòng ngủ, Mulberry Lane (154.3m2) - Tầng trung, giá tốt: 8.6 tỷ",8600.0,154.3,55.73558003888528,P. Mỗ Lao (P. Hà Đông mới),Đăng hôm nay,,https://batdongsan.com.vn/ban-can-ho-chung-cu-phuong-mo-lao-mulberry-lane/chu-nha-quyet-tam-ban-4-phong-ngu-154-3m2-tang-trung-gia-tot-8-6-ty-pr44332569
Hà Đông,"(Góc độc quyền) tìm mua căn hộ 3PN (117m2), slot xe, hướng ĐN - Với 8.5 tỷ (có thương lượng)",8500.0,111.4,76.3016157989228,P. Mỗ Lao (P. Hà Đông mới),Đăng hôm nay,,https://batdongsan.com.vn/ban-can-ho-chung-cu-phuong-mo-lao-seasons-avenue/goc-doc-quyen-tim-mua-3pn-117m2-slot-xe-huong-dn-voi-8-5-ty-co-thuong-luong-pr44316185
Hà Đông,"Bán CC đẹp 2PN 2WC tại CT4B Xa La, 5,2 tỷ, 67,8 m2",5200.0,67.8,76.69616519174042,P. Phúc La (P. Hà Đông mới),Đăng hôm nay,,https://batdongsan.com.vn/ban-can-ho-chung-cu-pho-phung-hung-1-phuong-phuc-la-khu-do-thi-moi-xa-la/ban-cc-dep-2pn-2wc-tai-ct4b-5-2-ty-69-8-m2-pr45090624
Hà Đông,"Bán căn penthouse 70m² giá tốt. Nhà hướng mát, cực thoáng mùa hè",2550.0,70.0,36.42857142857143,P. Kiến Hưng,Đăng hôm nay,,https://batdongsan.com.vn/ban-can-ho-chung-cu-phuong-kien-hung-khu-do-thi-thanh-ha-muong-thanh/mua-he-en-mua-huongthoang-mat-pr45269794
Hà Đông,"Bán CC CT4C 2PN, full nội thất đẹp, nhiều tiện ích tại KĐT Xa La, 3,7 tỷ, 52,3m2 LH0973 705 ***",3700.0,52.3,70.74569789674952,P. Phúc La (P. Hà Đông mới),Đăng hôm qua,,https://batdongsan.com.vn/ban-can-ho-chung-cu-pho-phung-hung-1-phuong-phuc-la-khu-do-thi-moi-xa-la/ban-cc-ct4c-2pn-full-noi-that-ep-nhieu-tien-ich-tai-k-t-3-7-ty-52-3m2-lh-0973705776-pr45235126
Hà Đông,Độc quyền duplex An Bình Homeland giá chỉ từ 10 tỷ,10000.0,135.0,74.07407407407408,P. Dương Nội,Đăng hôm qua,,https://batdongsan.com.vn/ban-can-ho-chung-cu-phuong-duong-noi-an-binh-homeland/oc-quyen-duplex-gia-chi-tu-10-ty-pr45295497
Hà Đông,"Bán căn hộ 65m2 view hồ Thiên Nga, công viên cây xanh, nội thất đẹp, giá tốt nhất0982 155 ***",3100.0,65.0,47.69230769230769,P. Kiến Hưng,Đăng hôm qua,,https://batdongsan.com.vn/ban-can-ho-chung-cu-phuong-kien-hung-khu-do-thi-thanh-ha-muong-thanh/ban-65m-view-thien-nga-cong-vien-cay-xanh-noi-that-ep-gia-tot-nhat-0982155548-pr45290679
Hà Đông,"CHÍNH CHỦ CẦN BÁN CĂN HỘ 50,9m 2PN-2VS FULL NỘI THẤT - THIẾT BỊ",4100.0,50.9,80.55009823182712,P. Kiến Hưng,Đăng hôm qua,,https://batdongsan.com.vn/ban-can-ho-chung-cu-duong-hoang-cong-phuong-kien-hung-mipec-city-view/chinh-chu-ban-50-9m-2pn-2vs-full-noi-that-thiet-bi-pr45288657
Hà Đông,Độc quyền quỹ căn chuyển nhượng giá siêu tốt Parc Regent - Parkcity Hanoi,12950.0,111.0,116.66666666666667,P. La Khê (P. Dương Nội mới),Đăng 2 ngày trước,,https://batdongsan.com.vn/ban-can-ho-chung-cu-phuong-la-khe-parc-regent/doc-quyen-quy-chuyen-nhuong-gia-sieu-tot-parkcity-hanoi-pr44845038
Hà Đông,"Bán căn 2228 CT1, 103m2, chung cư The Pride - Hà Đông, Hà Nội",6800.0,102.8,66.147859922179,P. La Khê (P. Hà Đông mới),Đăng 2 ngày trước,,https://batdongsan.com.vn/ban-can-ho-chung-cu-duong-to-huu-phuong-la-khe-the-pride/ban-2228-ct1-103m2-ha-ong-ha-noi-pr45245706
Hà Đông,"Chính chủ bán căn góc 3 ngủ full nội thất mới, nhà thiết kế hiện đại, sang trọng.",4600.0,80.0,57.5,P. Kiến Hưng,Đăng 3 ngày trước,,https://batdongsan.com.vn/ban-can-ho-chung-cu-phuong-kien-hung-khu-do-thi-thanh-ha-muong-thanh/chinh-chu-ban-goc-3-ngu-full-noi-that-moi-nha-thiet-ke-hien-ai-sang-trong-pr45275678
Hà Đông,Độc quyền quỹ căn cần bán giá tốt nhất tại chung cư Park Kiara với giá tốt nhất,9300.0,82.0,113.41463414634147,P. La Khê (P. Dương Nội mới),Đăng 3 ngày trước,,https://batdongsan.com.vn/ban-can-ho-chung-cu-duong-le-trong-tan-phuong-la-khe-park-kiara/doc-quyen-quy-can-ban-gia-tot-nhat-tai-voi-gia-tot-nhat-pr42118287
Hà Đông,CĂN HỘ HIẾM - GIÁ ĐẦU TƯ NGAY MẶT PHỐ TRẦN PHÚ  NGUYỄN TRÃI | 79m2 | 2PN | CHỈ HƠN 5 TỶ,5380.0,79.0,68.10126582278481,P. Văn Quán (P. Hà Đông mới),Đăng 3 ngày trước,,https://batdongsan.com.vn/ban-can-ho-chung-cu-duong-tran-phu-phuong-van-quan-15/hiem-gia-au-tu-ngay-mat-pho-nguyen-trai-79m2-2pn-chi-hon-5-ty-pr45268592
Hà Đông,"Em Minh chuyên quỹ hàng Kepler Land Hà Đông, quỹ căn lớn, giá tốt nhất thị trường",4650.0,46.0,101.08695652173913,P. Mỗ Lao (P. Hà Đông mới),Đăng 4 ngày trước,,https://batdongsan.com.vn/ban-can-ho-chung-cu-duong-vu-trong-khanh-phuong-mo-lao-thap-doi-kepler-land/em-minh-chuyen-chuyen-nhuong-ha-ong-quy-a-dang-gia-tot-nhat-thi-truong-pr45168608
Hà Đông,Chính chủ em cần bán chung cư HH2E Xuân Mai 71.6m2 sổ đỏ giá 4.55 tỷ nôi thất cực đẹp,4550.0,71.6,63.54748603351956,P. Dương Nội,Đăng 4 ngày trước,,https://batdongsan.com.vn/ban-can-ho-chung-cu-duong-to-huu-phuong-duong-noi-xuan-mai-sparks-tower/chinh-chu-em-ban-hh2e-71-6m2-so-o-gia-4-55-ty-that-cuc-ep-pr45263104
Hà Đông,"Chính chủ bán căn hộ đẹp, view đẹp, ban công siêu rộng",18700.0,145.19,128.7967490874027,P. La Khê (P. Dương Nội mới),Đăng 5 ngày trước,,https://batdongsan.com.vn/ban-can-ho-chung-cu-phuong-la-khe-parc-regent/chinh-chu-ban-ep-view-ep-ban-cong-sieu-rong-pr45257704
Hà Đông,Quỹ Căn Giá Tốt Hiện Đang Bán Tại Chung Cư Park Kiara - Khu Đô Thị Park City Hà Nội,,60.0,,P. La Khê (P. Dương Nội mới),Đăng 6 ngày trước,,https://batdongsan.com.vn/ban-can-ho-chung-cu-duong-le-trong-tan-phuong-la-khe-park-kiara/ban-gap-penhouse-200m2-trang-bi-day-du-noi-that-dep-o-kiara-pr42511495
Hà Đông,Em Tuyết đang có quỹ căn chuyển nhượng tòa KEPLER LAND giá cực tốt,,45.6,,P. Mỗ Lao (P. Hà Đông mới),Đăng 1 tuần trước,,https://batdongsan.com.vn/ban-can-ho-chung-cu-phuong-mo-lao-thap-doi-kepler-land/em-tuyet-ang-co-quy-chuyen-nhuong-toa-gia-cuc-tot-pr45245146
Hà Đông,"Bán căn 91.6m2 view hồ Văn Quán, bàn giao quý 1/2026",5600.0,91.6,61.1353711790393,P. Văn Quán (P. Thanh Liệt mới),Đăng 1 tuần trước,,https://batdongsan.com.vn/ban-can-ho-chung-cu-duong-tran-phu-phuong-van-quan-grand-sunlake/ban-92m-view-ban-giao-quy-1-2025-pr44235668
Hà Đông,Cập nhật quỹ căn chuyển nhượng đang bán RẺ nhất tại The Pride - Tố Hữu - Hà Đông,,102.0,,P. La Khê (P. Hà Đông mới),Đăng 1 tuần trước,,https://batdongsan.com.vn/ban-can-ho-chung-cu-duong-to-huu-phuong-la-khe-the-pride/cap-nhat-quy-chuyen-nhuong-2-3pn-moi-nhat-ha-dong-pr42668745
Hà Đông,"Chính chủ bán CC 3PN, 3WC, 8.3 tỷ - 158m2, 2 ban công rộng. CT12, KĐT Văn Phú - Hà Đông, Hà Nội",8300.0,158.0,52.53164556962025,P. Phú La (P. Kiến Hưng mới),Đăng hôm nay,,https://batdongsan.com.vn/ban-can-ho-chung-cu-duong-le-trong-tan-phuong-phu-la-khu-do-thi-moi-van-phu/chinh-chu-ban-cc-3pn-3wc-158m2-ct12-kdt-ha-dong-ha-noi-pr44466732
Hà Đông,"Bán gấp căn hộ chung cư 67m2 , sổ đỏ chính chủ sang tên ngay, Vay bank thoải mái",,67.0,,P. Phú Lãm (P. Phú Lương mới),Đăng hôm nay,Có,https://batdongsan.com.vn/ban-can-ho-chung-cu-pho-xom-phuong-phu-lam-1-the-vesta/ban-gap-67m2-so-o-chinh-chu-sang-ten-ngay-vay-bank-thoai-mai-pr45296666
Hoàng Mai,"Bán căn hộ CC 90m²- 6,55 tỷ - Căn góc Mặt đường Giải Phóng - Tòa ICC số 1277 Giải Phóng",6550.0,90.0,72.77777777777777,·P. Thịnh Liệt (P. Hoàng Mai mới),Đăng hôm nay,,https://batdongsan.com.vn/ban-can-ho-chung-cu-duong-giai-phong-phuong-thinh-liet-8/ban-cc-90m2-7-15-ty-tai-toa-nha-icc-so-1277-hoang-mai-ha-noi-pr45237289
Hoàng Mai,"Sale lớn nhất năm tặng xe ô tô chính sách bán hàng hấp dẫn, áp dụng đến 25/3/2026",5500.0,61.5,89.4308943089431,·P. Hoàng Liệt,Đăng 2 ngày trước,,https://batdongsan.com.vn/ban-can-ho-chung-cu-duong-linh-duong-phuong-hoang-liet-khu-do-thi-moi-linh-dam/sale-lon-nhat-nam-tang-xe-o-to-chinh-sach-ban-hang-hap-dan-ap-dung-en-25-3-2026-chu-pr45278200
Hoàng Mai,"Bán căn 07 chung cư X2 Đại Kim sẵn sổ đỏ, đầy đủ nội thất về ở ngay",6740.0,86.4,78.00925925925925,·P. Đại Kim (P. Hoàng Liệt mới),Đăng 4 ngày trước,,https://batdongsan.com.vn/ban-can-ho-chung-cu-duong-tran-hoa-phuong-dai-kim-chung-cu-x2-dai-kim/ban-07-ai-san-so-o-ay-u-noi-that-ve-o-ngay-pr45262422
Hoàng Mai,Chung cư view đẹp dành cho vợ chồng mới cưới - sát vành đai 3,5190.0,59.0,87.96610169491525,P. Đại Kim (P. Hoàng Liệt mới),Đăng hôm nay,,https://batdongsan.com.vn/ban-can-ho-chung-cu-duong-tran-hoa-phuong-dai-kim-nha-o-xa-hoi-dong-mo/view-ep-danh-cho-vo-chong-moi-cuoi-sat-vanh-ai-3-pr45296015
Hoàng Mai,"Bán căn 3PN The Two Gamuda, 93.7m2 view nội khu siêu đẹp nhà hoàn thiện,0982 486 ***",8400.0,93.7,89.64781216648879,P. Trần Phú (P. Lĩnh Nam mới),Đăng hôm nay,,https://batdongsan.com.vn/ban-can-ho-chung-cu-phuong-tran-phu-7-the-two-residence-gamuda-garden/ban-3pn-93-7m2-view-noi-khu-sieu-ep-nha-hoan-thien-098-248-6603-pr45176024
Hoàng Mai,"Bán căn hộ The Two Gamuda 2 phòng ngủ 79m2, view nội khu0904 744 ***",6800.0,79.0,86.07594936708861,P. Trần Phú (P. Hoàng Mai mới),Đăng hôm nay,,https://batdongsan.com.vn/ban-can-ho-chung-cu-phuong-tran-phu-7-the-two-residence-gamuda-garden/ban-2-phong-ngu-79m2-view-noi-khu-pr44639580
Hoàng Mai,"Em Giang PKD chủ đầu tư căn ngoại giao giá tốt nhất thị trường, hỗ trợ vay ưu đãi ngân hàng",6500.0,95.0,68.42105263157895,P. Đại Kim (P. Hoàng Liệt mới),Đăng hôm nay,,https://batdongsan.com.vn/ban-can-ho-chung-cu-duong-tran-hoa-phuong-dai-kim-chung-cu-x2-dai-kim/em-giang-pkd-chu-dau-tu-quy-ngoai-giao-gia-tot-nhat-thi-truong-tro-vay-uu-ngan-hang-pr44752723
Hoàng Mai,"Em Giang PKD chủ đầu tư căn 3PN giá tốt nhất còn sót lại, hỗ trợ vay ngân hàng lãi suất ưu đãi",6500.0,88.0,73.86363636363636,P. Hoàng Liệt,Đăng hôm nay,,https://batdongsan.com.vn/ban-can-ho-chung-cu-duong-ngoc-hoi-phuong-hoang-liet-rose-town-79-ngoc-hoi/em-giang-pkd-chu-dau-tu-3pn-gia-tot-nhat-con-sot-lai-tro-vay-ngan-hang-lai-suat-uu-dai-pr44757064
Hoàng Mai,"Nhượng lại căn hộ 3PN 99.5m2 The Zen Gamuda, nội thất hoàn thiện giá mềm nhất khu,0982 486 ***",10200.0,99.5,102.51256281407035,P. Trần Phú (P. Lĩnh Nam mới),Đăng hôm nay,,https://batdongsan.com.vn/ban-can-ho-chung-cu-phuong-tran-phu-7-the-zen-residence/nhuong-lai-2pn-75-5m2-gamuda-noi-that-co-ban-gia-mem-nhat-khu-pr43458691
Hoàng Mai,"Bán căn hộ 2 phòng ngủ The Two Gamuda 78.5m2 đầy đủ nội thất siêu đẹp view nội khu,0982 486 ***",7480.0,78.5,95.28662420382166,P. Trần Phú (P. Lĩnh Nam mới),Đăng hôm nay,,https://batdongsan.com.vn/ban-can-ho-chung-cu-phuong-tran-phu-7-the-two-residence-gamuda-garden/ban-2-phong-ngu-78-5m2-ay-u-noi-that-sieu-ep-0982-486-pr45179649
Hoàng Mai,"Em Giang PKD Chủ đầu tư căn hộ 2PN giá tốt nhất dự án, hỗ trợ vay ngân hàng lãi suất ưu đãi",5000.0,79.0,63.29113924050633,P. Hoàng Liệt,Đăng hôm nay,,https://batdongsan.com.vn/ban-can-ho-chung-cu-duong-ngoc-hoi-phuong-hoang-liet-rose-town-79-ngoc-hoi/em-giang-pkd-chu-dau-tu-2pn-gia-tot-nhat-du-an-tro-vay-ngan-hang-lai-suat-uu-dai-pr44120060
Hoàng Mai,"Căn hộ 2PN 1WC 61,5m2 ban công ĐN, thoáng mát, đầy đủ đồ, vị trí siêu đắc địa, giá hợp lý 4,6 tỷ",4600.0,61.5,74.79674796747967,P. Đại Kim (P. Hoàng Liệt mới),Đăng hôm nay,,https://batdongsan.com.vn/ban-can-ho-chung-cu-phuong-dai-kim-khu-do-thi-moi-dai-kim-dinh-cong/2pn-1wc-61-5m2-ban-n-thoang-mat-ay-u-o-vi-tri-sieu-ac-ia-gia-hop-ly-4-6-ty-pr45196461
Hoàng Mai,"Siêu phẩm căn hộ T&T Riverview Vĩnh Hưng - cạnh Time City 91m2. 3 ngủ, 2 WC - view Sông Hồng",6980.0,91.0,76.7032967032967,P. Vĩnh Hưng,Đăng hôm qua,,https://batdongsan.com.vn/ban-can-ho-chung-cu-duong-vinh-hung-phuong-vinh-hung-2-t-t-riverview/sieu-pham-t-river-view-canh-time-city-91m-3-ngu-2-wc-view-song-hong-pr45150561
Hoàng Mai,"Quỹ căn chuyển nhượng rẻ nhất dự án Feliz Homes, dt: 45,64,,73,76,78,90,96,108,114m. Lh:0964 161 ***",6700.0,78.0,85.8974358974359,P. Hoàng Văn Thụ (P. Tương Mai mới),Đăng hôm nay,,https://batdongsan.com.vn/ban-can-ho-chung-cu-duong-hoang-mai-phuong-hoang-van-thu-4-feliz-homes/quy-chuyen-nhuong-re-nhat-du-an-dt-45-64-73-76-78-90-96-108-114m-lh-0964161887-pr45299346
Hoàng Mai,Bán siêu phẩm căn 1 phòng ngủ view hồ. Ngoài ra em còn quỹ căn 100 căn hộ bán,4500.0,50.0,90.0,P. Hoàng Văn Thụ (P. Tương Mai mới),Đăng hôm qua,,https://batdongsan.com.vn/ban-can-ho-chung-cu-phuong-hoang-van-thu-4-feliz-homes/ban-3-phong-ngu-san-vuon-homes-pr43600574
Hoàng Mai,"Chính chủ bán Chung cư Thông tấn xã, view đẹp, 3 phòng ngủ, 109.9m2. Giá 9,6 tỷ có thương lượng.",9600.0,109.9,87.35213830755231,P. Đại Kim (P. Hoàng Liệt mới),Đăng 2 ngày trước,,https://batdongsan.com.vn/ban-can-ho-chung-cu-duong-nguyen-xien-phuong-dai-kim-chung-cu-thong-tan-xa-viet-nam/chinh-chu-ban-goc-view-ep-3-phong-ngu-103-8m2-pr45240490
Hoàng Mai,"BÁN CĂN 3PN, 4PN TOÀ X2 ĐẠI KIM - BẮC LINH ĐÀM. ĐÃ CÓ SỔ. MỖI NHÀ 1 SLOT Ô TÔ.",,86.0,,P. Đại Kim (P. Hoàng Liệt mới),Đăng 3 ngày trước,,https://batdongsan.com.vn/ban-can-ho-chung-cu-duong-tran-hoa-phuong-dai-kim-chung-cu-x2-dai-kim/ban-3pn-4pn-toa-ai-bac-linh-am-a-co-so-moi-nha-1-slot-o-to-pr45269914
Hoàng Mai,"Quỹ độc quyền 1PN-2PN-duplex Rivea Residences đủ tầng hướng đẹp, chiết khấu đặc biệt 22,8% + lì xì",,45.0,,P. Thanh Trì (P. Lĩnh Nam mới),Đăng 4 ngày trước,,https://batdongsan.com.vn/ban-can-ho-chung-cu-duong-vinh-hung-phuong-thanh-tri-rivea-residences/quy-doc-quyen-1pn-2pn-duplex-du-tang-huong-dep-chiet-khau-dac-biet-22-8-li-xi-pr45039447
Hoàng Mai,"BÁN CĂN TẦNG TRUNG ĐẸP,SUẤT CBNV-NGOẠI GIAO 1PN+/2PN/3PN/DUPLEX VIEW ĐẸP,CK 22% + 600Tr,LH NGAY CĐT",,70.0,,P. Thanh Trì (P. Lĩnh Nam mới),Đăng 4 ngày trước,,https://batdongsan.com.vn/ban-can-ho-chung-cu-duong-vinh-hung-phuong-thanh-tri-rivea-residences/ban-tang-trung-ep-suat-cbnv-ngoai-giao-1pn-2pn-3pn-duplex-view-ep-ck-22-600tr-lh-ngay-c-t-pr45189123
Hoàng Mai,Sẵn sổ đỏ - Bán căn 09 chung cư X2 Đại Kim tầng 1x sổ đỏ 95m2,7100.0,95.0,74.73684210526316,P. Đại Kim (P. Hoàng Liệt mới),Đăng 4 ngày trước,,https://batdongsan.com.vn/ban-can-ho-chung-cu-duong-tran-hoa-phuong-dai-kim-chung-cu-x2-dai-kim/san-so-o-ban-09-ai-tang-1x-so-o-95m2-pr45262365
Hoàng Mai,"Bán gấp CC X2 Đại Kim, 54 triệu/m2, 123m2, 4PN, 2WC, nhỉnh 6 tỷ Trần Hòa, Hoàng Mai, Hà Nội",6640.0,123.0,53.983739837398375,P. Đại Kim (P. Hoàng Liệt mới),Đăng 4 ngày trước,Có,https://batdongsan.com.vn/ban-can-ho-chung-cu-duong-tran-hoa-phuong-dai-kim-chung-cu-x2-dai-kim/ban-gap-cc-54-trieu-m2-123m2-4pn-2wc-hoang-mai-ha-noi-pr44892199
Hoàng Mai,Tư vấn chuyên sâu DA melody linh đàm - Quỹ căn chủ đầu tư & chuyển nhượng có 1 0 2 - giá bán bao rẻ,4850.0,75.0,64.66666666666667,P. Hoàng Liệt,Đăng 1 tuần trước,,https://batdongsan.com.vn/ban-can-ho-chung-cu-duong-bang-liet-phuong-hoang-liet-ha-noi-melody-residences/tu-van-chuyen-sau-du-an-linh-dam-quy-chuyen-nhuong-co-1-0-2-gia-ban-bao-re-thi-truong-pr43501184
Hoàng Mai,"Bán căn hộ 2N nhỏ, Full nội thất đẹp, tòa Bắc Rice City",4670.0,53.5,87.28971962616822,P. Hoàng Liệt,Đăng 1 tuần trước,,https://batdongsan.com.vn/ban-can-ho-chung-cu-phuong-hoang-liet-rice-city-linh-dam/ban-2n-nho-full-noi-that-ep-toa-bac-city-pr45222197
Hoàng Mai,Bán gấp ! Chính chủ bán gấp căn 3 phòng Ngủ Chung cư phương đông green pack Toà B1 7ty5,7460.0,99.4,75.0503018108652,P. Hoàng Liệt,Đăng hôm nay,Có,https://batdongsan.com.vn/ban-can-ho-chung-cu-duong-tran-thu-do-phuong-hoang-liet-green-park-tran-thu-do/ban-gap-chinh-chu-ban-gap-3-phong-ngu-ong-pack-toa-b1-7ty5-pr45304949
Hoàng Mai,CHÍNH CHỦ BÁN GẤP CĂN 2PN 73M2 TÒA PARK 6 - TIMES CITY GIÁ 9.3 TỶ,9300.0,72.4,128.45303867403314,P. Mai Động (P. Tương Mai mới),Đăng hôm nay,Có,https://batdongsan.com.vn/ban-can-ho-chung-cu-duong-linh-nam-phuong-mai-dong-1-vinhomes-times-city-park-hill/chinh-chu-ban-gap-2pn-73m2-toa-6-gia-9-3-ty-pr45301847
Hoàng Mai,E Hiếu cư dân bán Feliz Homes: 1 ngủ: 4 tỷ và 2 ngủ: 6 tỷ và 3 ngủ: 7 tỷ - SĐT:0981 757 ***,6000.0,78.0,76.92307692307692,P. Hoàng Văn Thụ (P. Tương Mai mới),Đăng hôm nay,,https://batdongsan.com.vn/ban-can-ho-chung-cu-duong-hoang-mai-phuong-hoang-van-thu-4-feliz-homes/ban-gia-re-nhat-2-ngu-4-6-ty-va-3-ngu-6-ty-pr41456316
Hoàng Mai,[BQL] Quỹ căn hộ bán cắt lỗ sâu 1PN | 2PN | 3PN | 4PN | FELIZ HOMES - Hoàng Mai - Tháng 03/2026,6050.0,71.0,85.21126760563381,P. Hoàng Văn Thụ (P. Tương Mai mới),Đăng hôm nay,Có,https://batdongsan.com.vn/ban-can-ho-chung-cu-phuong-hoang-van-thu-4-feliz-homes/bql-quy-bang-hang-gia-tot-thang-03-2026-2pn-chi-tu-5-x-ty-3pn-tu-7-x-ty-pr45300085
Hoàng Mai,"Bảng giá Feliz Homes chuyển nhượng, giá tốt tháng 03/2026 căn 2PN chỉ từ 5.X tỷ, căn 3PN từ 7.X tỷ",6050.0,70.0,86.42857142857143,P. Hoàng Văn Thụ (P. Tương Mai mới),Đăng hôm nay,,https://batdongsan.com.vn/ban-can-ho-chung-cu-phuong-hoang-van-thu-4-feliz-homes/bang-gia-chuyen-nhuong-gia-tot-thang-7-2025-2pn-chi-tu-4-x-ty-3pn-tu-6-x-ty-pr43542822
Hoàng Mai,"Quỹ căn chuyển nhượng - giá thực cập nhật tốt nhất tại Feliz Homes. 1 ngủ, 2 ngủ, 3 ngủ, 4 ngủ",6800.0,82.0,82.92682926829268,P. Hoàng Văn Thụ (P. Tương Mai mới),Đăng hôm nay,,https://batdongsan.com.vn/ban-can-ho-chung-cu-phuong-hoang-van-thu-4-feliz-homes/quy-chuyen-nhuong-gia-thuc-cap-nhat-tot-nhat-tai-1-ngu-2-ngu-3-ngu-4-ngu-pr45242662
Hoàng Mai,"(Cực tốt) Quỹ căn bán 2N/3N, DT 52m/105m, sổ hồng, giá từ 4.65 tỷ, tại Rose Town.",5450.0,71.0,76.7605633802817,P. Hoàng Liệt,Đăng hôm qua,,https://batdongsan.com.vn/ban-can-ho-chung-cu-duong-ngoc-hoi-phuong-hoang-liet-rose-town-79-ngoc-hoi/cuc-tot-quy-ban-2n-3n-dt-52m-105m-so-hong-gia-tu-4-65-ty-tai-town-pr45293716
Thanh Xuân,"Quỹ căn ngoại giao, chuyển nhượng CH 2PN - 3PN tại dự án Handico Complex 33 Lê Văn Lương0866 836 ***",8770.0,78.3,112.0051085568327,·P. Nhân Chính (P. Thanh Xuân mới),Đăng hôm qua,,https://batdongsan.com.vn/ban-can-ho-chung-cu-duong-le-van-luong-phuong-nhan-chinh-handico-complex/quy-ngoai-giao-chuyen-nhuong-ch-2pn-3pn-tai-du-an-33-luong-pr44880234
Thanh Xuân,"Chính chủ (Miễn TG) bán nhanh CH tập thể H3 55m2 tại Đường Kim Giang, Hạ Đình, Thanh Xuân, Hà Nội",3900.0,55.0,70.9090909090909,·P. Hạ Đình (P. Thanh Liệt mới),Đăng 4 ngày trước,,https://batdongsan.com.vn/ban-can-ho-chung-cu-duong-kim-giang-phuong-ha-dinh-5/chinh-chu-mien-tg-ban-nhanh-ch-tap-the-h3-55m2-tai-uong-inh-thanh-xuan-noi-pr45263704
Thanh Xuân,Cập nhật bảng giá và chính sách bán hàng mới nhất dự án The Queen - 360 Giải Phóng,8100.0,90.0,90.0,·P. Phương Liệt,Đăng 4 ngày trước,,https://batdongsan.com.vn/ban-can-ho-chung-cu-duong-giai-phong-phuong-phuong-liet-the-queen/mua-nha-xin-ruoc-xe-sang-li-xi-au-xuan-en-650-trieu-khi-mua-360-phong-pr45155982
Thanh Xuân,"Chính chủ bán gấp căn hộ 18T2 Trung Hoà Nhân Chính - 102m2, 2PN, tầng cao, 2 ban công, giá tốt",8650.0,102.0,84.80392156862744,P. Nhân Chính (P. Yên Hòa mới),Đăng 4 ngày trước,Có,https://batdongsan.com.vn/ban-can-ho-chung-cu-duong-le-van-luong-phuong-nhan-chinh-5/chu-ban-gap-cc-102m2-2pn-tang-cao-toa-18t2-trung-hoa-gia-tot-nhat-pr45126997
Thanh Xuân,"Bán gấp căn hộ chung cư tòa Phú Gia Residence Nguyễn Huy Tưởng DT 102m2, 3 phòng ngủ, nội thất đẹp",9000.0,102.0,88.23529411764706,P. Thanh Xuân Trung (P. Khương Đình mới),Đăng hôm nay,Có,https://batdongsan.com.vn/ban-can-ho-chung-cu-duong-nguyen-huy-tuong-phuong-thanh-xuan-trung-phu-gia-residence/ban-gap-toa-dt-102m2-3-phong-ngu-noi-that-dep-pr45120855
Thanh Xuân,"Bán CC 2PN 1WC 85m2 tại toà B, Khương Trung, 8,89 tỷ VND",8890.0,85.0,104.58823529411765,P. Khương Trung (P. Phương Liệt mới),Đăng hôm nay,,https://batdongsan.com.vn/ban-can-ho-chung-cu-duong-khuong-trung-phuong-khuong-trung-star-tower-283-khuong-trung/ban-cc-2pn-1wc-85m2-tai-toa-b-8-89-ty-vnd-pr45291554
Thanh Xuân,"CC bán căn hộ 2PN 77m2 giá 6,35 tỷ LH:0902 030 ***",6350.0,77.0,82.46753246753246,P. Phương Liệt,Đăng hôm nay,,https://batdongsan.com.vn/ban-can-ho-chung-cu-duong-giai-phong-phuong-phuong-liet-imperial-plaza/cc-ban-2pn-78m2-gia-6-2-ty-lh-pr45064256
Thanh Xuân,"Bán căn hộ The Golden Palm Lê Văn Lương 102m2, 3 phòng ngủ, nội thất hiện đại, view đẹp nhất dự án",11000.0,102.0,107.84313725490196,P. Nhân Chính (P. Thanh Xuân mới),Đăng hôm nay,,https://batdongsan.com.vn/ban-can-ho-chung-cu-duong-le-van-luong-phuong-nhan-chinh-the-golden-palm-le-van-luong/ban-gap-dt-130m2-3-phong-ngu-goc-vom-view-ep-nhat-du-an-pr45201922
Thanh Xuân,"Cần bán gấp căn hộ chung cư cao cấp 105 m2, 3 PN tòa Golden Palm 21 Lê Văn Lương",12800.0,105.0,121.9047619047619,P. Nhân Chính (P. Thanh Xuân mới),Đăng hôm nay,Có,https://batdongsan.com.vn/ban-can-ho-chung-cu-duong-le-van-luong-phuong-nhan-chinh-the-golden-palm-le-van-luong/ban-gap-cao-cap-105-m2-3-pn-toa-21-luong-pr45133528
Thanh Xuân,"Em Giang PKD chủ đầu tư căn hộ 2PN giá tốt nhất dự án, HTLS 0% 18th, CK 9,5%, quà tân gia may mắn",6300.0,78.0,80.76923076923077,P. Phương Liệt,Đăng hôm nay,,https://batdongsan.com.vn/ban-can-ho-chung-cu-duong-giai-phong-phuong-phuong-liet-imperial-plaza/em-giang-pkd-chu-dau-tu-2pn-gia-tot-nhat-du-an-htls-0-18th-ck-9-5-qua-tan-gia-may-man-pr44051849
Thanh Xuân,Siêu hot! Chủ nhà cần bán gấp căn 2PN 2VS (căn góc) 79.7m2 đẹp nhất dự án Imperia Graden 203 NHT,7800.0,79.7,97.86700125470514,P. Thanh Xuân Trung (P. Thanh Xuân mới),Đăng hôm qua,Có,https://batdongsan.com.vn/ban-can-ho-chung-cu-duong-nguyen-huy-tuong-phuong-thanh-xuan-trung-imperia-garden/sieu-hot-chu-nha-ban-gap-2pn-2vs-goc-79-7-m2-ep-nhat-du-an-graden-203-nht-pr45271545
