Khu vực,Tiêu đề,Giá (triệu),Diện tích (m²),Giá/m² (triệu),Vị trí,Ngày đăng,Cắt lỗ?,Link
Đống Đa,"Quỹ cuối căn hộ 65-135m2 từ 2-4PN CC The Nestar 83 Hào Nam. Quỹ CĐT, sổ đỏ, full nội thất, slot xe",14000.0,90.0,155.55555555555554,P. Ô Chợ Dừa (P. Ô Chợ Dừa mới),Đăng 1 tuần trước,,https://batdongsan.com.vn/ban-can-ho-chung-cu-pho-hao-nam-phuong-o-cho-dua-the-terra-hao-nam/quy-cuoi-65-135m2-tu-2-4pn-cc-nestar-83-quy-c-t-so-full-noi-that-slot-xe-pr45279945
Đống Đa,Chỉ 3tỷ85! Tập thể phố Thái Thịnh Đống Đa - 2PN riêng biệt - Khách & bếp tách biệt,3850.0,55.0,70.0,P. Thịnh Quang (P. Đống Đa mới),Đăng hôm nay,,https://batdongsan.com.vn/ban-can-ho-chung-cu-pho-thai-thinh-phuong-thinh-quang-3/chi-3-ty85-tap-the-dong-da-2pn-rieng-biet-khach-bep-tach-biet-pr44981514
Đống Đa,"Bán căn hộ chung cư tầng 2 Tây Sơn, 55m2 view cực thoáng, đẹp như ảnh, 4.3 tỷ",4300.0,55.0,78.18181818181819,P. Kim Liên,Đăng hôm nay,,https://batdongsan.com.vn/ban-can-ho-chung-cu-duong-tay-son-phuong-kim-lien-3/ban-tang-2-55m2-view-cuc-thoang-ep-nhu-anh-4-3-ty-pr45351735
Đống Đa,"Hiếm! Bán Tập thể Chùa Láng- ĐH Ngoại Thương2PN full nội thất xịn, sổ to 35/65m, oto đỗ, thoáng đẹp",5560.0,65.0,85.53846153846153,P. Láng Thượng (P. Láng mới),Đăng hôm nay,,https://batdongsan.com.vn/ban-can-ho-chung-cu-pho-chua-lang-phuong-lang-thuong-3/hiem-ban-tap-the-h-ngoai-thuong2pn-full-noi-that-xin-so-to-35-65m-oto-o-thoang-ep-pr45361411
Đống Đa,"Chính chủ cần bán gấp căn hộ tại Vinhomes Nguyễn Chí Thanh, 90m2, 2PN, tầng cao LH:0814 332 ***",,90.0,,P. Láng Thượng (P. Láng mới),Đăng hôm nay,Có,https://batdongsan.com.vn/ban-can-ho-chung-cu-duong-nguyen-chi-thanh-phuong-lang-thuong-vinhomes-nguyen-chi-thanh/chinh-chu-ban-gap-tai-90m2-2pn-tang-cao-lh-0814332325-pr45212998
Đống Đa,"Căn đẹp nhất C5 Kim Liên, lô góc nhà mới, ở ngay 120m2, giá bán nhanh chỉ nhỉnh 4 tỷ - chính chủ",,120.0,,P. Kim Liên,Đăng hôm nay,,https://batdongsan.com.vn/ban-can-ho-chung-cu-duong-kim-lien-phuong-kim-lien-3/dep-nhat-c5-lo-goc-nha-moi-o-ngay-120m2-gia-ban-nhanh-chi-4-8-ty-chinh-chu-pr44949392
Đống Đa,"Bán căn tập thể C5 Kim Liên 120m Lô góc, 2 ban công, nhà đẹp, sang, giá bán nhanh nhỉnh 4 tỷ",,120.0,,P. Kim Liên,Đăng hôm nay,,https://batdongsan.com.vn/ban-can-ho-chung-cu-duong-kim-lien-phuong-kim-lien-3/ban-tap-the-c4-120m-lo-goc-2-ban-cong-nha-dep-nhu-moi-gia-chi-nhinh-5-ty-pr44786159
Đống Đa,"Hot! Bán gấp căn góc 3 ngủ DT 141m2 tầng 20, view hồ Thành Công sẵn sổ đổ full nội thất giá tốt",,141.0,,P. Láng Hạ (P. Giảng Võ mới),Đăng hôm nay,Có,https://batdongsan.com.vn/ban-can-ho-chung-cu-pho-lang-ha-phuong-lang-ha-green-diamond-93-lang-ha/hot-ban-gap-goc-3-ngu-dt-137m2-tang-11-view-thanh-cong-san-so-do-full-noi-that-gia-tot-pr42707884
Hai Bà Trưng,"Chính chủ gửi bán 8 CH giá rẻ 1PN-5.8 tỷ, 2PN-7.1 tỷ, 3PN-10.7 tỷ, 4PN-15T, sẵn sổ GDLH0968 602 ***",7100.0,76.0,93.42105263157895,·P. Vĩnh Tuy (P. Vĩnh Tuy mới),Đăng hôm nay,Có,https://batdongsan.com.vn/ban-can-ho-chung-cu-duong-minh-khai-phuong-vinh-tuy-times-city/chinh-chu-gui-ban-8-ch-gia-re-1pn-5-8-ty-2pn-7-1-ty-3pn-10-7-ty-4pn-15t-san-so-gdlh-pr45354264
Hai Bà Trưng,Cần bán căn góc 3 phòng ngủ DT 113m2 chung cư Thăng Long Garden 250 Minh Khai,9400.0,113.0,83.1858407079646,·P. Minh Khai (P. Tương Mai mới),Đăng 4 ngày trước,,https://batdongsan.com.vn/ban-can-ho-chung-cu-duong-minh-khai-phuong-minh-khai-thang-long-garden/ban-goc-3-phong-ngu-dt-113m2-250-khai-pr45323920
Hai Bà Trưng,"Bán căn 1 ngủ giá 5.8 tỷ, 2 ngủ 95m2 giá chỉ 9.5 tỷ. Quỹ căn có slot ô tô cập nhật T3/2026",9500.0,95.0,100.0,·P. Vĩnh Tuy (P. Vĩnh Tuy mới),Đăng 4 ngày trước,,https://batdongsan.com.vn/ban-can-ho-chung-cu-duong-minh-khai-phuong-vinh-tuy-times-city/ban-2-phong-ngu-view-thoang-90m2-full-o-gia-chi-9-9-ty-quy-co-slot-o-to-cap-nhat-t3-2026-pr45243301
Hai Bà Trưng,"Nhà TT ngõ 190 Phố Lò Đúc sổ đỏ chính chủ - sử dụng 55m2, giá 3,3 tỷ",3300.0,55.0,60.0,P. Đồng Nhân (P. Hai Bà Trưng mới),Đăng hôm nay,,https://batdongsan.com.vn/ban-can-ho-chung-cu-pho-lo-duc-phuong-dong-nhan-4/nha-tt-ngo-190-so-do-chinh-chu-su-dung-55m-gia-3-3-ti-pr45138340
Hai Bà Trưng,"Tập thể Quỳnh Mai tầng 3 sổ 53,8m2 thực sử dụng 105m2 3N3 VSKK chỉ 5.55 tỷ ở sướng hơn chung cư",5550.0,105.0,52.857142857142854,P. Quỳnh Mai (P. Bạch Mai mới),Đăng hôm nay,,https://batdongsan.com.vn/ban-can-ho-chung-cu-phuong-quynh-mai/chinh-chu-ban-tap-the-nha-e6-tang-5-so-do-35-4m2-thuc-te-80m2-du-cong-nang-nhinh-3-ty-pr43572460
Hai Bà Trưng,"Bán nhà tại Phố Lò Đúc, 3,38 tỷ, 32m2, 2PN + 1 WC. View mặt phố",3380.0,23.7,142.61603375527426,P. Phạm Đình Hổ (P. Hai Bà Trưng mới),Đăng 1 tuần trước,,https://batdongsan.com.vn/ban-can-ho-chung-cu-pho-lo-duc-phuong-pham-dinh-ho-4/ban-nha-rieng-tai-uc-3-38-ty-32m2-2pn-1-wc-view-mat-pho-pr45143441
Hai Bà Trưng,Bán gấp căn 2 ngủ 2 vệ sinh cam kết có slot ô tô cố định như ảnh ở Times City. Liên hệ0943 358 ***,10300.0,76.0,135.52631578947367,P. Vĩnh Tuy (P. Vĩnh Tuy mới),Đăng 1 tuần trước,Có,https://batdongsan.com.vn/ban-can-ho-chung-cu-duong-minh-khai-phuong-vinh-tuy-times-city/ban-gap-2-ngu-2-ve-sinh-cam-ket-co-slot-oto-co-dinh-nhu-anh-o-lien-he-pr43857170
Hai Bà Trưng,Mua bán chung cư cao cấp Sunshine Garden cạnh Timescity - phường Vĩnh Tuy - Hà Nội - LH0812 395 ***,8600.0,114.0,75.43859649122807,·P. Vĩnh Tuy (P. Vĩnh Tuy mới),Đăng 4 ngày trước,,https://batdongsan.com.vn/ban-can-ho-chung-cu-duong-duong-van-be-phuong-vinh-tuy-sunshine-garden/chinh-chu-ban-gap-hoa-hau-3pn-82m2-sunshinegarden-minh-khai-hbt-gia-chi-4-ty-lhe-pr39028867
Hai Bà Trưng,Tổng hợp quỹ căn 2PN và 3PN cần bán ở Imperia 423 Minh Khai. LH:0947 418 ***,,105.0,,·P. Vĩnh Tuy (P. Vĩnh Tuy mới),Đăng 6 ngày trước,,https://batdongsan.com.vn/ban-can-ho-chung-cu-duong-minh-khai-phuong-vinh-tuy-imperia-sky-garden/quy-ban-cat-lo-sau-2pn-3pn-tai-423-khai-pr36736749
Hai Bà Trưng,"Bán căn hộ Sunshine Garden giá rẻ: 1N: 4,6 tỷ, 3N: 8,3 tỷ, 4N: 10,5 tỷ - SĐT:0981 757 ***",8300.0,100.0,83.0,·P. Vĩnh Tuy (P. Vĩnh Tuy mới),Đăng 6 ngày trước,Có,https://batdongsan.com.vn/ban-can-ho-chung-cu-duong-duong-van-be-phuong-vinh-tuy-sunshine-garden/mua-ban-gia-re-1ngu-3-8-ty-2ngu-6-ty-3ngu-6-7-ty-sdt-pr43654783
Hai Bà Trưng,Bán căn 3PN 95m2 8 tỷ 300tr giá tốt nhất Sunshine Garden - Vĩnh Tuy - Cao Tuấn Anh0889 108 ***,8300.0,95.0,87.36842105263158,·P. Vĩnh Tuy (P. Vĩnh Tuy mới),Đăng 6 ngày trước,,https://batdongsan.com.vn/ban-can-ho-chung-cu-duong-duong-van-be-phuong-vinh-tuy-sunshine-garden/genz-land-chuyen-chuyen-nhuong-quy-da-dang-gia-tot-nhat-cho-khach-o-thuc-pr41938029
Hai Bà Trưng,"Bán căn 1 ngủ giá 5,8 tỷ, 2N2WC giá 8,3 tỷ và quỹ căn bán 1,2,3 ngủ rẻ nhất Timescity:0943 358 ***",8400.0,83.0,101.20481927710843,·P. Vĩnh Tuy (P. Vĩnh Tuy mới),Đăng 1 tuần trước,,https://batdongsan.com.vn/ban-can-ho-chung-cu-duong-minh-khai-phuong-vinh-tuy-times-city/bang-gia-moi-nhat-thang-9-re-nhat-view-dep-san-so-ban-gap-lh-pr44039674
Hai Bà Trưng,"Nhà TT ngõ 190 Phố Lò Đúc sổ đỏ chính chủ - sử dụng 55m2, giá 3,3 tỷ",3300.0,55.0,60.0,P. Đồng Nhân (P. Hai Bà Trưng mới),Đăng hôm nay,,https://batdongsan.com.vn/ban-can-ho-chung-cu-pho-lo-duc-phuong-dong-nhan-4/nha-tt-ngo-190-so-do-chinh-chu-su-dung-55m-gia-3-3-ti-pr45138340
Hai Bà Trưng,Bán gấp căn hộ 2N tòa T11 nội thất cao cấp sửa hết 600 triệu. Giá 8 tỷ 5 thương lượng sâu!,8500.0,83.0,102.40963855421687,P. Vĩnh Tuy (P. Vĩnh Tuy mới),Đăng hôm nay,Có,https://batdongsan.com.vn/ban-can-ho-chung-cu-duong-minh-khai-phuong-vinh-tuy-times-city/ban-gap-2n-toa-t11-noi-that-cao-cap-sua-het-600-trieu-gia-6-ty-thuong-luong-sau-pr41429237
Hai Bà Trưng,Quỹ căn hộ bán độc quyền giá rẻ Imperia Sky Garden Minh Khai - Em Cường0976 044 ***,10600.0,98.0,108.16326530612245,P. Vĩnh Tuy (P. Vĩnh Tuy mới),Đăng 2 ngày trước,Có,https://batdongsan.com.vn/ban-can-ho-chung-cu-duong-minh-khai-phuong-vinh-tuy-imperia-sky-garden/quy-ban-doc-quyen-gia-re-em-cuong-pr43596926
Hai Bà Trưng,"Chính chủ bán nhà tập thể tầng 1 tại A2 nhà 112 tập thể 8/3, Quỳnh Mai, 3PN, nhà đẹp long lanh",5800.0,120.0,48.333333333333336,P. Quỳnh Mai (P. Bạch Mai mới),Đăng 2 ngày trước,,https://batdongsan.com.vn/ban-can-ho-chung-cu-pho-8-3-1-phuong-quynh-mai-4/chinh-chu-ban-nha-tap-the-tang-1-tai-a2-nha-112-tap-the-8-3-3pn-nha-dep-long-lanh-pr45057821
Hai Bà Trưng,"Bán căn 2PN - 76m²- SLOT Ô TÔ, nhà đẹp, đầy đủ nội thất, ở ngay chỉ 9,5 tỷ có TL, LH0989 555 ***",9500.0,76.0,125.0,P. Vĩnh Tuy (P. Vĩnh Tuy mới),Đăng 2 ngày trước,,https://batdongsan.com.vn/ban-can-ho-chung-cu-duong-minh-khai-phuong-vinh-tuy-times-city/ban-2pn-76m-slot-o-to-nha-dep-day-du-noi-that-o-ngay-chi-8-4-ty-co-tl-lh-pr43801210
Hai Bà Trưng,"Giá rẻ nhất - chính chủ gửi bán căn 1PN tòa T08 5,8 tỷ, 2PN - 8,350 tỷ, 3PN - 12,5 tỷ, 4PN - 19 tỷ",5800.0,53.0,109.43396226415095,P. Vĩnh Tuy (P. Vĩnh Tuy mới),Đăng 4 ngày trước,Có,https://batdongsan.com.vn/ban-can-ho-chung-cu-duong-minh-khai-phuong-vinh-tuy-times-city/gia-re-nhat-chinh-chu-gui-ban-1pn-toa-t08-5-8-ty-2pn-8-350-3pn-12-5-ty-4pn-19-ty-pr45318824
Hai Bà Trưng,"Ban quản lí gửi em bán gấp căn hộ 2PN, 3PN dự án Imperia Sky Garden. LH xem nhà TPKD0387 032 ***",,74.83,,P. Vĩnh Tuy (P. Vĩnh Tuy mới),Đăng 1 tuần trước,Có,https://batdongsan.com.vn/ban-can-ho-chung-cu-duong-minh-khai-phuong-vinh-tuy-imperia-sky-garden/ban-cat-lo-hai-ba-trung-ha-noi-pr33560194
Hai Bà Trưng,Bán căn 2 phòng ngủ 87m² Park Hill Thiết kế 2 ngủ sáng 2 vệ sinh phòng khách rộng chủ nhà thiện chí,10700.0,87.0,122.98850574712644,P. Vĩnh Tuy (P. Vĩnh Tuy mới),Đăng 1 tuần trước,,https://batdongsan.com.vn/ban-can-ho-chung-cu-duong-minh-khai-phuong-vinh-tuy-times-city/ban-2-phong-ngu-87m-park-hill-thiet-ke-2-ngu-sang-2-ve-sinh-phong-khach-rong-chu-nha-thien-chi-pr45283001
Hai Bà Trưng,Quỹ căn hộ giá rẻ dòng tiền lớn tại Sunshine Garden cạnh Timescity 1PN-4PN Phạm Minh Đức0982 869 ***,9300.0,116.0,80.17241379310344,P. Vĩnh Tuy (P. Vĩnh Tuy mới),Đăng 1 tuần trước,Có,https://batdongsan.com.vn/ban-can-ho-chung-cu-duong-duong-van-be-phuong-vinh-tuy-sunshine-garden/tong-hop-quy-gia-re-1pn-2pn-3pn-4pn-pham-minh-duc-pr44224546
Hai Bà Trưng,"Chính chủ Bán căn góc 2 ngủ, 2 vệ sinh , 1 phòng khách, bếp.. toà Park 9 KĐT Timescity",11160.0,77.0,144.93506493506493,P. Vĩnh Tuy (P. Vĩnh Tuy mới),Đăng hôm nay,,https://batdongsan.com.vn/ban-can-ho-chung-cu-duong-minh-khai-phuong-vinh-tuy-times-city/chinh-chu-ban-goc-2-ngu-2-ve-sinh-1-phong-khach-bep-toa-park-9-k-t-timescity-pr45360893
Hai Bà Trưng,BÁN CĂN HỘ TẦNG 1 - TỔNG DIỆN TÍCH 60M2 - SÂN RIÊNG 20M2 - SỔ ĐỎ CHÍNH CHỦ,3500.0,30.0,116.66666666666667,P. Minh Khai (P. Bạch Mai mới),Đăng hôm nay,,https://batdongsan.com.vn/ban-can-ho-chung-cu-duong-minh-khai-phuong-minh-khai-4/ban-tang-1-60m-so-o-chinh-chu-san-rieng-20m-pr45349057
Hai Bà Trưng,"Bán gấp căn hộ 3 ngủ tòa Kinh Đô, số 93 Lò Đúc, Hai Bà Trưng. 116m2 tầng trung, NT đẹp nhỉnh 13 tỷ",13500.0,116.0,116.37931034482759,P. Phạm Đình Hổ (P. Hai Bà Trưng mới),Đăng hôm nay,Có,https://batdongsan.com.vn/ban-can-ho-chung-cu-pho-lo-duc-phuong-pham-dinh-ho-toa-nha-93-lo-duc-kinh-do-tower/ban-gap-3n-o-93-uc-hai-ba-trung-116m2-tang-trung-nt-ep-nhinh-13-ty-pr45291947
Thanh Trì,Chủ đầu tư Bluegem dự kiến ra hàng đợt cuối các tầng siêu đẹp: 12 - 15 - 16 - 18.,6500.0,85.0,76.47058823529412,X. Tứ Hiệp (X. Thanh Trì mới),Đăng hôm qua,,https://batdongsan.com.vn/ban-can-ho-chung-cu-duong-nguyen-bac-1-xa-tu-hiep-bluegem-tower/chu-au-du-kien-ra-hang-ot-cuoi-cac-tang-sieu-ep-12-15-16-18-pr45347022
Thanh Trì,"Căn hộ Greenera Southmark, bán gấp, 7.2 tỷ, 76,2m2, 2PN, 2WC, đầy đủ nội thất",7200.0,76.2,94.48818897637796,TT. Văn Điển (P. Hoàng Liệt mới),Đăng 2 ngày trước,Có,https://batdongsan.com.vn/ban-can-ho-chung-cu-duong-ngoc-hoi-thi-tran-van-dien-greenera-southmark/ban-gap-7-2-ty-76-3m2-2pn-2wc-ay-u-noi-that-pr45336887
Thanh Trì,"Bán căn hộ chung cư ký HĐMB với cđt, 3PN, 3WC, CT14 Hồng Hà Eco City, Yên Sở, giá 6,5 tỷ, 82,1m2",6500.0,82.1,79.17174177831913,X. Tứ Hiệp (X. Thanh Trì mới),Đăng 3 ngày trước,,https://batdongsan.com.vn/ban-can-ho-chung-cu-duong-nguyen-bo-xa-tu-hiep-hong-ha-eco-city/ban-ky-h-mb-voi-c-t-3pn-3wc-tai-yen-so-hn-gia-6-5-ty-82-1m2-pr45326922
Thanh Trì,"Chính chủ bán gấp căn hộ 67m2 tại Eco Green City, 6,1 tỷ, 2PN, 2WC, view đẹp",6100.0,67.0,91.04477611940298,X. Tân Triều (P. Thanh Liệt mới),Đăng 1 tuần trước,Có,https://batdongsan.com.vn/ban-can-ho-chung-cu-duong-nguyen-xien-xa-tan-trieu-eco-green-city/chinh-chu-ban-gap-67m2-tai-6-1-ty-2pn-2wc-view-ep-pr45254868
Thanh Trì,"Siêu hot! Chủ nhà cần tiền giảm sốc 300tr, căn 2PN 2VS (căn góc) 76.1m2 đẹp nhất dự án Eco Green",6050.0,76.1,79.5006570302234,X. Tân Triều (P. Thanh Liệt mới),Đăng hôm nay,,https://batdongsan.com.vn/ban-can-ho-chung-cu-duong-nguyen-xien-xa-tan-trieu-eco-green-city/sieu-hot-chu-nha-tien-giam-soc-300tr-2-ngu-2vs-goc-76m2-dep-nhat-du-an-green-pr44839098
Thanh Trì,"CT8B Căn hộ chung cư 66m2 tầng trung, ban công Đông Nam mát mẻ",4250.0,66.0,64.39393939393939,X. Tả Thanh Oai (X. Đại Thanh mới),Đăng 4 ngày trước,,https://batdongsan.com.vn/ban-can-ho-chung-cu-duong-phan-trong-tue-xa-ta-thanh-oai-chung-cu-dai-thanh/ct8b-66m2-tang-trung-ban-cong-ong-nam-mat-me-pr45276649
Thanh Trì,"Em Giang căn ngoại giao đặc biệt hiếm có, giá tốt nhất thị trường, hỗ trợ vay ngân hàng",7000.0,127.0,55.118110236220474,X. Tứ Hiệp (X. Thanh Trì mới),Đăng 6 ngày trước,,https://batdongsan.com.vn/ban-can-ho-chung-cu-duong-tu-hiep-xa-tu-hiep-tecco-garden/em-giang-quy-ngoai-giao-dac-biet-hiem-co-gia-tot-nhat-thj-truong-tro-vay-ngan-hang-pr43874813
Thanh Trì,"Bán Căn hộ đẹp, nhiều tiện ích 3,22 tỷ, 47,3 m2 tại Căn hộ 1208 Tòa CT10A, Đại Thanh, Hà Nội",3220.0,47.3,68.07610993657505,X. Tả Thanh Oai (X. Đại Thanh mới),Đăng 1 tuần trước,,https://batdongsan.com.vn/ban-can-ho-chung-cu-duong-phan-trong-tue-xa-ta-thanh-oai-chung-cu-dai-thanh/ban-ep-nhieu-tien-ich-3-22-ty-47-3-m2-tai-1208-toa-ct10a-ai-ha-noi-pr45268330
Thanh Trì,Chính chủ bán chung cư Eco Green 286 Nguyễn Xiển,6650.0,73.9,89.98646820027064,X. Tân Triều (P. Thanh Liệt mới),Đăng 2 tuần trước,,https://batdongsan.com.vn/ban-can-ho-chung-cu-duong-nguyen-xien-xa-tan-trieu-eco-green-city/chinh-chu-ban-286-xien-pr45202488
Thanh Trì,"7 suất 2PN-3PN quỹ cán bộ BlueGem, vào tên trực tiếp HĐ, quà tặng tiền mặt 330tr, vay NH lãi ưu đãi",,99.6,,X. Tứ Hiệp (X. Thanh Trì mới),Đăng 1 tuần trước,,https://batdongsan.com.vn/ban-can-ho-chung-cu-duong-nguyen-bac-1-xa-tu-hiep-bluegem-tower/chinh-chu-e-lai-suat-bo-3pn-ma-06a-va-09b-qua-tang-tien-mat-330-trieu-tro-vay-nh-lai-6-5-pr45289005
Thanh Trì,"Chính chủ bán gấp căn hộ 67m2 tại Eco Green City, 6,1 tỷ, 2PN, 2WC, view đẹp",6100.0,67.0,91.04477611940298,X. Tân Triều (P. Thanh Liệt mới),Đăng 1 tuần trước,Có,https://batdongsan.com.vn/ban-can-ho-chung-cu-duong-nguyen-xien-xa-tan-trieu-eco-green-city/chinh-chu-ban-gap-67m2-tai-6-1-ty-2pn-2wc-view-ep-pr45254868
Thanh Trì,"Chuẩn giá như ảnh: Bán căn 75m2 (2N2WC) giá 6.3 tỷ, sẵn sổ tại Eco Green City Nguyễn Xiển",6300.0,75.0,84.0,X. Tân Triều (P. Thanh Liệt mới),Đăng hôm nay,,https://batdongsan.com.vn/ban-can-ho-chung-cu-duong-nguyen-xien-xa-tan-trieu-eco-green-city/chuan-gia-nhu-anh-ban-76m2-2n2wc-full-noi-that-san-so-tai-gia-6-5-ty-pr45214585
Thanh Trì,"Nhận nhà ở ngay độc quyền ngoại giao 3PN 6,xtỷ. Sẵn 2,1 tỷ ký HĐMB, CK 6%, 3PN 100% full",6200.0,100.0,62.0,X. Tứ Hiệp (X. Thanh Trì mới),Đăng hôm nay,,https://batdongsan.com.vn/ban-can-ho-chung-cu-duong-nguyen-bac-1-xa-tu-hiep-bluegem-tower/nhan-nha-o-ngay-oc-quyen-ngoai-giao-3pn-6-xty-san-2-1-ty-ky-h-mb-ck-6-3pn-100-full-pr45343416
Thanh Trì,"Chính chủ bán nhanh căn 4PN Bluegem Thanh Trì, giá siêu rẻ! LH0912 824 ***",8170.0,127.0,64.33070866141732,X. Tứ Hiệp (X. Thanh Trì mới),Đăng hôm nay,,https://batdongsan.com.vn/ban-can-ho-chung-cu-duong-nguyen-bac-1-xa-tu-hiep-bluegem-tower/chinh-chu-ban-nhanh-4pn-thanh-tri-gia-sieu-re-lh-pr45356908
Thanh Trì,"Bán căn hộ chung cư BlueGem Tower tại Nguyễn Bặc, 11,7 tỷ, 167m2, Thanh Trì, Hà Nội",11900.0,167.0,71.25748502994011,X. Tứ Hiệp (X. Thanh Trì mới),Đăng hôm nay,,https://batdongsan.com.vn/ban-can-ho-chung-cu-duong-nguyen-bac-1-xa-tu-hiep-bluegem-tower/ban-tai-11-7-ty-167m2-thanh-tri-ha-noi-pr44977157
Thanh Trì,"Bán Căn hộ chung cư Eco Green City, 6,2 tỷ, 75m2, 2PN, 2WC, chính chủ, giá siêu hời tại Thanh Trì",6200.0,75.0,82.66666666666667,X. Tân Triều (P. Thanh Liệt mới),Đăng hôm qua,,https://batdongsan.com.vn/ban-can-ho-chung-cu-duong-nguyen-xien-xa-tan-trieu-eco-green-city/ban-6-2-ty-75m2-2pn-2wc-chinh-chu-gia-sieu-hoi-tai-thanh-tri-pr45348814
Thanh Trì,"Chỉ 8x tr/m2, độc quyền căn 47m2 4 tỷ. Sẵn 1,2t ký HĐMB, vay 0% 24 tháng, ck tới 16%, Q tặng 400tr",4000.0,47.0,85.1063829787234,TT. Văn Điển (P. Hoàng Liệt mới),Đăng hôm qua,,https://batdongsan.com.vn/ban-can-ho-chung-cu-duong-ngoc-hoi-thi-tran-van-dien-greenera-southmark/chi-8x-tr-m2-oc-quyen-47m2-4-ty-san-1-2t-ky-h-mb-vay-0-24-thang-ck-toi-16-q-tang-400tr-pr45271308
Thanh Trì,"Căn hộ 3pn, 2vs BlueGem Tower, thiết kế tố ưu, view đẹp, ck 3%, quà tặng cực hót lên tới 350tr",,95.0,,X. Tứ Hiệp (X. Thanh Trì mới),Đăng hôm qua,,https://batdongsan.com.vn/ban-can-ho-chung-cu-duong-nguyen-bac-1-xa-tu-hiep-bluegem-tower/93m2-3pn-2vs-thiet-ke-to-uu-view-dep-gia-tot-nhat-thi-truong-pr44997087
Thanh Trì,"Cắt lãi nhẹ trục 05B dự án BlueGem, giá bao rẻ nhất thị trường, 2 tháng nữa nhận nhà. LH0941 349 ***",6020.0,94.0,64.04255319148936,X. Tứ Hiệp (X. Thanh Trì mới),Đăng hôm qua,,https://batdongsan.com.vn/ban-can-ho-chung-cu-duong-nguyen-bac-1-xa-tu-hiep-bluegem-tower/cat-lai-nhe-truc-03b-du-an-gia-bao-re-nhat-thi-truong-2-thang-nua-nhan-nha-lh-0941-349-888-pr45213466
Thanh Trì,QUỸ CĂN NGOẠI GIAO CHỦ ĐẦU TƯ VIHA FLORA | CHUẨN BỊ RA HÀNG ĐỢT 1 VỚI CHÍNH SÁCH TỐT.LH:0899 689 ***,,63.0,,X. Tứ Hiệp (X. Thanh Trì mới),Đăng 2 ngày trước,,https://batdongsan.com.vn/ban-can-ho-chung-cu-duong-nguyen-bo-xa-tu-hiep-hong-ha-eco-city/quy-ngoai-giao-chu-au-viha-flora-chuan-bi-ra-hang-ot-1-voi-chinh-sach-tot-lh-pr45339437
Thanh Trì,Duy nhất 1 căn 2PN2WC tòa SM2 giá đợt đầu rẻ nhất tại Greenera Southmark Ngọc Hồi,6520.0,79.3,82.21941992433796,TT. Văn Điển (P. Hoàng Liệt mới),Đăng 3 ngày trước,,https://batdongsan.com.vn/ban-can-ho-chung-cu-duong-ngoc-hoi-thi-tran-van-dien-greenera-southmark/quy-hang-om-cua-cdt-duy-nhat-6-2n-toa-sm2-gia-dot-dau-sieu-re-hoi-pr45140492
Thanh Trì,"Quỹ căn hộ bán 2pn, 3pn và duplex tại Eco Green City Nguyễn Xiển giá tốt nhất thị trường",5700.0,67.0,85.07462686567165,X. Tân Triều (P. Thanh Liệt mới),Đăng 3 ngày trước,,https://batdongsan.com.vn/ban-can-ho-chung-cu-duong-nguyen-xien-xa-tan-trieu-eco-green-city/quy-ban-2pn-va-3pn-tai-ecogreen-gia-tot-nhat-thi-truong-pr45240451
Thanh Trì,"Em Giang PKD chủ đầu tư quỹ căn ngoại giao chỉ từ 1,5 tỷ, HTLS 0% trog 24th, liên hệ0936 396 ***",,63.0,,X. Tứ Hiệp (X. Thanh Trì mới),Đăng 4 ngày trước,,https://batdongsan.com.vn/ban-can-ho-chung-cu-xa-tu-hiep-hong-ha-eco-city/em-giang-pkd-chu-au-quy-ngoai-giao-chi-1-5-ty-htls-0-trog-24th-lien-he-pr45321816
Thanh Trì,Quỹ căn ngoại giao 3PN mã 01B - mã 07B tầng đẹp. Nhận ngay gói chiết khấu VIP. LH0866 324 ***,5180.0,85.0,60.94117647058823,X. Tứ Hiệp (X. Thanh Trì mới),Đăng 4 ngày trước,,https://batdongsan.com.vn/ban-can-ho-chung-cu-duong-nguyen-bac-1-xa-tu-hiep-bluegem-tower/quy-ngoai-giao-2pn-3pn-4pn-tang-dep-nhan-ngay-goi-chiet-khau-vip-doc-quyen-lien-he-pr43845164
Thanh Trì,"Tôi chính chủ bán căn 2PN DT 75m2 Eco Green City, giá 5.8 tỷ bao phí, LH:0932 392 ***",5800.0,75.0,77.33333333333333,X. Tân Triều (P. Thanh Liệt mới),Đăng 5 ngày trước,,https://batdongsan.com.vn/ban-can-ho-chung-cu-duong-nguyen-xien-xa-tan-trieu-eco-green-city/chinh-chu-ban-2pn-dt68m2-ecogreen-gia-3-8-ty-bao-phi-lh-pr40831776
Thanh Trì,"Giá chốt bất ngờ chỉ 3,450 tỷ Căn góc 60m 2pn 2vs Sổ hồng lâu dài tại tòa ct10 chung cư đại thanh",3450.0,60.0,57.5,X. Tả Thanh Oai (X. Đại Thanh mới),Đăng hôm nay,,https://batdongsan.com.vn/ban-can-ho-chung-cu-duong-phan-trong-tue-xa-ta-thanh-oai-chung-cu-dai-thanh/gia-chot-bat-ngo-chi-3-450-ty-goc-60m-2pn-2vs-so-hong-lau-tai-toa-ct10-ai-thanh-pr45361533
Đan Phượng,"Chính chủ cần bán nhanh 3 căn 2PN XP Homes Star Tân Tây Đô: 52,8m - 62m - 64m, LH E0979 898 ***",3690.0,52.8,69.88636363636364,X. Tân Lập (X. Ô Diên mới),Đăng 6 ngày trước,,https://batdongsan.com.vn/ban-can-ho-chung-cu-duong-quoc-lo-32-xa-tan-lap-24-chung-cu-xphomes-tan-tay-do/chinh-chu-ban-nhanh-3-2pn-xp-homes-star-o-52-8m-62m-64m-lh-e-0979898648-pr45309967
Đan Phượng,"Bán căn chung cư XPhome 2PN, 2WC tại Khu đô thị mới Tân Tây Đô, giá 3,X tỷ- LH0944 974 ***",,52.8,,X. Tân Lập (X. Ô Diên mới),Đăng hôm nay,,https://batdongsan.com.vn/ban-can-ho-chung-cu-duong-quoc-lo-32-xa-tan-lap-24-khu-do-thi-moi-tan-tay-do/ban-xphome-2pn-2wc-tai-o-o-gia-3-x-ty-lh-0944974334-pr45196828
Đan Phượng,"Quỹ ngoại giao chung cư Vinhomes Đan Phượng - đợt đầu giá 7x tr/m2 ck 17 %, HT vay 80% miễn lãi 24T",5860.0,93.0,63.01075268817204,X. Tân Hội (X. Ô Diên mới),Đăng hôm nay,,https://batdongsan.com.vn/ban-can-ho-chung-cu-xa-tan-hoi-7-vinhomes-wonder-city/thong-tin-dang-phuong-chuan-bi-ra-hang-pr43933818
Đan Phượng,"Suất ngoại giao căn duplex, diện tích 162m2/3PN, giá 9 tỷ. Chung cư Masterise Đan Phượng",9000.0,162.0,55.55555555555556,X. Tân Hội (X. Ô Diên mới),Đăng hôm nay,,https://batdongsan.com.vn/ban-can-ho-chung-cu-duong-tay-thang-long-xa-tan-hoi-7-vinhomes-wonder-city/suat-ngoai-giao-simplex-dien-tich-94m-2pn-gia-6-ty-masterise-dan-phuong-pr44497739
Đan Phượng,"Quỹ căn 2 - 3 ngủ giá tốt nhất Vinhomes Đan Phượng chỉ từ 7x tr/m2, cơ hội đầu tư chắc thắng",4730.0,60.0,78.83333333333333,X. Tân Hội (X. Ô Diên mới),Đăng hôm nay,,https://batdongsan.com.vn/ban-can-ho-chung-cu-xa-tan-hoi-7-masteri-sky-quarter/quy-2-3-ngu-gia-tot-nhat-vinhomes-an-phuong-chi-tu-7x-tr-m2-co-au-tu-chac-thang-pr45165401
Đan Phượng,"CẦN BÁN CĂN GÓC 3 NGỦ, 3 VỆ SINH CHUNG CƯ TÂN TÂY ĐÔ.",,110.0,,X. Tân Lập (X. Ô Diên mới),Đăng hôm nay,,https://batdongsan.com.vn/ban-can-ho-chung-cu-duong-quoc-lo-32-xa-tan-lap-24-20/ban-goc-3-ngu-3-ve-sinh-tay-o-pr45234018
Đan Phượng,"Cực rẻ! Cực hiếm! Chính chủ bán căn 54m2, 2PN toà Xphomes Star full nội thất 3.4 tỷ. LH0968 989 ***",3400.0,54.0,62.96296296296296,X. Tân Lập (X. Ô Diên mới),Đăng hôm nay,,https://batdongsan.com.vn/ban-can-ho-chung-cu-duong-quoc-lo-32-xa-tan-lap-24-chung-cu-xphomes-tan-tay-do/cuc-re-cuc-hiem-chinh-chu-ban-54m2-2pn-toa-star-full-noi-that-3-4-ty-lh-0968989239-pr45261656
Đan Phượng,Cần bán căn Duplex 3PN/162m2. Giá 55 tr/m2. HTLS 0% 24 tháng. Chung cư Masterise Đan Phượng,,162.0,,X. Tân Hội (X. Ô Diên mới),Đăng hôm qua,,https://batdongsan.com.vn/ban-can-ho-chung-cu-duong-tay-thang-long-xa-tan-hoi-7-vinhomes-wonder-city/ban-duplex-3pn-162m2-gia-55-tr-m2-htls-0-24-masterise-dan-phuong-pr44826789
Đan Phượng,"Độc quyền căn 3 ngủ, 88m2, ký CĐT, hướng Tây tứ mệnh. Chung cư Masterise Đan Phượng",,88.0,,X. Tân Hội (X. Ô Diên mới),Đăng hôm qua,,https://batdongsan.com.vn/ban-can-ho-chung-cu-xa-tan-hoi-7-masteri-sky-quarter/doc-quyen-3-ngu-88m2-ky-cdt-huong-tay-tu-menh-masterise-dan-phuong-pr44818946
Đan Phượng,"Bán căn hộ chung cư tại Quốc lộ 32, Đan Phượng, 3,9 tỷ, 78 m2, 2PN, 2WC",3900.0,78.0,50.0,X. Tân Lập (X. Ô Diên mới),Đăng hôm qua,,https://batdongsan.com.vn/ban-can-ho-chung-cu-duong-quoc-lo-32-xa-tan-lap-24-20/ban-tai-32-an-phuong-3-9-ty-78-m2-2pn-2wc-pr45350574
Đan Phượng,"Không lo được tài chính, cần bán lại căn 2 phòng ngủ, toà Sky Tower A. Chung cư Vin Đan Phượng",,60.0,,X. Tân Hội (X. Ô Diên mới),Đăng hôm qua,,https://batdongsan.com.vn/ban-can-ho-chung-cu-duong-tay-thang-long-xa-tan-hoi-7-vinhomes-wonder-city/khong-lo-duoc-tai-chinh-ban-lai-2-phong-ngu-toa-sky-tower-a-vin-dan-phuong-pr44818935
