Khu vực,Tiêu đề,Giá (triệu),Diện tích (m²),Giá/m² (triệu),Vị trí,Ngày đăng,Cắt lỗ?,Link
Thanh Xuân,Bán căn hộ CC toà Artemis. DT 94m2 3PN 2WC. Căn góc view cực thoáng. Giá bán 9 tỷ,9000.0,94.0,95.74468085106383,P. Khương Mai (P. Phương Liệt mới),Đăng hôm qua,,https://batdongsan.com.vn/ban-can-ho-chung-cu-duong-le-trong-tan-phuong-khuong-mai-the-artemis/ban-cc-toa-dt-94m-3pn-2wc-goc-view-cuc-thoang-gia-ban-9-ty-pr45265603
Thanh Xuân,Cần bán căn hộ 18T2 Lê Văn Lương 116m2 3PN 2 WC nhà về ở luôn giá 9.5 tỷ,9500.0,116.0,81.89655172413794,P. Nhân Chính (P. Thanh Xuân mới),Đăng hôm qua,,https://batdongsan.com.vn/ban-can-ho-chung-cu-duong-le-van-luong-phuong-nhan-chinh-5/ban-18t2-107m-3pn-2-wc-nha-ve-o-luon-gia-8-6-ty-pr44179786
Thanh Xuân,"Giá có thương lượng CẬP NHẬT QUỸ CĂN 2PN,3PN bàn giao T1/2026 tại HANDICO COMPLEX 33 LÊ VĂN LƯƠNG",7700.0,70.0,110.0,·P. Nhân Chính (P. Thanh Xuân mới),Đăng 1 tuần trước,,https://batdongsan.com.vn/ban-can-ho-chung-cu-duong-le-van-luong-phuong-nhan-chinh-handico-complex/gia-co-thuong-cap-nhat-quy-2pn-3pn-ban-giao-t1-2026-tai-33-luong-pr45236974
Thanh Xuân,Bán căn hộ Viha Complex Viha Leciva 107 Nguyễn Tuân giá tốt nhất thị trường cập nhật liên tục 24/24,6620.0,72.0,91.94444444444444,P. Thanh Xuân Trung (P. Thanh Xuân mới),Đăng hôm nay,,https://batdongsan.com.vn/ban-can-ho-chung-cu-duong-nguyen-tuan-phuong-thanh-xuan-trung-viha-complex/quy-ngoai-giao-du-an-leciva-cam-ket-re-nhat-cap-nhat-24-24-pr41967566
Thanh Xuân,"HOT HOT HOT Duy còn duy nhất 1 căn chung cư bộ công an 282 Nguyễn Huy Tưởng, Thanh Xuân, Hà Nội.",5400.0,67.0,80.59701492537313,P. Thanh Xuân Bắc (P. Thanh Liệt mới),Đăng hôm nay,,https://batdongsan.com.vn/ban-can-ho-chung-cu-duong-nguyen-huy-tuong-phuong-thanh-xuan-bac-chung-cu-282-nguyen-huy-tuong/hot-hot-hot-duy-con-duy-nhat-1-bo-cong-an-282-ha-noi-pr45301539
Thanh Xuân,King Palace giỏ hàng chuyển nhượng độc quyền quỹ căn,,93.0,,P. Thượng Đình (P. Thanh Xuân mới),Đăng hôm nay,,https://batdongsan.com.vn/ban-can-ho-chung-cu-duong-nguyen-trai-phuong-thuong-dinh-king-palace/gio-hang-chuyen-nhuong-oc-quyen-quy-2-3pn-pr45272823
Thanh Xuân,FULL NGUỒN 33 LÊ VĂN LƯƠNG  GIÁ TỐT NHẤT THỊ TRƯỜNG- KÝ NGAY!,,94.7,,P. Nhân Chính (P. Yên Hòa mới),Đăng hôm nay,,https://batdongsan.com.vn/ban-can-ho-chung-cu-duong-le-van-luong-phuong-nhan-chinh-handico-complex/full-nguon-33-gia-tot-nhat-thi-truong-ky-ngay-pr45034824
Thanh Xuân,Tổng hợp quỹ căn hộ Royal City cập nhật giá mới nhất tháng 03/2026. LH:0985 676 ***,14000.0,131.0,106.87022900763358,P. Thượng Đình (P. Thanh Xuân mới),Đăng hôm nay,,https://batdongsan.com.vn/ban-can-ho-chung-cu-duong-nguyen-trai-phuong-thuong-dinh-royal-city/tong-hop-quy-cap-nhat-gia-moi-nhat-thang-08-2025-lh-pr43671230
Thanh Xuân,"Chính chủ bán căn 3PN DT 122m2 chung cư Imperia Garden, giá 11 tỷ bao phí, LH0932 392 ***",11000.0,122.0,90.1639344262295,P. Thanh Xuân Trung (P. Thanh Xuân mới),Đăng hôm qua,,https://batdongsan.com.vn/ban-can-ho-chung-cu-duong-nguyen-huy-tuong-phuong-thanh-xuan-trung-imperia-garden/ban-dien-tich-82m2-gia-3-15-ty-lh-0965551255-pr30365431
Thanh Xuân,MỞ BÁN CHUNG CƯ VINHOMES GALAXY - VINHOMES CAO XẢ LÁ. DT TỪ 45M-65M-75M-120M2. LH0945 787 ***,,75.0,,P. Thượng Đình (P. Khương Đình mới),Đăng hôm qua,,https://batdongsan.com.vn/ban-can-ho-chung-cu-duong-nguyen-trai-phuong-thuong-dinh-vinhomes-galaxy/mo-ban-cao-xa-la-dt-tu-45m-65m-75m-120m2-lh-0945787555-pr45272170
Thanh Xuân,DUY NHẤT 10 SUẤT TẶNG XE Ô TÔ TOYOTA KHI MUA 2PN CHUNG CƯ IMPERIAL PLAZA,8200.0,76.0,107.89473684210526,P. Phương Liệt,Đăng hôm qua,,https://batdongsan.com.vn/ban-can-ho-chung-cu-duong-giai-phong-phuong-phuong-liet-imperial-plaza/the-queen-360-truc-tiep-cdt-chiet-khau-9-5-full-noi-that-pr44042493
Thanh Xuân,Chính chủ bán gấp căn hộ 3 ngủ R4 căn đẹp view quảng trường,14300.0,105.0,136.1904761904762,P. Thượng Đình (P. Thanh Xuân mới),Đăng hôm qua,Có,https://batdongsan.com.vn/ban-can-ho-chung-cu-duong-nguyen-trai-phuong-thuong-dinh-royal-city/chinh-chu-ban-gap-3-ngu-r6-goc-dep-pr44462281
Thanh Xuân,"VINHOMES GALAXY - VIN CAO XÀ LÁ CHÍNH THỨC RA HÀNG T4 , IB ĐỂ NHẬN TT CHÍNH THỨC TỪ CĐT VINHOMES",,63.0,,P. Thượng Đình (P. Khương Đình mới),Đăng 2 ngày trước,,https://batdongsan.com.vn/ban-can-ho-chung-cu-duong-nguyen-trai-phuong-thuong-dinh-vinhomes-galaxy/chinh-thuc-ra-mat-cao-xa-la-thang-10-ib-de-nhan-tt-chuan-pr44078151
Thanh Xuân,Suất nội bộ (cam kết) 100% ngoại giao giá tốt căn đẹp Viha 107 Nguyễn Tuân. LH0988 160 ***,,72.0,,P. Thanh Xuân Trung (P. Thanh Xuân mới),Đăng 2 ngày trước,,https://batdongsan.com.vn/ban-can-ho-chung-cu-duong-nguyen-tuan-phuong-thanh-xuan-trung-viha-complex/10-suat-noi-bo-gia-tot-dep-cua-du-an-107-lien-he-ngay-pr39187138
Thanh Xuân,"Chính chủ cần bán căn hộ Imperia Garden, 69.1m2, tòa A",8350.0,69.1,120.83936324167874,P. Thanh Xuân Trung (P. Khương Đình mới),Đăng 2 ngày trước,,https://batdongsan.com.vn/ban-can-ho-chung-cu-duong-nguyen-huy-tuong-phuong-thanh-xuan-trung-imperia-garden/chinh-chu-ban-69-2m2-toa-a-pr45016863
Thanh Xuân,(Hàng hiếm) quỹ căn góc hoa hậu trục 10 3PN2VS 93m2 đã nhận nhà tại Handico 33 Lê Văn Lương,11080.0,92.29,120.05634413262541,P. Nhân Chính (P. Thanh Xuân mới),Đăng 2 ngày trước,,https://batdongsan.com.vn/ban-can-ho-chung-cu-duong-le-van-luong-phuong-nhan-chinh-handico-complex/hang-hiem-quy-goc-hoa-hau-truc-10-3pn2vs-93m2-a-nha-tai-33-luong-pr45277823
Thanh Xuân,CHÍNH THỨC NHẬN BOOKING DỰ ÁN 130 HẠ ĐÌNH ĐỘNG LỰC TOWER GIÁ 12XTR/M2 LIÊN HỆ :0817 936 ***,,72.96,,P. Hạ Đình (P. Thanh Liệt mới),Đăng 3 ngày trước,,https://batdongsan.com.vn/ban-can-ho-chung-cu-pho-ha-dinh-phuong-ha-dinh-dong-luc-tower/chinh-thuc-nhan-booking-du-an-130-inh-ong-gia-12xtr-m2-lien-he-0817936888-pr45185179
Thanh Xuân,"Tổng hợp quỹ căn hộ 1PN, 2PN, 3PN, 4PN, duplex, đập thông đang bán tại Royal City, LH:0365 691 ***",,133.0,,P. Thượng Đình (P. Khương Đình mới),Đăng 3 ngày trước,,https://batdongsan.com.vn/ban-can-ho-chung-cu-duong-nguyen-trai-phuong-thuong-dinh-royal-city/tong-hop-quy-1pn-2pn-3pn-4pn-duplex-dap-thong-dang-ban-tai-lh-pr42032007
Thanh Xuân,"Tôi cần bán căn chung cư cc tại 33 Lê Văn Lương, DT: 86m2, 3PN, 2WC, nhà mới bàn giao, giá rẻ",9290.0,86.0,108.02325581395348,P. Nhân Chính (P. Thanh Xuân mới),Đăng 3 ngày trước,Có,https://batdongsan.com.vn/ban-can-ho-chung-cu-duong-le-van-luong-phuong-nhan-chinh-handico-complex/toi-ban-cc-tai-33-dt-86m2-3pn-2wc-nha-moi-ban-giao-gia-re-pr45268833
Tây Hồ,"PKD CĐT thông báo! Quỹ căn 2PN, 3PN, 4PN, Duplex - Heritage West Lake view Hồ Tây giá tốt. T03/2026",,180.0,,·P. Phú Thượng (P. Hồng Hà mới),Đăng hôm qua,,https://batdongsan.com.vn/ban-can-ho-chung-cu-duong-lac-long-quan-phuong-phu-thuong-1-heritage-west-lake/pkd-cdt-thong-bao-quy-2pn-3pn-4pn-duplex-view-tay-gia-tot-t03-2025-pr42291037
Tây Hồ,"Duy nhất 1 căn Duplex view trọn Sông Hồng, Cầu Nhật Tân giá đợt đầu Noble Tây Hồ tầng đẹp",27800.0,147.7,188.21936357481383,·P. Phú Thượng,Đăng 4 ngày trước,,https://batdongsan.com.vn/ban-can-ho-chung-cu-phuong-phu-thuong-1-noble-crystal-tay-ho/duy-nhat-1-duplex-view-tron-song-hong-cau-nhat-tan-gia-ot-au-tang-ep-pr45263041
Tây Hồ,Duy nhất căn Sky Villa sân vườn đẳng cấp nhất Noble Tây Hồ được vận hành 5* bởi WorldHotels,61000.0,285.0,214.03508771929825,·P. Phú Thượng,Đăng 6 ngày trước,,https://batdongsan.com.vn/ban-can-ho-chung-cu-phuong-phu-thuong-1-noble-crystal-tay-ho/duy-nhat-sky-villa-san-vuon-ang-cap-nhat-uoc-van-hanh-5-boi-worldhotels-pr45256011
Tây Hồ,"Bán căn 3 ngủ Sunshine Riverside - 83,8 m2 - Tầng trung view sông + Cầu Nhật Tân - 8,2 tỷ (full đồ)",8200.0,83.8,97.85202863961814,P. Phú Thượng,Đăng hôm nay,,https://batdongsan.com.vn/ban-can-ho-chung-cu-phuong-phu-thuong-1-sunshine-riverside/ban-3-ngu-83-8-m2-tang-trung-view-song-cau-nhat-tan-8-4-ty-full-o-pr45186649
Tây Hồ,"Bán căn 3 ngủ Sunshine Riverside - 92,7m2 - Giá: 8.8 tỷ - View nội khu + bể bơi - Sổ đỏ",8800.0,92.7,94.92988133764833,P. Phú Thượng,Đăng hôm nay,,https://batdongsan.com.vn/ban-can-ho-chung-cu-duong-vo-chi-cong-phuong-phu-thuong-1-sunshine-riverside/ban-3-ngu-92-7m2-gia-9-3-ty-view-noi-khu-be-boi-so-do-pr44869064
Tây Hồ,Bán căn 3 ngủ - 99.1m2 Sunshine Riverside - 2 ban công - Tầng trung view sông + cầu NT + nội khu,9600.0,99.1,96.87184661957619,P. Phú Thượng,Đăng hôm nay,,https://batdongsan.com.vn/ban-can-ho-chung-cu-phuong-phu-thuong-1-sunshine-riverside/ban-3-ngu-100m2-2-ban-cong-tang-trung-view-song-cau-nt-noi-khu-pr44899618
Tây Hồ,Bán căn 81.7 m2 Sunshine Riverside - View cầu + sông - Full đồ rời đầy đủ - Sổ đỏ - 8.3 tỷ,8300.0,81.7,101.59118727050183,P. Phú Thượng (P. Hồng Hà mới),Đăng hôm nay,,https://batdongsan.com.vn/ban-can-ho-chung-cu-duong-vo-chi-cong-phuong-phu-thuong-1-sunshine-riverside/ban-82m2-view-cau-song-full-do-roi-day-du-so-do-nhinh-8-ty-pr44982836
Tây Hồ,Bán căn Sunshine Riverside - 64.1m2 thông thủy - 2 ngủ view sông - Giá: 7.04tỷ (Sổ đỏ) - tầng cao,7040.0,64.1,109.82839313572543,P. Phú Thượng,Đăng hôm qua,,https://batdongsan.com.vn/ban-can-ho-chung-cu-phuong-phu-thuong-1-sunshine-riverside/ban-64-1m2-thong-thuy-2-ngu-view-song-gia-7-04ty-so-o-tang-cao-pr45266265
Tây Hồ,"Bán căn chung cư 72,9 m2 tại Tây Hồ Riverview, view sông Hồng đẹp - thoáng mát. Sổ đỏ trao tay",6500.0,72.9,89.16323731138546,P. Phú Thượng (P. Hồng Hà mới),Đăng hôm qua,,https://batdongsan.com.vn/ban-can-ho-chung-cu-pho-thuong-thuy-phuong-phu-thuong-1-tay-ho-river-view/chinh-chu-ban-72-9-m2-toa-riverview-song-hong-dep-thoang-mat-pr43748578
Tây Hồ,"Bán căn 4 ngủ Sunshine Riverside (Tây Hồ) - full đồ đẹp - 120.7 m2 thông thuỷ giá: 12,5 tỷ (sổ đỏ)",12500.0,120.7,103.56255178127589,P. Phú Thượng (P. Hồng Hà mới),Đăng 2 ngày trước,,https://batdongsan.com.vn/ban-can-ho-chung-cu-duong-vo-chi-cong-phuong-phu-thuong-1-sunshine-riverside/ban-4-ngu-tay-full-do-dep-120-7-m2-thong-thuy-gia-12-5-ty-so-do-pr44304506
Tây Hồ,"Bán Penthouse Sunshine Riverside - 209,1 m2 - Sổ đỏ - Nhà cơ bản - View Hồ Tây - Giá: 20,5 tỷ",20500.0,209.1,98.03921568627452,P. Phú Thượng,Đăng 2 ngày trước,,https://batdongsan.com.vn/ban-can-ho-chung-cu-duong-vo-chi-cong-phuong-phu-thuong-1-sunshine-riverside/ban-penthouse-209-1-m2-so-do-nha-co-ban-view-tay-gia-20-5-ty-pr45071394
Tây Hồ,Bán căn hộ tầng cao CT13B Ciputra - view trường quốc tế UNIS - đối diện Lotte Mall,5900.0,66.6,88.58858858858859,P. Phú Thượng,Đăng 2 tuần trước,,https://batdongsan.com.vn/ban-can-ho-chung-cu-phuong-phu-thuong-1-khu-do-thi-nam-thang-long-ciputra/ban-tang-cao-ct13b-view-truong-quoc-te-unis-doi-dien-lotte-mall-pr44868008
Tây Hồ,"Bán căn hộ 3pn 2wc full nội thất, chung cư tại D. El Dorado II, 14 tỷ 86 m2, giá ưu đãi",14000.0,86.0,162.7906976744186,·P. Xuân La (P. Xuân Đỉnh mới),Đăng 6 ngày trước,,https://batdongsan.com.vn/ban-can-ho-chung-cu-duong-vo-chi-cong-phuong-xuan-la-d-el-dorado-ii/ban-tai-14-9-ty-86-m2-gia-uu-dai-pr44569538
Tây Hồ,Căn hộ duplex hàng NG đợt 1 giá nội bộ Noble Tây Hồ tầng siêu vip LH nhận thông tin ngay,24000.0,132.0,181.8181818181818,·P. Phú Thượng,Đăng 6 ngày trước,,https://batdongsan.com.vn/ban-can-ho-chung-cu-phuong-phu-thuong-1-noble-crystal-tay-ho/duplex-hang-ng-ot-1-gia-noi-bo-tang-sieu-vip-lh-nhan-thong-tin-ngay-pr45255935
Tây Hồ,"Chính chủ căn hộ chung cư tầng 9 Ciputra Hà Nội view thẳng Lotte, 54m2, 2PN, 1WC hot hot",4700.0,54.0,87.03703703703704,·P. Phú Thượng,Đăng 6 ngày trước,,https://batdongsan.com.vn/ban-can-ho-chung-cu-duong-vo-chi-cong-phuong-phu-thuong-1-khu-do-thi-nam-thang-long-ciputra/chinh-chu-tang-9-ha-noi-86-trieu-m2-54m2-2pn-1wc-pr45099214
Tây Hồ,"Căn duplex 3PN 132m2 ban công Đông Nam, giá 24 tỷ, toà Noble Crystal Tây Hồ quản lý bởi WorldHotels",24000.0,132.0,181.8181818181818,·P. Phú Thượng (P. Hồng Hà mới),Đăng 1 tuần trước,,https://batdongsan.com.vn/ban-can-ho-chung-cu-duong-vo-chi-cong-phuong-phu-thuong-1-noble-crystal-tay-ho/duplex-3pn-132m2-ban-ong-nam-gia-24-ty-toa-quan-ly-boi-worldhotels-pr45156801
Tây Hồ,Quỹ căn tầng đẹp giá tốt chung cư The Reflection Westlake Tây Hồ liên hệ:0822 238 ***,,60.0,,P. Phú Thượng (P. Hồng Hà mới),Đăng hôm nay,,https://batdongsan.com.vn/ban-can-ho-chung-cu-duong-vo-chi-cong-phuong-phu-thuong-1-the-reflection-west-lake/quy-tang-ep-gia-tot-westlake-tay-lien-he-0822238686-pr45220058
Tây Hồ,"Sự kiện Cất nóc liên hệ Chủ đầu tư Celestine WestLake chiết khấu 11%, chỉ đóng 20% nhận nhà, sổ đỏ",18400.0,117.8,156.19694397283533,P. Phú Thượng (P. Hồng Hà mới),Đăng hôm nay,,https://batdongsan.com.vn/ban-can-ho-chung-cu-phuong-phu-thuong-1-celestine-westlake/chu-dau-tu-chinh-thuc-ra-hang-2-3-ngu-dep-nhat-tay-ch-khau-10-0-ls-pr43946422
Tây Hồ,"Cập nhật quỹ căn tháng 3 và chính sách bán hàng, căn hộ Celestine Westlake view Hồ Tây hiếm",,110.0,,P. Phú Thượng (P. Tây Hồ mới),Đăng hôm nay,,https://batdongsan.com.vn/ban-can-ho-chung-cu-duong-vo-chi-cong-phuong-phu-thuong-1-celestine-westlake/cap-nhat-quy-thang-3-va-chinh-sach-ban-hang-view-tay-hiem-pr45302007
Tây Hồ,"Mở bán đợt 1 căn hộ studio, 1PN, 2PN, 3PN, penthouse The Reflection 699 Lạc Long Quân của cđt Kusto",,30.0,,P. Phú Thượng (P. Hồng Hà mới),Đăng hôm nay,,https://batdongsan.com.vn/ban-can-ho-chung-cu-duong-vo-chi-cong-phuong-phu-thuong-1-the-reflection-west-lake/mo-ban-ot-1-studio-1pn-2pn-3pn-penthouse-699-lac-long-quan-cua-c-t-kusto-pr45181205
Tây Hồ,Mở bán sky villa Noble Crystal Tây Hồ 280m2 view Hồ Tây và Sông Hồng cầu Nhật Tân về đêm,58000.0,280.0,207.14285714285714,P. Phú Thượng,Đăng hôm qua,,https://batdongsan.com.vn/ban-can-ho-chung-cu-duong-nguyen-van-huyen-phuong-phu-thuong-1-noble-crystal-tay-ho/ban-sky-villa-sunshine-river-280m-view-cau-nhat-tan-ve-dem-lh0369398998-pr26938120
Tây Hồ,"Chính chủ bán căn chung cư Vườn Đào, Lạc Long Quân, Tây Hồ. 126,2m2, 3PN - Full nội thất cao cấp",13880.0,126.2,109.98415213946117,P. Phú Thượng (P. Tây Hồ mới),Đăng hôm qua,,https://batdongsan.com.vn/ban-can-ho-chung-cu-duong-lac-long-quan-phuong-phu-thuong-1-khu-do-thi-vuon-dao/chinh-chu-ban-ao-tay-126-2m2-3pn-full-noi-that-cao-cap-pr45294343
Tây Hồ,Suất ngoại giao căn Duplex 4PN Noble Crystal Tây Hồ vị trí view đẹp giá tốt nhất hiện nay,37120.0,220.5,168.34467120181407,P. Phú Thượng,Đăng hôm qua,,https://batdongsan.com.vn/ban-can-ho-chung-cu-phuong-phu-thuong-1-noble-crystal-tay-ho/suat-ngoai-giao-duplex-4pn-vi-tri-view-ep-gia-tot-nhat-hien-nay-pr45292396
Tây Hồ,Tưng bừng cất nóc công bố quỹ căn giá tốt nhất tại Celestine Westlake view Hồ Tây T3/2026,13600.0,85.0,160.0,P. Phú Thượng (P. Tây Hồ mới),Đăng hôm qua,,https://batdongsan.com.vn/ban-can-ho-chung-cu-duong-vo-chi-cong-phuong-phu-thuong-1-celestine-westlake/quy-mat-chua-tung-bo-cuoi-cung-tai-view-tay-t12-2025-pr44697931
Tây Hồ,"Bán và bàn giao căn hộ tinh hoa Tây Hồ, đơn vị quản lý Soho & Heritage 677 Lạc Long Quân thông báo",,94.0,,P. Phú Thượng (P. Hồng Hà mới),Đăng hôm qua,,https://batdongsan.com.vn/ban-can-ho-chung-cu-duong-lac-long-quan-phuong-phu-thuong-1-heritage-west-lake/ban-va-ban-giao-tinh-hoa-tay-don-vi-ly-soho-677-thong-bao-pr44398971
Tây Hồ,"Chính chủ bán CH 1PN đẳng cấp tại Noble Crystal Tây Hồ Tây, Ciputra",12500.0,76.0,164.47368421052633,P. Phú Thượng,Đăng 2 ngày trước,,https://batdongsan.com.vn/ban-can-ho-chung-cu-phuong-phu-thuong-1-noble-crystal-tay-ho/chinh-chu-ban-ch-1pn-ang-cap-tai-tay-ciputra-pr45285995
Tây Hồ,"Căn hộ Ciputra DT 153m2 04PN BC Đông Nam, đủ đồ giá rẻ 13.3 tỷ. LH em Hường0936 670 ***",13300.0,153.0,86.9281045751634,P. Phú Thượng,Đăng 2 ngày trước,Có,https://batdongsan.com.vn/ban-can-ho-chung-cu-phuong-phu-thuong-1-khu-do-thi-nam-thang-long-ciputra/dt-153m-04pn-bc-ong-u-o-gia-re-13-3-ty-lh-em-huong-0936-670-899-pr45284018
Tây Hồ,Quỹ căn giá tốt 2PN - 3PN view Hồ Tây + Starlake tại HDI Tây Hồ (Võ Chí Công). Có slot ô tô. Sẵn sổ,8000.0,73.0,109.58904109589041,P. Xuân La (P. Xuân Đỉnh mới),Đăng 2 ngày trước,,https://batdongsan.com.vn/ban-can-ho-chung-cu-phuong-xuan-la-tay-ho-residence/hdi-vo-chi-cong-ban-goc-3pn-107-2m2-tang-cao-view-tron-so-lau-dai-gia-1x-ty-pr44825778
Tây Hồ,"Cập nhật danh sách bán căn hộ Ciputra KĐT Nam Thăng Long mới nhất tháng 032026 - hàng đẹp, giá tốt",13000.0,123.0,105.6910569105691,P. Phú Thượng,Đăng 2 ngày trước,,https://batdongsan.com.vn/ban-can-ho-chung-cu-duong-lac-long-quan-phuong-phu-thuong-1-khu-do-thi-nam-thang-long-ciputra/cap-nhat-bang-gia-ban-kdt-moi-nhat-3-2024-lh-pr39356340
Gia Lâm,"Bán căn hộ MetroPolitan 1PN + từ 3.3tỷ 2PN từ 3.85tỷ, 3PN view hồ từ 5.65tỷ, LH0911 269 ***",5990.0,89.5,66.92737430167598,·X. Dương Xá (X. Gia Lâm mới),Đăng hôm nay,,https://batdongsan.com.vn/ban-can-ho-chung-cu-xa-duong-xa-vinhomes-ocean-park-gia-lam/ban-metropolitan-studio-tu-2-35ty-1pn-tu-3-16ty-2pn-tu-3-85ty-3pn-tu-5-55ty-lh-pr44678951
Gia Lâm,"Quỹ căn khu Metro, TT tiến độ vào tiền ít từ 1-2 tỷ, bàn giao T1/2027, tiện ích cao cấp sang trọng",5650.0,83.0,68.07228915662651,·X. Dương Xá (X. Gia Lâm mới),Đăng hôm nay,,https://batdongsan.com.vn/ban-can-ho-chung-cu-xa-duong-xa-vinhomes-ocean-park-gia-lam/quy-khu-metro-tt-tien-do-vao-tien-it-tu-1-2-ty-ban-giao-t12-2026-tien-ich-cao-cap-sang-trong-pr44939376
Gia Lâm,"Quỹ căn Vinhomes Ocean Park cần bán giá rẻ, cắt lỗ gấp. Cam kết giá rẻ hơn thị trường 200-300tr/căn",,43.0,,·X. Dương Xá (X. Gia Lâm mới),Đăng hôm nay,Có,https://batdongsan.com.vn/ban-can-ho-chung-cu-xa-duong-xa-vinhomes-ocean-park-gia-lam/thanh-trung-group-quy-chinh-chu-gui-ban-phap-ly-ro-rang-hop-ly-nhat-pr39722407
Gia Lâm,SĐ sẵn két - Căn góc 2N2WC toà S203. DT tim tường 70m thông thuỷ 65m. Tầng 19 VIP không nồm ẩm,4950.0,65.0,76.15384615384616,X. Đa Tốn (X. Gia Lâm mới),Đăng hôm nay,,https://batdongsan.com.vn/ban-can-ho-chung-cu-xa-da-ton-the-sapphire-2-vinhomes-ocean-park/s-san-ket-goc-2n2wc-toa-s203-dt-tim-tuong-70m-thong-thuy-65m-tang-19-vip-ko-nom-am-pr45277132
Gia Lâm,Chính chủ bán căn hộ Masteri Waterfront Vinhomes Ocean Park | 47m2 | 1pn + | giá 3.9 tỷ luxury,3900.0,47.0,82.97872340425532,X. Đa Tốn (X. Gia Lâm mới),Đăng hôm nay,,https://batdongsan.com.vn/ban-can-ho-chung-cu-duong-quoc-lo-5b-xa-da-ton-masteri-waterfront/chinh-chu-ban-vinhomes-ocean-park-55m-2pn-2wc-gia-4-95-ty-luxury-pr44948641
Gia Lâm,"Cần tiền bán gấp căn Studio full đồ DT 33,5m2 giá cực chất 2,45 tỷ tại Vinhomes Ocean Park",2450.0,33.5,73.13432835820896,X. Đa Tốn (X. Gia Lâm mới),Đăng hôm nay,Có,https://batdongsan.com.vn/ban-can-ho-chung-cu-xa-da-ton-the-sapphire-1-vinhomes-ocean-park/tien-ban-gap-studio-full-do-dt-33-5m2-gia-cuc-chat-2-53-ty-tai-park-pr44862908
Gia Lâm,"Bán CC 1PN, 43,5m2 tại Vinhomes Ocean Park Gia Lâm, giá tốt 3,2 tỷ VND",3200.0,43.5,73.5632183908046,X. Đa Tốn (X. Gia Lâm mới),Đăng hôm nay,,https://batdongsan.com.vn/ban-can-ho-chung-cu-xa-da-ton-the-sapphire-2-vinhomes-ocean-park/ban-cc-1pn-43-5m2-tai-gia-lam-gia-tot-3-2-ty-vnd-pr44536686
Gia Lâm,"Studio gần toàn văn phòng dòng tiền tốt cần bán gấp, giá rẻ nhất thị trường",2250.0,27.7,81.2274368231047,X. Đa Tốn (X. Gia Lâm mới),Đăng hôm nay,Có,https://batdongsan.com.vn/ban-can-ho-chung-cu-xa-da-ton-the-sapphire-2-vinhomes-ocean-park/studio-gan-toan-van-phong-dong-tien-tot-ban-gap-gia-re-nhat-thi-truong-pr45262694
Gia Lâm,"Bán CH siêu hot 2PN, 1WC, 55.5m2 tại Vinhomes Ocean Park Gia Lâm, 3,7 tỷ",3700.0,55.5,66.66666666666667,X. Đa Tốn (X. Gia Lâm mới),Đăng hôm nay,,https://batdongsan.com.vn/ban-can-ho-chung-cu-xa-da-ton-the-sapphire-1-vinhomes-ocean-park/ban-ch-sieu-hot-2pn-1wc-54m2-tai-gia-lam-3-68-ty-pr44527997
Gia Lâm,"Chính chủ bán căn hộ 2pn 1wc S2.05 Vinhomes Ocean Park Gia Lâm, 55m2, giá 3.65 tỷ rẻ nhất TT",3650.0,55.0,66.36363636363636,X. Đa Tốn (X. Gia Lâm mới),Đăng hôm nay,,https://batdongsan.com.vn/ban-can-ho-chung-cu-xa-da-ton-the-sapphire-2-vinhomes-ocean-park/chinh-chu-ban-toa-s1-11-studio-gia-lam-30-5m-gia-2-42-ty-re-nhat-tt-pr44956847
Gia Lâm,Chính chủ bán gấp căn hộ 2PN2WC tòa S2.05 view thoáng Vinhomes Ocean Park | 63m2 | giá 4.15 tỷ,4150.0,63.0,65.87301587301587,X. Đa Tốn (X. Gia Lâm mới),Đăng hôm nay,Có,https://batdongsan.com.vn/ban-can-ho-chung-cu-xa-da-ton-the-sapphire-2-vinhomes-ocean-park/chinh-chu-ban-gap-2pn1wc-toa-s2-09-bc-dong-nam-55m2-gia-3-72-ty-pr44948337
Gia Lâm,"Chính chủ gửi bán nhanh căn 1PN + R1.032701 49m2, view biệt thự, giá 3.9 tỷ Vinhomes Ocean Park",3900.0,49.0,79.59183673469387,TT. Trâu Quỳ (X. Gia Lâm mới),Đăng hôm nay,,https://batdongsan.com.vn/ban-can-ho-chung-cu-duong-dong-du-1-thi-tran-trau-quy-the-zenpark/chinh-chu-ban-nhanh-1pn-r1-032701-49m2-view-biet-thu-gia-3-9-ty-vinhomes-ocean-park-pr44956427
Gia Lâm,"Chuyển vào Sài Gòn nên cần bán gấp căn 3PN, nội thất đẹp 2 ban công ĐN view siêu thoáng tầng đẹp",5100.0,74.8,68.18181818181819,X. Đa Tốn (X. Gia Lâm mới),Đăng hôm nay,Có,https://batdongsan.com.vn/ban-can-ho-chung-cu-xa-da-ton-the-sapphire-1-vinhomes-ocean-park/chuyen-vao-sai-gon-nen-ban-gap-3pn-noi-that-ep-2-ban-cong-n-view-sieu-thoang-tang-ep-pr45266760
Gia Lâm,Ban quản lý dự án Vinhomes quỹ 500 căn tháng 3 chính chủ giá tốt nhất thị trường studio 1PN 2PN 3PN,2950.0,43.0,68.6046511627907,·X. Dương Xá (X. Gia Lâm mới),Đăng hôm nay,,https://batdongsan.com.vn/ban-can-ho-chung-cu-duong-an-dao-xa-duong-xa-vinhomes-ocean-park-gia-lam/ban-quan-ly-du-quy-thang-12-chinh-chu-studio-1pn-2pn-3pn-mien-phi-trung-gian-pr44783891
Gia Lâm,"Quỹ căn độc quyền giá tốt view đẹp, sẵn sổ, hỗ trợ vay 70% xem nhà 24/7, miễn phí môi giới",2950.0,43.0,68.6046511627907,·X. Dương Xá (X. Gia Lâm mới),Đăng hôm nay,,https://batdongsan.com.vn/ban-can-ho-chung-cu-xa-duong-xa-vinhomes-ocean-park-gia-lam/quy-view-dep-chinh-chu-ban-cat-lo-tu-300tr-so-do-chinh-chu-mien-phi-mg-tro-vay-toi-70-pr39114589
Gia Lâm,QUỸ CĂN CẬP NHẬT MỚI NHẤT 2026 - PHÂN KHU SAPPHIRE VINHOMES OCEAN PARK,2200.0,27.0,81.48148148148148,·X. Dương Xá (X. Gia Lâm mới),Đăng hôm nay,,https://batdongsan.com.vn/ban-can-ho-chung-cu-xa-duong-xa-vinhomes-ocean-park-gia-lam/quy-cap-nhat-moi-nhat-2026-phan-khu-sapphire-park-pr45300074
Gia Lâm,Quỹ căn giá tốt nhất thị trường phân khu Masteri Water Front. Cập nhật mới nhất năm 2026,3550.0,43.0,82.55813953488372,·X. Đa Tốn (X. Gia Lâm mới),Đăng hôm nay,,https://batdongsan.com.vn/ban-can-ho-chung-cu-duong-quoc-lo-5b-xa-da-ton-masteri-waterfront/quy-gia-tot-nhat-thi-truong-phan-khu-water-front-cap-nhat-moi-nhat-nam-2026-pr45300069
Gia Lâm,"Tổng hợp quỹ căn The Zenpark, giá tốt nhất năm 2026",2500.0,27.0,92.5925925925926,·TT. Trâu Quỳ (X. Gia Lâm mới),Đăng hôm nay,,https://batdongsan.com.vn/ban-can-ho-chung-cu-duong-dong-du-1-thi-tran-trau-quy-the-zenpark/tong-hop-gia-tot-nhat-nam-2026-pr45233090
Gia Lâm,Chính chủ bán gấp căn studio tại tòa PR6 Vinhome Ocenpark1 full nội thất cao cấp- Q1/2027 nhận nhà,2220.0,27.5,80.72727272727273,·X. Đa Tốn (X. Gia Lâm mới),Đăng hôm qua,Có,https://batdongsan.com.vn/ban-can-ho-chung-cu-xa-da-ton-the-paris-vinhomes-ocean-park/chinh-chu-ban-gap-studio-tai-toa-pr6-vinhome-ocenpark1-full-noi-that-cao-cap-q1-2027-nhan-nha-pr45293467
Gia Lâm,"Quỹ căn 2 phòng ngủ giá tốt nhất Masteri Homes, sẵn khách thuê dòng tiền 14r/ tháng",4800.0,55.0,87.27272727272727,·X. Dương Xá (X. Gia Lâm mới),Đăng hôm qua,,https://batdongsan.com.vn/ban-can-ho-chung-cu-xa-duong-xa-vinhomes-ocean-park-gia-lam/quy-2-phong-ngu-tot-nhat-masteri-homes-san-khach-thue-dong-tien-14r-thang-pr45233099
Gia Lâm,Quỹ 500 căn hộ độc quyền chính chủ gửi bán giá tốt nhất tại Vinhomes Ocean Park! Miễn phí môi giới,3450.0,55.0,62.72727272727273,·X. Dương Xá (X. Gia Lâm mới),Đăng 2 ngày trước,,https://batdongsan.com.vn/ban-can-ho-chung-cu-xa-duong-xa-vinhomes-ocean-park-gia-lam/quy-500-oc-quyen-chinh-chu-gui-ban-tot-nhat-tai-mien-phi-moi-gioi-pr45210944
Gia Lâm,"Quỹ căn hộ bán cắt lỗ tại Vinhome Ocean Park, sẵn sổ sang tên, hỗ trợ vay 80%, full nội thất",3950.0,63.0,62.698412698412696,·X. Dương Xá (X. Gia Lâm mới),Đăng 2 ngày trước,Có,https://batdongsan.com.vn/ban-can-ho-chung-cu-xa-duong-xa-vinhomes-ocean-park-gia-lam/quy-ban-cat-lo-tai-vinhome-oceanpark-san-so-sang-ten-tro-vay-80-full-noi-that-pr45281792
