Khu vực,Tiêu đề,Giá (triệu),Diện tích (m²),Giá/m² (triệu),Vị trí,Ngày đăng,Cắt lỗ?,Link
Gia Lâm,"Căn hộ CC siêu hot tại Đa Tốn, 3,4 tỷ, 43,2 m2, 1PN, 1WC",3400.0,43.2,78.7037037037037,·X. Đa Tốn (X. Gia Lâm mới),Đăng 2 ngày trước,,https://batdongsan.com.vn/ban-can-ho-chung-cu-xa-da-ton/cc-sieu-hot-tai-a-3-4-ty-43-2-m2-1pn-1wc-pr45280762
Gia Lâm,"Quỹ căn phân khu Zurich, Beverly, Paris, London cập nhật giá tốt mới nhất năm 2026",3050.0,43.0,70.93023255813954,·X. Dương Xá (X. Gia Lâm mới),Đăng 5 ngày trước,,https://batdongsan.com.vn/ban-can-ho-chung-cu-xa-duong-xa-vinhomes-ocean-park-gia-lam/quy-phan-khu-zurich-beverly-paris-london-cap-nhat-tot-nhat-thang-10-2025-pr44277919
Gia Lâm,"Em Hằng gửi đến quý khách mua nhà tại Vinhomes Ocean Park 1 quỹ căn giá rẻ, tầng đẹp, view sẵn sổ",3650.0,55.0,66.36363636363636,·X. Dương Xá (X. Gia Lâm mới),Đăng 1 tuần trước,Có,https://batdongsan.com.vn/ban-can-ho-chung-cu-xa-duong-xa-vinhomes-ocean-park-gia-lam/em-hang-gui-den-quy-khach-mua-nha-tai-1-quy-re-tang-dep-view-san-so-pr43916626
Gia Lâm,"Siêu rẻ! Bán căn 2PN2WC toà M2 Masteri Waterfront giá chỉ 4.2 tỷ full đồ, tầng hợp lý, view thoáng",4200.0,56.0,75.0,X. Đa Tốn (X. Gia Lâm mới),Đăng hôm nay,,https://batdongsan.com.vn/ban-can-ho-chung-cu-duong-quoc-lo-5b-xa-da-ton-masteri-waterfront/sieu-re-ban-2pn2wc-toa-m2-gia-chi-4-2-ty-full-o-tang-hop-ly-view-thoang-pr45301434
Gia Lâm,SĐ sẵn két - Căn góc 2N2WC toà S203. DT tim tường 70m thông thuỷ 65m. Tầng 19 VIP không nồm ẩm,4950.0,65.0,76.15384615384616,X. Đa Tốn (X. Gia Lâm mới),Đăng hôm nay,,https://batdongsan.com.vn/ban-can-ho-chung-cu-xa-da-ton-the-sapphire-2-vinhomes-ocean-park/s-san-ket-goc-2n2wc-toa-s203-dt-tim-tuong-70m-thong-thuy-65m-tang-19-vip-ko-nom-am-pr45277132
Gia Lâm,"Căn hộ 1N+ 52m²  Ban công Tây Nam thoáng đẹp  Full nội thất cao cấp , độc quyền TPLand Việt Nam",,52.0,,X. Dương Xá (X. Gia Lâm mới),Đăng 4 ngày trước,,https://batdongsan.com.vn/ban-can-ho-chung-cu-xa-duong-xa-vinhomes-ocean-park-gia-lam/1n-52m-ban-cong-tay-nam-thoang-ep-full-noi-that-cao-cap-oc-quyen-tpland-viet-nam-pr45267623
Gia Lâm,"Siêu phẩm đập thông Masteri luxury duy nhất trên thị trường, độc quyền TPLand Việt Nam",15800.0,138.0,114.4927536231884,X. Đa Tốn (X. Gia Lâm mới),Đăng 4 ngày trước,,https://batdongsan.com.vn/ban-can-ho-chung-cu-duong-quoc-lo-5b-xa-da-ton-masteri-waterfront/sieu-pham-ap-thong-luxury-duy-nhat-tren-thi-truong-oc-quyen-tpland-viet-nam-pr45267546
Gia Lâm,Chính chủ Bán căn 2PN 2VS giá rẻ nhất Zurich full nội thất cao cấp chỉ 4.39tỷ,4390.0,56.5,77.69911504424779,X. Đa Tốn (X. Gia Lâm mới),Đăng 4 ngày trước,Có,https://batdongsan.com.vn/ban-can-ho-chung-cu-xa-da-ton-the-zurich-vinhomes-ocean-park/chinh-chu-ban-2pn2vs-gia-re-nhat-full-noi-that-cao-cap-4-390ty-pr45265337
Long Biên,"Bán căn ngoại giao Platinum Long Biên, căn hộ cao cấp bậc nhất thủ đô Long Biên",11780.0,76.0,155.0,·P. Long Biên,Đăng 3 ngày trước,,https://batdongsan.com.vn/ban-can-ho-chung-cu-duong-co-linh-phuong-long-bien-platinum-long-bien/ban-ngoai-giao-cao-cap-bac-nhat-thu-do-bien-pr44983775
Long Biên,"Bán xuất ngoại giao, căn hộ sắp bàn giao Ruby Riverside Long Biên, hàng hiếm",7150.0,65.0,110.0,P. Phúc Đồng (P. Phúc Lợi mới),Đăng hôm nay,,https://batdongsan.com.vn/ban-can-ho-chung-cu-pho-mai-phuc-phuong-phuc-dong-ruby-riverside/sap-ban-giao-long-bien-suat-ngoai-giao-uu-dai-trong-thang-1-pr44985025
Long Biên,"Sky Villa Noble Crystal Trực tiếp CĐT, CK 6%, tặng quà 1.2 tỷ, giá từ 150tr/m²,siêu phẩm giới hạn",,185.0,,P. Việt Hưng (P. Phúc Lợi mới),Đăng 3 ngày trước,,https://batdongsan.com.vn/ban-can-ho-chung-cu-phuong-viet-hung-2-noble-crystal-long-bien/sky-villa-truc-tiep-c-t-ck-6-tang-qua-1-2-ty-gia-tu-150tr-m-sieu-pham-gioi-han-pr45272193
Long Biên,"Bán căn hộ 3PN, 2WC, 84,7m2 tại Lý Sơn, Bồ Đề, ngay Ngọc Thụy, Nguyễn Văn Cừ, Long Biên, 4,99 tỷ",4990.0,84.7,58.913813459268006,P. Bồ Đề,Đăng hôm nay,,https://batdongsan.com.vn/ban-can-ho-chung-cu-duong-ly-son-phuong-bo-de-9/ban-3pn-2wc-84-7m2-tai-ngay-ngoc-thuy-ng-van-long-bien-4-99-ty-pr44738544
Long Biên,"Chung cư Việt Hưng, Long Biên - 98m2",6370.0,96.5,66.01036269430051,P. Đức Giang (P. Việt Hưng mới),Đăng hôm nay,,https://batdongsan.com.vn/ban-can-ho-chung-cu-phuong-duc-giang-2-khu-do-thi-viet-hung/long-bien-98m2-6-18-ti-pr45292047
Long Biên,"Bán chung cư Việt Hưng CT9. DT 84.6m2, 3 ngủ, 2VS. Lô góc tầng cao. Gần mặt phố Ngô Gia Tự",5490.0,84.6,64.8936170212766,P. Đức Giang (P. Việt Hưng mới),Đăng 1 tuần trước,,https://batdongsan.com.vn/ban-can-ho-chung-cu-duong-nguyen-cao-luyen-phuong-duc-giang-2-khu-do-thi-viet-hung/ban-ct9-dt-84m2-3-ngu-2vs-lo-goc-tang-gan-mat-pho-ngo-gia-tu-pr44923988
Long Biên,"Bán chung cư CT15 Green Park Việt Hưng. DT 100m2, 3 ngủ, 2VS, tầng đẹp, ban công Đông Nam",8500.0,100.0,85.0,P. Giang Biên (P. Việt Hưng mới),Đăng 1 tuần trước,,https://batdongsan.com.vn/ban-can-ho-chung-cu-duong-bui-thien-ngo-phuong-giang-bien-1-green-park-ct15-viet-hung/ban-dt-100m2-3-ngu-2vs-tang-dep-ban-cong-dong-nam-pr44523927
Long Biên,"Bán căn N01 72m2 full nội thất đẹp, thiết kế hiện đại, giá 7.99 tỷ bao phí, vào ở ngay cực hiếm!!!!",7990.0,72.0,110.97222222222223,P. Bồ Đề (P. Hồng Hà mới),Đăng 3 ngày trước,,https://batdongsan.com.vn/ban-can-ho-chung-cu-duong-nguyen-van-cu-1-phuong-bo-de-berriver-jardin-long-bien/ban-n01-72m2-full-noi-that-ep-thiet-ke-hien-ai-gia-7-99-ty-bao-phi-vao-o-ngay-cuc-hiem-pr45272053
Long Biên,"Mở bán đợt 1 - căn hộ cao cấp Platinum Long Biên sống đỉnh cao, kết nối vàng",7500.0,48.0,156.25,P. Long Biên,Đăng 4 ngày trước,,https://batdongsan.com.vn/ban-can-ho-chung-cu-duong-co-linh-phuong-long-bien-platinum-long-bien/mo-ban-dot-1-cao-cap-song-dinh-cao-ket-noi-vang-pr44985223
Long Biên,"Garden City, Long Biên - CC cao cấp Canal Park 3PN Căn góc 128m2, View bể bơi Đông Nam mát mẻ,Đủ NT",8600.0,128.0,67.1875,P. Thạch Bàn (P. Long Biên mới),Đăng 1 tuần trước,,https://batdongsan.com.vn/ban-can-ho-chung-cu-phuong-thach-ban-1-ha-noi-garden-city/tang-that-400tr-cao-cap-gaden-lo-goc-huong-mat-chu-nha-vao-da-nang-pr43155222
Long Biên,Mua bán chung cư Sunshine Green Iconic giá rẻ nhất thị trường từ studio|1PN|2PN|3PN|duplex|skyvilla,8000.0,85.0,94.11764705882354,P. Phúc Đồng (P. Phúc Lợi mới),Đăng hôm nay,Có,https://batdongsan.com.vn/ban-can-ho-chung-cu-phuong-phuc-dong-sunshine-green-iconic/anh-that-ban-3pn-116m2-nha-nguyen-ban-gia-11ty5-re-nhat-thi-truong-pr45014284
Long Biên,"BÁN CĂN HỘ TẦNG TRUNG CT10 KĐT VIỆT HƯNG, DT156M2, 4PN, 3VS, BÀN GIAO FULL NT, SĐCC, GIÁ 9,45 TỶ .",9450.0,156.0,60.57692307692308,P. Đức Giang (P. Việt Hưng mới),Đăng hôm nay,,https://batdongsan.com.vn/ban-can-ho-chung-cu-duong-ngo-gia-tu-phuong-duc-giang-2-khu-do-thi-viet-hung/ban-tang-trung-ct10-k-t-dt156m2-4pn-3vs-ban-giao-full-nt-s-cc-9-45-ty-pr45301466
Long Biên,Quỹ căn chuyển nhượng 1PN | 2PN | 3PN | Duplex - Skyvila Sunshine Green Iconic - E Long0869 971 ***,11600.0,108.0,107.4074074074074,P. Phúc Đồng (P. Phúc Lợi mới),Đăng hôm nay,,https://batdongsan.com.vn/ban-can-ho-chung-cu-phuong-phuc-dong-sunshine-green-iconic/quy-chuyen-nhuong-cat-lo-gia-re-nhat-thi-truong-tai-em-long-pr42164654
Long Biên,Quỹ căn hộ bán 1PN | 2PN | 3PN | Duplex - Sky Sunshine Green Iconic - Phúc Đồng Long Biên,12000.0,108.0,111.11111111111111,P. Phúc Đồng (P. Phúc Lợi mới),Đăng hôm nay,,https://batdongsan.com.vn/ban-can-ho-chung-cu-phuong-phuc-dong-sunshine-green-iconic/quy-ban-1pn-2pn-3pn-duplex-sky-long-bien-pr44998175
Long Biên,"Bán nhanh CH 77m2 Le Grand Jardin Sài Đồng giá 6,5 tỷ ban công ĐN, sẵn sổ, có hỗ trợ vay ngân hàng",6500.0,77.0,84.41558441558442,P. Phúc Đồng (P. Phúc Lợi mới),Đăng hôm nay,,https://batdongsan.com.vn/ban-can-ho-chung-cu-duong-huynh-van-nghe-phuong-phuc-dong-le-grand-jardin-sai-dong/ban-nhanh-ch-76m-gia-5-1-ty-ban-cong-dn-san-so-co-tro-vay-ngan-hang-pr43663344
Long Biên,HẠ CHÀO 300TR CHỈ CÒN HƠN 4 TỶ CĂN HỘ VIỆT HƯNG THANG MÁY 76M 2 PHÒNG NGỦ FULL NỘI THẤT CAO CẤP,4690.0,76.0,61.71052631578947,P. Đức Giang (P. Việt Hưng mới),Đăng hôm nay,,https://batdongsan.com.vn/ban-can-ho-chung-cu-phuong-duc-giang-2-khu-do-thi-viet-hung/ban-chcc-76m-2pn-2wc-goc-tang-cao-view-dep-gia-thoa-thuan-pr44840192
Long Biên,"RẺ NHẤT BẢNG HÀNG! Căn 77.5m2 (2PN, 2VS), tầng cao, đã có sổ đỏ. Giá 6.8x tỷ bao thuế phí",6900.0,77.5,89.03225806451613,P. Ngọc Thụy (P. Hồng Hà mới),Đăng hôm qua,,https://batdongsan.com.vn/ban-can-ho-chung-cu-phuong-ngoc-thuy-khai-son-city/hot-1-duy-nhat-77-5m-2pn-2vs-bc-dong-nam-view-thoang-vinh-vien-pr43906116
Long Biên,"Chính chủ cần bán căn 2PN - 89m2 tại Khai Sơn: Tầng cực đẹp, view sông, nội thất CĐT, giá 7 tỷ bp",7000.0,89.0,78.65168539325843,P. Ngọc Thụy (P. Bồ Đề mới),Đăng hôm qua,,https://batdongsan.com.vn/ban-can-ho-chung-cu-phuong-ngoc-thuy-khai-son-city/chinh-chu-ban-2pn-89m2-tai-tang-cuc-ep-view-song-noi-that-c-t-gia-6-9x-ty-bp-pr45254067
Long Biên,Quỹ căn 2PN - 3PN - 4PN giá tốt nhất Khai Sơn City - nhận nhà ở ngay - LH0902 161 ***,8800.0,120.0,73.33333333333333,P. Ngọc Thụy (P. Bồ Đề mới),Đăng hôm qua,,https://batdongsan.com.vn/ban-can-ho-chung-cu-phuong-ngoc-thuy-khai-son-city/quy-2pn-3pn-4pn-gia-tot-nhat-nhan-nha-o-ngay-lh-0902161056-pr45167862
Long Biên,"Trực tiếp CĐT: Căn 3PN Khai Sơn City, chiết khấu 9.5%, lãi 0% 15 tháng, QT 80tr",8200.0,96.8,84.7107438016529,P. Ngọc Thụy (P. Bồ Đề mới),Đăng hôm qua,,https://batdongsan.com.vn/ban-can-ho-chung-cu-phuong-ngoc-thuy-khai-son-city/ban-cc-valencia-do-thi-viet-hung-66m-2n2vs-gia-chi-3-040-ty-bc-dn-view-bt-vinhomes-pr42212630
Long Biên,"Quỹ căn góc đẹp nhất Khai Sơn, view hồ, tầng đẹp: 96m2, 3PN 2WC, ban công Đông Nam. Giá 8.x tỷ bp",8300.0,96.0,86.45833333333333,P. Ngọc Thụy (P. Bồ Đề mới),Đăng hôm qua,,https://batdongsan.com.vn/ban-can-ho-chung-cu-phuong-ngoc-thuy-khai-son-city/quy-goc-ep-nhat-view-tang-ep-96m2-3pn-2wc-ban-cong-ong-nam-gia-8-x-ty-bp-pr45232980
Long Biên,Bán căn CC HimLam Thạch Bàn đẹp nhất khu,4950.0,60.0,82.5,P. Thạch Bàn (P. Long Biên mới),Đăng hôm qua,,https://batdongsan.com.vn/ban-can-ho-chung-cu-duong-co-linh-phuong-thach-ban-1-him-lam-thach-ban-2/cc-himlam-ep-nhat-khu-pr45291887
Long Biên,Bán căn góc 97m2 ban công đông nam đẹp nhất khai sơn,8450.0,97.0,87.11340206185567,P. Ngọc Thụy (P. Bồ Đề mới),Đăng hôm qua,,https://batdongsan.com.vn/ban-can-ho-chung-cu-phuong-ngoc-thuy-khai-son-city/ban-goc-97m2-ban-cong-dong-nam-dep-nhat-son-pr44348611
Long Biên,Chính chủ bán căn 3N siêu đẹp view sông CC AQH,4800.0,65.0,73.84615384615384,P. Thượng Thanh (P. Việt Hưng mới),Đăng hôm qua,,https://batdongsan.com.vn/ban-can-ho-chung-cu-phuong-thuong-thanh-1-aqh-riverside/chinh-chu-ban-3n-sieu-ep-view-song-cc-aqh-pr45202807
Hoài Đức,"BOOKING NHẬN ƯU ĐÃI LỚN IMPERIA SKY PARK CẠNH VINHOMES SMART CITY, ĐỦ QUỸ CĂN STUDIO - SKY VILLAS",,52.5,,·X. An Khánh,Đăng hôm nay,,https://batdongsan.com.vn/ban-can-ho-chung-cu-duong-dai-lo-thang-long-xa-an-khanh-4-imperia-sky-park/booking-nhan-uu-ai-lon-canh-vinhomes-smart-city-u-quy-studio-villas-pr45156054
Hoài Đức,"IMPERIA SKY PARK MỞ BÁN TỪ MÓNG CĂN 2PN TỪ 55-68M2 VỐN TỰ CÓ CHỈ TỪ 1,5 TỶ MIỄN LÃI 24T- CK TỚI 15%",5100.0,55.0,92.72727272727273,·X. An Khánh,Đăng hôm nay,,https://batdongsan.com.vn/ban-can-ho-chung-cu-duong-dai-lo-thang-long-xa-an-khanh-4-imperia-sky-park/mo-ban-tu-mong-2pn-tu-55-68m2-von-tu-co-chi-tu-1-5-ty-mien-lai-24t-ck-toi-15-pr45299923
Hoài Đức,Quỹ 200 căn 2PN - 3PN kí trực tiếp Chủ đầu tư - Giá giai đoạn 1,,75.0,,·X. Di Trạch (X. Hoài Đức mới),Đăng hôm nay,,https://batdongsan.com.vn/ban-can-ho-chung-cu-duong-vanh-dai-3-5-xa-di-trach-the-flame-vine/quy-200-2pn-3pn-ki-truc-tiep-chu-au-tu-gia-giai-oan-1-pr45212757
Hoài Đức,Bán gấp căn 2 ngủ 83m2 - đã có sổ đỏ - view đẹp và thoáng - xem nhà 24/24,6300.0,83.0,75.90361445783132,X. Di Trạch (X. Hoài Đức mới),Đăng hôm nay,Có,https://batdongsan.com.vn/ban-can-ho-chung-cu-duong-32-xa-di-trach-chung-cu-the-wisteria/ban-gap-2-ngu-83m2-a-co-so-o-view-ep-va-thoang-xem-nha-24-24-pr45271737
Hoài Đức,Bán căn hộ 139m2 chung cư Wisteria - ban công Đông Nam - có hỗ trợ bank 70%,9100.0,139.0,65.46762589928058,X. Di Trạch (X. Hoài Đức mới),Đăng hôm qua,,https://batdongsan.com.vn/ban-can-ho-chung-cu-duong-32-xa-di-trach-chung-cu-the-wisteria/ban-138m2-ban-cong-ong-nam-co-tro-bank-70-pr45271497
Hoài Đức,"Bán nhanh căn hộ 2PN2VS toà Gemek 2 An Khánh view Vinsmart 66m2 chỉ 4,4 tỷ",4400.0,66.0,66.66666666666667,X. An Khánh,Đăng 2 ngày trước,,https://batdongsan.com.vn/ban-can-ho-chung-cu-duong-le-trong-tan-xa-an-khanh-4-gemek-premium/chinh-chu-ban-2pn2vs-toa-2-view-vinsmart-66m-chi-4-4-ty-pr45251955
Hoài Đức,Căn góc 3 ngủ - diện tích 114m2 - view đẹp hướng mát - có sổ đỏ,7600.0,114.0,66.66666666666667,X. Di Trạch (X. Hoài Đức mới),Đăng 6 ngày trước,,https://batdongsan.com.vn/ban-can-ho-chung-cu-duong-32-xa-di-trach-chung-cu-the-wisteria/goc-3-ngu-dien-tich-114m2-view-ep-huong-mat-co-so-o-pr45189866
Hoài Đức,Quỹ căn studio- 1PN-2PN-3PN tòa Sky1 và Sky2 không chênh kí trực tiếp chủ đầu tư MIK Group,4080.0,43.0,94.88372093023256,·X. An Khánh,Đăng hôm nay,,https://batdongsan.com.vn/ban-can-ho-chung-cu-duong-dai-lo-thang-long-xa-an-khanh-4-imperia-sky-park/quy-studio-1pn-2pn-3pn-toa-sky1-va-sky2-khong-chenh-ki-truc-tiep-chu-au-tu-mik-group-pr45179876
Hoài Đức,"Độc quyền bán Căn hộ cao cấp 2PN, 60m2 tầng trung, BC Đông Nam view công viên nội khu Imperia MIK",,60.0,,·X. An Khánh,Đăng hôm qua,,https://batdongsan.com.vn/ban-can-ho-chung-cu-duong-dai-lo-thang-long-xa-an-khanh-4-imperia-sky-park/ban-cc-2pn-60m2-tang-trung-gia-uu-ai-ha-noi-pr45277657
Hoài Đức,IMPERIA SKY PARK NAM AN KHÁNH  NHẬN BOOKING SỚM | CĂN HỘ CAO CẤP SỞ HỮU LÂU DÀI,5020.0,54.0,92.96296296296296,·X. An Khánh,Đăng hôm qua,,https://batdongsan.com.vn/ban-can-ho-chung-cu-duong-dai-lo-thang-long-xa-an-khanh-4-imperia-sky-park/nam-nhan-booking-som-cao-cap-so-huu-lau-dai-pr45290879
Hoài Đức,"MỞ BÁN CHUNG CƯ IMPERIA SKY PARK 1-2-3PN GẦN VINHOMES SMART CITY TÂY MỖ, CÁCH SVĐ MỸ ĐÌNH CHỈ 8PH",,42.0,,·X. An Khánh,Đăng hôm qua,,https://batdongsan.com.vn/ban-can-ho-chung-cu-duong-dai-lo-thang-long-xa-an-khanh-4-imperia-sky-park/mo-ban-1-2-3pn-ngay-canh-vinhomes-smart-city-tay-mo-cach-sv-my-inh-chi-7-phut-pr45253829
Hoài Đức,Chỉ từ 419tr sở hữu căn hộ MIK An Khánh cạnh Vinhomes Smart City. Liên hệ0888 999 ***,,28.0,,·X. An Khánh,Đăng 2 ngày trước,,https://batdongsan.com.vn/ban-can-ho-chung-cu-duong-dai-lo-thang-long-xa-an-khanh-4-imperia-sky-park/chi-tu-419tr-so-huu-mik-canh-vinhomes-smart-city-lien-he-0888999819-pr45254080
Hoài Đức,Anh chị quan tâm dự án MIK An Khánh tuyệt đối đừng bỏ qua bài phân tích này,,68.0,,·X. An Khánh,Đăng 2 ngày trước,,https://batdongsan.com.vn/ban-can-ho-chung-cu-duong-dai-lo-thang-long-xa-an-khanh-4-imperia-sky-park/anh-chi-quan-tam-du-mik-tuyet-oi-ung-bo-qua-bai-phan-tich-nay-pr45271137
Hoài Đức,Chỉ từ hơn 400 triệu sở hữu căn hộ Imperia Sky Park - MIK An Khánh. Kí trực tiếp với CĐT MIK Group,,43.0,,·X. An Khánh,Đăng 2 ngày trước,,https://batdongsan.com.vn/ban-can-ho-chung-cu-duong-dai-lo-thang-long-xa-an-khanh-4-imperia-sky-park/chi-tu-hon-400trieu-so-huu-mik-ki-truc-tiep-voi-c-t-mik-group-pr45255208
Hoài Đức,Booking quỹ ngoại giao căn hộ cao cấp The Flame Vine HH03 Hinode Royal Park,,75.0,,·X. Di Trạch (X. Hoài Đức mới),Đăng 1 tuần trước,,https://batdongsan.com.vn/ban-can-ho-chung-cu-duong-vanh-dai-3-5-xa-di-trach-the-flame-vine/quy-ngoai-giao-cao-cap-hh03-hinode-royal-park-pr45239972
Hoài Đức,"Quỹ căn STUDIO, 1PN, 2PN+ độc quyền tại toà Imperia Sky Park Early Bird 15% tặng FULL đồ liền tường",,69.0,,·X. An Khánh,Đăng 1 tuần trước,,https://batdongsan.com.vn/ban-can-ho-chung-cu-duong-dai-lo-thang-long-xa-an-khanh-4-imperia-sky-park/quy-studio-1pn-2pn-oc-quyen-tai-toa-early-bird-15-tang-full-o-lien-tuong-pr45227678
Hoài Đức,RA MẮT CHUNG CƯ IMPERIA SKY PARK NAM AN KHÁNH,,28.0,,·X. An Khánh,Đăng 1 tuần trước,,https://batdongsan.com.vn/ban-can-ho-chung-cu-duong-dai-lo-thang-long-xa-an-khanh-4-imperia-sky-park/ra-mat-nam-khanh-pr45232497
Hoài Đức,Chỉ 95 triệu/m² cơ hội cuối cùng để mua Imperia Sky Park dòng căn Studio- 3PN- Sky Villa Metro số 5,14630.0,154.0,95.0,X. An Khánh,Đăng hôm nay,,https://batdongsan.com.vn/ban-can-ho-chung-cu-duong-dai-lo-thang-long-xa-an-khanh-4-imperia-sky-park/chi-90tr-m2-co-hoi-cuoi-cung-e-mua-dong-studio-3pn-villa-metro-so-5-pr45296635
Hoài Đức,Danh sách các căn hộ đang có nhu cầu chuyển nhượng giá tốt tại The Wisteria loại 2 & 3 phòng ngủ,6500.0,83.0,78.3132530120482,X. Di Trạch (X. Hoài Đức mới),Đăng hôm nay,,https://batdongsan.com.vn/ban-can-ho-chung-cu-duong-32-xa-di-trach-chung-cu-the-wisteria/danh-sach-cac-dang-co-nhu-cau-chuyen-nhuong-gia-tot-tai-loai-2-3-phong-ngu-pr45059737
Hoài Đức,Quỹ căn chuyển nhượng Wisteria: Xuân sang đón lộc - về nhà an cư,6200.0,83.0,74.6987951807229,X. Di Trạch (X. Hoài Đức mới),Đăng hôm nay,,https://batdongsan.com.vn/ban-can-ho-chung-cu-duong-32-xa-di-trach-chung-cu-the-wisteria/quy-chuyen-nhuong-xuan-sang-don-loc-ve-nha-an-cu-pr45050315
Hoài Đức,"Booking đợt đầu căn hộ chung cư The Flame Vine, giá dự kiến 70 triệu/m2, 70 m2, 2PN, 2WC",,70.0,,X. Di Trạch (X. Hoài Đức mới),Đăng hôm qua,,https://batdongsan.com.vn/ban-can-ho-chung-cu-duong-vanh-dai-3-5-xa-di-trach-the-flame-vine/ban-ot-au-70-trieu-m2-70-m2-2pn-2wc-pr45287926
Hoài Đức,Đại lý Seven Realty đã và đang nhận được rất nhiều lượt booking của dự án Imperia Sky Park,6180.0,65.0,95.07692307692308,X. An Khánh,Đăng 2 ngày trước,,https://batdongsan.com.vn/ban-can-ho-chung-cu-duong-dai-lo-thang-long-xa-an-khanh-4-imperia-sky-park/ai-ly-seven-realty-a-va-ang-nhan-uoc-rat-nhieu-luot-booking-cua-du-park-pr45188539
Hoài Đức,CĂN HỘ CHUNG CƯ TẠI HOÀI ĐỨC TÀI CHÍNH CHỈ TỪ 2 TỶ TẠI DỰ ÁN THE FLAME VINE HINODE ROYAL PARK,,73.0,,X. Di Trạch (X. Hoài Đức mới),Đăng 2 ngày trước,,https://batdongsan.com.vn/ban-can-ho-chung-cu-duong-quoc-lo-32-xa-di-trach-hinode-royal-park/tai-hoai-uc-tai-chinh-chi-tu-2-ty-tai-du-an-the-flame-vine-park-pr45240675
Hoài Đức,BOOKING SỚM - ĐÚNG ĐẠI LÝ - CHỌN CĂN ĐẸP - IMPERIA SKY PARK,,55.0,,X. An Khánh,Đăng 3 ngày trước,,https://batdongsan.com.vn/ban-can-ho-chung-cu-duong-dai-lo-thang-long-xa-an-khanh-4-imperia-sky-park/booking-som-ung-ai-ly-chon-ep-park-pr45274547
Đống Đa,Quỹ căn chuyển nhượng từ 1-2-3-4 phòng | sẵn sổ đỏ cập nhật liên tục tại Green Diamond 93 Láng Hạ,,86.0,,P. Láng Hạ (P. Giảng Võ mới),Đăng hôm nay,,https://batdongsan.com.vn/ban-can-ho-chung-cu-pho-lang-ha-phuong-lang-ha-green-diamond-93-lang-ha/quy-chuyen-nhuong-tu-1-2-3-4-phong-san-so-do-cap-nhat-lien-tuc-tai-93-ha-pr42650757
Đống Đa,Chính chủ bán căn 3PN đồ đẹp Vinhomes Nguyễn Chí Thanh giá rẻ nhất thị trường. Liên hệ0372 004 ***,18000.0,120.0,150.0,P. Láng Thượng (P. Láng mới),Đăng hôm qua,Có,https://batdongsan.com.vn/ban-can-ho-chung-cu-duong-nguyen-chi-thanh-phuong-lang-thuong-vinhomes-nguyen-chi-thanh/chinh-chu-ban-2pn-do-dep-gia-re-nhat-thi-truong-lien-he-pr44292544
Đống Đa,"Quỹ cuối căn hộ 65-135m2 từ 2-4PN CC The Nestar 83 Hào Nam. Quỹ CĐT, sổ đỏ, full nội thất, slot xe",14000.0,90.0,155.55555555555554,P. Ô Chợ Dừa (P. Ô Chợ Dừa mới),Đăng 2 ngày trước,,https://batdongsan.com.vn/ban-can-ho-chung-cu-pho-hao-nam-phuong-o-cho-dua-the-terra-hao-nam/quy-cuoi-65-135m2-tu-2-4pn-cc-nestar-83-quy-c-t-so-full-noi-that-slot-xe-pr45279945
Đống Đa,Cần bán gấp căn hộ 3phòng ngủ tòa Mipec Tower 299 Tây Sơn Đống Đa 104.8m2 giá 10.5tỷ. LH0988 669 ***,10500.0,104.8,100.19083969465649,P. Trung Liệt (P. Ô Chợ Dừa mới),Đăng hôm nay,Có,https://batdongsan.com.vn/ban-can-ho-chung-cu-duong-tay-son-phuong-trung-liet-mipec-towers/ban-gap-3-phong-ngu-toa-tower-299-dong-da-105m2-gia-10-ty-lh-pr44956456
Đống Đa,Tập thể mặt phố Láng Hạ - Tầng 2 + 3 /sổ 65/90m2,5780.0,90.0,64.22222222222223,P. Láng Hạ (P. Đống Đa mới),Đăng hôm nay,,https://batdongsan.com.vn/ban-can-ho-chung-cu-pho-lang-ha-phuong-lang-ha-3/tap-the-mat-tang-2-3-so-65-90m2-pr44997099
Đống Đa,Tập thể tầng 1 Nam Thành Công Hoàng Ngọc Phách sổ 43m2 SD ~90m2 | 3PN khách + Bếp | 2WC,6660.0,90.0,74.0,P. Láng Hạ (P. Đống Đa mới),Đăng hôm nay,,https://batdongsan.com.vn/ban-can-ho-chung-cu-pho-hoang-ngoc-phach-phuong-lang-ha-3/tap-the-tang-1-nam-thanh-cong-so-43m-sd-90m-3pn-khach-bep-2wc-pr44998211
Đống Đa,"Bán căn hộ toà M5 Nguyễn Chí Thanh. Căn góc 149m2 3PN 2WC. Nhà ở luôn giá 12,2 tỷ",12200.0,149.0,81.87919463087249,P. Láng Hạ (P. Giảng Võ mới),Đăng hôm nay,,https://batdongsan.com.vn/ban-can-ho-chung-cu-duong-nguyen-chi-thanh-phuong-lang-ha-chung-cu-m5-nguyen-chi-thanh/ban-toa-goc-149m-3pn-2wc-nha-o-luon-gia-12-2-ty-pr45292668
Đống Đa,"Cần bán căn hộ Hà Thành Plaza 102 Thái Thịnh, DT 146,5m thiết kế 3PN 2WC full nội thất. Giá 11,3 tỷ",11300.0,146.5,77.13310580204778,P. Thịnh Quang (P. Đống Đa mới),Đăng hôm nay,,https://batdongsan.com.vn/ban-can-ho-chung-cu-pho-thai-thinh-phuong-thinh-quang-ha-thanh-plaza/ban-102-dt-146-5m-thiet-ke-3pn-2wc-full-noi-that-gia-11-5-ty-pr44602801
Đống Đa,"Tập thể Phương Mai, Đống Đa, tầng 1, ô tô đỗ, 60m2 2pn đẹp ở luôn giá 3,68 tỷ",3680.0,60.0,61.333333333333336,P. Phương Mai (P. Kim Liên mới),Đăng hôm nay,,https://batdongsan.com.vn/ban-can-ho-chung-cu-pho-phuong-mai-phuong-phuong-mai-3/nhinh-3-ty-tap-the-ong-a-tang-1-o-to-o-60m2-2pn-nha-ep-pr45224851
Đống Đa,"Tập thể rộng 110m2 có 3PN, 2WC khép kín sổ đỏ 40m2 giá 4,65 tỷ phố Lương Định Của, Đống Đa, Hà Nội",4650.0,110.0,42.27272727272727,P. Phương Mai (P. Kim Liên mới),Đăng hôm nay,,https://batdongsan.com.vn/ban-can-ho-chung-cu-pho-luong-dinh-cua-phuong-phuong-mai-3/ban-cc-view-dep-3pn-2wc-3-45-ty-80m2-o-dong-da-hn-hot-pr42720058
Đống Đa,"Tập thể Phố Huỳnh Thúc Kháng, Đống Đa, lô góc, view phố, 80m2 3PN chủ nhiệt bán giá tốt 4,85 tỷ",4850.0,80.0,60.625,P. Láng Hạ (P. Đống Đa mới),Đăng hôm nay,,https://batdongsan.com.vn/ban-can-ho-chung-cu-duong-huynh-thuc-khang-phuong-lang-ha-3/sieu-pham-mat-pho-dong-da-lo-goc-view-pho-80m2-3pn-chi-5-13-ty-pr44851164
Đống Đa,"Tập thể Hoàng Ngọc Phách, Đống Đa, tầng 1, 6,38 tỷ, 110m2, 3PN, 2WC, giá siêu hời",6380.0,110.0,58.0,P. Láng Hạ (P. Đống Đa mới),Đăng hôm nay,,https://batdongsan.com.vn/ban-can-ho-chung-cu-pho-hoang-ngoc-phach-phuong-lang-ha-3/hiem-nha-ban-tap-the-ong-a-tang-1-6-38-ty-110m2-3pn-2wc-gia-sieu-hoi-pr45251903
Đống Đa,"Bán tập thể Vĩnh Hồ, Đống Đa, 70m2 2PN ở luôn hàng hiếm giá 3,79 tỷ cực chất",3790.0,70.0,54.142857142857146,P. Thịnh Quang (P. Đống Đa mới),Đăng hôm nay,,https://batdongsan.com.vn/ban-can-ho-chung-cu-duong-vinh-ho-phuong-thinh-quang-3/ban-tap-the-2pn-1wc-tai-3-79-ty-70m2-hang-hiem-tai-gia-cuc-chat-pr45224363
Đống Đa,"Chính chủ bán căn hộ cao cấp số 102 Thái Thịnh, căn góc 2 ban công, full nội thất mới 100%",12000.0,114.4,104.8951048951049,P. Thịnh Quang (P. Đống Đa mới),Đăng 4 ngày trước,,https://batdongsan.com.vn/ban-can-ho-chung-cu-pho-thai-thinh-phuong-thinh-quang-ha-thanh-plaza/chinh-chu-ban-cao-cap-so-102-goc-2-ban-cong-full-noi-that-moi-100-pr45195491
Đống Đa,CĂN HỘ 2PN - 3PN VIEW 2 HỒ LỚN NHẤT PHƯỜNG ĐỐNG ĐA. SỔ ĐỎ LÂU DÀI. XEM NHÀ 24/7:0899 822 ***,,137.0,,P. Láng Hạ (P. Giảng Võ mới),Đăng 4 ngày trước,,https://batdongsan.com.vn/ban-can-ho-chung-cu-pho-lang-ha-phuong-lang-ha-green-diamond-93-lang-ha/cap-nhat-bang-hang-dot-2-voi-nhieu-2pn-3pn-lan-dau-tien-ra-hang-chinh-sach-hap-dan-pr37484807
Đống Đa,Bán Chung cư Cao Cấp TT quận Đống Đa,13500.0,125.0,108.0,P. Phương Mai (P. Kim Liên mới),Đăng 6 ngày trước,,https://batdongsan.com.vn/ban-can-ho-chung-cu-duong-truong-chinh-phuong-phuong-mai-capital-garden-102-truong-chinh/ban-cao-cap-tt-quan-dong-da-pr44652255
