Khu vực,Tiêu đề,Giá (triệu),Diện tích (m²),Giá/m² (triệu),Vị trí,Ngày đăng,Cắt lỗ?,Link
Long Biên,Bán căn góc 97m2 ban công đông nam đẹp nhất khai sơn,8450.0,97.0,87.11340206185567,P. Ngọc Thụy (P. Bồ Đề mới),Đăng hôm qua,,https://batdongsan.com.vn/ban-can-ho-chung-cu-phuong-ngoc-thuy-khai-son-city/ban-goc-97m2-ban-cong-dong-nam-dep-nhat-son-pr44348611
Long Biên,Chính chủ bán căn 3N siêu đẹp view sông CC AQH,4800.0,65.0,73.84615384615384,P. Thượng Thanh (P. Việt Hưng mới),Đăng hôm qua,,https://batdongsan.com.vn/ban-can-ho-chung-cu-phuong-thuong-thanh-1-aqh-riverside/chinh-chu-ban-3n-sieu-ep-view-song-cc-aqh-pr45202807
Long Biên,"Bán căn 2 phòng ngủ 2 vệ sinh chung cư an quý hưng view sông , view vin cổ loa",4900.0,61.0,80.32786885245902,P. Thượng Thanh (P. Việt Hưng mới),Đăng hôm qua,,https://batdongsan.com.vn/ban-can-ho-chung-cu-phuong-thuong-thanh-1-aqh-riverside/ban-2-phong-ngu-2-ve-sinh-an-quy-hung-view-song-view-vin-co-loa-pr44834901
Hoài Đức,"IMPERIA SKY PARK MỞ BÁN TỪ MÓNG CĂN 2PN TỪ 55-68M2 VỐN TỰ CÓ CHỈ TỪ 1,5 TỶ MIỄN LÃI 24T- CK TỚI 15%",5100.0,55.0,92.72727272727273,·X. An Khánh,Đăng hôm nay,,https://batdongsan.com.vn/ban-can-ho-chung-cu-duong-dai-lo-thang-long-xa-an-khanh-4-imperia-sky-park/mo-ban-tu-mong-2pn-tu-55-68m2-von-tu-co-chi-tu-1-5-ty-mien-lai-24t-ck-toi-15-pr45299923
Hoài Đức,"BOOKING NHẬN ƯU ĐÃI LỚN IMPERIA SKY PARK CẠNH VINHOMES SMART CITY, ĐỦ QUỸ CĂN STUDIO - SKY VILLAS",,52.5,,·X. An Khánh,Đăng hôm nay,,https://batdongsan.com.vn/ban-can-ho-chung-cu-duong-dai-lo-thang-long-xa-an-khanh-4-imperia-sky-park/booking-nhan-uu-ai-lon-canh-vinhomes-smart-city-u-quy-studio-villas-pr45156054
Hoài Đức,Quỹ 200 căn 2PN - 3PN kí trực tiếp Chủ đầu tư - Giá giai đoạn 1,,75.0,,·X. Di Trạch (X. Hoài Đức mới),Đăng hôm nay,,https://batdongsan.com.vn/ban-can-ho-chung-cu-duong-vanh-dai-3-5-xa-di-trach-the-flame-vine/quy-200-2pn-3pn-ki-truc-tiep-chu-au-tu-gia-giai-oan-1-pr45212757
Hoài Đức,Bán gấp căn 2 ngủ 83m2 - đã có sổ đỏ - view đẹp và thoáng - xem nhà 24/24,6300.0,83.0,75.90361445783132,X. Di Trạch (X. Hoài Đức mới),Đăng hôm nay,Có,https://batdongsan.com.vn/ban-can-ho-chung-cu-duong-32-xa-di-trach-chung-cu-the-wisteria/ban-gap-2-ngu-83m2-a-co-so-o-view-ep-va-thoang-xem-nha-24-24-pr45271737
Hoài Đức,Bán căn hộ 139m2 chung cư Wisteria - ban công Đông Nam - có hỗ trợ bank 70%,9100.0,139.0,65.46762589928058,X. Di Trạch (X. Hoài Đức mới),Đăng hôm qua,,https://batdongsan.com.vn/ban-can-ho-chung-cu-duong-32-xa-di-trach-chung-cu-the-wisteria/ban-138m2-ban-cong-ong-nam-co-tro-bank-70-pr45271497
Hoài Đức,"Bán nhanh căn hộ 2PN2VS toà Gemek 2 An Khánh view Vinsmart 66m2 chỉ 4,4 tỷ",4400.0,66.0,66.66666666666667,X. An Khánh,Đăng 2 ngày trước,,https://batdongsan.com.vn/ban-can-ho-chung-cu-duong-le-trong-tan-xa-an-khanh-4-gemek-premium/chinh-chu-ban-2pn2vs-toa-2-view-vinsmart-66m-chi-4-4-ty-pr45251955
Hoài Đức,Căn góc 3 ngủ - diện tích 114m2 - view đẹp hướng mát - có sổ đỏ,7600.0,114.0,66.66666666666667,X. Di Trạch (X. Hoài Đức mới),Đăng 6 ngày trước,,https://batdongsan.com.vn/ban-can-ho-chung-cu-duong-32-xa-di-trach-chung-cu-the-wisteria/goc-3-ngu-dien-tich-114m2-view-ep-huong-mat-co-so-o-pr45189866
Hoài Đức,Quỹ căn studio- 1PN-2PN-3PN tòa Sky1 và Sky2 không chênh kí trực tiếp chủ đầu tư MIK Group,4080.0,43.0,94.88372093023256,·X. An Khánh,Đăng hôm nay,,https://batdongsan.com.vn/ban-can-ho-chung-cu-duong-dai-lo-thang-long-xa-an-khanh-4-imperia-sky-park/quy-studio-1pn-2pn-3pn-toa-sky1-va-sky2-khong-chenh-ki-truc-tiep-chu-au-tu-mik-group-pr45179876
Hoài Đức,"Độc quyền bán Căn hộ cao cấp 2PN, 60m2 tầng trung, BC Đông Nam view công viên nội khu Imperia MIK",,60.0,,·X. An Khánh,Đăng hôm qua,,https://batdongsan.com.vn/ban-can-ho-chung-cu-duong-dai-lo-thang-long-xa-an-khanh-4-imperia-sky-park/ban-cc-2pn-60m2-tang-trung-gia-uu-ai-ha-noi-pr45277657
Hoài Đức,IMPERIA SKY PARK NAM AN KHÁNH  NHẬN BOOKING SỚM | CĂN HỘ CAO CẤP SỞ HỮU LÂU DÀI,5020.0,54.0,92.96296296296296,·X. An Khánh,Đăng hôm qua,,https://batdongsan.com.vn/ban-can-ho-chung-cu-duong-dai-lo-thang-long-xa-an-khanh-4-imperia-sky-park/nam-nhan-booking-som-cao-cap-so-huu-lau-dai-pr45290879
Hoài Đức,"MỞ BÁN CHUNG CƯ IMPERIA SKY PARK 1-2-3PN GẦN VINHOMES SMART CITY TÂY MỖ, CÁCH SVĐ MỸ ĐÌNH CHỈ 8PH",,42.0,,·X. An Khánh,Đăng hôm qua,,https://batdongsan.com.vn/ban-can-ho-chung-cu-duong-dai-lo-thang-long-xa-an-khanh-4-imperia-sky-park/mo-ban-1-2-3pn-ngay-canh-vinhomes-smart-city-tay-mo-cach-sv-my-inh-chi-7-phut-pr45253829
Hoài Đức,Chỉ từ 419tr sở hữu căn hộ MIK An Khánh cạnh Vinhomes Smart City. Liên hệ0888 999 ***,,28.0,,·X. An Khánh,Đăng 2 ngày trước,,https://batdongsan.com.vn/ban-can-ho-chung-cu-duong-dai-lo-thang-long-xa-an-khanh-4-imperia-sky-park/chi-tu-419tr-so-huu-mik-canh-vinhomes-smart-city-lien-he-0888999819-pr45254080
Hoài Đức,Anh Chị Quan Tâm dự án MIK An Khánh tuyệt đối đừng bỏ qua bài phân tích này,6260.0,68.0,92.05882352941177,·X. An Khánh,Đăng 2 ngày trước,,https://batdongsan.com.vn/ban-can-ho-chung-cu-duong-dai-lo-thang-long-xa-an-khanh-4-imperia-sky-park/anh-chi-quan-tam-du-mik-tuyet-oi-ung-bo-qua-bai-phan-tich-nay-pr45271137
Hoài Đức,Chỉ từ hơn 400 triệu sở hữu căn hộ Imperia Sky Park - MIK An Khánh. Kí trực tiếp với CĐT MIK Group,,43.0,,·X. An Khánh,Đăng 2 ngày trước,,https://batdongsan.com.vn/ban-can-ho-chung-cu-duong-dai-lo-thang-long-xa-an-khanh-4-imperia-sky-park/chi-tu-hon-400trieu-so-huu-mik-ki-truc-tiep-voi-c-t-mik-group-pr45255208
Hoài Đức,Booking nhận ưu đãi quỹ căn studio-1PN-2PN-3PN tòa Sky1 và Sky2 kí trực tiếp Chủ đầu tư MIK GROUP,,55.0,,·X. An Khánh,Đăng 4 ngày trước,,https://batdongsan.com.vn/ban-can-ho-chung-cu-duong-dai-lo-thang-long-xa-an-khanh-4-imperia-sky-park/booking-nhan-uu-ai-quy-studio-1pn-2pn-3pn-toa-sky1-va-sky2-ki-truc-tiep-chu-au-tu-mik-group-pr45218771
Hoài Đức,Booking quỹ ngoại giao căn hộ cao cấp The Flame Vine HH03 Hinode Royal Park,,75.0,,·X. Di Trạch (X. Hoài Đức mới),Đăng 1 tuần trước,,https://batdongsan.com.vn/ban-can-ho-chung-cu-duong-vanh-dai-3-5-xa-di-trach-the-flame-vine/quy-ngoai-giao-cao-cap-hh03-hinode-royal-park-pr45239972
Hoài Đức,"Quỹ căn STUDIO, 1PN, 2PN+ độc quyền tại toà Imperia Sky Park Early Bird 15% tặng FULL đồ liền tường",,69.0,,·X. An Khánh,Đăng 1 tuần trước,,https://batdongsan.com.vn/ban-can-ho-chung-cu-duong-dai-lo-thang-long-xa-an-khanh-4-imperia-sky-park/quy-studio-1pn-2pn-oc-quyen-tai-toa-early-bird-15-tang-full-o-lien-tuong-pr45227678
Hoài Đức,RA MẮT CHUNG CƯ IMPERIA SKY PARK NAM AN KHÁNH,,28.0,,·X. An Khánh,Đăng 1 tuần trước,,https://batdongsan.com.vn/ban-can-ho-chung-cu-duong-dai-lo-thang-long-xa-an-khanh-4-imperia-sky-park/ra-mat-nam-khanh-pr45232497
Hoài Đức,Danh sách các căn hộ đang có nhu cầu chuyển nhượng giá tốt tại The Wisteria loại 2 & 3 phòng ngủ,6500.0,83.0,78.3132530120482,X. Di Trạch (X. Hoài Đức mới),Đăng hôm nay,,https://batdongsan.com.vn/ban-can-ho-chung-cu-duong-32-xa-di-trach-chung-cu-the-wisteria/danh-sach-cac-dang-co-nhu-cau-chuyen-nhuong-gia-tot-tai-loai-2-3-phong-ngu-pr45059737
Hoài Đức,Quỹ căn chuyển nhượng Wisteria: Xuân sang đón lộc - về nhà an cư,6200.0,83.0,74.6987951807229,X. Di Trạch (X. Hoài Đức mới),Đăng hôm nay,,https://batdongsan.com.vn/ban-can-ho-chung-cu-duong-32-xa-di-trach-chung-cu-the-wisteria/quy-chuyen-nhuong-xuan-sang-don-loc-ve-nha-an-cu-pr45050315
Hoài Đức,CHỈ 95TR/M2 CƠ HỘI CUỐI CÙNG ĐỂ MUA IMPERIA SKY PARK dòng căn Studio - 3PN - SKY VILLA METRO SỐ 5,14630.0,154.0,95.0,X. An Khánh,Đăng hôm nay,,https://batdongsan.com.vn/ban-can-ho-chung-cu-duong-dai-lo-thang-long-xa-an-khanh-4-imperia-sky-park/chi-90tr-m2-co-hoi-cuoi-cung-e-mua-dong-studio-3pn-villa-metro-so-5-pr45296635
Hoài Đức,"Booking đợt đầu căn hộ chung cư The Flame Vine, giá dự kiến 70 triệu/m2, 70 m2, 2PN, 2WC",,70.0,,X. Di Trạch (X. Hoài Đức mới),Đăng hôm qua,,https://batdongsan.com.vn/ban-can-ho-chung-cu-duong-vanh-dai-3-5-xa-di-trach-the-flame-vine/ban-ot-au-70-trieu-m2-70-m2-2pn-2wc-pr45287926
Hoài Đức,Đại lý Seven Realty đã và đang nhận được rất nhiều lượt booking của dự án Imperia Sky Park,6180.0,65.0,95.07692307692308,X. An Khánh,Đăng 2 ngày trước,,https://batdongsan.com.vn/ban-can-ho-chung-cu-duong-dai-lo-thang-long-xa-an-khanh-4-imperia-sky-park/ai-ly-seven-realty-a-va-ang-nhan-uoc-rat-nhieu-luot-booking-cua-du-park-pr45188539
Hoài Đức,CĂN HỘ CHUNG CƯ TẠI HOÀI ĐỨC TÀI CHÍNH CHỈ TỪ 2 TỶ TẠI DỰ ÁN THE FLAME VINE HINODE ROYAL PARK,,73.0,,X. Di Trạch (X. Hoài Đức mới),Đăng 2 ngày trước,,https://batdongsan.com.vn/ban-can-ho-chung-cu-duong-quoc-lo-32-xa-di-trach-hinode-royal-park/tai-hoai-uc-tai-chinh-chi-tu-2-ty-tai-du-an-the-flame-vine-park-pr45240675
Đống Đa,Chính chủ bán căn 3PN đồ đẹp Vinhomes Nguyễn Chí Thanh giá rẻ nhất thị trường. Liên hệ0372 004 ***,18000.0,120.0,150.0,P. Láng Thượng (P. Láng mới),Đăng hôm qua,Có,https://batdongsan.com.vn/ban-can-ho-chung-cu-duong-nguyen-chi-thanh-phuong-lang-thuong-vinhomes-nguyen-chi-thanh/chinh-chu-ban-2pn-do-dep-gia-re-nhat-thi-truong-lien-he-pr44292544
Đống Đa,"Quỹ cuối căn hộ 65-135m2 từ 2-4PN CC The Nestar 83 Hào Nam. Quỹ CĐT, sổ đỏ, full nội thất, slot xe",14000.0,90.0,155.55555555555554,P. Ô Chợ Dừa (P. Ô Chợ Dừa mới),Đăng 2 ngày trước,,https://batdongsan.com.vn/ban-can-ho-chung-cu-pho-hao-nam-phuong-o-cho-dua-the-terra-hao-nam/quy-cuoi-65-135m2-tu-2-4pn-cc-nestar-83-quy-c-t-so-full-noi-that-slot-xe-pr45279945
Đống Đa,"Chính chủ bán căn hộ cao cấp số 102 Thái Thịnh, căn góc 2 ban công, full nội thất mới 100%",12000.0,114.4,104.8951048951049,P. Thịnh Quang (P. Đống Đa mới),Đăng 4 ngày trước,,https://batdongsan.com.vn/ban-can-ho-chung-cu-pho-thai-thinh-phuong-thinh-quang-ha-thanh-plaza/chinh-chu-ban-cao-cap-so-102-goc-2-ban-cong-full-noi-that-moi-100-pr45195491
Đống Đa,Tập thể Phương Mai - Lương Định Của - 3PN 2WC - 3 mặt thoáng - ô tô đỗ cầu thang,4590.0,75.0,61.2,P. Phương Mai (P. Kim Liên mới),Đăng hôm nay,,https://batdongsan.com.vn/ban-can-ho-chung-cu-pho-luong-dinh-cua-phuong-phuong-mai-3/tap-the-inh-3pn-2wc-3-mat-thoang-o-to-o-cau-thang-pr45179896
Đống Đa,"Tập thể Phương Mai, Đống Đa, tầng 1, ô tô đỗ, 60m2 2pn đẹp ở luôn giá 3,68 tỷ",3680.0,60.0,61.333333333333336,P. Phương Mai (P. Kim Liên mới),Đăng hôm nay,,https://batdongsan.com.vn/ban-can-ho-chung-cu-pho-phuong-mai-phuong-phuong-mai-3/nhinh-3-ty-tap-the-ong-a-tang-1-o-to-o-60m2-2pn-nha-ep-pr45224851
Đống Đa,Tập thể phố Nguyễn Chí Thanh - 90m2 - 3PN - 2WC - view thoáng - oto vòng quanh - 6.3 tỷ,6300.0,90.0,70.0,P. Láng Thượng (P. Láng mới),Đăng hôm nay,,https://batdongsan.com.vn/ban-can-ho-chung-cu-duong-nguyen-chi-thanh-phuong-lang-thuong-3/tap-the-pho-90m2-3pn-2wc-view-thoang-oto-vong-quanh-6-3-ty-pr45200546
Đống Đa,Hiếm! - Căn hộ phố Chùa Láng - cạnh ĐH Ngoại Thương - 2 ngủ,4150.0,65.0,63.84615384615385,P. Láng Thượng (P. Láng mới),Đăng hôm nay,,https://batdongsan.com.vn/ban-can-ho-chung-cu-pho-chua-lang-phuong-lang-thuong-3/hiem-canh-h-ngoai-2-ngu-pr45204875
Đống Đa,"Bán nhà chính chủ tập thể tầng 1 Kim Liên 58.5m2, 3 ngủ 2 WC, 2 mặt tiền trước sau",5600.0,58.5,95.72649572649573,P. Kim Liên,Đăng hôm nay,,https://batdongsan.com.vn/ban-can-ho-chung-cu-pho-luong-dinh-cua-phuong-kim-lien-3/ban-nha-chinh-chu-tap-the-tang-1-58-5m2-3-ngu-2-wc-2-mat-tien-truoc-sau-pr45282863
Đống Đa,"Tập thể Hoàng Ngọc Phách, Đống Đa, tầng 1, 6,38 tỷ, 110m2, 3PN, 2WC, giá siêu hời",6380.0,110.0,58.0,P. Láng Hạ (P. Đống Đa mới),Đăng hôm nay,,https://batdongsan.com.vn/ban-can-ho-chung-cu-pho-hoang-ngoc-phach-phuong-lang-ha-3/hiem-nha-ban-tap-the-ong-a-tang-1-6-38-ty-110m2-3pn-2wc-gia-sieu-hoi-pr45251903
Đống Đa,Cần bán gấp căn hộ 3phòng ngủ tòa Mipec Tower 299 Tây Sơn Đống Đa 104.8m2 giá 10.5tỷ. LH0988 669 ***,10500.0,104.8,100.19083969465649,P. Trung Liệt (P. Ô Chợ Dừa mới),Đăng hôm nay,Có,https://batdongsan.com.vn/ban-can-ho-chung-cu-duong-tay-son-phuong-trung-liet-mipec-towers/ban-gap-3-phong-ngu-toa-tower-299-dong-da-105m2-gia-10-ty-lh-pr44956456
Đống Đa,"Bán tập thể 2PN, 60m2 tại Tôn Đức Thắng, Văn Miếu, Đống Đa, giá ưu đãi 3,78 tỷ",3780.0,60.0,63.0,P. Văn Miếu - Quốc Tử Giám (P. Văn Miếu-quốc Tử Giám mới),Đăng hôm nay,,https://batdongsan.com.vn/ban-can-ho-chung-cu-pho-ton-duc-thang-phuong-van-mieu-quoc-tu-giam-3/ban-tap-the-2pn-60m2-tai-uc-ong-a-gia-uu-ai-3-78-ty-pr45224522
Đống Đa,"Bán tập thể Vĩnh Hồ, Đống Đa, 70m2 2PN ở luôn hàng hiếm giá 3,79 tỷ cực chất",3790.0,70.0,54.142857142857146,P. Thịnh Quang (P. Đống Đa mới),Đăng hôm nay,,https://batdongsan.com.vn/ban-can-ho-chung-cu-duong-vinh-ho-phuong-thinh-quang-3/ban-tap-the-2pn-1wc-tai-3-79-ty-70m2-hang-hiem-tai-gia-cuc-chat-pr45224363
Đống Đa,"Bán căn hộ toà M5 Nguyễn Chí Thanh. Căn góc 149m2 3PN 2WC. Nhà ở luôn giá 12,2 tỷ",12200.0,149.0,81.87919463087249,P. Láng Hạ (P. Giảng Võ mới),Đăng hôm nay,,https://batdongsan.com.vn/ban-can-ho-chung-cu-duong-nguyen-chi-thanh-phuong-lang-ha-chung-cu-m5-nguyen-chi-thanh/ban-toa-goc-149m-3pn-2wc-nha-o-luon-gia-12-2-ty-pr45292668
Đống Đa,CĂN HỘ 2PN - 3PN VIEW 2 HỒ LỚN NHẤT PHƯỜNG ĐỐNG ĐA. SỔ ĐỎ LÂU DÀI. XEM NHÀ 24/7:0899 822 ***,,137.0,,P. Láng Hạ (P. Giảng Võ mới),Đăng 4 ngày trước,,https://batdongsan.com.vn/ban-can-ho-chung-cu-pho-lang-ha-phuong-lang-ha-green-diamond-93-lang-ha/cap-nhat-bang-hang-dot-2-voi-nhieu-2pn-3pn-lan-dau-tien-ra-hang-chinh-sach-hap-dan-pr37484807
Đống Đa,Bán Chung cư Cao Cấp TT quận Đống Đa,13500.0,125.0,108.0,P. Phương Mai (P. Kim Liên mới),Đăng 6 ngày trước,,https://batdongsan.com.vn/ban-can-ho-chung-cu-duong-truong-chinh-phuong-phuong-mai-capital-garden-102-truong-chinh/ban-cao-cap-tt-quan-dong-da-pr44652255
Đống Đa,Quỹ căn chuyển nhượng từ 1-2-3-4 phòng | sẵn sổ đỏ cập nhật liên tục tại Green Diamond 93 Láng Hạ,,86.0,,P. Láng Hạ (P. Giảng Võ mới),Đăng 1 tuần trước,,https://batdongsan.com.vn/ban-can-ho-chung-cu-pho-lang-ha-phuong-lang-ha-green-diamond-93-lang-ha/quy-chuyen-nhuong-tu-1-2-3-4-phong-san-so-do-cap-nhat-lien-tuc-tai-93-ha-pr42650757
Đống Đa,"QUỸ CĂN BÁN TẠI CHCC TÂN HOÀNG MINH - 36 HOÀNG CẦU 3PN, NT FULL, VIEW ĐẸP. LH:0906 961 ***",,135.0,,P. Ô Chợ Dừa (P. Ô Chợ Dừa mới),Đăng 1 tuần trước,,https://batdongsan.com.vn/ban-can-ho-chung-cu-pho-hoang-cau-phuong-o-cho-dua-d-le-pont-dor-hoang-cau/chinh-chu-ban-cao-cap-toa-tan-minh-dt-151m2-3-ngu-3-vs-full-do-11-9-ty-pr40367994
Đống Đa,"Quỹ 20 căn bán tại chung cư cao cấp Hateco Laroma, 2PN, 3PN, duplex, penthouse.0963 668 ***",,120.0,,P. Láng Thượng (P. Láng mới),Đăng 1 tuần trước,,https://batdongsan.com.vn/ban-can-ho-chung-cu-duong-huynh-thuc-khang-phuong-lang-thuong-hateco-laroma/quy-20-ban-tai-cao-cap-2pn-3pn-duplex-penthouse-12-ty-pr44518188
Đống Đa,Chính chủ bán 3 căn hộ tại Lancaster Lumianire 1152 Láng với diện tích 49m2-156m2-180m2 giá rẻ,,168.0,,P. Láng Thượng (P. Láng mới),Đăng 2 tuần trước,Có,https://batdongsan.com.vn/ban-can-ho-chung-cu-duong-lang-phuong-lang-thuong-lancaster-luminaire/chinh-chu-ban-3-tai-lumianire-1152-voi-dien-tich-49m2-156m2-180m2-gia-re-pr45194173
Đống Đa,Tập thể Phương Mai - Lương Định Của - 3PN 2WC - 3 mặt thoáng - ô tô đỗ cầu thang,4590.0,75.0,61.2,P. Phương Mai (P. Kim Liên mới),Đăng hôm nay,,https://batdongsan.com.vn/ban-can-ho-chung-cu-pho-luong-dinh-cua-phuong-phuong-mai-3/tap-the-inh-3pn-2wc-3-mat-thoang-o-to-o-cau-thang-pr45179896
Đống Đa,"Tập thể Phương Mai, Đống Đa, tầng 1, ô tô đỗ, 60m2 2pn đẹp ở luôn giá 3,68 tỷ",3680.0,60.0,61.333333333333336,P. Phương Mai (P. Kim Liên mới),Đăng hôm nay,,https://batdongsan.com.vn/ban-can-ho-chung-cu-pho-phuong-mai-phuong-phuong-mai-3/nhinh-3-ty-tap-the-ong-a-tang-1-o-to-o-60m2-2pn-nha-ep-pr45224851
Đống Đa,"Bán nhanh CHCC 3PN + 1, 142m2, tầng đẹp, full NT tại Green Diamond - 93 Láng Hạ. Giá rẻ nhất dự án",17000.0,142.0,119.71830985915493,P. Láng Hạ (P. Giảng Võ mới),Đăng hôm nay,Có,https://batdongsan.com.vn/ban-can-ho-chung-cu-pho-lang-ha-phuong-lang-ha-green-diamond-93-lang-ha/ban-nhanh-cao-cap-1pn-47m2-tang-trung-tai-93-gia-re-nhat-du-an-pr41057985
Đống Đa,"Chính chủ cần bán CHCC Tân Hoàng Minh - 36 Hoàng Cầu, 134m2, 3N2WC, Full NT, tầng đẹp-View thoáng",,134.0,,P. Ô Chợ Dừa (P. Ô Chợ Dừa mới),Đăng hôm nay,,https://batdongsan.com.vn/ban-can-ho-chung-cu-pho-hoang-cau-phuong-o-cho-dua-d-le-pont-dor-hoang-cau/chinh-chu-ban-tai-tan-minh-dt-93m2-2-ngu-full-do-gia-5-3-ty-pr36119284
Đống Đa,"Nhà mình bán Penhouse 260m2 tại Mipec Tây Sơn, có thông tầng, full đồ, căn góc đẹp nhất toà",28000.0,260.0,107.6923076923077,P. Trung Liệt (P. Ô Chợ Dừa mới),Đăng hôm nay,,https://batdongsan.com.vn/ban-can-ho-chung-cu-duong-tay-son-phuong-trung-liet-mipec-towers/nha-minh-ban-penhouse-280m2-tai-co-thong-tang-full-do-goc-dep-nhat-toa-pr44701945
Đống Đa,Tập thể phố Nguyễn Chí Thanh - 90m2 - 3PN - 2WC - view thoáng - oto vòng quanh - 6.3 tỷ,6300.0,90.0,70.0,P. Láng Thượng (P. Láng mới),Đăng hôm nay,,https://batdongsan.com.vn/ban-can-ho-chung-cu-duong-nguyen-chi-thanh-phuong-lang-thuong-3/tap-the-pho-90m2-3pn-2wc-view-thoang-oto-vong-quanh-6-3-ty-pr45200546
Đống Đa,"Bán căn hộ 135m2 4pn CC The Nestar 83 Hào Nam, full nội thất, slot gửi xe ô tô",,135.0,,P. Ô Chợ Dừa (P. Ô Chợ Dừa mới),Đăng hôm nay,,https://batdongsan.com.vn/ban-can-ho-chung-cu-pho-hao-nam-phuong-o-cho-dua-the-terra-hao-nam/ban-135m2-4pn-cc-nestar-83-full-noi-that-slot-gui-xe-to-pr45299580
Đống Đa,"Gia đình cần bán căn 4PN tòa M5 Nguyễn Chí Thanh 152m2, giá 13 tỷ. LH0936 242 ***",13000.0,152.0,85.52631578947368,P. Láng Hạ (P. Giảng Võ mới),Đăng hôm nay,,https://batdongsan.com.vn/ban-can-ho-chung-cu-duong-nguyen-chi-thanh-phuong-lang-ha-chung-cu-m5-nguyen-chi-thanh/gia-inh-ban-4pn-toa-152m-gia-13-ty-lh-0936242111-pr45146199
Đống Đa,"Bán CHCC tại B4 - B14 Kim Liên, 7 tỷ VND, 73 m2, nội thất đầy đủ",7000.0,73.0,95.89041095890411,P. Kim Liên,Đăng hôm nay,,https://batdongsan.com.vn/ban-can-ho-chung-cu-duong-pham-ngoc-thach-phuong-kim-lien-chung-cu-b4-b14-kim-lien/ban-chcc-tai-7-ty-vnd-73-m2-noi-that-ay-u-pr45267651
Đống Đa,"Bán căn hộ 2 phòng ngủ 75m2 giá 6.6 tỷ full nội thất đẹp ở ngay, toà B14 Kim Liên,0982 281 ***",6600.0,75.0,88.0,P. Kim Liên,Đăng hôm nay,,https://batdongsan.com.vn/ban-can-ho-chung-cu-duong-pham-ngoc-thach-phuong-kim-lien-chung-cu-b4-b14-kim-lien/ban-2-phong-ngu-75m2-gia-6-6-ty-full-noi-that-ep-o-ngay-toa-0982281144-pr45299526
Đống Đa,"Tôi cần bán căn góc 3PN, 148 m2 tòa Sky 88 Láng hạ, giá 16 tỷ. LH:0936 242 ***",16000.0,148.0,108.10810810810811,P. Láng Hạ (P. Giảng Võ mới),Đăng hôm nay,,https://batdongsan.com.vn/ban-can-ho-chung-cu-pho-lang-ha-phuong-lang-ha-sky-city-towers-88-lang-ha/toi-ban-goc-3pn-148-m2-toa-88-gia-16-ty-lh-pr45105698
Đan Phượng,Quỹ Căn Nội Bộ Toà 22 Tầng Mở Bán Sớm. Giá 7xTr/m2. CK 14%. Vay 70% GTCH. Masterise Đan Phượng,5400.0,60.0,90.0,X. Tân Hội (X. Ô Diên mới),Đăng 3 ngày trước,,https://batdongsan.com.vn/ban-can-ho-chung-cu-duong-tay-thang-long-xa-tan-hoi-7-vinhomes-wonder-city/quy-noi-bo-ban-som-masterise-toa-16-22-tang-vay-70-gtch-du-an-dan-phuong-pr44717669
Đan Phượng,"Chuyển xuống mặt đất cần bán căn hộ 90m tòa CT2A KĐT Tân Tây Đô, full đồ, sổ đỏ lâu dài",,90.0,,X. Tân Lập (X. Ô Diên mới),Đăng 1 tuần trước,,https://batdongsan.com.vn/ban-can-ho-chung-cu-duong-quoc-lo-32-xa-tan-lap-24-khu-do-thi-moi-tan-tay-do/chuyen-xuong-mat-at-ban-90m-toa-ct2a-k-t-o-full-o-so-o-lau-dai-pr45246882
Đan Phượng,"Cần bán căn hộ 80m2 , giá rẻ nhất",,80.0,,X. Tân Lập (X. Ô Diên mới),Đăng hôm nay,Có,https://batdongsan.com.vn/ban-can-ho-chung-cu-duong-quoc-lo-32-xa-tan-lap-24-khu-do-thi-moi-tan-tay-do/ban-goc-dep-full-cho-khach-thien-chi-pr44295299
Đan Phượng,"Bán căn hộ 2pn full nội thất toà HHA, KĐT Tân tây đô",,62.0,,X. Tân Lập (X. Ô Diên mới),Đăng hôm nay,,https://batdongsan.com.vn/ban-can-ho-chung-cu-duong-quoc-lo-32-xa-tan-lap-24-khu-do-thi-moi-tan-tay-do/ban-2pn-full-noi-that-toa-hha-kdt-do-pr44674904
Đan Phượng,"Suất ngoại giao căn duplex, diện tích 162m2/3PN, giá 9 tỷ. Chung cư Masterise Đan Phượng",9000.0,162.0,55.55555555555556,X. Tân Hội (X. Ô Diên mới),Đăng hôm nay,,https://batdongsan.com.vn/ban-can-ho-chung-cu-duong-tay-thang-long-xa-tan-hoi-7-vinhomes-wonder-city/suat-ngoai-giao-simplex-dien-tich-94m-2pn-gia-6-ty-masterise-dan-phuong-pr44497739
Đan Phượng,"Không lo được tài chính, cần bán lại căn 2 phòng ngủ, toà Sky Tower A. Chung cư Vin Đan Phượng",,60.0,,X. Tân Hội (X. Ô Diên mới),Đăng hôm nay,,https://batdongsan.com.vn/ban-can-ho-chung-cu-duong-tay-thang-long-xa-tan-hoi-7-vinhomes-wonder-city/khong-lo-duoc-tai-chinh-ban-lai-2-phong-ngu-toa-sky-tower-a-vin-dan-phuong-pr44818935
Đan Phượng,"Căn Tân Tây Đô 79.3m2, 3 ngủ, 2 vệ sinh. Lô góc. Tặng full nội thất. Giá 4 tỷ 9. LH0989 388 ***",4900.0,79.3,61.7906683480454,X. Tân Lập (X. Ô Diên mới),Đăng hôm nay,,https://batdongsan.com.vn/ban-can-ho-chung-cu-duong-quoc-lo-32-xa-tan-lap-24-khu-do-thi-moi-tan-tay-do/79-3m-3-ngu-2-ve-sinh-goc-tang-full-noi-that-gia-4-ty-9-lh-pr44650996
Đan Phượng,"Bán CC 2PN 2WC tại Quốc lộ 32, Tân Lập, Huyện Đan Phượng, 4,25 tỷ, 80m2 view đẹp",4250.0,80.0,53.125,X. Tân Lập (X. Ô Diên mới),Đăng hôm nay,,https://batdongsan.com.vn/ban-can-ho-chung-cu-duong-quoc-lo-32-xa-tan-lap-24-20/ban-cc-2pn-2wc-tai-32-huyen-an-phuong-4-25-ty-80m2-view-ep-pr45297265
Đan Phượng,"CẦN BÁN CĂN GÓC 3 NGỦ, 3 VỆ SINH CHUNG CƯ TÂN TÂY ĐÔ.",,110.0,,X. Tân Lập (X. Ô Diên mới),Đăng hôm nay,,https://batdongsan.com.vn/ban-can-ho-chung-cu-duong-quoc-lo-32-xa-tan-lap-24-20/ban-goc-3-ngu-3-ve-sinh-tay-o-pr45234018
Đan Phượng,Căn hộ duplex tầng thấp Masteri Sky Quarter đẳng cấp sống như biệt thự trên không giá chỉ 10 tỷ,10000.0,176.0,56.81818181818182,X. Tân Hội (X. Ô Diên mới),Đăng hôm nay,,https://batdongsan.com.vn/ban-can-ho-chung-cu-xa-tan-hoi-7-masteri-sky-quarter/duplex-tang-thap-dang-cap-song-nhu-biet-thu-tren-khong-gia-chi-10-ty-pr44533905
Đan Phượng,"Quỹ căn 2 - 3 ngủ giá tốt nhất Vinhomes Đan Phượng chỉ từ 7x tr/m2, cơ hội đầu tư chắc thắng",4730.0,60.0,78.83333333333333,X. Tân Hội (X. Ô Diên mới),Đăng hôm qua,,https://batdongsan.com.vn/ban-can-ho-chung-cu-xa-tan-hoi-7-masteri-sky-quarter/quy-2-3-ngu-gia-tot-nhat-vinhomes-an-phuong-chi-tu-7x-tr-m2-co-au-tu-chac-thang-pr45165401
Đan Phượng,"Bán căn hộ chung cư 3PN đầy đủ nội thất, view đẹp giá tốt - Tân Tây Đô, 95m2, Đan Phượng, Hà Nội",,95.0,,X. Tân Lập (X. Ô Diên mới),Đăng hôm qua,,https://batdongsan.com.vn/ban-can-ho-chung-cu-duong-quoc-lo-32-xa-tan-lap-24-khu-do-thi-moi-tan-tay-do/ban-3pn-day-du-noi-that-view-dep-gia-tot-95m2-dan-phuong-ha-noi-pr43188421
Đan Phượng,"Tôi cần Bán căn góc 52,8m2-2PN - 2WC , view đông nam mát mẻ.toà XPHOMES Star - Tân Tây Đô.",,52.8,,X. Tân Lập (X. Ô Diên mới),Đăng hôm qua,,https://batdongsan.com.vn/ban-can-ho-chung-cu-duong-quoc-lo-32-xa-tan-lap-24-chung-cu-xphomes-tan-tay-do/ban-goc-59m2-2pn-2wc-toa-xphome-star-so-san-gia-ban-3-ty-1x-pr42385474
Đan Phượng,Chính chủ cần bán nhanh căn 3 ngủ toà CT2A KDT Tân Tây Đô. Thiết kế 3 ngủ xịn full đồ. Lh 098191588,5150.0,85.0,60.588235294117645,X. Tân Lập (X. Ô Diên mới),Đăng hôm qua,,https://batdongsan.com.vn/ban-can-ho-chung-cu-duong-quoc-lo-32-xa-tan-lap-24-khu-do-thi-moi-tan-tay-do/chinh-chu-ban-nhanh-3-ngu-toa-ct2a-kdt-thiet-ke-3-ngu-xin-full-lh-098191588-pr45038040
Đan Phượng,"GẤP Đổi nhà nên cần bán căn CC 52,8m2, view đẹp, tầng trung, có nội thất,sẵn sổ, giá chỉ nhỉnh 3tỷ",3450.0,52.8,65.3409090909091,X. Tân Lập (X. Ô Diên mới),Đăng hôm qua,,https://batdongsan.com.vn/ban-can-ho-chung-cu-duong-quoc-lo-32-xa-tan-lap-24-chung-cu-xphomes-tan-tay-do/gap-oi-nha-nen-ban-cc-52-8m2-view-ep-tang-trung-co-noi-that-san-so-gia-chi-nhinh-3ty-pr45291627
