Khu vực,Tiêu đề,Giá (triệu),Diện tích (m²),Giá/m² (triệu),Vị trí,Ngày đăng,Cắt lỗ?,Link
Đan Phượng,"BÁN CĂN GÓC 2 NGỦ XP HOMES STAR TÂN TÂY ĐÔ Diện tích 52,8m thiết kế 2 phòng ngủ, giá 3,x0979 898 ***",3790.0,52.9,71.64461247637051,X. Tân Lập (X. Ô Diên mới),Đăng hôm qua,,https://batdongsan.com.vn/ban-can-ho-chung-cu-duong-quoc-lo-32-xa-tan-lap-24-chung-cu-xphomes-tan-tay-do/ban-goc-2-ngu-xp-homes-star-o-dien-tich-52-8m-thiet-ke-2-phong-ngu-gia-3-x-0979898648-pr45290590
Đan Phượng,Chung cư Vinhomes Đan Phượng siêu phẩm chuẩn hạng sang của CĐT Masterise Homes sắp ra mắt,,45.0,,X. Tân Hội (X. Ô Diên mới),Đăng hôm qua,,https://batdongsan.com.vn/ban-can-ho-chung-cu-xa-tan-hoi-7-masteri-sky-quarter/vinhomes-dan-phuong-sieu-pham-chuan-hang-sang-cua-cdt-masterise-homes-sap-ra-mat-pr44546101
Đan Phượng,Mở bán tòa chung cư hạng sang cuối cùng của CĐT Masterise Homes tại Vinhomes Đan Phượng,5300.0,63.0,84.12698412698413,X. Tân Hội (X. Ô Diên mới),Đăng hôm qua,,https://batdongsan.com.vn/ban-can-ho-chung-cu-xa-tan-hoi-7-masteri-sky-quarter/mo-ban-2-toa-hang-sang-cua-masterise-homes-tai-vinhomes-dan-phuong-pr44577422
Đan Phượng,"Chính chủ gửi bán căn hộ chung cư tòa HHA, Xphomes, Tân Tây Đô, Ô Diên, HN",3950.0,62.0,63.70967741935484,X. Tân Lập (X. Ô Diên mới),Đăng hôm qua,,https://batdongsan.com.vn/ban-can-ho-chung-cu-duong-quoc-lo-32-xa-tan-lap-24-khu-do-thi-moi-tan-tay-do/chinh-chu-gui-ban-toa-hha-xphomes-o-dien-hn-pr44812859
Đan Phượng,"Chính chủ bán căn hộ chung cư Tân Tây Đô 77m2, full đồ sẵn ở",4700.0,77.0,61.03896103896104,X. Tân Lập (X. Ô Diên mới),Đăng hôm qua,,https://batdongsan.com.vn/ban-can-ho-chung-cu-duong-quoc-lo-32-xa-tan-lap-24-chung-cu-xphomes-tan-tay-do/chinh-chi-ban-77m2-full-san-o-pr44778542
