Khu vực,Tiêu đề,Giá (triệu),Diện tích (m²),Giá/m² (triệu),Vị trí,Ngày đăng,Cắt lỗ?,Link
Đan Phượng,Bán gấp căn góc 55m2 - 2PN - 2WC toà CT2A Tân Tây Đô.Sổ đỏ đầy đủ. LH:0387 720 ***,,55.0,,X. Tân Lập (X. Ô Diên mới),Đăng hôm qua,Có,https://batdongsan.com.vn/ban-can-ho-chung-cu-duong-quoc-lo-32-xa-tan-lap-24-khu-do-thi-moi-tan-tay-do/gia-tot-nhat-vi-ban-gap-goc-55m2-2pn-2wc-so-day-du-lh-pr42957636
Đan Phượng,"Bán căn hộ chung cư đẹp 2PN, 2WC, 80m2 tại Quốc lộ 32, giá thỏa thuận, đầy đủ tiện ích",,80.0,,X. Tân Lập (X. Ô Diên mới),Đăng hôm qua,,https://batdongsan.com.vn/ban-can-ho-chung-cu-duong-quoc-lo-32-xa-tan-lap-24-20/ban-ep-2pn-2wc-80m2-tai-32-gia-thoa-thuan-ay-u-tien-ich-pr45178749
Đan Phượng,"Nhà ở xã hội Tân Lập mở bán 1/5 - 15/15. Cách Đại Học Công nghiệp 4KM, gần Vinhomes Đan Phượng",1970.0,68.0,28.970588235294116,X. Tân Lập (X. Ô Diên mới),Đăng hôm qua,,https://batdongsan.com.vn/ban-can-ho-chung-cu-xa-tan-lap-24-khu-nha-o-xa-tan-lap-cienco-5/hoi-mo-ban-1-5-15-15-cach-ai-hoc-cong-nghiep-4km-gan-vinhomes-an-phuong-pr45345569
Đan Phượng,Tân Tây Đô - chung cư - thoáng sáng - ở ngay - nhà đẹp - 80m2 - nhỉnh 4 tỷ. Vị trí đẹp ngay QL32,4980.0,80.0,62.25,X. Tân Lập (X. Ô Diên mới),Đăng hôm qua,,https://batdongsan.com.vn/ban-can-ho-chung-cu-duong-quoc-lo-32-xa-tan-lap-24-chung-cu-xphomes-tan-tay-do/o-thoang-sang-o-ngay-nha-ep-80m-nhinh-4-ty-vi-tri-ep-ngay-ql32-th-pr45343811
Đan Phượng,"Ngộp bank! Cần bán lại căn 1N+, Toà Sky Tower A, hướng đẹp. Chung cư Masterise Đan Phượng",,44.0,,X. Tân Hội (X. Ô Diên mới),Đăng 2 ngày trước,Có,https://batdongsan.com.vn/ban-can-ho-chung-cu-xa-tan-hoi-7-masteri-sky-quarter/suat-ngoai-giao-duplex-dien-tich-167m2-gia-59-tr-m2-ky-cdt-masterise-dan-phuong-pr44717876
Đan Phượng,"GẤP Đổi nhà nên cần bán căn CC 52,8m2, view đẹp, tầng trung, có nội thất,sẵn sổ, giá chỉ nhỉnh 3tỷ",3450.0,52.8,65.3409090909091,X. Tân Lập (X. Ô Diên mới),Đăng 2 ngày trước,,https://batdongsan.com.vn/ban-can-ho-chung-cu-duong-quoc-lo-32-xa-tan-lap-24-chung-cu-xphomes-tan-tay-do/gap-oi-nha-nen-ban-cc-52-8m2-view-ep-tang-trung-co-noi-that-san-so-gia-chi-nhinh-3ty-pr45291627
Đan Phượng,Mở bán chung cư cao cấp của Masterise Homes tại Vinhomes Đan Phượng với chiết khấu cực kỳ hấp dẫn!,,85.0,,X. Tân Hội (X. Ô Diên mới),Đăng 2 ngày trước,,https://batdongsan.com.vn/ban-can-ho-chung-cu-xa-tan-hoi-7-masteri-sky-quarter/mo-ban-cao-cap-cua-masterise-homes-tai-vinhomes-dan-phuong-voi-chiet-khau-cuc-ky-hap-dan-pr44561984
Đan Phượng,Chính thức nhận booking toà chung cư cuối cùng hạng sang với vị trí trung tâm tại Vin Đan Phượng,,62.0,,X. Tân Hội (X. Ô Diên mới),Đăng 2 ngày trước,,https://batdongsan.com.vn/ban-can-ho-chung-cu-xa-tan-hoi-7-masteri-sky-quarter/chinh-thuc-nhan-booking-2-toa-hang-sang-cua-cdt-masterise-homes-tai-vinhomes-dan-phuong-pr44548265
Đan Phượng,Mở bán tòa chung cư hạng sang cuối cùng của CĐT Masterise Homes tại Vinhomes Đan Phượng,5300.0,63.0,84.12698412698413,X. Tân Hội (X. Ô Diên mới),Đăng 2 ngày trước,,https://batdongsan.com.vn/ban-can-ho-chung-cu-xa-tan-hoi-7-masteri-sky-quarter/mo-ban-2-toa-hang-sang-cua-masterise-homes-tai-vinhomes-dan-phuong-pr44577422
