Khu vực,Tiêu đề,Giá (triệu),Diện tích (m²),Giá/m² (triệu),Vị trí,Ngày đăng,Cắt lỗ?,Link
Đống Đa,"QUỸ CĂN BÁN TẠI CHCC TÂN HOÀNG MINH - 36 HOÀNG CẦU 3PN, NT FULL, VIEW ĐẸP. LH:0906 961 ***",,135.0,,P. Ô Chợ Dừa (P. Ô Chợ Dừa mới),Đăng 1 tuần trước,,https://batdongsan.com.vn/ban-can-ho-chung-cu-pho-hoang-cau-phuong-o-cho-dua-d-le-pont-dor-hoang-cau/chinh-chu-ban-cao-cap-toa-tan-minh-dt-151m2-3-ngu-3-vs-full-do-11-9-ty-pr40367994
Đống Đa,"Quỹ 20 căn bán tại chung cư cao cấp Hateco Laroma, 2PN, 3PN, duplex, penthouse.0963 668 ***",,120.0,,P. Láng Thượng (P. Láng mới),Đăng 1 tuần trước,,https://batdongsan.com.vn/ban-can-ho-chung-cu-duong-huynh-thuc-khang-phuong-lang-thuong-hateco-laroma/quy-20-ban-tai-cao-cap-2pn-3pn-duplex-penthouse-12-ty-pr44518188
Đống Đa,Chính chủ bán 3 căn hộ tại Lancaster Lumianire 1152 Láng với diện tích 49m2-156m2-180m2 giá rẻ,,168.0,,P. Láng Thượng (P. Láng mới),Đăng 2 tuần trước,Có,https://batdongsan.com.vn/ban-can-ho-chung-cu-duong-lang-phuong-lang-thuong-lancaster-luminaire/chinh-chu-ban-3-tai-lumianire-1152-voi-dien-tich-49m2-156m2-180m2-gia-re-pr45194173
Đống Đa,Cần bán gấp căn hộ 3phòng ngủ tòa Mipec Tower 299 Tây Sơn Đống Đa 104.8m2 giá 10.5tỷ. LH0988 669 ***,10500.0,104.8,100.19083969465649,P. Trung Liệt (P. Ô Chợ Dừa mới),Đăng hôm nay,Có,https://batdongsan.com.vn/ban-can-ho-chung-cu-duong-tay-son-phuong-trung-liet-mipec-towers/ban-gap-3-phong-ngu-toa-tower-299-dong-da-105m2-gia-10-ty-lh-pr44956456
Đống Đa,Tập thể mặt phố Láng Hạ - Tầng 2 + 3 /sổ 65/90m2,5780.0,90.0,64.22222222222223,P. Láng Hạ (P. Đống Đa mới),Đăng hôm nay,,https://batdongsan.com.vn/ban-can-ho-chung-cu-pho-lang-ha-phuong-lang-ha-3/tap-the-mat-tang-2-3-so-65-90m2-pr44997099
Đống Đa,Tập thể tầng 1 Nam Thành Công Hoàng Ngọc Phách sổ 43m2 SD ~90m2 | 3PN khách + Bếp | 2WC,6660.0,90.0,74.0,P. Láng Hạ (P. Đống Đa mới),Đăng hôm nay,,https://batdongsan.com.vn/ban-can-ho-chung-cu-pho-hoang-ngoc-phach-phuong-lang-ha-3/tap-the-tang-1-nam-thanh-cong-so-43m-sd-90m-3pn-khach-bep-2wc-pr44998211
Đống Đa,"Bán căn hộ toà M5 Nguyễn Chí Thanh. Căn góc 149m2 3PN 2WC. Nhà ở luôn giá 12,2 tỷ",12200.0,149.0,81.87919463087249,P. Láng Hạ (P. Giảng Võ mới),Đăng hôm nay,,https://batdongsan.com.vn/ban-can-ho-chung-cu-duong-nguyen-chi-thanh-phuong-lang-ha-chung-cu-m5-nguyen-chi-thanh/ban-toa-goc-149m-3pn-2wc-nha-o-luon-gia-12-2-ty-pr45292668
Đống Đa,"Cần bán căn hộ Hà Thành Plaza 102 Thái Thịnh, DT 146,5m thiết kế 3PN 2WC full nội thất. Giá 11,3 tỷ",11300.0,146.5,77.13310580204778,P. Thịnh Quang (P. Đống Đa mới),Đăng hôm nay,,https://batdongsan.com.vn/ban-can-ho-chung-cu-pho-thai-thinh-phuong-thinh-quang-ha-thanh-plaza/ban-102-dt-146-5m-thiet-ke-3pn-2wc-full-noi-that-gia-11-5-ty-pr44602801
Đống Đa,"Tập thể Đặng Tiến Đông, Đống Đa, Tầng 3, Sổ to, 50m2 2pn ở luôn giá 4,15 tỷ",4150.0,50.0,83.0,P. Trung Liệt (P. Đống Đa mới),Đăng hôm nay,,https://batdongsan.com.vn/ban-can-ho-chung-cu-duong-dang-tien-dong-phuong-trung-liet-3/khu-vip-tap-the-dong-da-tang-3-so-to-50m2-2pn-nha-dep-nhinh-3-8-ty-pr44339957
Đống Đa,"#TẬP THỂ NAM THÀNH CÔNG, TẦNG 1 Ô TÔ ĐỖ CỬA, SỔ SIÊU KHỦNG, THOÁNG SÁNG",6200.0,60.0,103.33333333333333,P. Láng Hạ (P. Láng mới),Đăng hôm nay,,https://batdongsan.com.vn/ban-can-ho-chung-cu-duong-nam-thanh-cong-phuong-lang-ha-3/tap-the-tang-1-o-to-o-cua-so-sieu-khung-thoang-sang-pr45273693
Đống Đa,"Tập thể Phương Mai, Đống Đa, tầng 1, ô tô đỗ, 60m2 2pn đẹp ở luôn giá 3,68 tỷ",3680.0,60.0,61.333333333333336,P. Phương Mai (P. Kim Liên mới),Đăng hôm nay,,https://batdongsan.com.vn/ban-can-ho-chung-cu-pho-phuong-mai-phuong-phuong-mai-3/nhinh-3-ty-tap-the-ong-a-tang-1-o-to-o-60m2-2pn-nha-ep-pr45224851
Đống Đa,"Sốc! Căn góc 120m² Kim Liên, nhà mới tinh, đẹp y hình, 3PN, trung tâm quận Đống Đa, chỉ nhỉnh 4 tỷ!",,120.0,,P. Kim Liên,Đăng hôm nay,,https://batdongsan.com.vn/ban-can-ho-chung-cu-duong-kim-lien-phuong-kim-lien-3/soc-goc-120m-nha-moi-tinh-dep-y-hinh-3pn-trung-tam-quan-dong-da-chi-nhinh-4-ty-pr44949380
Đống Đa,"Tập thể rộng 110m2 có 3PN, 2WC khép kín sổ đỏ 40m2 giá 4,65 tỷ phố Lương Định Của, Đống Đa, Hà Nội",4650.0,110.0,42.27272727272727,P. Phương Mai (P. Kim Liên mới),Đăng hôm nay,,https://batdongsan.com.vn/ban-can-ho-chung-cu-pho-luong-dinh-cua-phuong-phuong-mai-3/ban-cc-view-dep-3pn-2wc-3-45-ty-80m2-o-dong-da-hn-hot-pr42720058
Đống Đa,"Bán căn hộ 102 Thái Thịnh Hà Thành Plaza - 115m2 - nhỉnh 10 tỷ 3 ngủ, căn góc nhà mới 100%",,115.0,,P. Thịnh Quang (P. Đống Đa mới),Đăng hôm nay,,https://batdongsan.com.vn/ban-can-ho-chung-cu-pho-thai-thinh-phuong-thinh-quang-ha-thanh-plaza/ban-102-115m2-10-ty-3-ngu-goc-nha-moi-100-pr44659171
Thanh Trì,Quỹ căn 3N trước khi bàn giao T6. Giá nhỉnh 6 tỷ . Ck 3% . Quà tặng 110tr,,100.0,,·X. Tứ Hiệp (X. Thanh Trì mới),Đăng hôm nay,,https://batdongsan.com.vn/ban-can-ho-chung-cu-duong-nguyen-bac-1-xa-tu-hiep-bluegem-tower/quy-3n-truoc-khi-ban-giao-t6-gia-nhinh-6-ty-ck-3-qua-tang-110tr-pr45304034
Thanh Trì,Mở bán đợt cuối quỹ ngoại giao căn 3PN BlueGem Tower giá 63.8 triệu/m2 full VAT trực tiếp CĐT,6700.0,105.0,63.80952380952381,X. Tứ Hiệp (X. Thanh Trì mới),Đăng hôm nay,,https://batdongsan.com.vn/ban-can-ho-chung-cu-duong-nguyen-bac-1-xa-tu-hiep-bluegem-tower/mo-ban-dot-cuoi-quy-ngoai-giao-3pn-blue-gem-gia-62-trieu-m2-full-vat-truc-tiep-cdt-pr44716087
Thanh Trì,Chính chủ để lại suất cán bộ 3PN mã 06A và 09B. Quà tặng tiền mặt 330 triệu. Hỗ trợ vay NH lãi 6.5%,,99.6,,X. Tứ Hiệp (X. Thanh Trì mới),Đăng hôm qua,,https://batdongsan.com.vn/ban-can-ho-chung-cu-duong-nguyen-bac-1-xa-tu-hiep-bluegem-tower/chinh-chu-e-lai-suat-bo-3pn-ma-06a-va-09b-qua-tang-tien-mat-330-trieu-tro-vay-nh-lai-6-5-pr45289005
Thanh Trì,"Chính chủ bán gấp căn hộ 67m2 tại Eco Green City, 6,1 tỷ, 2PN, 2WC, view đẹp",6100.0,67.0,91.04477611940298,X. Tân Triều (P. Thanh Liệt mới),Đăng 4 ngày trước,Có,https://batdongsan.com.vn/ban-can-ho-chung-cu-duong-nguyen-xien-xa-tan-trieu-eco-green-city/chinh-chu-ban-gap-67m2-tai-6-1-ty-2pn-2wc-view-ep-pr45254868
Thanh Trì,"Em Giang căn ngoại giao đặc biệt hiếm có, giá tốt nhất thị trường, hỗ trợ vay ngân hàng",7000.0,127.0,55.118110236220474,X. Tứ Hiệp (X. Thanh Trì mới),Đăng hôm nay,,https://batdongsan.com.vn/ban-can-ho-chung-cu-duong-tu-hiep-xa-tu-hiep-tecco-garden/em-giang-quy-ngoai-giao-dac-biet-hiem-co-gia-tot-nhat-thj-truong-tro-vay-ngan-hang-pr43874813
Thanh Trì,"CT8B Căn hộ chung cư 66m2 tầng trung, ban công Đông Nam mát mẻ",4250.0,66.0,64.39393939393939,X. Tả Thanh Oai (X. Đại Thanh mới),Đăng hôm nay,,https://batdongsan.com.vn/ban-can-ho-chung-cu-duong-phan-trong-tue-xa-ta-thanh-oai-chung-cu-dai-thanh/ct8b-66m2-tang-trung-ban-cong-ong-nam-mat-me-pr45276649
Thanh Trì,"Bán Căn hộ đẹp, nhiều tiện ích 3,22 tỷ, 47,3 m2 tại Căn hộ 1208 Tòa CT10A, Đại Thanh, Hà Nội",3220.0,47.3,68.07610993657505,X. Tả Thanh Oai (X. Đại Thanh mới),Đăng hôm qua,,https://batdongsan.com.vn/ban-can-ho-chung-cu-duong-phan-trong-tue-xa-ta-thanh-oai-chung-cu-dai-thanh/ban-ep-nhieu-tien-ich-3-22-ty-47-3-m2-tai-1208-toa-ct10a-ai-ha-noi-pr45268330
Thanh Trì,Chính chủ bán chung cư Eco Green 286 Nguyễn Xiển,6650.0,73.9,89.98646820027064,X. Tân Triều (P. Thanh Liệt mới),Đăng 1 tuần trước,,https://batdongsan.com.vn/ban-can-ho-chung-cu-duong-nguyen-xien-xa-tan-trieu-eco-green-city/chinh-chu-ban-286-xien-pr45202488
Thanh Trì,Căn hộ 2PN tòa Seren không gian sống cân bằng giữa thiên nhiên & đô thị,6850.0,76.33,89.74191012707979,TT. Văn Điển (P. Hoàng Liệt mới),Đăng 2 ngày trước,,https://batdongsan.com.vn/ban-can-ho-chung-cu-duong-ngoc-hoi-thi-tran-van-dien-greenera-southmark/bo-doi-1pn-truc-dep-06-co-dau-tu-sinh-loi-an-ly-tuong-tai-southmark-pr44399330
Thanh Trì,"6,5 tỷ SH căn 3 ngủ 100m2 trung tâm Thanh Trì, vay tối đa 80% GTCH, LS 6,5% 12T, tặng 1 chỉ vàng",6500.0,100.0,65.0,X. Tứ Hiệp (X. Thanh Trì mới),Đăng 3 ngày trước,,https://batdongsan.com.vn/ban-can-ho-chung-cu-duong-nguyen-bac-1-xa-tu-hiep-bluegem-tower/6-5-ty-sh-3-ngu-100m2-trung-tam-thanh-tri-vay-toi-a-80-gtch-ls-6-5-12t-tang-1-chi-vang-pr45269901
Thanh Trì,"Duy nhất 10 căn độc quyền 2PN và 2PN sân vườn, giá chỉ với 6,8tỷ trên/căn gọi ngay nhận thông tin",6800.0,76.3,89.1218872870249,TT. Văn Điển (P. Hoàng Liệt mới),Đăng 4 ngày trước,,https://batdongsan.com.vn/ban-can-ho-chung-cu-duong-ngoc-hoi-thi-tran-van-dien-greenera-southmark/2pn-khong-gian-song-chuan-cho-gia-dinh-tre-o-thuc-doc-ban-tai-southmark-pr45064013
Thanh Trì,"Chính chủ bán gấp căn hộ 67m2 tại Eco Green City, 6,1 tỷ, 2PN, 2WC, view đẹp",6100.0,67.0,91.04477611940298,X. Tân Triều (P. Thanh Liệt mới),Đăng 4 ngày trước,Có,https://batdongsan.com.vn/ban-can-ho-chung-cu-duong-nguyen-xien-xa-tan-trieu-eco-green-city/chinh-chu-ban-gap-67m2-tai-6-1-ty-2pn-2wc-view-ep-pr45254868
Thanh Trì,"Quỹ căn Ecogreen tháng 3. Các căn DT: 55m2 (4,6 tỷ). 67m2 (5,7 tỷ), 75m2 (6 tỷ), 95m2 ( 8,2 tỷ),...",6000.0,75.0,80.0,X. Tân Triều (P. Thanh Liệt mới),Đăng hôm nay,,https://batdongsan.com.vn/ban-can-ho-chung-cu-duong-nguyen-xien-xa-tan-trieu-eco-green-city/quy-ecogreen-thang-3-cac-dt-55m2-4-6-ty-67m2-5-7-ty-75m2-6-ty-95m2-8-2-ty-pr45304249
Thanh Trì,"Bán gấp 5 căn hộ 55m2 67m2, 75m2, 86m2, 95m2 giá tốt, ko chào ảo tại Eco Green City. Lh:0975 226 ***",5900.0,75.0,78.66666666666667,X. Tân Triều (P. Thanh Liệt mới),Đăng hôm nay,Có,https://batdongsan.com.vn/ban-can-ho-chung-cu-duong-nguyen-xien-xa-tan-trieu-eco-green-city/ban-gap-4-55m2-67m2-86m2-95m2-tai-ecogreen-gia-tu-2-6-ty-lh-pr39131730
Thanh Trì,MỞ BÁN CHUNG CƯ CT14 - FLORIA HỒNG HÀ ECOCITY. LH:0963 805 ***,80.0,63.0,1.2698412698412698,X. Tứ Hiệp (X. Thanh Trì mới),Đăng hôm nay,,https://batdongsan.com.vn/ban-can-ho-chung-cu-xa-tu-hiep-hong-ha-eco-city/mo-ban-ct14-floria-ecocity-lh-0963805921-pr45299201
Thanh Trì,Cần bán căn hộ 2 ngủ đẹp - đủ đồ - giá rẻ chuẩn chủ nhà báo tại chung cư Viện 103 KDT Văn Quán,5300.0,82.5,64.24242424242425,X. Tân Triều (P. Hà Đông mới),Đăng hôm nay,Có,https://batdongsan.com.vn/ban-can-ho-chung-cu-duong-yen-xa-xa-tan-trieu-chung-cu-vien-103/ban-2-ngu-ep-u-o-gia-re-chuan-chu-nha-bao-tai-103-kdt-van-quan-pr45297887
Thanh Trì,"Chỉ 8x tr/m2, độc quyền căn 47m2 4 tỷ. Sẵn 1,2t ký HĐMB, vay 0% 24 tháng, ck tới 16%, Q tặng 400tr",4000.0,47.0,85.1063829787234,TT. Văn Điển (P. Hoàng Liệt mới),Đăng hôm qua,,https://batdongsan.com.vn/ban-can-ho-chung-cu-duong-ngoc-hoi-thi-tran-van-dien-greenera-southmark/chi-8x-tr-m2-oc-quyen-47m2-4-ty-san-1-2t-ky-h-mb-vay-0-24-thang-ck-toi-16-q-tang-400tr-pr45271308
Thanh Trì,"Chuẩn giá như ảnh: Bán căn 75m2 (2N2WC) giá 6.3 tỷ, sẵn sổ tại Eco Green City Nguyễn Xiển",6300.0,75.0,84.0,X. Tân Triều (P. Thanh Liệt mới),Đăng 2 ngày trước,,https://batdongsan.com.vn/ban-can-ho-chung-cu-duong-nguyen-xien-xa-tan-trieu-eco-green-city/chuan-gia-nhu-anh-ban-76m2-2n2wc-full-noi-that-san-so-tai-gia-6-5-ty-pr45214585
Thanh Trì,"Quỹ căn tháng 6-2025 Eco Green City, 67m2- 5.5tỷ, 75m2-6.1tỷ, 86m2-7.6tỷ, 95m2-8tỷ view thoáng mát",6100.0,75.0,81.33333333333333,X. Tân Triều (P. Thanh Liệt mới),Đăng 2 ngày trước,,https://batdongsan.com.vn/ban-can-ho-chung-cu-duong-nguyen-xien-xa-tan-trieu-eco-green-city/quy-thang-6-2025-67m2-4-5ty-75m2-5ty-86m2-6-2ty-95m2-6-5ty-view-thoang-mat-pr43242062
Thanh Trì,SM2.0910 giá tốt nhất dự án | hàng giai đoạn đầu biên độ sinh lời cao,6500.0,79.3,81.9672131147541,TT. Văn Điển (P. Hoàng Liệt mới),Đăng 2 ngày trước,,https://batdongsan.com.vn/ban-can-ho-chung-cu-duong-ngoc-hoi-thi-tran-van-dien-greenera-southmark/sm2-0910-gia-tot-nhat-du-an-hang-giai-doan-dau-bien-do-sinh-loi-cao-pr45109782
Thanh Trì,3PN dual - key Lavish | Linh hoạt cho đa thế hệ Tối ưu giá trị sinh lời,10000.0,124.5,80.32128514056225,TT. Văn Điển (P. Hoàng Liệt mới),Đăng 2 ngày trước,,https://batdongsan.com.vn/ban-can-ho-chung-cu-duong-ngoc-hoi-thi-tran-van-dien-greenera-southmark/sieu-pham-truc-vang-duy-nhat-2pn-dep-nhat-du-an-chinh-thuc-tai-xuat-pr44399571
Thanh Trì,Bán suất ngoại giao đặc biệt căn 3PN diện tích 105m2 giá chỉ hơn 63 triệu/m2 giảm sâu tới 260 triệu,6700.0,105.0,63.80952380952381,X. Tứ Hiệp (X. Thanh Trì mới),Đăng 3 ngày trước,,https://batdongsan.com.vn/ban-can-ho-chung-cu-duong-nguyen-bac-1-xa-tu-hiep-bluegem-tower/ban-suat-ngoai-giao-ac-biet-3pn-dien-tich-105-m2-gia-chi-63-trieu-m2-giam-sau-toi-260-trieu-pr45272154
Thanh Trì,"BQL gửi bán CH 67m2, 75m2, 86m2, 95m2 tòa EcoGreen. Full đồ, có sổ đỏ phù hợp ở lâu dài, Giá thật.",8300.0,95.0,87.36842105263158,X. Tân Triều (P. Thanh Liệt mới),Đăng 3 ngày trước,,https://batdongsan.com.vn/ban-can-ho-chung-cu-duong-nguyen-xien-xa-tan-trieu-eco-green-city/bql-gui-ban-ch-67m2-75m2-86m2-95m2-toa-ecogreen-full-o-co-so-o-phu-hop-o-lau-dai-gia-that-pr45271054
Thanh Trì,"Tôi cần bán chung cư Viện 103, Văn Quán 84m2, 2 phòng ngủ, 2 vs, giá tốt",4800.0,84.0,57.142857142857146,X. Tân Triều (P. Hà Đông mới),Đăng 3 ngày trước,,https://batdongsan.com.vn/ban-can-ho-chung-cu-duong-yen-xa-xa-tan-trieu-chung-cu-vien-103/toi-ban-103-gan-van-quan-112m2-3-ngu-2-vs-gia-tot-pr44105555
Thanh Trì,BÁN CHUNG CƯ TABUDEC PLAZA 3 PHÒNG NGỦ NỘI THẤT CAO CẤP TẦNG ĐẸP LH:0937 893 ***,7070.0,104.0,67.98076923076923,X. Tả Thanh Oai (X. Đại Thanh mới),Đăng 4 ngày trước,,https://batdongsan.com.vn/ban-can-ho-chung-cu-duong-phan-trong-tue-xa-ta-thanh-oai-tabudec-plaza/ban-3-phong-ngu-noi-that-cao-cap-tang-ep-lh-0937893286-pr45203746
Đan Phượng,Quỹ Căn Nội Bộ Toà 22 Tầng Mở Bán Sớm. Giá 7xTr/m2. CK 14%. Vay 70% GTCH. Masterise Đan Phượng,5400.0,60.0,90.0,X. Tân Hội (X. Ô Diên mới),Đăng 3 ngày trước,,https://batdongsan.com.vn/ban-can-ho-chung-cu-duong-tay-thang-long-xa-tan-hoi-7-vinhomes-wonder-city/quy-noi-bo-ban-som-masterise-toa-16-22-tang-vay-70-gtch-du-an-dan-phuong-pr44717669
Đan Phượng,"Quỹ căn 2 - 3 ngủ giá tốt nhất Vinhomes Đan Phượng chỉ từ 7x tr/m2, cơ hội đầu tư chắc thắng",4730.0,60.0,78.83333333333333,X. Tân Hội (X. Ô Diên mới),Đăng hôm nay,,https://batdongsan.com.vn/ban-can-ho-chung-cu-xa-tan-hoi-7-masteri-sky-quarter/quy-2-3-ngu-gia-tot-nhat-vinhomes-an-phuong-chi-tu-7x-tr-m2-co-au-tu-chac-thang-pr45165401
Đan Phượng,"Ngộp bank! Cần bán lại căn 1N+, Toà Sky Tower A, hướng đẹp. Chung cư Masterise Đan Phượng",,44.0,,X. Tân Hội (X. Ô Diên mới),Đăng hôm nay,Có,https://batdongsan.com.vn/ban-can-ho-chung-cu-xa-tan-hoi-7-masteri-sky-quarter/suat-ngoai-giao-duplex-dien-tich-167m2-gia-59-tr-m2-ky-cdt-masterise-dan-phuong-pr44717876
Đan Phượng,"Độc quyền căn 3 ngủ, 88m2, ký CĐT, hướng Tây tứ mệnh. Chung cư Masterise Đan Phượng",,88.0,,X. Tân Hội (X. Ô Diên mới),Đăng hôm nay,,https://batdongsan.com.vn/ban-can-ho-chung-cu-xa-tan-hoi-7-masteri-sky-quarter/doc-quyen-3-ngu-88m2-ky-cdt-huong-tay-tu-menh-masterise-dan-phuong-pr44818946
Đan Phượng,Cần bán căn góc 2 ngủ + view bể bơi tầng trung giá tốt nhất thị trường - Toà 16 tầng,,66.0,,X. Tân Hội (X. Ô Diên mới),Đăng hôm nay,,https://batdongsan.com.vn/ban-can-ho-chung-cu-duong-422-xa-tan-hoi-7-masteri-sky-quarter/ban-goc-2-ngu-view-be-boi-tang-trung-gia-tot-nhat-thi-truong-toa-16-tang-pr44790345
Đan Phượng,"Bán gấp căn góc toà CT1A Tân Tây Đô, 2PN - 2WC, sổ đỏ đầy đủ, full đồ đẹp. LH:0387 720 ***",,76.0,,X. Tân Lập (X. Ô Diên mới),Đăng hôm nay,Có,https://batdongsan.com.vn/ban-can-ho-chung-cu-duong-quoc-lo-32-xa-tan-lap-24-khu-do-thi-moi-tan-tay-do/ban-55m-toa-ct2a-so-san-full-de-lai-gia-ban-1-ty-4xx-lh-pr38900896
Đan Phượng,"Cần bán căn hộ 80m2 , giá rẻ nhất",,80.0,,X. Tân Lập (X. Ô Diên mới),Đăng hôm nay,Có,https://batdongsan.com.vn/ban-can-ho-chung-cu-duong-quoc-lo-32-xa-tan-lap-24-khu-do-thi-moi-tan-tay-do/ban-goc-dep-full-cho-khach-thien-chi-pr44295299
Đan Phượng,"Bán căn hộ 2pn full nội thất toà HHA, KĐT Tân tây đô",,62.0,,X. Tân Lập (X. Ô Diên mới),Đăng hôm nay,,https://batdongsan.com.vn/ban-can-ho-chung-cu-duong-quoc-lo-32-xa-tan-lap-24-khu-do-thi-moi-tan-tay-do/ban-2pn-full-noi-that-toa-hha-kdt-do-pr44674904
Đan Phượng,"Suất ngoại giao căn duplex, diện tích 162m2/3PN, giá 9 tỷ. Chung cư Masterise Đan Phượng",9000.0,162.0,55.55555555555556,X. Tân Hội (X. Ô Diên mới),Đăng hôm nay,,https://batdongsan.com.vn/ban-can-ho-chung-cu-duong-tay-thang-long-xa-tan-hoi-7-vinhomes-wonder-city/suat-ngoai-giao-simplex-dien-tich-94m-2pn-gia-6-ty-masterise-dan-phuong-pr44497739
Đan Phượng,"Không lo được tài chính, cần bán lại căn 2 phòng ngủ, toà Sky Tower A. Chung cư Vin Đan Phượng",,60.0,,X. Tân Hội (X. Ô Diên mới),Đăng hôm nay,,https://batdongsan.com.vn/ban-can-ho-chung-cu-duong-tay-thang-long-xa-tan-hoi-7-vinhomes-wonder-city/khong-lo-duoc-tai-chinh-ban-lai-2-phong-ngu-toa-sky-tower-a-vin-dan-phuong-pr44818935
Đan Phượng,"Căn Tân Tây Đô 79.3m2, 3 ngủ, 2 vệ sinh. Lô góc. Tặng full nội thất. Giá 4 tỷ 9. LH0989 388 ***",4900.0,79.3,61.7906683480454,X. Tân Lập (X. Ô Diên mới),Đăng hôm nay,,https://batdongsan.com.vn/ban-can-ho-chung-cu-duong-quoc-lo-32-xa-tan-lap-24-khu-do-thi-moi-tan-tay-do/79-3m-3-ngu-2-ve-sinh-goc-tang-full-noi-that-gia-4-ty-9-lh-pr44650996
Đan Phượng,"Bán CC 2PN 2WC tại Quốc lộ 32, Tân Lập, Huyện Đan Phượng, 4,25 tỷ, 80m2 view đẹp",4250.0,80.0,53.125,X. Tân Lập (X. Ô Diên mới),Đăng hôm nay,,https://batdongsan.com.vn/ban-can-ho-chung-cu-duong-quoc-lo-32-xa-tan-lap-24-20/ban-cc-2pn-2wc-tai-32-huyen-an-phuong-4-25-ty-80m2-view-ep-pr45297265
Đan Phượng,"CẦN BÁN CĂN GÓC 3 NGỦ, 3 VỆ SINH CHUNG CƯ TÂN TÂY ĐÔ.",,110.0,,X. Tân Lập (X. Ô Diên mới),Đăng hôm nay,,https://batdongsan.com.vn/ban-can-ho-chung-cu-duong-quoc-lo-32-xa-tan-lap-24-20/ban-goc-3-ngu-3-ve-sinh-tay-o-pr45234018
Đan Phượng,Căn hộ duplex tầng thấp Masteri Sky Quarter đẳng cấp sống như biệt thự trên không giá chỉ 10 tỷ,10000.0,176.0,56.81818181818182,X. Tân Hội (X. Ô Diên mới),Đăng hôm nay,,https://batdongsan.com.vn/ban-can-ho-chung-cu-xa-tan-hoi-7-masteri-sky-quarter/duplex-tang-thap-dang-cap-song-nhu-biet-thu-tren-khong-gia-chi-10-ty-pr44533905
Đan Phượng,"Bán căn hộ chung cư 3PN đầy đủ nội thất, view đẹp giá tốt - Tân Tây Đô, 95m2, Đan Phượng, Hà Nội",,95.0,,X. Tân Lập (X. Ô Diên mới),Đăng hôm qua,,https://batdongsan.com.vn/ban-can-ho-chung-cu-duong-quoc-lo-32-xa-tan-lap-24-khu-do-thi-moi-tan-tay-do/ban-3pn-day-du-noi-that-view-dep-gia-tot-95m2-dan-phuong-ha-noi-pr43188421
Đan Phượng,"Tôi cần Bán căn góc 52,8m2-2PN - 2WC , view đông nam mát mẻ.toà XPHOMES Star - Tân Tây Đô.",,52.8,,X. Tân Lập (X. Ô Diên mới),Đăng hôm qua,,https://batdongsan.com.vn/ban-can-ho-chung-cu-duong-quoc-lo-32-xa-tan-lap-24-chung-cu-xphomes-tan-tay-do/ban-goc-59m2-2pn-2wc-toa-xphome-star-so-san-gia-ban-3-ty-1x-pr42385474
Đan Phượng,Chính chủ cần bán nhanh căn 3 ngủ toà CT2A KDT Tân Tây Đô. Thiết kế 3 ngủ xịn full đồ. Lh 098191588,5150.0,85.0,60.588235294117645,X. Tân Lập (X. Ô Diên mới),Đăng hôm qua,,https://batdongsan.com.vn/ban-can-ho-chung-cu-duong-quoc-lo-32-xa-tan-lap-24-khu-do-thi-moi-tan-tay-do/chinh-chu-ban-nhanh-3-ngu-toa-ct2a-kdt-thiet-ke-3-ngu-xin-full-lh-098191588-pr45038040
Đan Phượng,"GẤP Đổi nhà nên cần bán căn CC 52,8m2, view đẹp, tầng trung, có nội thất,sẵn sổ, giá chỉ nhỉnh 3tỷ",3450.0,52.8,65.3409090909091,X. Tân Lập (X. Ô Diên mới),Đăng hôm qua,,https://batdongsan.com.vn/ban-can-ho-chung-cu-duong-quoc-lo-32-xa-tan-lap-24-chung-cu-xphomes-tan-tay-do/gap-oi-nha-nen-ban-cc-52-8m2-view-ep-tang-trung-co-noi-that-san-so-gia-chi-nhinh-3ty-pr45291627
Đan Phượng,"BÁN CĂN GÓC 2 NGỦ XP HOMES STAR TÂN TÂY ĐÔ Diện tích 52,8m thiết kế 2 phòng ngủ, giá 3,x0979 898 ***",3790.0,52.9,71.64461247637051,X. Tân Lập (X. Ô Diên mới),Đăng hôm qua,,https://batdongsan.com.vn/ban-can-ho-chung-cu-duong-quoc-lo-32-xa-tan-lap-24-chung-cu-xphomes-tan-tay-do/ban-goc-2-ngu-xp-homes-star-o-dien-tich-52-8m-thiet-ke-2-phong-ngu-gia-3-x-0979898648-pr45290590
Đan Phượng,"Chính chủ gửi bán căn hộ chung cư tòa HHA, Xphomes, Tân Tây Đô, Ô Diên, HN",3950.0,62.0,63.70967741935484,X. Tân Lập (X. Ô Diên mới),Đăng hôm qua,,https://batdongsan.com.vn/ban-can-ho-chung-cu-duong-quoc-lo-32-xa-tan-lap-24-khu-do-thi-moi-tan-tay-do/chinh-chu-gui-ban-toa-hha-xphomes-o-dien-hn-pr44812859
