Khu vực,Tiêu đề,Giá (triệu),Diện tích (m²),Giá/m² (triệu),Vị trí,Ngày đăng,Cắt lỗ?,Link
Đan Phượng,"Chính chủ bán căn hộ chung cư Tân Tây Đô 77m2, full đồ sẵn ở",4700.0,77.0,61.03896103896104,X. Tân Lập (X. Ô Diên mới),Đăng hôm qua,,https://batdongsan.com.vn/ban-can-ho-chung-cu-duong-quoc-lo-32-xa-tan-lap-24-chung-cu-xphomes-tan-tay-do/chinh-chi-ban-77m2-full-san-o-pr44778542
Đan Phượng,Tôi chính chủ cần bán căn góc 90m2 3N 2VS toà xpHOMES Star full nội thất mới 100% chưa ai ở bao giờ,,90.0,,X. Tân Lập (X. Ô Diên mới),Đăng hôm qua,,https://batdongsan.com.vn/ban-can-ho-chung-cu-duong-quoc-lo-32-xa-tan-lap-24-chung-cu-xphomes-tan-tay-do/toi-chinh-chu-ban-goc-90m2-3n-2vs-toa-star-full-noi-that-moi-100-chua-ai-o-bao-gio-pr44923268
Đan Phượng,"CẦN BÁN CĂN GÓC 3 NGỦ, 3 VỆ SINH CHUNG CƯ TÂN TÂY ĐÔ.",,110.0,,X. Tân Lập (X. Ô Diên mới),Đăng hôm qua,,https://batdongsan.com.vn/ban-can-ho-chung-cu-duong-quoc-lo-32-xa-tan-lap-24-20/ban-goc-3-ngu-3-ve-sinh-tay-o-pr45234018
Đan Phượng,Hoàn thiện hồ sơ mua NOXH dự án tân lập mở bán tháng 5/2026 giá đẹp,,65.0,,X. Tân Lập (X. Ô Diên mới),Đăng 2 ngày trước,,https://batdongsan.com.vn/ban-can-ho-chung-cu-duong-quoc-lo-32-xa-tan-lap-24-khu-nha-o-xa-tan-lap-cienco-5/hoan-thien-so-mua-noxh-du-an-mo-ban-thang-5-2026-gia-ep-pr45150818
Đan Phượng,"Không lo được tài chính, cần bán lại căn 2 phòng ngủ, toà Sky Tower A. Chung cư Vin Đan Phượng",,60.0,,X. Tân Hội (X. Ô Diên mới),Đăng 2 ngày trước,,https://batdongsan.com.vn/ban-can-ho-chung-cu-duong-tay-thang-long-xa-tan-hoi-7-vinhomes-wonder-city/khong-lo-duoc-tai-chinh-ban-lai-2-phong-ngu-toa-sky-tower-a-vin-dan-phuong-pr44818935
Đan Phượng,"Ngộp bank! Cần bán lại căn 1N+, Toà Sky Tower A, hướng đẹp. Chung cư Masterise Đan Phượng",,44.0,,X. Tân Hội (X. Ô Diên mới),Đăng 2 ngày trước,Có,https://batdongsan.com.vn/ban-can-ho-chung-cu-xa-tan-hoi-7-masteri-sky-quarter/suat-ngoai-giao-duplex-dien-tich-167m2-gia-59-tr-m2-ky-cdt-masterise-dan-phuong-pr44717876
Đan Phượng,Quỹ căn Masteri - Vinhomes Đan Phượng. Tòa 22 tầng cuối cùng. Giá chỉ từ 7x triệu/m²,4690.0,67.0,70.0,X. Tân Hội (X. Ô Diên mới),Đăng 2 ngày trước,,https://batdongsan.com.vn/ban-can-ho-chung-cu-xa-tan-hoi-7-masteri-sky-quarter/vinhomes-dan-phuong-co-tot-nhat-booking-som-chon-dep-ck-16-an-han-toi-36-thang-pr44755109
Đan Phượng,Nhà ở xã hội Tân Lập- Nhà ở xã hội Ô DIÊN TÂN LẬP- DỰ KIẾN THU HỒ SƠ 1/5-15/5,,64.0,,X. Tân Lập (X. Ô Diên mới),Đăng 3 ngày trước,,https://batdongsan.com.vn/ban-can-ho-chung-cu-xa-tan-lap-24-khu-nha-o-xa-tan-lap-cienco-5/hoi-hoi-dien-du-kien-thu-so-1-5-15-5-pr45274604
Đan Phượng,"Độc quyền căn 3 ngủ, 88m2, ký CĐT, hướng Tây tứ mệnh. Chung cư Masterise Đan Phượng",,88.0,,X. Tân Hội (X. Ô Diên mới),Đăng 3 ngày trước,,https://batdongsan.com.vn/ban-can-ho-chung-cu-xa-tan-hoi-7-masteri-sky-quarter/doc-quyen-3-ngu-88m2-ky-cdt-huong-tay-tu-menh-masterise-dan-phuong-pr44818946
