Khu vực,Tiêu đề,Giá (triệu),Diện tích (m²),Giá/m² (triệu),Vị trí,Ngày đăng,Cắt lỗ?,Link
Tây Hồ,"Chủ đầu tư chính thức ra hàng Celestine WestLake căn 2-3 ngủ đẹp nhất Hồ Tây, chiết khấu 10%, 0% LS",,84.0,,P. Phú Thượng (P. Hồng Hà mới),Đăng hôm qua,,https://batdongsan.com.vn/ban-can-ho-chung-cu-phuong-phu-thuong-1-celestine-westlake/chu-dau-tu-chinh-thuc-ra-hang-2-3-ngu-dep-nhat-tay-ch-khau-10-0-ls-pr43946422
Tây Hồ,Suất ngoại giao căn Duplex 4PN Noble Crystal Tây Hồ vị trí view đẹp giá tốt nhất hiện nay,37120.0,220.5,168.34467120181407,P. Phú Thượng,Đăng hôm qua,,https://batdongsan.com.vn/ban-can-ho-chung-cu-phuong-phu-thuong-1-noble-crystal-tay-ho/suat-ngoai-giao-duplex-4pn-vi-tri-view-ep-gia-tot-nhat-hien-nay-pr45292396
Tây Hồ,Quỹ căn tầng đẹp giá tốt chung cư The Reflection Westlake Tây Hồ liên hệ:0822 238 ***,,60.0,,P. Phú Thượng (P. Hồng Hà mới),Đăng hôm qua,,https://batdongsan.com.vn/ban-can-ho-chung-cu-duong-vo-chi-cong-phuong-phu-thuong-1-the-reflection-west-lake/quy-tang-ep-gia-tot-westlake-tay-lien-he-0822238686-pr45220058
Tây Hồ,Tưng bừng cất nóc công bố quỹ căn giá tốt nhất tại Celestine Westlake view Hồ Tây T3/2026,13600.0,85.0,160.0,P. Phú Thượng (P. Tây Hồ mới),Đăng hôm qua,,https://batdongsan.com.vn/ban-can-ho-chung-cu-duong-vo-chi-cong-phuong-phu-thuong-1-celestine-westlake/quy-mat-chua-tung-bo-cuoi-cung-tai-view-tay-t12-2025-pr44697931
Tây Hồ,"Bán và bàn giao căn hộ tinh hoa Tây Hồ, đơn vị quản lý Soho & Heritage 677 Lạc Long Quân thông báo",,94.0,,P. Phú Thượng (P. Hồng Hà mới),Đăng hôm qua,,https://batdongsan.com.vn/ban-can-ho-chung-cu-duong-lac-long-quan-phuong-phu-thuong-1-heritage-west-lake/ban-va-ban-giao-tinh-hoa-tay-don-vi-ly-soho-677-thong-bao-pr44398971
Tây Hồ,"CHÍNH CHỦ BÁN CH 1PN ĐẲNG CẤP TẠI NOBLE CRYSTAL  TÂY HỒ TÂY, CIPUTRA",12500.0,76.0,164.47368421052633,P. Phú Thượng,Đăng 2 ngày trước,,https://batdongsan.com.vn/ban-can-ho-chung-cu-phuong-phu-thuong-1-noble-crystal-tay-ho/chinh-chu-ban-ch-1pn-ang-cap-tai-tay-ciputra-pr45285995
Tây Hồ,"Căn hộ Ciputra DT 153m2 04PN BC Đông Nam, đủ đồ giá rẻ 13.3 tỷ. LH em Hường0936 670 ***",13300.0,153.0,86.9281045751634,P. Phú Thượng,Đăng 2 ngày trước,Có,https://batdongsan.com.vn/ban-can-ho-chung-cu-phuong-phu-thuong-1-khu-do-thi-nam-thang-long-ciputra/dt-153m-04pn-bc-ong-u-o-gia-re-13-3-ty-lh-em-huong-0936-670-899-pr45284018
Tây Hồ,Quỹ căn giá tốt 2PN - 3PN view Hồ Tây + Starlake tại HDI Tây Hồ (Võ Chí Công). Có slot ô tô. Sẵn sổ,8000.0,73.0,109.58904109589041,P. Xuân La (P. Xuân Đỉnh mới),Đăng 2 ngày trước,,https://batdongsan.com.vn/ban-can-ho-chung-cu-phuong-xuan-la-tay-ho-residence/hdi-vo-chi-cong-ban-goc-3pn-107-2m2-tang-cao-view-tron-so-lau-dai-gia-1x-ty-pr44825778
Tây Hồ,"Cập nhật danh sách bán căn hộ Ciputra KĐT Nam Thăng Long mới nhất tháng 032026 - hàng đẹp, giá tốt",13000.0,123.0,105.6910569105691,P. Phú Thượng,Đăng 2 ngày trước,,https://batdongsan.com.vn/ban-can-ho-chung-cu-duong-lac-long-quan-phuong-phu-thuong-1-khu-do-thi-nam-thang-long-ciputra/cap-nhat-bang-gia-ban-kdt-moi-nhat-3-2024-lh-pr39356340
Tây Hồ,Quỹ 30 căn hộ 1PN - 2PN - 3PN - PENTHOUSE Cần Bán tại chung cư The Prime Starlake - Tây Hồ Tây,16000.0,84.48,189.39393939393938,P. Xuân La (P. Xuân Đỉnh mới),Đăng 3 ngày trước,,https://batdongsan.com.vn/ban-can-ho-chung-cu-duong-vo-chi-cong-phuong-xuan-la-kdt-tay-ho-tay-starlake-ha-noi/quy-30-1pn-2pn-3pn-penthouse-ban-tai-the-prime-tay-pr45210776
Hoài Đức,"BOOKING NHẬN ƯU ĐÃI LỚN IMPERIA SKY PARK CẠNH VINHOMES SMART CITY, ĐỦ QUỸ CĂN STUDIO - SKY VILLAS",,52.5,,·X. An Khánh,Đăng hôm qua,,https://batdongsan.com.vn/ban-can-ho-chung-cu-duong-dai-lo-thang-long-xa-an-khanh-4-imperia-sky-park/booking-nhan-uu-ai-lon-canh-vinhomes-smart-city-u-quy-studio-villas-pr45156054
Hoài Đức,"Độc quyền bán Căn hộ cao cấp 2PN, 60m2 tầng trung, BC Đông Nam view công viên nội khu Imperia MIK",,60.0,,·X. An Khánh,Đăng hôm qua,,https://batdongsan.com.vn/ban-can-ho-chung-cu-duong-dai-lo-thang-long-xa-an-khanh-4-imperia-sky-park/ban-cc-2pn-60m2-tang-trung-gia-uu-ai-ha-noi-pr45277657
Hoài Đức,IMPERIA SKY PARK NAM AN KHÁNH  NHẬN BOOKING SỚM | CĂN HỘ CAO CẤP SỞ HỮU LÂU DÀI,5020.0,54.0,92.96296296296296,·X. An Khánh,Đăng hôm qua,,https://batdongsan.com.vn/ban-can-ho-chung-cu-duong-dai-lo-thang-long-xa-an-khanh-4-imperia-sky-park/nam-nhan-booking-som-cao-cap-so-huu-lau-dai-pr45290879
Hoài Đức,Bán gấp căn 2 ngủ 83m2 - đã có sổ đỏ - view đẹp và thoáng - xem nhà 24/24,6300.0,83.0,75.90361445783132,X. Di Trạch (X. Hoài Đức mới),Đăng hôm nay,Có,https://batdongsan.com.vn/ban-can-ho-chung-cu-duong-32-xa-di-trach-chung-cu-the-wisteria/ban-gap-2-ngu-83m2-a-co-so-o-view-ep-va-thoang-xem-nha-24-24-pr45271737
Hoài Đức,Bán căn hộ 139m2 chung cư Wisteria - ban công Đông Nam - có hỗ trợ bank 70%,9100.0,139.0,65.46762589928058,X. Di Trạch (X. Hoài Đức mới),Đăng hôm qua,,https://batdongsan.com.vn/ban-can-ho-chung-cu-duong-32-xa-di-trach-chung-cu-the-wisteria/ban-138m2-ban-cong-ong-nam-co-tro-bank-70-pr45271497
Hoài Đức,"Bán nhanh căn hộ 2PN2VS toà Gemek 2 An Khánh view Vinsmart 66m2 chỉ 4,4 tỷ",4400.0,66.0,66.66666666666667,X. An Khánh,Đăng 2 ngày trước,,https://batdongsan.com.vn/ban-can-ho-chung-cu-duong-le-trong-tan-xa-an-khanh-4-gemek-premium/chinh-chu-ban-2pn2vs-toa-2-view-vinsmart-66m-chi-4-4-ty-pr45251955
Hoài Đức,Căn góc 3 ngủ - diện tích 114m2 - view đẹp hướng mát - có sổ đỏ,7600.0,114.0,66.66666666666667,X. Di Trạch (X. Hoài Đức mới),Đăng 6 ngày trước,,https://batdongsan.com.vn/ban-can-ho-chung-cu-duong-32-xa-di-trach-chung-cu-the-wisteria/goc-3-ngu-dien-tich-114m2-view-ep-huong-mat-co-so-o-pr45189866
Hoài Đức,"MỞ BÁN CHUNG CƯ IMPERIA SKY PARK 1-2-3PN GẦN VINHOMES SMART CITY TÂY MỖ, CÁCH SVĐ MỸ ĐÌNH CHỈ 8PH",,42.0,,·X. An Khánh,Đăng hôm qua,,https://batdongsan.com.vn/ban-can-ho-chung-cu-duong-dai-lo-thang-long-xa-an-khanh-4-imperia-sky-park/mo-ban-1-2-3pn-ngay-canh-vinhomes-smart-city-tay-mo-cach-sv-my-inh-chi-7-phut-pr45253829
Hoài Đức,Quỹ căn studio- 1PN-2PN-3PN tòa Sky1 và Sky2 không chênh kí trực tiếp chủ đầu tư MIK Group,4080.0,43.0,94.88372093023256,·X. An Khánh,Đăng hôm qua,,https://batdongsan.com.vn/ban-can-ho-chung-cu-duong-dai-lo-thang-long-xa-an-khanh-4-imperia-sky-park/quy-studio-1pn-2pn-3pn-toa-sky1-va-sky2-khong-chenh-ki-truc-tiep-chu-au-tu-mik-group-pr45179876
Hoài Đức,Chỉ từ 419tr sở hữu căn hộ MIK An Khánh cạnh Vinhomes Smart City. Liên hệ0888 999 ***,,28.0,,·X. An Khánh,Đăng 2 ngày trước,,https://batdongsan.com.vn/ban-can-ho-chung-cu-duong-dai-lo-thang-long-xa-an-khanh-4-imperia-sky-park/chi-tu-419tr-so-huu-mik-canh-vinhomes-smart-city-lien-he-0888999819-pr45254080
Hoài Đức,Anh Chị Quan Tâm dự án MIK An Khánh tuyệt đối đừng bỏ qua bài phân tích này,6260.0,68.0,92.05882352941177,·X. An Khánh,Đăng 2 ngày trước,,https://batdongsan.com.vn/ban-can-ho-chung-cu-duong-dai-lo-thang-long-xa-an-khanh-4-imperia-sky-park/anh-chi-quan-tam-du-mik-tuyet-oi-ung-bo-qua-bai-phan-tich-nay-pr45271137
Hoài Đức,Chỉ từ hơn 400 triệu sở hữu căn hộ Imperia Sky Park - MIK An Khánh. Kí trực tiếp với CĐT MIK Group,,43.0,,·X. An Khánh,Đăng 2 ngày trước,,https://batdongsan.com.vn/ban-can-ho-chung-cu-duong-dai-lo-thang-long-xa-an-khanh-4-imperia-sky-park/chi-tu-hon-400trieu-so-huu-mik-ki-truc-tiep-voi-c-t-mik-group-pr45255208
Hoài Đức,Booking nhận ưu đãi quỹ căn studio-1PN-2PN-3PN tòa Sky1 và Sky2 kí trực tiếp Chủ đầu tư MIK GROUP,,55.0,,·X. An Khánh,Đăng 4 ngày trước,,https://batdongsan.com.vn/ban-can-ho-chung-cu-duong-dai-lo-thang-long-xa-an-khanh-4-imperia-sky-park/booking-nhan-uu-ai-quy-studio-1pn-2pn-3pn-toa-sky1-va-sky2-ki-truc-tiep-chu-au-tu-mik-group-pr45218771
Hoài Đức,"Sở hữu chung cư Flame Vine khu đô thị Hinode Royal Park 2PN, 2WC chỉ từ 5.2 tỷ. Liên hệ0985 106 ***",,73.0,,·X. Di Trạch (X. Hoài Đức mới),Đăng 1 tuần trước,,https://batdongsan.com.vn/ban-can-ho-chung-cu-duong-quoc-lo-32-xa-di-trach-hinode-royal-park/so-huu-flame-vine-khu-o-thi-2pn-2wc-chi-tu-5-2-ty-lien-he-0985106176-pr45241847
Hoài Đức,Booking quỹ ngoại giao căn hộ cao cấp The Flame Vine HH03 Hinode Royal Park,,75.0,,·X. Di Trạch (X. Hoài Đức mới),Đăng 1 tuần trước,,https://batdongsan.com.vn/ban-can-ho-chung-cu-duong-vanh-dai-3-5-xa-di-trach-the-flame-vine/quy-ngoai-giao-cao-cap-hh03-hinode-royal-park-pr45239972
Hoài Đức,"Quỹ căn STUDIO, 1PN, 2PN+ độc quyền tại toà Imperia Sky Park Early Bird 15% tặng FULL đồ liền tường",,69.0,,·X. An Khánh,Đăng 1 tuần trước,,https://batdongsan.com.vn/ban-can-ho-chung-cu-duong-dai-lo-thang-long-xa-an-khanh-4-imperia-sky-park/quy-studio-1pn-2pn-oc-quyen-tai-toa-early-bird-15-tang-full-o-lien-tuong-pr45227678
Hoài Đức,RA MẮT CHUNG CƯ IMPERIA SKY PARK NAM AN KHÁNH,,28.0,,·X. An Khánh,Đăng 1 tuần trước,,https://batdongsan.com.vn/ban-can-ho-chung-cu-duong-dai-lo-thang-long-xa-an-khanh-4-imperia-sky-park/ra-mat-nam-khanh-pr45232497
Hoài Đức,Quỹ căn chuyển nhượng Wisteria: Xuân sang đón lộc - về nhà an cư,6200.0,83.0,74.6987951807229,X. Di Trạch (X. Hoài Đức mới),Đăng hôm nay,,https://batdongsan.com.vn/ban-can-ho-chung-cu-duong-32-xa-di-trach-chung-cu-the-wisteria/quy-chuyen-nhuong-xuan-sang-don-loc-ve-nha-an-cu-pr45050315
Hoài Đức,CHỈ 95TR/M2 CƠ HỘI CUỐI CÙNG ĐỂ MUA IMPERIA SKY PARK dòng căn Studio - 3PN - SKY VILLA METRO SỐ 5,14630.0,154.0,95.0,X. An Khánh,Đăng hôm nay,,https://batdongsan.com.vn/ban-can-ho-chung-cu-duong-dai-lo-thang-long-xa-an-khanh-4-imperia-sky-park/chi-90tr-m2-co-hoi-cuoi-cung-e-mua-dong-studio-3pn-villa-metro-so-5-pr45296635
Hoài Đức,Danh sách các căn hộ đang có nhu cầu chuyển nhượng giá tốt tại The Wisteria loại 2 & 3 phòng ngủ,6500.0,83.0,78.3132530120482,X. Di Trạch (X. Hoài Đức mới),Đăng hôm qua,,https://batdongsan.com.vn/ban-can-ho-chung-cu-duong-32-xa-di-trach-chung-cu-the-wisteria/danh-sach-cac-dang-co-nhu-cau-chuyen-nhuong-gia-tot-tai-loai-2-3-phong-ngu-pr45059737
Hoài Đức,"Booking đợt đầu căn hộ chung cư The Flame Vine, giá dự kiến 70 triệu/m2, 70 m2, 2PN, 2WC",,70.0,,X. Di Trạch (X. Hoài Đức mới),Đăng hôm qua,,https://batdongsan.com.vn/ban-can-ho-chung-cu-duong-vanh-dai-3-5-xa-di-trach-the-flame-vine/ban-ot-au-70-trieu-m2-70-m2-2pn-2wc-pr45287926
Hoài Đức,Đại lý Seven Realty đã và đang nhận được rất nhiều lượt booking của dự án Imperia Sky Park,6180.0,65.0,95.07692307692308,X. An Khánh,Đăng 2 ngày trước,,https://batdongsan.com.vn/ban-can-ho-chung-cu-duong-dai-lo-thang-long-xa-an-khanh-4-imperia-sky-park/ai-ly-seven-realty-a-va-ang-nhan-uoc-rat-nhieu-luot-booking-cua-du-park-pr45188539
Hoài Đức,CĂN HỘ CHUNG CƯ TẠI HOÀI ĐỨC TÀI CHÍNH CHỈ TỪ 2 TỶ TẠI DỰ ÁN THE FLAME VINE HINODE ROYAL PARK,,73.0,,X. Di Trạch (X. Hoài Đức mới),Đăng 2 ngày trước,,https://batdongsan.com.vn/ban-can-ho-chung-cu-duong-quoc-lo-32-xa-di-trach-hinode-royal-park/tai-hoai-uc-tai-chinh-chi-tu-2-ty-tai-du-an-the-flame-vine-park-pr45240675
Hoài Đức,BOOKING SỚM - ĐÚNG ĐẠI LÝ - CHỌN CĂN ĐẸP - IMPERIA SKY PARK,,55.0,,X. An Khánh,Đăng 3 ngày trước,,https://batdongsan.com.vn/ban-can-ho-chung-cu-duong-dai-lo-thang-long-xa-an-khanh-4-imperia-sky-park/booking-som-ung-ai-ly-chon-ep-park-pr45274547
Thanh Trì,Chính chủ để lại suất cán bộ 3PN mã 06A và 09B. Quà tặng tiền mặt 330 triệu. Hỗ trợ vay NH lãi 6.5%,,99.6,,X. Tứ Hiệp (X. Thanh Trì mới),Đăng hôm qua,,https://batdongsan.com.vn/ban-can-ho-chung-cu-duong-nguyen-bac-1-xa-tu-hiep-bluegem-tower/chinh-chu-e-lai-suat-bo-3pn-ma-06a-va-09b-qua-tang-tien-mat-330-trieu-tro-vay-nh-lai-6-5-pr45289005
Thanh Trì,Căn hộ 2PN tòa Seren không gian sống cân bằng giữa thiên nhiên & đô thị,6850.0,76.33,89.74191012707979,TT. Văn Điển (P. Hoàng Liệt mới),Đăng 2 ngày trước,,https://batdongsan.com.vn/ban-can-ho-chung-cu-duong-ngoc-hoi-thi-tran-van-dien-greenera-southmark/bo-doi-1pn-truc-dep-06-co-dau-tu-sinh-loi-an-ly-tuong-tai-southmark-pr44399330
Thanh Trì,"6,5 tỷ SH căn 3 ngủ 100m2 trung tâm Thanh Trì, vay tối đa 80% GTCH, LS 6,5% 12T, tặng 1 chỉ vàng",6500.0,100.0,65.0,X. Tứ Hiệp (X. Thanh Trì mới),Đăng 3 ngày trước,,https://batdongsan.com.vn/ban-can-ho-chung-cu-duong-nguyen-bac-1-xa-tu-hiep-bluegem-tower/6-5-ty-sh-3-ngu-100m2-trung-tam-thanh-tri-vay-toi-a-80-gtch-ls-6-5-12t-tang-1-chi-vang-pr45269901
Thanh Trì,"Chính chủ bán gấp căn hộ 67m2 tại Eco Green City, 6,1 tỷ, 2PN, 2WC, view đẹp",6100.0,67.0,91.04477611940298,X. Tân Triều (P. Thanh Liệt mới),Đăng 4 ngày trước,Có,https://batdongsan.com.vn/ban-can-ho-chung-cu-duong-nguyen-xien-xa-tan-trieu-eco-green-city/chinh-chu-ban-gap-67m2-tai-6-1-ty-2pn-2wc-view-ep-pr45254868
Thanh Trì,"Em Giang căn ngoại giao đặc biệt hiếm có, giá tốt nhất thị trường, hỗ trợ vay ngân hàng",7000.0,127.0,55.118110236220474,X. Tứ Hiệp (X. Thanh Trì mới),Đăng hôm nay,,https://batdongsan.com.vn/ban-can-ho-chung-cu-duong-tu-hiep-xa-tu-hiep-tecco-garden/em-giang-quy-ngoai-giao-dac-biet-hiem-co-gia-tot-nhat-thj-truong-tro-vay-ngan-hang-pr43874813
Thanh Trì,"Bán Căn hộ đẹp, nhiều tiện ích 3,22 tỷ, 47,3 m2 tại Căn hộ 1208 Tòa CT10A, Đại Thanh, Hà Nội",3220.0,47.3,68.07610993657505,X. Tả Thanh Oai (X. Đại Thanh mới),Đăng hôm qua,,https://batdongsan.com.vn/ban-can-ho-chung-cu-duong-phan-trong-tue-xa-ta-thanh-oai-chung-cu-dai-thanh/ban-ep-nhieu-tien-ich-3-22-ty-47-3-m2-tai-1208-toa-ct10a-ai-ha-noi-pr45268330
Thanh Trì,"Siêu hot! Chủ nhà cần tiền giảm sốc 300tr, căn 2PN 2VS (căn góc) 76.1m2 đẹp nhất dự án Eco Green",6050.0,76.1,79.5006570302234,X. Tân Triều (P. Thanh Liệt mới),Đăng 3 ngày trước,,https://batdongsan.com.vn/ban-can-ho-chung-cu-duong-nguyen-xien-xa-tan-trieu-eco-green-city/sieu-hot-chu-nha-tien-giam-soc-300tr-2-ngu-2vs-goc-76m2-dep-nhat-du-an-green-pr44839098
Thanh Trì,Chính chủ bán chung cư Eco Green 286 Nguyễn Xiển,6650.0,73.9,89.98646820027064,X. Tân Triều (P. Thanh Liệt mới),Đăng 1 tuần trước,,https://batdongsan.com.vn/ban-can-ho-chung-cu-duong-nguyen-xien-xa-tan-trieu-eco-green-city/chinh-chu-ban-286-xien-pr45202488
Thanh Trì,"Duy nhất 10 căn độc quyền 2PN và 2PN sân vườn, giá chỉ với 6,8tỷ trên/căn gọi ngay nhận thông tin",6800.0,76.3,89.1218872870249,TT. Văn Điển (P. Hoàng Liệt mới),Đăng 4 ngày trước,,https://batdongsan.com.vn/ban-can-ho-chung-cu-duong-ngoc-hoi-thi-tran-van-dien-greenera-southmark/2pn-khong-gian-song-chuan-cho-gia-dinh-tre-o-thuc-doc-ban-tai-southmark-pr45064013
Thanh Trì,"Chính chủ bán gấp căn hộ 67m2 tại Eco Green City, 6,1 tỷ, 2PN, 2WC, view đẹp",6100.0,67.0,91.04477611940298,X. Tân Triều (P. Thanh Liệt mới),Đăng 4 ngày trước,Có,https://batdongsan.com.vn/ban-can-ho-chung-cu-duong-nguyen-xien-xa-tan-trieu-eco-green-city/chinh-chu-ban-gap-67m2-tai-6-1-ty-2pn-2wc-view-ep-pr45254868
Thanh Trì,DUY NHẤT 1 CĂN 2PN tòa SM2 giá đợt đầu siêu rẻ tại Greenera Southmark Ngọc Hồi,6520.0,79.3,82.21941992433796,TT. Văn Điển (P. Hoàng Liệt mới),Đăng 1 tuần trước,,https://batdongsan.com.vn/ban-can-ho-chung-cu-duong-ngoc-hoi-thi-tran-van-dien-greenera-southmark/quy-hang-om-cua-cdt-duy-nhat-6-2n-toa-sm2-gia-dot-dau-sieu-re-hoi-pr45140492
Thanh Trì,"Chỉ 8x tr/m2, độc quyền căn 47m2 4 tỷ. Sẵn 1,2t ký HĐMB, vay 0% 24 tháng, ck tới 16%, Q tặng 400tr",4000.0,47.0,85.1063829787234,TT. Văn Điển (P. Hoàng Liệt mới),Đăng hôm qua,,https://batdongsan.com.vn/ban-can-ho-chung-cu-duong-ngoc-hoi-thi-tran-van-dien-greenera-southmark/chi-8x-tr-m2-oc-quyen-47m2-4-ty-san-1-2t-ky-h-mb-vay-0-24-thang-ck-toi-16-q-tang-400tr-pr45271308
Thanh Trì,"Chuẩn giá như ảnh: Bán căn 75m2 (2N2WC) giá 6.3 tỷ, sẵn sổ tại Eco Green City Nguyễn Xiển",6300.0,75.0,84.0,X. Tân Triều (P. Thanh Liệt mới),Đăng 2 ngày trước,,https://batdongsan.com.vn/ban-can-ho-chung-cu-duong-nguyen-xien-xa-tan-trieu-eco-green-city/chuan-gia-nhu-anh-ban-76m2-2n2wc-full-noi-that-san-so-tai-gia-6-5-ty-pr45214585
Thanh Trì,"Quỹ căn tháng 6-2025 Eco Green City, 67m2- 5.5tỷ, 75m2-6.1tỷ, 86m2-7.6tỷ, 95m2-8tỷ view thoáng mát",6100.0,75.0,81.33333333333333,X. Tân Triều (P. Thanh Liệt mới),Đăng 2 ngày trước,,https://batdongsan.com.vn/ban-can-ho-chung-cu-duong-nguyen-xien-xa-tan-trieu-eco-green-city/quy-thang-6-2025-67m2-4-5ty-75m2-5ty-86m2-6-2ty-95m2-6-5ty-view-thoang-mat-pr43242062
Thanh Trì,SM2.0910 giá tốt nhất dự án | hàng giai đoạn đầu biên độ sinh lời cao,6500.0,79.3,81.9672131147541,TT. Văn Điển (P. Hoàng Liệt mới),Đăng 2 ngày trước,,https://batdongsan.com.vn/ban-can-ho-chung-cu-duong-ngoc-hoi-thi-tran-van-dien-greenera-southmark/sm2-0910-gia-tot-nhat-du-an-hang-giai-doan-dau-bien-do-sinh-loi-cao-pr45109782
Thanh Trì,3PN dual - key Lavish | Linh hoạt cho đa thế hệ Tối ưu giá trị sinh lời,10000.0,124.5,80.32128514056225,TT. Văn Điển (P. Hoàng Liệt mới),Đăng 2 ngày trước,,https://batdongsan.com.vn/ban-can-ho-chung-cu-duong-ngoc-hoi-thi-tran-van-dien-greenera-southmark/sieu-pham-truc-vang-duy-nhat-2pn-dep-nhat-du-an-chinh-thuc-tai-xuat-pr44399571
Thanh Trì,Bán suất ngoại giao đặc biệt căn 3PN diện tích 105m2 giá chỉ hơn 63 triệu/m2 giảm sâu tới 260 triệu,6700.0,105.0,63.80952380952381,X. Tứ Hiệp (X. Thanh Trì mới),Đăng 3 ngày trước,,https://batdongsan.com.vn/ban-can-ho-chung-cu-duong-nguyen-bac-1-xa-tu-hiep-bluegem-tower/ban-suat-ngoai-giao-ac-biet-3pn-dien-tich-105-m2-gia-chi-63-trieu-m2-giam-sau-toi-260-trieu-pr45272154
Thanh Trì,"BQL gửi bán CH 67m2, 75m2, 86m2, 95m2 tòa EcoGreen. Full đồ, có sổ đỏ phù hợp ở lâu dài, Giá thật.",8300.0,95.0,87.36842105263158,X. Tân Triều (P. Thanh Liệt mới),Đăng 3 ngày trước,,https://batdongsan.com.vn/ban-can-ho-chung-cu-duong-nguyen-xien-xa-tan-trieu-eco-green-city/bql-gui-ban-ch-67m2-75m2-86m2-95m2-toa-ecogreen-full-o-co-so-o-phu-hop-o-lau-dai-gia-that-pr45271054
Thanh Trì,"Tôi cần bán chung cư Viện 103, Văn Quán 84m2, 2 phòng ngủ, 2 vs, giá tốt",4800.0,84.0,57.142857142857146,X. Tân Triều (P. Hà Đông mới),Đăng 3 ngày trước,,https://batdongsan.com.vn/ban-can-ho-chung-cu-duong-yen-xa-xa-tan-trieu-chung-cu-vien-103/toi-ban-103-gan-van-quan-112m2-3-ngu-2-vs-gia-tot-pr44105555
Thanh Trì,BÁN CHUNG CƯ TABUDEC PLAZA 3 PHÒNG NGỦ NỘI THẤT CAO CẤP TẦNG ĐẸP LH:0937 893 ***,7070.0,104.0,67.98076923076923,X. Tả Thanh Oai (X. Đại Thanh mới),Đăng 4 ngày trước,,https://batdongsan.com.vn/ban-can-ho-chung-cu-duong-phan-trong-tue-xa-ta-thanh-oai-tabudec-plaza/ban-3-phong-ngu-noi-that-cao-cap-tang-ep-lh-0937893286-pr45203746
Thanh Trì,"Căn hộ 3pn, 2vs BlueGem Tower, thiết kế tố ưu, view đẹp, ck 3%, quà tặng lên tới 350tr cho khách",,95.0,,X. Tứ Hiệp (X. Thanh Trì mới),Đăng 6 ngày trước,,https://batdongsan.com.vn/ban-can-ho-chung-cu-duong-nguyen-bac-1-xa-tu-hiep-bluegem-tower/93m2-3pn-2vs-thiet-ke-to-uu-view-dep-gia-tot-nhat-thi-truong-pr44997087
Thanh Trì,"Tôi chính chủ bán căn 2PN DT 75m2 Eco Green City, giá 5.8 tỷ bao phí, LH:0932 392 ***",5800.0,75.0,77.33333333333333,X. Tân Triều (P. Thanh Liệt mới),Đăng 6 ngày trước,,https://batdongsan.com.vn/ban-can-ho-chung-cu-duong-nguyen-xien-xa-tan-trieu-eco-green-city/chinh-chu-ban-2pn-dt68m2-ecogreen-gia-3-8-ty-bao-phi-lh-pr40831776
Thanh Trì,Quỹ căn ngoại giao 3PN mã 01B - mã 07B tầng đẹp. Nhận ngay gói chiết khấu VIP. LH0866 324 ***,5180.0,85.0,60.94117647058823,X. Tứ Hiệp (X. Thanh Trì mới),Đăng 1 tuần trước,,https://batdongsan.com.vn/ban-can-ho-chung-cu-duong-nguyen-bac-1-xa-tu-hiep-bluegem-tower/quy-ngoai-giao-2pn-3pn-4pn-tang-dep-nhan-ngay-goi-chiet-khau-vip-doc-quyen-lien-he-pr43845164
Thanh Trì,"Cắt lãi nhẹ trục 03B dự án BlueGem, giá bao rẻ nhất thị trường, 2 tháng nữa nhận nhà. LH0941 349 ***",6020.0,94.0,64.04255319148936,X. Tứ Hiệp (X. Thanh Trì mới),Đăng 1 tuần trước,,https://batdongsan.com.vn/ban-can-ho-chung-cu-duong-nguyen-bac-1-xa-tu-hiep-bluegem-tower/cat-lai-nhe-truc-03b-du-an-gia-bao-re-nhat-thi-truong-2-thang-nua-nhan-nha-lh-0941-349-888-pr45213466
Thanh Trì,"Cần nhượng lại căn hộ Tecco Garden, thiết kế 2pn, 3pn, 4pn, Giá vẫn tốt cho khách hàng sớm nhất.",,127.6,,X. Tứ Hiệp (X. Thanh Trì mới),Đăng hôm nay,,https://batdongsan.com.vn/ban-can-ho-chung-cu-duong-tu-hiep-xa-tu-hiep-tecco-garden/ban-2pn-4pn-thanh-tri-gia-chi-4xxtr-1m2-so-hong-san-cn-pr42587154
Đan Phượng,Quỹ Căn Nội Bộ Toà 22 Tầng Mở Bán Sớm. Giá 7xTr/m2. CK 14%. Vay 70% GTCH. Masterise Đan Phượng,5400.0,60.0,90.0,X. Tân Hội (X. Ô Diên mới),Đăng 3 ngày trước,,https://batdongsan.com.vn/ban-can-ho-chung-cu-duong-tay-thang-long-xa-tan-hoi-7-vinhomes-wonder-city/quy-noi-bo-ban-som-masterise-toa-16-22-tang-vay-70-gtch-du-an-dan-phuong-pr44717669
Đan Phượng,"Chuyển xuống mặt đất cần bán căn hộ 90m tòa CT2A KĐT Tân Tây Đô, full đồ, sổ đỏ lâu dài",,90.0,,X. Tân Lập (X. Ô Diên mới),Đăng 1 tuần trước,,https://batdongsan.com.vn/ban-can-ho-chung-cu-duong-quoc-lo-32-xa-tan-lap-24-khu-do-thi-moi-tan-tay-do/chuyen-xuong-mat-at-ban-90m-toa-ct2a-k-t-o-full-o-so-o-lau-dai-pr45246882
Đan Phượng,"Quỹ căn 2 - 3 ngủ giá tốt nhất Vinhomes Đan Phượng chỉ từ 7x tr/m2, cơ hội đầu tư chắc thắng",4730.0,60.0,78.83333333333333,X. Tân Hội (X. Ô Diên mới),Đăng hôm qua,,https://batdongsan.com.vn/ban-can-ho-chung-cu-xa-tan-hoi-7-masteri-sky-quarter/quy-2-3-ngu-gia-tot-nhat-vinhomes-an-phuong-chi-tu-7x-tr-m2-co-au-tu-chac-thang-pr45165401
Đan Phượng,"Bán căn hộ chung cư 3PN đầy đủ nội thất, view đẹp giá tốt - Tân Tây Đô, 95m2, Đan Phượng, Hà Nội",,95.0,,X. Tân Lập (X. Ô Diên mới),Đăng hôm qua,,https://batdongsan.com.vn/ban-can-ho-chung-cu-duong-quoc-lo-32-xa-tan-lap-24-khu-do-thi-moi-tan-tay-do/ban-3pn-day-du-noi-that-view-dep-gia-tot-95m2-dan-phuong-ha-noi-pr43188421
Đan Phượng,"Tôi cần Bán căn góc 52,8m2-2PN - 2WC , view đông nam mát mẻ.toà XPHOMES Star - Tân Tây Đô.",,52.8,,X. Tân Lập (X. Ô Diên mới),Đăng hôm qua,,https://batdongsan.com.vn/ban-can-ho-chung-cu-duong-quoc-lo-32-xa-tan-lap-24-chung-cu-xphomes-tan-tay-do/ban-goc-59m2-2pn-2wc-toa-xphome-star-so-san-gia-ban-3-ty-1x-pr42385474
Đan Phượng,Chính chủ cần bán nhanh căn 3 ngủ toà CT2A KDT Tân Tây Đô. Thiết kế 3 ngủ xịn full đồ. Lh 098191588,5150.0,85.0,60.588235294117645,X. Tân Lập (X. Ô Diên mới),Đăng hôm qua,,https://batdongsan.com.vn/ban-can-ho-chung-cu-duong-quoc-lo-32-xa-tan-lap-24-khu-do-thi-moi-tan-tay-do/chinh-chu-ban-nhanh-3-ngu-toa-ct2a-kdt-thiet-ke-3-ngu-xin-full-lh-098191588-pr45038040
Đan Phượng,"GẤP Đổi nhà nên cần bán căn CC 52,8m2, view đẹp, tầng trung, có nội thất,sẵn sổ, giá chỉ nhỉnh 3tỷ",3450.0,52.8,65.3409090909091,X. Tân Lập (X. Ô Diên mới),Đăng hôm qua,,https://batdongsan.com.vn/ban-can-ho-chung-cu-duong-quoc-lo-32-xa-tan-lap-24-chung-cu-xphomes-tan-tay-do/gap-oi-nha-nen-ban-cc-52-8m2-view-ep-tang-trung-co-noi-that-san-so-gia-chi-nhinh-3ty-pr45291627
Đan Phượng,"BÁN CĂN GÓC 2 NGỦ XP HOMES STAR TÂN TÂY ĐÔ Diện tích 52,8m thiết kế 2 phòng ngủ, giá 3,x0979 898 ***",3790.0,52.9,71.64461247637051,X. Tân Lập (X. Ô Diên mới),Đăng hôm qua,,https://batdongsan.com.vn/ban-can-ho-chung-cu-duong-quoc-lo-32-xa-tan-lap-24-chung-cu-xphomes-tan-tay-do/ban-goc-2-ngu-xp-homes-star-o-dien-tich-52-8m-thiet-ke-2-phong-ngu-gia-3-x-0979898648-pr45290590
Đan Phượng,Chung cư Vinhomes Đan Phượng siêu phẩm chuẩn hạng sang của CĐT Masterise Homes sắp ra mắt,,45.0,,X. Tân Hội (X. Ô Diên mới),Đăng hôm qua,,https://batdongsan.com.vn/ban-can-ho-chung-cu-xa-tan-hoi-7-masteri-sky-quarter/vinhomes-dan-phuong-sieu-pham-chuan-hang-sang-cua-cdt-masterise-homes-sap-ra-mat-pr44546101
Đan Phượng,Mở bán tòa chung cư hạng sang cuối cùng của CĐT Masterise Homes tại Vinhomes Đan Phượng,5300.0,63.0,84.12698412698413,X. Tân Hội (X. Ô Diên mới),Đăng hôm qua,,https://batdongsan.com.vn/ban-can-ho-chung-cu-xa-tan-hoi-7-masteri-sky-quarter/mo-ban-2-toa-hang-sang-cua-masterise-homes-tai-vinhomes-dan-phuong-pr44577422
Đan Phượng,"Chính chủ gửi bán căn hộ chung cư tòa HHA, Xphomes, Tân Tây Đô, Ô Diên, HN",3950.0,62.0,63.70967741935484,X. Tân Lập (X. Ô Diên mới),Đăng hôm qua,,https://batdongsan.com.vn/ban-can-ho-chung-cu-duong-quoc-lo-32-xa-tan-lap-24-khu-do-thi-moi-tan-tay-do/chinh-chu-gui-ban-toa-hha-xphomes-o-dien-hn-pr44812859
