Khu vực,Tiêu đề,Giá (triệu),Diện tích (m²),Giá/m² (triệu),Vị trí,Ngày đăng,Cắt lỗ?,Link
Thanh Xuân,BÁN GẤP NHÀ ĐẸP Ở NGAY - 50M2 - 6 TẦNG THANG MÁY - 2 THOÁNG - FULL NỘI THẤT LUXURY - VIEW CAO XA LA,13700.0,50.0,274.0,P. Khương Đình,Đăng 2 ngày trước,Có,https://batdongsan.com.vn/ban-nha-rieng-phuong-khuong-dinh/ban-ep-o-ngay-50m2-6-tang-thang-may-2-thoang-truoc-sau-full-noi-that-view-cao-xa-la-pr45500340
Thanh Xuân,"Chỉ 9,4x tỷ sở hữu ngay căn 3 phòng ngủ 102.5m2 The Queen 360 Giải Phóng - LS 0% 18 tháng",9430.0,102.5,92.0,P. Phương Liệt,Đăng 2 ngày trước,,https://batdongsan.com.vn/ban-can-ho-chung-cu-duong-giai-phong-phuong-phuong-liet-the-queen/chi-9-4x-ty-so-huu-ngay-3-ngu-102-5m2-360-ls-0-18-thang-pr45452579
Thanh Xuân,Chính chủ bán nhà 31 Vương Thừa Vũ.0904 962 ***,31000.0,52.2,593.8697318007662,P. Khương Trung (P. Khương Đình mới),Đăng 3 ngày trước,,https://batdongsan.com.vn/ban-nha-rieng-duong-vuong-thua-vu-phuong-khuong-trung-5/chinh-chu-ban-31-vu-pr45490745
Thanh Xuân,"Chính chủ cần bán căn chung cư 2 ngủ - 2wc - chỉ 6.8 tỷ - 85m2 - gần đại học Bách Khoa, Kinh Tế",6800.0,85.0,80.0,P. Phương Liệt,Đăng 3 ngày trước,,https://batdongsan.com.vn/ban-can-ho-chung-cu-duong-giai-phong-phuong-phuong-liet-imperial-plaza/chinh-chu-ban-2-ngu-2wc-chi-6-8-ty-85m-gan-ai-hoc-bach-khoa-kinh-te-pr45230134
Thanh Xuân,"BQL bán căn mới nhất giá tốt, căn hộ đã sẵn sổ để giao dịch. LH:0961 846 ***",7700.0,66.0,116.66666666666667,P. Thanh Xuân Trung (P. Thanh Xuân mới),Đăng 5 ngày trước,,https://batdongsan.com.vn/ban-can-ho-chung-cu-duong-nguyen-huy-tuong-phuong-thanh-xuan-trung-imperia-garden/bql-tong-hop-quy-moi-nhat-2pn-va-3pn-gia-tot-da-san-so-de-giao-dich-lh-pr38879162
Thanh Xuân,"Chính chủ bán căn Duplex Viha Complex, Nguyễn Tuân, 18 tỷ VND, 145m2, 4PN, 3WC, Nhận nhà ngay",18000.0,145.0,124.13793103448276,P. Thanh Xuân Trung (P. Thanh Xuân mới),Đăng 6 ngày trước,,https://batdongsan.com.vn/ban-can-ho-chung-cu-duong-nguyen-tuan-phuong-thanh-xuan-trung-viha-complex/chinh-chu-ban-duplex-18-ty-vnd-145m2-4pn-3wc-nhan-nha-ngay-pr45473095
Thanh Xuân,"Trực tiếp vào tên hợp đồng The Queen 360 Giải Phóng, căn 2PN - DT 76m2. Full nội thất, CK đến 13,5%",8250.0,76.0,108.55263157894737,P. Phương Liệt,Đăng 6 ngày trước,,https://batdongsan.com.vn/ban-can-ho-chung-cu-duong-giai-phong-phuong-phuong-liet-the-queen/truc-tiep-vao-ten-hop-ong-360-2pn-dt-76m2-full-noi-that-ck-en-13-5-pr45180360
Thanh Xuân,Tổng hợp quỹ căn hộ Royal City cập nhật giá mới nhất tháng 04/2026. LH:0985 676 ***,14000.0,131.0,106.87022900763358,P. Thượng Đình (P. Thanh Xuân mới),Đăng 6 ngày trước,,https://batdongsan.com.vn/ban-can-ho-chung-cu-duong-nguyen-trai-phuong-thuong-dinh-royal-city/tong-hop-quy-cap-nhat-gia-moi-nhat-thang-08-2025-lh-pr43671230
Tây Hồ,Cập nhật liên tục quỹ căn biệt thự Ciputra mới nhất - giá tốt nhất thị trường tháng 6 /2025,44100.0,126.0,350.0,·P. Phú Thượng,Đăng hôm nay,,https://batdongsan.com.vn/ban-nha-biet-thu-lien-ke-phuong-phu-thuong-1-khu-do-thi-nam-thang-long-ciputra/cap-nhat-tuc-quy-can-moi-nhat-gia-tot-nhat-truong-6-2025-pr45462252
Tây Hồ,"CĐT mở bán biệt thự GĐ3 KĐT Ciputra có thiết kế đẹp, sổ đỏ lâu dài, giá bán và chính sách cực tốt",52500.0,150.0,350.0,·P. Phú Thượng,Đăng hôm nay,,https://batdongsan.com.vn/ban-nha-biet-thu-lien-ke-phuong-phu-thuong-1-gia-by-kita/cdt-mo-ban-gd3-kdt-ciputra-co-thiet-dep-so-do-lau-dai-ban-va-chinh-sach-cuc-tot-pr44846228
Tây Hồ,Tôi chính chủ Bán suất ngoại giao việt thự Khu P ciputra giá rẻ vị trí đẹp nhất dự án,123500.0,300.0,411.6666666666667,·P. Phú Thượng,Đăng hôm nay,Có,https://batdongsan.com.vn/ban-nha-biet-thu-lien-ke-phuong-phu-thuong-1-khu-do-thi-nam-thang-long-ciputra/toi-chinh-chu-ban-suat-ngoai-giao-viet-p-gia-re-vi-tri-ep-nhat-du-an-pr45423066
Tây Hồ,"Ảnh thật - MP Tô Ngọc Vân-Xuân Diệu, phường Quảng An góc 2 mặt tiền du khách nước ngoài đông đúc",94000.0,160.0,587.5,P. Quảng An (P. Tây Hồ mới),Đăng hôm nay,,https://batdongsan.com.vn/ban-nha-mat-pho-duong-to-ngoc-van-phuong-quang-an-2-6/anh-that-goc-2-chinh-khach-tay-nhieu-hon-khach-viet-pr42382071
Tây Hồ,"Bán căn 3 ngủ Sunshine Riverside - 83,8 m2 - Tầng trung view sông + Cầu Nhật Tân - 8,2 tỷ (full đồ)",8200.0,83.8,97.85202863961814,P. Phú Thượng,Đăng hôm qua,,https://batdongsan.com.vn/ban-can-ho-chung-cu-phuong-phu-thuong-1-sunshine-riverside/ban-3-ngu-83-8-m2-tang-trung-view-song-cau-nhat-tan-8-4-ty-full-o-pr45186649
Tây Hồ,"Chính chủ bán đất thông phố Vệ Hồ, 115m2, nở hậu vượng phát, ngõ rộng gần 4m - 24 tỷ",24000.0,115.0,208.69565217391303,P. Xuân La (P. Tây Hồ mới),Đăng 4 ngày trước,,https://batdongsan.com.vn/ban-dat-duong-lac-long-quan-phuong-xuan-la-6/chinh-chu-ban-at-thong-pho-ve-ho-115m2-no-hau-vuong-phat-ngo-rong-gan-4m-24-ty-pr45460156
Tây Hồ,"Bán biệt thự Ciputra - Mặt đường đôi đối diện Noble - 180m2 x 5T, 1 hầm - Full nội thất đẹp - 95 tỷ",95000.0,180.0,527.7777777777778,P. Phú Thượng,Đăng hôm nay,,https://batdongsan.com.vn/ban-nha-biet-thu-lien-ke-duong-nguyen-hoang-ton-phuong-phu-thuong-1-khu-do-thi-nam-thang-long-ciputra/ban-mat-doi-doi-dien-noble-180m2-x-5t-1-ham-full-noi-that-dep-95-ty-pr44773802
Tây Hồ,"Nhà mặt ngõ Bán Đảo Quảng Khánh, gần công viên, vườn hoa, hạ tầng nâng cấp",25500.0,67.0,380.5970149253731,P. Quảng An (P. Tây Hồ mới),Đăng hôm nay,,https://batdongsan.com.vn/ban-nha-rieng-pho-quang-khanh-phuong-quang-an-2-6/mat-ngo-ban-ao-gan-cong-vien-vuon-hoa-ha-tang-nang-cap-pr45377052
Tây Hồ,"Bán đất mặt phố Lạc Long Quân, 152,3m2, đã có giấy phép xây 1 hầm 7 nổi 1 tum. LH0904 562 ***",135240.0,152.3,887.984241628365,P. Nhật Tân (P. Tây Hồ mới),Đăng hôm nay,,https://batdongsan.com.vn/ban-dat-duong-lac-long-quan-phuong-nhat-tan-2-6/ban-mat-pho-152-3m2-da-co-xay-phep-xay-1-ham-7-noi-1-tum-lh-pr44242471
Tây Hồ,"Lô BT rẻ nhất Ciputra hướng ĐN, sổ đỏ nhận nhà ngay 4 tầng 1 hầm, đường 17,5m giá 54.5tỷ0985 009 ***",54500.0,140.0,389.2857142857143,P. Phú Thượng,Đăng hôm nay,,https://batdongsan.com.vn/ban-nha-biet-thu-lien-ke-phuong-phu-thuong-1-gia-by-kita/lo-bt-re-nhat-ciputra-huong-dn-so-do-nhan-ngay-4-tang-1-ham-duong-17-5m-5x-pr44843239
Tây Hồ,"Bán căn 2 ngủ Sunshine Riverside - 64.5m2 - tầng trung cao - view sông + cầu Nhật Tân - giá: 6,7 tỷ",6700.0,64.5,103.87596899224806,P. Phú Thượng,Đăng hôm nay,,https://batdongsan.com.vn/ban-can-ho-chung-cu-duong-vo-chi-cong-phuong-phu-thuong-1-sunshine-riverside/ban-2-ngu-64-5m2-tang-trung-cao-view-song-cau-nhat-tan-gia-6-7-ty-pr45394637
Tây Hồ,"BT view công viên Ciputra khu mới có hầm, sổ đỏ bàn giao nhà ngay giá tốt trực tiếp CĐT",65000.0,140.0,464.2857142857143,P. Phú Thượng,Đăng hôm nay,,https://batdongsan.com.vn/ban-nha-biet-thu-lien-ke-phuong-phu-thuong-1-biet-thu-gia22/bt-view-cong-vien-co-ham-so-do-ciputra-khu-moi-ban-giao-ngay-mua-truc-tiep-cdt-gia-sieu-tot-pr44202509
Tây Hồ,BT song lập có hầm Ciputra MT 9m vỉa 5m đường rộng cạnh lô góc phân khu mới giá đợt 1 trực tiếp CĐT,85000.0,180.0,472.22222222222223,P. Phú Thượng,Đăng hôm nay,,https://batdongsan.com.vn/ban-nha-biet-thu-lien-ke-duong-vo-chi-cong-phuong-phu-thuong-1-gia-by-kita/bt-song-lap-co-ham-ciputra-mt-9m-via-5m-rong-canh-lo-goc-phan-khu-moi-dot-1-truc-tiep-cdt-pr44086549
Tây Hồ,"CỰC HIẾM! BÁN CĂN HỘ 2PN2WC 88M CC D'LE ROI - 59 XUÂN DIỆU, TẦNG CAO VIEW HỒ TÂY TUYỆT ĐẸP. 16,5TỶ",16500.0,88.0,187.5,·P. Quảng An (P. Tây Hồ mới),Đăng hôm nay,,https://batdongsan.com.vn/ban-can-ho-chung-cu-duong-xuan-dieu-phuong-quang-an-2-d-le-roi-soleil/cuc-hiem-ban-2pn2wc-88m-cc-59-tang-cao-view-tay-tuyet-ep-16-5ty-pr45512733
Tây Hồ,Trực tiếp CĐT BT Ciputra mới có hầm cạnh công viên hồ 65ha đã có sổ - nhận nhà ngay - Vay 0% 24 th,52500.0,140.0,375.0,·P. Phú Thượng (P. Hồng Hà mới),Đăng hôm nay,,https://batdongsan.com.vn/ban-nha-biet-thu-lien-ke-phuong-phu-thuong-1-gia-by-kita/truc-tiep-cdt-bt-ciputra-moi-co-ham-canh-cong-vien-ho-65ha-da-co-so-nhan-ngay-vay-0-24-th-pr44846459
Tây Hồ,Penthouse Duplex 610m2 Dinh thự trên không View trọn Sông Hồng & Hồ Tây- Sân vườn riêng 155m2 Noble,160000.0,610.0,262.2950819672131,·P. Phú Thượng,Đăng hôm nay,,https://batdongsan.com.vn/ban-can-ho-chung-cu-phuong-phu-thuong-1-noble-crystal-tay-ho/penthouse-duplex-610m2-dinh-thu-tren-khong-view-tron-song-hong-san-vuon-rieng-155m2-noble-pr45489167
Tây Hồ,"Không ngờ cất nóc mà giá tốt quá - Căn 3PN Đông Nam, chiết khấu 11% Vay 0% lãi 30 tháng, gần 17 tỷ",16990.0,110.0,154.45454545454547,·P. Phú Thượng (P. Tây Hồ mới),Đăng hôm nay,,https://batdongsan.com.vn/ban-can-ho-chung-cu-duong-vo-chi-cong-phuong-phu-thuong-1-celestine-westlake/khong-ngo-cat-noc-ma-gia-tot-qua-3pn-ong-nam-chiet-khau-11-vay-0-lai-30-thang-gan-17-ty-pr45511615
Tây Hồ,"D'.El Dorado I. Căn 2PN 2WC 86m2 full nội thất 659 Lạc Long Quân view Hồ Tây sẵn sổ đỏ. Giá 16,5 tỷ",16500.0,86.0,191.86046511627907,·P. Phú Thượng (P. Tây Hồ mới),Đăng hôm nay,,https://batdongsan.com.vn/ban-can-ho-chung-cu-duong-nguyen-hoang-ton-phuong-phu-thuong-1-d-el-dorado/ban-2pn-2wc-86m2-full-noi-that-del-lac-long-quan-view-tron-tay-san-so-do-gia-16-ty-pr45115168
Tây Hồ,Tổng hợp quỹ căn đẹp KĐT Ciputra GĐ3 - giáp công viên 65 ha - quỹ căn cực hiếm - sổ đỏ trao tay,52000.0,150.0,346.6666666666667,·P. Phú Thượng,Đăng hôm nay,,https://batdongsan.com.vn/ban-nha-biet-thu-lien-ke-phuong-phu-thuong-1-gia-by-kita/tong-hop-quy-can-ep-k-t-ciputra-g-3-giap-cong-vien-65-ha-quy-can-cuc-hiem-so-o-trao-tay-pr45161828
Tây Hồ,"PKD CĐT thông báo! Quỹ căn 2PN, 3PN, 4PN, Duplex - Heritage West Lake / SOHO view Hồ Tây. T04/2026",,180.0,,·P. Phú Thượng (P. Hồng Hà mới),Đăng hôm nay,,https://batdongsan.com.vn/ban-can-ho-chung-cu-duong-lac-long-quan-phuong-phu-thuong-1-heritage-west-lake/pkd-cdt-thong-bao-quy-2pn-3pn-4pn-duplex-view-tay-gia-tot-t03-2025-pr42291037
Tây Hồ,"2026 trực tiếp CĐT BT Ciputra có hầm đã có sổ, nhận nhà ngay cạnh công viên 65ha Vay 0% LS 24 tháng",52000.0,150.0,346.6666666666667,·P. Phú Thượng,Đăng hôm qua,,https://batdongsan.com.vn/ban-nha-biet-thu-lien-ke-phuong-phu-thuong-1-gia-by-kita/truc-tiep-cdt-ban-bt-ciputra-co-ham-da-co-so-nhan-ngay-chi-tu-356tr-m2-vay-0-ls-24-thang-pr43195112
Tây Hồ,"(Trực tiếp CĐT) Căn 3 ngủ Đông Nam cạnh BT vườn Đào, đang chiết khấu đến 11%, View Hồ Tây chỉ 17 tỷ",17060.0,110.0,155.0909090909091,·P. Phú Thượng (P. Tây Hồ mới),Đăng hôm qua,,https://batdongsan.com.vn/ban-can-ho-chung-cu-duong-vo-chi-cong-phuong-phu-thuong-1-celestine-westlake/truc-tiep-c-t-3-ngu-ong-nam-canh-bt-vuon-ao-ang-chiet-khau-en-11-view-tay-17-ty-pr45471859
Tây Hồ,"Bán và bàn giao căn hộ tinh hoa Soho & Heritage West lake, 677 Lạc Long Quân, Tây Hồ. Xem nhà ngay",,85.0,,·P. Phú Thượng (P. Tây Hồ mới),Đăng hôm qua,,https://batdongsan.com.vn/ban-can-ho-chung-cu-duong-lac-long-quan-phuong-phu-thuong-1-heritage-west-lake/don-vi-ly-soho-thong-bao-ban-va-ban-giao-tinh-hoa-tay-ho-pr42342146
Tây Hồ,Vì sao căn hộ 03 ngủ tại Chung cư Celestine Westlake Tây Hồ lại giao dịch tốt như vậy,17600.0,118.0,149.15254237288136,·P. Phú Thượng (P. Tây Hồ mới),Đăng hôm qua,,https://batdongsan.com.vn/ban-can-ho-chung-cu-phuong-phu-thuong-1-celestine-westlake/tay-cap-nhat-gia-ban-va-chinh-sach-uu-dai-tot-nhat-thi-truong-pr44106928
Tây Hồ,"Duplex góc 4PN 221m2 view 3 hướng Hồ Tây, công viên 65ha, biển hồ hiếm tại Noble Crystal Tây Hồ",37000.0,221.0,167.420814479638,·P. Phú Thượng,Đăng hôm qua,,https://batdongsan.com.vn/ban-can-ho-chung-cu-phuong-phu-thuong-1-noble-crystal-tay-ho/duplex-goc-4pn-197m-view-3-huong-cong-vien-65ha-bien-hiem-tai-ho-pr45365679
Tây Hồ,"Bán căn hộ duplex Đông Nam 132m2 hàng NG đợt 1 Noble Tây Hồ, tầng đẹp ưu đãi cao",23900.0,132.0,181.06060606060606,·P. Phú Thượng,Đăng hôm qua,,https://batdongsan.com.vn/ban-can-ho-chung-cu-phuong-phu-thuong-1-noble-crystal-tay-ho/ban-duplex-ong-nam-132m2-hang-ng-ot-1-tang-ep-uu-ai-cao-pr45475245
Tây Hồ,"Cần bán 2 căn Noble Ctystal Tây Hồ giá 12,x tỷ và 15,x tỷ",15200.0,93.5,162.5668449197861,·P. Phú Thượng,Đăng hôm qua,,https://batdongsan.com.vn/ban-can-ho-chung-cu-phuong-phu-thuong-1-noble-crystal-tay-ho/ban-2-ctystal-gia-12-x-ty-va-15-x-ty-pr45448335
Tây Hồ,CHÍNH CHỦ BÁN CĂN HỘ 1N TÒA S5 toà Noble Crystal Tây Hồ.,12200.0,76.0,160.52631578947367,·P. Phú Thượng,Đăng hôm qua,,https://batdongsan.com.vn/ban-can-ho-chung-cu-phuong-phu-thuong-1-noble-crystal-tay-ho/chinh-chu-ban-1n-toa-s5-toa-ho-pr45505292
Tây Hồ,Suất ngoại giao căn góc duplex 4PN Noble Crystal Tây Hồ vị trí view đẹp giá tốt nhất hiện nay,37100.0,221.0,167.8733031674208,·P. Phú Thượng,Đăng hôm qua,,https://batdongsan.com.vn/ban-can-ho-chung-cu-phuong-phu-thuong-1-noble-crystal-tay-ho/suat-ngoai-giao-goc-duplex-4pn-vi-tri-view-ep-gia-tot-nhat-hien-nay-pr45503405
Tây Hồ,"Mở Bán Penthouse Noble Crystal Tây Hồ 288m2 có bể bơi sân vườn riêng 72m2, view Hồ Tây Sông Hồng",58000.0,286.0,202.7972027972028,·P. Phú Thượng,Đăng hôm qua,,https://batdongsan.com.vn/ban-can-ho-chung-cu-phuong-phu-thuong-1-noble-crystal-tay-ho/ban-penthouse-co-be-boi-rieng-tai-ha-noi-sunshine-river-286m-lh0986998291-pr28410440
Bắc Từ Liêm,"Siêu phẩm Đông Ngạc - kinh doanh dòng tiền ổn định 1,1 tỷ/năm",19500.0,92.0,211.95652173913044,·P. Đông Ngạc,Đăng hôm qua,,https://batdongsan.com.vn/ban-nha-rieng-phuong-dong-ngac/sieu-pham-ong-kinh-doanh-tien-on-inh-1-1-ty-nam-pr45506748
Bắc Từ Liêm,"Chỉ 1,5-2 tỷ sở hữu căn hộ 3 phòng ngủ tại TMC Smart Home",10000.0,84.0,119.04761904761905,·P. Xuân Đỉnh,Đăng 2 ngày trước,,https://batdongsan.com.vn/ban-can-ho-chung-cu-duong-nguyen-dinh-tu-phuong-xuan-dinh-tmc-smart-home/chi-1-5-2-ty-so-huu-3-phong-ngu-tai-home-pr45242632
Bắc Từ Liêm,Sở hữu ngay Shop chân đế thương mại - Đã sẵn khách thuê KĐT Goldmark City,8100.0,139.0,58.273381294964025,·P. Phú Diễn,Đăng 6 ngày trước,,https://batdongsan.com.vn/ban-shophouse-nha-pho-thuong-mai-duong-ho-tung-mau-phuong-phu-dien-rox-tower/so-huu-ngay-shop-chan-e-a-san-khach-thue-k-t-goldmark-city-pr45469965
Bắc Từ Liêm,Mảnh đất vàng trong làng đầu tư 185m2 chia 2 sổ vị trí lõi Xuân Đỉnh chỉ 190tr/m2,35150.0,185.0,190.0,P. Xuân Đỉnh,Đăng hôm nay,,https://batdongsan.com.vn/ban-dat-duong-xuan-dinh-phuong-xuan-dinh-718/manh-at-vang-trong-lang-au-tu-185m2-chia-2-so-vi-tri-loi-inh-chi-190tr-m2-pr45509817
Bắc Từ Liêm,"Gấp bán căn góc 3 phòng ngủ - 97,5 m2 thông thuỷ - Sunshine City - view sông - full đồ - sẵn sổ",9300.0,97.5,95.38461538461539,P. Đông Ngạc (P. Phú Thượng mới),Đăng hôm qua,,https://batdongsan.com.vn/ban-can-ho-chung-cu-duong-pham-van-dong-phuong-dong-ngac-sunshine-city/gap-ban-goc-3-phong-ngu-98-m2-thong-thuy-view-song-full-o-san-so-pr45485030
Bắc Từ Liêm,"Bán đất phân lô Mũi Tràng, đường 13m, DT 96m2, MT 5.71m. Sổ đỏ. Giá 28 tỷ. LH0978 996 ***",28000.0,96.0,291.6666666666667,P. Đông Ngạc,Đăng hôm nay,,https://batdongsan.com.vn/ban-dat-phuong-dong-ngac/ban-at-phan-lo-mui-trang-uong-13m-dt-96m2-mt-5-71m-so-o-gia-28-ty-lh-pr45501699
Bắc Từ Liêm,"Bán căn 2 ngủ - Sunshine City - View nội khu - 72.7m2 (có bồn tắm) Tầng trung. Giá: 8,2tỷ full đồ",8200.0,72.7,112.79229711141677,P. Đông Ngạc (P. Phú Thượng mới),Đăng hôm nay,,https://batdongsan.com.vn/ban-can-ho-chung-cu-duong-pham-van-dong-phuong-dong-ngac-sunshine-city/ban-2-ngu-view-noi-khu-72-7m2-co-bon-tam-tang-trung-gia-8-5-ty-full-do-pr45010678
Bắc Từ Liêm,"Bán căn 3ngủ - View nội khu. Chung cư Sunshine City - 98,7m2 thông thuỷ - Giá: 10.3tỷ (full đồ+sổ)",10300.0,98.7,104.35663627152988,P. Đông Ngạc (P. Phú Thượng mới),Đăng hôm nay,,https://batdongsan.com.vn/ban-can-ho-chung-cu-duong-pham-van-dong-phuong-dong-ngac-sunshine-city/ban-3-ngu-view-noi-khu-98-7m2-thong-thuy-gia-10-5-ty-full-o-so-pr45266202
Bắc Từ Liêm,"Bán căn 3 ngủ Sunshine City - 89m2 - tầng cao - view thành phố, nhìn xa núi - giá: 8,9 tỷ (sổ đỏ)",8900.0,89.0,100.0,P. Đông Ngạc (P. Phú Thượng mới),Đăng hôm nay,,https://batdongsan.com.vn/ban-can-ho-chung-cu-duong-pham-van-dong-phuong-dong-ngac-sunshine-city/ban-3-ngu-tang-cuc-cao-view-thanh-pho-nhin-xa-nui-gia-7-8-ty-bao-phi-pr43162731
Bắc Từ Liêm,"Bán nhà Xuân Đỉnh sát mặt phố ô tô tránh, ngõ thông kinh doanh 79.3m2 11.3 tỷ",11300.0,79.3,142.4968474148802,P. Xuân Đỉnh,Đăng hôm nay,,https://batdongsan.com.vn/ban-nha-rieng-duong-xuan-dinh-phuong-xuan-dinh-718/ban-inh-sat-mat-pho-oto-tranh-ngo-thong-kinh-doanh-88m-au-11-ty-pr45501214
Bắc Từ Liêm,"Chính chủ gửi bán BT TP Giao Lưu DT 234m2, MT 13.3m, 5 tầng thang máy, bể bơi, 2 mặt tiền, ảnh thật",78000.0,234.0,333.3333333333333,Phường Cổ Nhuế 1 (P. Phú Diễn mới),Đăng hôm nay,,https://batdongsan.com.vn/ban-nha-biet-thu-lien-ke-duong-pham-van-dong-phuong-co-nhue-1-thanh-pho-giao-luu/chinh-chu-ban-tp-dt-234m2-mt-13m-4-tang-thang-may-be-boi-2-mat-tien-pr45514975
Bắc Từ Liêm,"Bán căn góc 3 phòng ngủ full đồ 104m2 Sunshine City tầng sân vườn - giá 10,5 tỷ sổ đỏ sang tên",10500.0,104.0,100.96153846153847,P. Đông Ngạc (P. Phú Thượng mới),Đăng hôm nay,,https://batdongsan.com.vn/ban-can-ho-chung-cu-phuong-dong-ngac-sunshine-city/ban-goc-3-ngu-full-do-104m2-tang-san-vuon-gia-10-5-ty-so-do-sang-ten-pr44021198
Bắc Từ Liêm,Bán căn góc 3 phòng ngủ 105m2 Sunshine City tầng cao view Sông Hồng - giá 12 tỷ sổ đỏ sang tên,12000.0,105.0,114.28571428571429,P. Đông Ngạc (P. Phú Thượng mới),Đăng hôm nay,,https://batdongsan.com.vn/ban-can-ho-chung-cu-phuong-dong-ngac-sunshine-city/ban-goc-3-ngu-105m2-tang-cao-view-song-hong-gia-10-ty-so-do-sang-ten-pr43782343
Bắc Từ Liêm,2PN view đẹp 8.2 tỷ - 3PN 98m2 giá 9.5 tỷ - 3PN 116m2 giá 11 tỷ cam kết còn hàng Sunshine City,11000.0,116.0,94.82758620689656,·P. Đông Ngạc (P. Phú Thượng mới),Đăng 6 ngày trước,,https://batdongsan.com.vn/ban-can-ho-chung-cu-phuong-dong-ngac-sunshine-city/2pn-view-ep-8-2-ty-3pn-98m2-gia-9-5-ty-3pn-116m2-gia-11-ty-cam-ket-con-hang-city-pr45386964
Bắc Từ Liêm,"Chính chủ Sunshine City cần bán: 2 ngủ: 8 tỷ, 3 ngủ: 9 tỷ - Duplex: 15 tỷ - SĐT:0981 757 ***",9000.0,90.0,100.0,·P. Đông Ngạc (P. Phú Thượng mới),Đăng 6 ngày trước,,https://batdongsan.com.vn/ban-can-ho-chung-cu-phuong-dong-ngac-sunshine-city/chinh-chu-ban-2-ngu-8-3-ty-3-ngu-9-ty-duplex-15-ty-s-t-0981-757-285-pr45281678
Bắc Từ Liêm,"Quỹ căn chuyển nhượng chung cư Sunshine City Ciputra tháng 3/2026 - 3PN giá 9,x tỷ",9200.0,89.0,103.37078651685393,·P. Đông Ngạc (P. Phú Thượng mới),Đăng 1 tuần trước,,https://batdongsan.com.vn/ban-can-ho-chung-cu-phuong-dong-ngac-sunshine-city/quy-chuyen-nhuong-ciputra-thang-12-2025-3pn-gia-9ty-pr44709300
Bắc Từ Liêm,Danh sách căn hộ Sunshine City 04/2026: Mua ở + đầu tư giá tốt nhất + hỗ trợ vay ngân hàng,11200.0,116.0,96.55172413793103,·P. Đông Ngạc (P. Phú Thượng mới),Đăng 1 tuần trước,,https://batdongsan.com.vn/ban-can-ho-chung-cu-phuong-dong-ngac-sunshine-city/danh-sach-quy-ciputra-5-2025-mua-o-dau-tu-gia-tot-nhat-tro-vay-ngan-hang-pr42943002
Bắc Từ Liêm,Chính chủ bán biệt thự Ngoại Giao Đoàn mặt phố Nguyễn Xuân Khoát vị trí đẹp 2 mặt đường kinh doanh,,425.0,,P. Xuân Đỉnh,Đăng hôm nay,,https://batdongsan.com.vn/ban-nha-biet-thu-lien-ke-duong-nguyen-xuan-khoat-phuong-xuan-dinh-khu-ngoai-giao-doan/chinh-chu-ban-mat-pho-vi-tri-dep-2-mat-kinh-doanh-pr40367314
Bắc Từ Liêm,Bán gấp nhà mặt phố Phạm Văn Đồng 9 tầng thang máy 35m - kinh doanh - ô tô - vỉa hè giá hơn 19 tỷ,19000.0,35.0,542.8571428571429,P. Xuân Đỉnh,Đăng hôm nay,Có,https://batdongsan.com.vn/ban-nha-mat-pho-phuong-xuan-dinh/ban-gap-pham-van-ong-9-tang-thang-may-35m-kinh-doanh-o-to-via-he-gia-hon-19-ty-pr45516894
Bắc Từ Liêm,"Chủ đầu tư chính thức ra hàng, Giá không chênh, ký HĐMB, Chiết khấu đến 9%, vay 0% lãi 24 tháng",8490.0,70.0,121.28571428571429,P. Xuân Đỉnh,Đăng hôm nay,,https://batdongsan.com.vn/ban-can-ho-chung-cu-duong-nguyen-dinh-tu-phuong-xuan-dinh-tmc-smart-home/10-suat-ngoai-giao-cuoi-chu-dau-de-nhan-toi-12-chiet-khau-som-gia-tot-nhat-pr44495916
Bắc Từ Liêm,"Cập nhật danh sách các căn hộ chuyển nhượng Goldmark City loại 2 - 3 & 4PN. Giá chỉ từ 6,5 tỷ",6500.0,86.0,75.5813953488372,P. Phú Diễn,Đăng hôm nay,,https://batdongsan.com.vn/ban-can-ho-chung-cu-duong-ho-tung-mau-phuong-phu-dien-goldmark-city/cap-nhat-danh-sach-cac-chuyen-nhuong-loai-2-3-4pn-gia-chi-tu-6-5-ty-pr45474496
Bắc Từ Liêm,"Tôi cần bán 2 căn hộ Goldmark City, căn 2PN 6,5tỷ và căn 3PN 7.8tỷ, có sổ đỏ, hỗ trợ vay bank",6500.0,83.0,78.3132530120482,P. Phú Diễn,Đăng hôm nay,,https://batdongsan.com.vn/ban-can-ho-chung-cu-duong-ho-tung-mau-phuong-phu-dien-goldmark-city/toi-ban-2-goc-2-ngu-5-ty-100tr-va-goc-3-ngu-6-ty-100tr-co-so-do-pr41979496
Bắc Từ Liêm,Chọn lọc 30 căn hộ HH Thái Hà Epics Home & CBCS Bộ CA loại 2 & 3 phòng ngủ 70m2 - 144m2 giá cực tốt,6000.0,70.0,85.71428571428571,Phường Cổ Nhuế 2 (P. Đông Ngạc mới),Đăng hôm nay,,https://batdongsan.com.vn/ban-can-ho-chung-cu-duong-pham-van-dong-phuong-co-nhue-2-nha-o-cho-can-bo-chien-sy-bo-cong-an/chon-loc-30-hh-thai-ha-epics-home-cbcs-ca-loai-2-3-phong-ngu-70m2-144m2-gia-cuc-tot-pr45430294
Bắc Từ Liêm,"Trả trước 1.52tỷ sở hữu căn 3PN tại TMC SmartHome -Ngay kề KĐT Ciputra & Starlake, Ngoại Giao Đoàn",,84.9,,P. Xuân Đỉnh (P. Đông Ngạc mới),Đăng hôm nay,,https://batdongsan.com.vn/ban-can-ho-chung-cu-duong-nguyen-dinh-tu-phuong-xuan-dinh-tmc-smart-home/tra-truoc-1-52ty-so-huu-3pn-tai-smarthome-ngay-ke-k-t-ciputra-starlake-ngoai-giao-oan-pr45513543
Bắc Từ Liêm,"Bán gấp căn hộ 2PN, diện tích 70m2, full nội thất đẹp, giá 5,95 tỷ, cc Thái Hà 43 Phạm Văn Đồng",5950.0,70.0,85.0,Phường Cổ Nhuế 2 (P. Đông Ngạc mới),Đăng hôm nay,Có,https://batdongsan.com.vn/ban-can-ho-chung-cu-duong-pham-van-dong-phuong-co-nhue-2-nha-o-cho-can-bo-chien-sy-bo-cong-an/ban-gap-cc-2pn-2wc-dien-tich-70m-full-noi-that-ep-tang-trung-huong-mat-cc-thai-ha-an-pr45169604
Bắc Từ Liêm,"Chính chủ bán giá 2 ngủ 6.5 tỷ, căn 3 ngủ 8 tỷ, căn 4 ngủ 12 tỷ. Hỗ trợ bank 80%, xem nhà 24/07",6200.0,83.0,74.6987951807229,P. Phú Diễn,Đăng hôm nay,,https://batdongsan.com.vn/ban-can-ho-chung-cu-duong-ho-tung-mau-phuong-phu-dien-goldmark-city/ban-cat-lo-gia-tot-tai-gmc-tu-45-tr-m2-169m2-gia-7-ty-130m2-6-6-ty-114m2-6-ty-tro-vay-80-pr40907957
Bắc Từ Liêm,"Bán căn hộ Jade Square, căn 2 PN toà J3, view thoáng, hướng mát, tầng đẹp, giá rẻ hơn 500tr",8600.0,86.0,100.0,P. Xuân Đỉnh (P. Đông Ngạc mới),Đăng hôm nay,Có,https://batdongsan.com.vn/ban-can-ho-chung-cu-duong-nguyen-dinh-tu-phuong-xuan-dinh-jade-square/ban-2-pn-toa-j3-view-thoang-huong-mat-tang-dep-gia-tot-thi-truong-pr45113848
Bắc Từ Liêm,Bán gấp mảnh đất 180m2 mặt tiền 22m mặt đường Phạm Văn Đồng lô góc 3 thoáng,,179.0,,Phường Cổ Nhuế 1 (P. Xuân Đỉnh mới),Đăng hôm qua,Có,https://batdongsan.com.vn/ban-dat-duong-pham-van-dong-phuong-co-nhue-1-718/ban-gap-manh-at-180m2-mat-tien-22m-mat-uong-ong-lo-goc-3-thoang-pr45444394
Bắc Từ Liêm,Chuyên bán căn hộ cao cấp tháp đôi Hanjadin(NO1-T6 & T7) Ngoại Giao Đoàn - Giá tốt nhất thị trường,,105.0,,P. Xuân Tảo (P. Xuân Đỉnh mới),Đăng 2 ngày trước,,https://batdongsan.com.vn/ban-can-ho-chung-cu-phuong-xuan-tao-n01-t7-ngoai-giao-doan/chinh-chu-ban-dt104m2-3pn-toa-no1-view-tron-tay-thoang-mat-gia-tot-pr40088970
Bắc Từ Liêm,"Chính chủ nhờ bán CHCC Han Jardin , T6 + T7 , phường Xuân Đỉnh, 105m2, 3PN, đồ cơ bản giá chỉ 19 tỷ",19000.0,105.0,180.95238095238096,P. Xuân Tảo (P. Xuân Đỉnh mới),Đăng 2 ngày trước,,https://batdongsan.com.vn/ban-can-ho-chung-cu-duong-nguyen-van-huyen-phuong-xuan-tao-chung-cu-han-jardin/chinh-chu-nho-ban-chcc-t6-t7-inh-105m2-3pn-o-co-ban-gia-chi-19-ty-pr45496935
Gia Lâm,"Quỹ căn độc quyền giá tốt view đẹp, sẵn sổ, hỗ trợ vay 70% xem nhà 24/7, miễn phí môi giới",2950.0,43.0,68.6046511627907,·X. Dương Xá (X. Gia Lâm mới),Đăng hôm nay,,https://batdongsan.com.vn/ban-can-ho-chung-cu-xa-duong-xa-vinhomes-ocean-park-gia-lam/quy-view-dep-chinh-chu-ban-cat-lo-tu-300tr-so-do-chinh-chu-mien-phi-mg-tro-vay-toi-70-pr39114589
