Khu vực,Tiêu đề,Giá (triệu),Diện tích (m²),Giá/m² (triệu),Vị trí,Ngày đăng,Cắt lỗ?,Link
Gia Lâm,"Bán căn hộ MetroPolitan 1PN + từ 3.28tỷ 2PN từ 3.85tỷ, 3PN view hồ từ 5.65tỷ, LH0911 269 ***",6300.0,90.3,69.76744186046511,·X. Dương Xá (X. Gia Lâm mới),Đăng hôm nay,,https://batdongsan.com.vn/ban-can-ho-chung-cu-xa-duong-xa-vinhomes-ocean-park-gia-lam/ban-metropolitan-studio-tu-2-35ty-1pn-tu-3-16ty-2pn-tu-3-85ty-3pn-tu-5-55ty-lh-pr44678951
Gia Lâm,Ban quản lý dự án Vinhomes quỹ 500 căn cắt lỗ tháng 4 giá tốt nhất thị trường studio 1PN 2PN 3PN,2950.0,43.0,68.6046511627907,·X. Dương Xá (X. Gia Lâm mới),Đăng hôm nay,Có,https://batdongsan.com.vn/ban-can-ho-chung-cu-duong-an-dao-xa-duong-xa-vinhomes-ocean-park-gia-lam/ban-quan-ly-du-quy-500-cat-lo-thang-4-tot-nhat-thi-truong-studio-1pn-2pn-3pn-pr45433318
Gia Lâm,Bán 1PN + 43m2 full nội thất mới đẹp. Ban công Tây Bắc thoáng đẹp,3150.0,43.0,73.25581395348837,X. Đa Tốn (X. Gia Lâm mới),Đăng 5 ngày trước,,https://batdongsan.com.vn/ban-can-ho-chung-cu-xa-da-ton-the-sapphire-1-vinhomes-ocean-park/ban-cc-giban-cc-gia-lam-6-6-ty-vnd-98-4-m2-view-ep-hot-pr45401160
Gia Lâm,"Chính chủ bán gấp đất TDP Kiên Thành - sát Vinhomes Ocean Park, giá chỉ 112tr/m² bao phí0855 448 ***",8180.0,73.0,112.05479452054794,TT. Trâu Quỳ (X. Gia Lâm mới),Đăng 5 ngày trước,Có,https://batdongsan.com.vn/ban-dat-duong-kien-thanh-thi-tran-trau-quy-11/chinh-chu-ban-gap-at-tdp-sat-vinhomes-ocean-park-gia-chi-112tr-m-bao-phi-0855448822-pr45294545
Gia Lâm,"Cần tiền Bán gấp căn hộ 2PN, 1WC, 55m2 giá chỉ 3tỷ4 tại Vinhomes Ocean Park Gia Lâm",3400.0,55.0,61.81818181818182,X. Đa Tốn (X. Gia Lâm mới),Đăng hôm nay,Có,https://batdongsan.com.vn/ban-can-ho-chung-cu-xa-da-ton-the-sapphire-1-vinhomes-ocean-park/ban-2pn-1wc-55m2-tai-gia-lam-3-4-ty-vnd-pr45503536
Gia Lâm,Bán nhanh căn 2PN full nội thất đẹp sổ sẵn view đẹp - giá tốt tại Vinhomes Ocean Park 1,4490.0,62.8,71.49681528662421,X. Đa Tốn (X. Gia Lâm mới),Đăng hôm nay,,https://batdongsan.com.vn/ban-can-ho-chung-cu-xa-da-ton-the-sapphire-1-vinhomes-ocean-park/ban-nhanh-2pn-full-noi-that-ep-so-san-view-ep-gia-tot-tai-1-pr45244077
Gia Lâm,"Bán căn hộ CC 1PN, 1WC, 47m2 tại Vinhomes Ocean Park Gia Lâm, 3,050 tỷ",3050.0,47.0,64.8936170212766,X. Đa Tốn (X. Gia Lâm mới),Đăng hôm nay,,https://batdongsan.com.vn/ban-can-ho-chung-cu-xa-da-ton-the-sapphire-1-vinhomes-ocean-park/ban-cc-1pn-1wc-47m2-tai-gia-lam-3-2-ty-pr44775084
Gia Lâm,"Chính chủ bán 2n2vs góc Zenpark VHOP1 toà R1.010506, Đông Nam - 74,1m2 - 5,850 tỷ bao phí",5850.0,74.1,78.94736842105264,TT. Trâu Quỳ (X. Gia Lâm mới),Đăng hôm nay,,https://batdongsan.com.vn/ban-can-ho-chung-cu-duong-dong-du-1-thi-tran-trau-quy-the-zenpark/chinh-chu-ban-2n2vs-goc-vhop1-toa-r1-01-ong-nam-74-1m2-5-850-ti-bao-phi-pr45444478
Gia Lâm,Chính chủ gửi bán gấp căn hộ 2PN + 2W góc tòa S1.07 full đồ BC Tây Nam View Briton siêu thoáng mát,4320.0,63.8,67.7115987460815,X. Đa Tốn (X. Gia Lâm mới),Đăng hôm nay,Có,https://batdongsan.com.vn/ban-can-ho-chung-cu-xa-da-ton-the-sapphire-1-vinhomes-ocean-park/chuyen-vao-sai-gon-nen-ban-gap-2pn-goc-full-o-ban-cong-tay-nam-view-sieu-thoang-tang-ep-pr45310438
Gia Lâm,Bán căn 1PN + 43m2 tại Vinhomes OceanPark Gia Lâm,3220.0,43.0,74.88372093023256,X. Đa Tốn (X. Gia Lâm mới),Đăng hôm qua,,https://batdongsan.com.vn/ban-can-ho-chung-cu-xa-da-ton-the-sapphire-1-vinhomes-ocean-park/ban-1pn-43m-tai-oceanpark-gia-lam-pr45461769
Gia Lâm,"SL San Hô 1 view công viên, view hồ, vừa ở vừa kinh doanh tại Vinhomes Oceanpark 1 Gia Lâm",41000.0,150.0,273.3333333333333,X. Dương Xá (X. Gia Lâm mới),Đăng 4 ngày trước,,https://batdongsan.com.vn/ban-nha-biet-thu-lien-ke-xa-duong-xa-vinhomes-ocean-park-gia-lam/sl-san-ho-1-view-cong-vien-view-ho-vua-o-vua-kinh-doanh-tai-oceanpark-1-lam-pr45412303
Gia Lâm,Bán liền kề Sao Biển Vinhomes Ocean Park Gia Lâm 67.5m2 dòng tiền 25tr/tháng 15.3 tỷ,15300.0,67.5,226.66666666666666,X. Dương Xá (X. Gia Lâm mới),Đăng 6 ngày trước,,https://batdongsan.com.vn/ban-nha-biet-thu-lien-ke-xa-duong-xa-vinhomes-ocean-park-gia-lam/ban-sao-bien-67-5m-dong-tien-25tr-thang-15-5-ty-pr45444360
Gia Lâm,"Quỹ căn cập nhật mới nhất 2026 - phân khu Saphire, Zurich, Beverly, London, Paris",3600.0,55.0,65.45454545454545,·X. Dương Xá (X. Gia Lâm mới),Đăng hôm nay,,https://batdongsan.com.vn/ban-can-ho-chung-cu-xa-duong-xa-vinhomes-ocean-park-gia-lam/quy-cap-nhat-moi-nhat-2026-phan-khu-sapphire-park-pr45356217
Gia Lâm,"QUỸ CĂN CẬP NHẬT MỚI NHẤT 2026-PHÂN KHU SAPHIRE, LONDON, ZURICH, BEVERLY, PARIS VINHOMES OCEAN PARK",3450.0,55.0,62.72727272727273,·X. Dương Xá (X. Gia Lâm mới),Đăng hôm nay,,https://batdongsan.com.vn/ban-can-ho-chung-cu-xa-duong-xa-vinhomes-ocean-park-gia-lam/quy-cap-nhat-moi-nhat-2026-phan-khu-sapphire-park-pr45300074
Gia Lâm,"Quỹ căn cắt lỗ Masteri Homes, sẵn khách thuê dòng tiền 10-20tr/ tháng",4300.0,55.0,78.18181818181819,·X. Dương Xá (X. Gia Lâm mới),Đăng hôm nay,Có,https://batdongsan.com.vn/ban-can-ho-chung-cu-xa-duong-xa-vinhomes-ocean-park-gia-lam/quy-2-phong-ngu-tot-nhat-masteri-homes-san-khach-thue-dong-tien-14r-thang-pr45233099
Gia Lâm,"BÁN GẤP - SHOP MẶT SẢNH 70M2 GIÁ CHỈ 11,8 TỶ RẺ HƠN THỊ TRƯỜNG 3 TỶ, CHO THUÊ 60TR/THÁNG",11800.0,70.0,168.57142857142858,·X. Dương Xá (X. Gia Lâm mới),Đăng hôm nay,Có,https://batdongsan.com.vn/ban-shophouse-nha-pho-thuong-mai-xa-duong-xa-vinhomes-ocean-park-gia-lam/ban-gap-shop-mat-sanh-70m2-chi-11-8-ty-re-hon-thi-truong-3-ty-cho-thue-60tr-thang-pr45510503
Gia Lâm,"Chỉ từ 16 tỷ, Cần bán nhà phố LK Gia Lâm HN, sẵn sàng ra sổ, cách OCP 5 phút, vốn ban đầu chỉ từ 6t",16020.0,77.0,208.05194805194805,·TT. Trâu Quỳ (X. Gia Lâm mới),Đăng 2 ngày trước,,https://batdongsan.com.vn/ban-nha-biet-thu-lien-ke-duong-nguyen-mau-tai-thi-tran-trau-quy-ha-noi-oriental/chi-tu-16-ty-can-ban-pho-lk-gia-lam-hn-san-sang-ra-so-cach-ocp-5-phut-von-ban-au-chi-tu-6t-pr45499137
Gia Lâm,Bán gấp cắt lỗ 300 triệu căn hộ chung cư do ngộp ngân hàng tại Vinhomes Ocean Park 1.,,43.0,,·X. Dương Xá (X. Gia Lâm mới),Đăng 2 ngày trước,Có,https://batdongsan.com.vn/ban-can-ho-chung-cu-xa-duong-xa-vinhomes-ocean-park-gia-lam/thanh-trung-group-quy-chinh-chu-gui-ban-phap-ly-ro-rang-hop-ly-nhat-pr39722407
Gia Lâm,"Rẻ nhất thị trường! Biệt thự Song lập SB8, 150m2, mặt tiền 10m gần hồ giá chỉ 33 tỷ tại VHOP1",33000.0,150.0,220.0,·X. Dương Xá (X. Gia Lâm mới),Đăng 2 ngày trước,,https://batdongsan.com.vn/ban-nha-biet-thu-lien-ke-xa-duong-xa-vinhomes-ocean-park-gia-lam/41-5-ty-sl-san-ho-150m2-mat-song-cong-vien-huong-ong-nam-duy-nhat-tai-du-an-vhop1-pr45411439
Gia Lâm,Cần bán gấp biệt thự đơn lập góc view trực diện công viên khu Ngọc Trai - Vinhomes Ocean Park,,316.0,,·X. Dương Xá (X. Gia Lâm mới),Đăng 3 ngày trước,Có,https://batdongsan.com.vn/ban-nha-biet-thu-lien-ke-xa-duong-xa-vinhomes-ocean-park-gia-lam/can-ban-gap-on-lap-goc-view-truc-dien-cong-vien-khu-ngoc-trai-park-pr45398079
Gia Lâm,"Mình cần bán nhanh căn hộ 63m2 2pn view sông tòa ZR2 Vinhomes Ocean Park, căn góc siêu đẹp",4470.0,63.0,70.95238095238095,·X. Đa Tốn (X. Gia Lâm mới),Đăng 3 ngày trước,,https://batdongsan.com.vn/ban-can-ho-chung-cu-xa-da-ton-the-zurich-vinhomes-ocean-park/ban-cc-tai-toa-zr2-gia-lam-4-38-ty-63m2-uy-tin-hang-hiem-pr45358958
Gia Lâm,"Chính chủ mình nhượng lại căn hộ 43m2, 3,4 tỷ tại toà S2.12, Vinhomes Ocean Park Gia Lâm, view đẹp",3400.0,43.0,79.06976744186046,·X. Đa Tốn (X. Gia Lâm mới),Đăng 3 ngày trước,,https://batdongsan.com.vn/ban-can-ho-chung-cu-xa-da-ton-the-sapphire-2-vinhomes-ocean-park/ban-43m2-3-5-ty-tai-toa-s2-12-gia-lam-view-ep-pr45358564
Gia Lâm,Shophouse mặt đường 52m đối diện chung cư Vinhomes Ocean Park sổ đỏ lâu dài. Liên hệ:0917 099 ***,21000.0,60.0,350.0,·X. Dương Xá (X. Gia Lâm mới),Đăng 3 ngày trước,,https://batdongsan.com.vn/ban-shophouse-nha-pho-thuong-mai-duong-ngoc-trai-6-xa-duong-xa-vinhomes-ocean-park-gia-lam/mat-52m-doi-dien-truong-hoc-dau-tu-lien-he-pr44473732
Gia Lâm,"Quỹ căn chuyển nhượng giá tốt phân khu Central Metropolitan ( BE,LD,PR,ZR) Mr.Hải :0813 658 ***",3100.0,48.5,63.91752577319588,·TT. Trâu Quỳ (X. Gia Lâm mới),Đăng 3 ngày trước,,https://batdongsan.com.vn/ban-can-ho-chung-cu-duong-ly-thanh-tong-thi-tran-trau-quy-central-metropolitan/chuyen-nhuong-gia-tot-phan-khu-be-ld-pr-zr-mr-hai-pr45486382
Gia Lâm,Bán 1PN + 43m2 full nội thất mới đẹp. Ban công Tây Bắc thoáng đẹp,3150.0,43.0,73.25581395348837,·X. Đa Tốn (X. Gia Lâm mới),Đăng 5 ngày trước,,https://batdongsan.com.vn/ban-can-ho-chung-cu-xa-da-ton-the-sapphire-1-vinhomes-ocean-park/ban-cc-giban-cc-gia-lam-6-6-ty-vnd-98-4-m2-view-ep-hot-pr45401160
Gia Lâm,"3PN 86m toà Beverly chi 5.5xtỷ, 2PN 74.5m giá 4.720tỷ. Cập nhật liên tục quỹ căn tốt nhất tháng 4",5550.0,86.0,64.53488372093024,·X. Đa Tốn (X. Gia Lâm mới),Đăng 6 ngày trước,,https://batdongsan.com.vn/ban-can-ho-chung-cu-xa-da-ton-the-beverly-vinhomes-ocean-park/cap-nhat-quy-gia-tot-nhat-thang-4-phan-khu-metropolitan-oceanpark-pr45471337
Gia Lâm,Top 1! Biệt thự đơn lập góc giá tốt nhất tại Vinhomes Ocean Park Gia Lâm. LH0967 510 ***,70000.0,298.0,234.8993288590604,·X. Dương Xá (X. Gia Lâm mới),Đăng 6 ngày trước,,https://batdongsan.com.vn/ban-nha-biet-thu-lien-ke-xa-duong-xa-vinhomes-ocean-park-gia-lam/ap-goc-view-ho-1-trong-nhung-can-dep-nhat-tot-tai-lh-pr40465470
Gia Lâm,"Song Lập Sao Biển hoàn thiện full nội thất có thang máy - gần Hồ, gần Biển, gần Quảng trường Vin 1",35000.0,150.0,233.33333333333334,·X. Dương Xá (X. Gia Lâm mới),Đăng 6 ngày trước,,https://batdongsan.com.vn/ban-nha-biet-thu-lien-ke-xa-duong-xa-vinhomes-ocean-park-gia-lam/song-lap-sao-bien-hoan-thien-full-noi-that-co-thang-may-gan-ho-gan-bien-gan-quang-truong-vin-1-pr45090670
Gia Lâm,"BÁN GẤP BIỆT THỰ SONG LẬP SAN HÔ 26,x TỶ VINHOMES OCEAN PARK 1 GIA LÂM HÀ NỘI",,150.0,,·X. Dương Xá (X. Gia Lâm mới),Đăng 6 ngày trước,Có,https://batdongsan.com.vn/ban-nha-biet-thu-lien-ke-xa-duong-xa-vinhomes-ocean-park-gia-lam/quy-can-1-vi-tri-dep-gan-cong-vien-ho-tot-nhat-pr44065415
Long Biên,BÁN CĂN GÓC HOA HẬU HH2B GIA THỤY - 3 NGỦ GIÁ TỐT,6900.0,85.1,81.08108108108108,·P. Ngọc Thụy (P. Bồ Đề mới),Đăng 5 ngày trước,,https://batdongsan.com.vn/ban-can-ho-chung-cu-duong-ngoc-thuy-phuong-ngoc-thuy-9/ban-goc-hoa-hau-hh2b-gia-3-ngu-gia-tot-pr45138034
Long Biên,"Bán xuất ngoại giao, căn hộ sắp bàn giao Ruby Riverside Long Biên, hàng hiếm",7150.0,65.0,110.0,·P. Phúc Đồng (P. Phúc Lợi mới),Đăng 5 ngày trước,,https://batdongsan.com.vn/ban-can-ho-chung-cu-pho-mai-phuc-phuong-phuc-dong-ruby-riverside/sap-ban-giao-long-bien-suat-ngoai-giao-uu-dai-trong-thang-1-pr44985025
Long Biên,"Chính chủ bán biệt thự 2 mặt tiền Vinhomes Riverside (không qua trung gian), giá tốt, 54 tỷ",54000.0,176.0,306.8181818181818,·P. Phúc Lợi,Đăng 6 ngày trước,,https://batdongsan.com.vn/ban-nha-biet-thu-lien-ke-duong-nguyet-que-25-phuong-phuc-loi-vinhomes-riverside/chinh-chu-ban-khong-qua-trung-gian-gia-tot-54-ty-pr45470111
Long Biên,"Việt Hưng - phố Kim Quan Thượng. Cực hiếm quỹ đất xây biệt thự sân vườn, kho xưởng. Giá đầu tư",56900.0,333.0,170.87087087087087,P. Việt Hưng,Đăng hôm qua,,https://batdongsan.com.vn/ban-dat-duong-kim-quan-thuong-phuong-viet-hung-2-9/pho-cuc-hiem-quy-at-xay-biet-thu-san-vuon-kho-xuong-gia-au-tu-pr45148234
Long Biên,"Tôi chủ nhà bán căn nhà tự xây 4.5 tầng tại ngõ 137 P.Việt Hưng, phường Việt Hưng. Gara oto 7 chỗ",15500.0,47.0,329.78723404255317,P. Việt Hưng,Đăng 2 ngày trước,,https://batdongsan.com.vn/ban-nha-rieng-pho-viet-hung-phuong-viet-hung-2-9/gia-inh-minh-can-ban-can-4-5-tang-tai-ngo-137-gara-oto-7-cho-pr45269365
Long Biên,Bán nhà mặt tiền 7m rất hiếm trên khu đất đấu giá Long Biên (Cự Khối cũ).,21500.0,91.0,236.26373626373626,P. Cự Khối (P. Long Biên mới),Đăng 3 ngày trước,,https://batdongsan.com.vn/ban-nha-rieng-duong-hoa-dong-1-phuong-cu-khoi-9/ban-mat-tien-7m-rat-hiem-tren-khu-at-au-gia-long-bien-cu-pr45340348
Long Biên,"Chính chủ cần thanh khoản gấp lô đất 61m2 mặt tiền 5m Ngọc Thụy, Long Biên, ô tô tránh",15250.0,61.0,250.0,P. Ngọc Thụy (P. Bồ Đề mới),Đăng 5 ngày trước,,https://batdongsan.com.vn/ban-dat-phuong-ngoc-thuy/chinh-chu-can-thanh-khoan-gap-lo-at-61m2-mat-tien-5m-long-bien-o-to-tranh-pr45410076
Long Biên,Bán nhà mặt chợ Thạch Bàn - Cổ Linh - kinh doanh - vỉa hè - oto tránh - thang máy,17500.0,56.0,312.5,P. Thạch Bàn (P. Long Biên mới),Đăng hôm nay,,https://batdongsan.com.vn/ban-nha-rieng-duong-nguyen-van-linh-phuong-thach-ban-1-9/mat-cho-co-kinh-doanh-via-he-oto-tranh-thang-may-pr45316600
Long Biên,180 triệu/m2. Ngọc Thuỵ đường oto 7 chỗ thông ngủ trong nhà. Rẻ nhất thị trường,21600.0,120.0,180.0,P. Ngọc Thụy (P. Bồ Đề mới),Đăng hôm nay,,https://batdongsan.com.vn/ban-nha-rieng-duong-ngoc-thuy-phuong-ngoc-thuy-9/180trieu-m2-uong-oto-7-cho-thong-ngu-trong-re-nhat-thi-truong-pr45505124
Long Biên,"Bán nhà Long Biên 49m2 x 6 tầng thang máy x 3 ngủ - Ô tô vào, lô góc cực thoáng",11000.0,49.0,224.48979591836735,P. Giang Biên (P. Việt Hưng mới),Đăng hôm nay,,https://batdongsan.com.vn/ban-nha-rieng-phuong-giang-bien-1/ban-long-50m2-x-6-tang-thang-may-x-3-ngu-o-to-vao-lo-goc-cuc-thoang-pr45137634
Long Biên,BÁN NHÀ PHÚC LỢI 51M2  4 TẦNG -Ô TÔ THÔNG  NỞ HẬU  NHÀ DÂN XÂY  GIÁ 7.3 TỶ-LONG BIÊN-HÀ NỘI,7300.0,51.0,143.13725490196077,P. Phúc Lợi,Đăng hôm nay,,https://batdongsan.com.vn/ban-nha-rieng-duong-phuc-loi-phuong-phuc-loi-9/ban-51m2-4-tang-o-to-thong-no-hau-dan-xay-gia-7-3-ty-long-bien-ha-noi-pr45509790
Long Biên,Nhà mới Phúc Lợi 6 tầng thang máy ô tô 7 chỗ ngủ trong nhà dòng tiền 14tr/th - Long Biên,9680.0,46.0,210.43478260869566,P. Phúc Lợi,Đăng hôm nay,,https://batdongsan.com.vn/ban-nha-rieng-duong-phuc-loi-phuong-phuc-loi-9/moi-6-tang-thang-may-o-to-7-cho-ngu-trong-dong-tien-14tr-th-long-bien-pr45509843
Long Biên,Bán nhà Phúc Lợi 32.3m2 - 5 tầng kinh doanh - ô tô tải đỗ cửa nở hậu full nội thất - 8.5 tỷ,8500.0,32.3,263.15789473684214,P. Phúc Lợi,Đăng hôm nay,,https://batdongsan.com.vn/ban-nha-rieng-duong-phuc-loi-phuong-phuc-loi-9/ban-32-3m2-5-tang-kinh-doanh-o-to-tai-o-cua-no-hau-full-noi-that-8-5-ty-pr45509808
Long Biên,"Bán căn ngoại giao Platinum Long Biên, căn hộ cao cấp bậc nhất thủ đô Long Biên",11780.0,76.0,155.0,·P. Long Biên,Đăng 1 tuần trước,,https://batdongsan.com.vn/ban-can-ho-chung-cu-duong-co-linh-phuong-long-bien-platinum-long-bien/ban-ngoai-giao-cao-cap-bac-nhat-thu-do-bien-pr44983775
Long Biên,"Bán Nhà riêng 51,9m2, 14,5 tỷ tại số 17A ngõ 353 Bát Khối, Long Biên, Hà Nội",14500.0,51.9,279.383429672447,P. Long Biên,Đăng hôm nay,,https://batdongsan.com.vn/ban-nha-rieng-duong-bat-khoi-phuong-long-bien-9/ban-51-9m2-14-5-ty-tai-so-17a-ngo-353-ha-noi-pr45517169
Long Biên,"Tôi cần bán nhà mới số B4 khu 918 phúc đồng, long biên,Hà Nội, 46m,8 tầng, vỉa hè,ô tô ,19,8 tỷ",19800.0,46.0,430.4347826086956,P. Phúc Đồng (P. Long Biên mới),Đăng hôm nay,,https://batdongsan.com.vn/ban-nha-rieng-duong-phuc-dong-phuong-phuc-dong-9/toi-can-ban-moi-so-20-b4-khu-918-ong-long-bien-ha-noi-46m-8-tang-via-he-o-to-19-8-ty-pr45516512
Long Biên,Cập nhật quỹ căn chuyển nhượng giá tốt nhất T4/2026 Khai Sơn City. Lh:0967 935 ***,6600.0,90.0,73.33333333333333,P. Ngọc Thụy (P. Bồ Đề mới),Đăng hôm nay,,https://batdongsan.com.vn/ban-can-ho-chung-cu-phuong-ngoc-thuy-khai-son-city/cap-nhat-quy-chuyen-nhuong-gia-tot-nhat-t4-2026-lh-pr45467773
Long Biên,Mặt phố Nguyễn Văn Cừ.Giá êm 290tr/m Full thổ cư.Diện tích cực rộng 175m2 phù hợp đầu tư.,49000.0,175.0,280.0,P. Bồ Đề,Đăng hôm nay,,https://batdongsan.com.vn/ban-nha-mat-pho-duong-nguyen-van-cu-1-phuong-bo-de-9/gia-em-290tr-m-full-tho-dien-tich-cuc-rong-175m2-phu-hop-au-tu-pr45510821
Long Biên,"Chính chủ cần bán gấp căn hộ chung cư 2PN, 80m2 tại Tòa No8, Khu đô thị Sài Đồng",5100.0,80.0,63.75,P. Sài Đồng (P. Phúc Lợi mới),Đăng hôm qua,Có,https://batdongsan.com.vn/ban-can-ho-chung-cu-phuong-sai-dong-khu-do-thi-sai-dong/chinh-chu-ban-gap-2pn-80m2-tai-toa-no8-o-ong-pr45389914
Long Biên,Quỹ căn giá tốt nhất Khai Sơn City: 1PN chỉ từ 2tỷ8 / 2PN chỉ từ 6tỷx / 3PN chỉ từ 7tỷx,6900.0,90.0,76.66666666666667,P. Ngọc Thụy (P. Bồ Đề mới),Đăng hôm qua,,https://batdongsan.com.vn/ban-can-ho-chung-cu-phuong-ngoc-thuy-khai-son-city/quy-tong-hop-gia-tot-nhat-1pn-chi-tu-2ty8-2pn-chi-tu-6tyx-3pn-chi-tu-7tyx-pr45428719
Long Biên,Hàng HOT! Căn 120m2(3PN + 3VS) - tòa K5 - 71 triệu/m2 - hỗ trợ vay ngân hàng - vào ở ngay,8520.0,120.0,71.0,P. Ngọc Thụy (P. Bồ Đề mới),Đăng hôm qua,,https://batdongsan.com.vn/ban-can-ho-chung-cu-phuong-ngoc-thuy-khai-son-city/hang-hot-120m2-3pn-3vs-toa-k5-71-trieu-m2-tro-vay-ngan-hang-vao-o-ngay-pr45420242
Long Biên,"Chính chủ cần bán căn 2PN 89m giá 6.9tỷ tại Khai Sơn, tầng đẹp hợp lý, không trực diện nghĩa trang",6900.0,89.0,77.52808988764045,P. Ngọc Thụy (P. Bồ Đề mới),Đăng 2 ngày trước,,https://batdongsan.com.vn/ban-can-ho-chung-cu-phuong-ngoc-thuy-khai-son-city/chinh-chu-ban-2pn-89m-gia-6-8x-tai-tang-ep-hop-ly-khong-truc-dien-nghia-trang-pr45479662
Long Biên,CHÍNH CHỦ BÁN LÔ 240M2 MẶT PHỐ 4 OTO TRÁNH NHAU THOẢI MÁI TẠI VIỆT HƯNG - HÀ NỘI.,,240.0,,P. Đức Giang (P. Việt Hưng mới),Đăng 2 ngày trước,,https://batdongsan.com.vn/ban-dat-duong-vu-duc-than-phuong-duc-giang-2-9/chinh-chu-ban-lo-240m2-mat-pho-4-oto-tranh-nhau-thoai-mai-tai-viet-hung-ha-noi-pr44655521
Long Biên,Siêu hiếm! bán tòa nhà dòng tiền TT Long Biên 7 tầng 12 phòng full nội thất thu nhập 1 tỷ/năm,22800.0,82.0,278.0487804878049,P. Bồ Đề,Đăng 2 ngày trước,,https://batdongsan.com.vn/ban-nha-rieng-duong-hoang-nhu-tiep-phuong-bo-de-9/sieu-hiem-ban-toa-dong-tien-tt-long-bien-7-tang-12-phong-full-noi-that-thu-nhap-1-ty-nam-pr45498502
Long Biên,"Em cần bán căn 120m Khai Sơn City tầng đẹp, vị trí xa nghĩa trang, giá 8.5x tỷ (bao phí sang tên)",8540.0,120.0,71.16666666666667,P. Ngọc Thụy (P. Bồ Đề mới),Đăng 2 ngày trước,,https://batdongsan.com.vn/ban-can-ho-chung-cu-phuong-ngoc-thuy-khai-son-city/em-ban-120m-tang-ep-vi-tri-xa-nghia-trang-gia-8-5x-bao-phi-sang-ten-pr45479604
Long Biên,"CHÍNH THỨC NHẬN BOOKING DỰ ÁN THE MAGNOLIA PRIVATE RESIDENCE LONG BIÊN, KÝ THẲNG CĐT LH0917 231 ***",10000.0,84.0,119.04761904761905,P. Ngọc Thụy (P. Bồ Đề mới),Đăng 2 ngày trước,,https://batdongsan.com.vn/ban-can-ho-chung-cu-duong-nguyen-gia-bong-phuong-ngoc-thuy-the-magnolia-private-residences/chinh-thuc-nhan-booking-du-an-residence-long-bien-ky-thang-c-t-lh-pr45494307
Long Biên,Đất Lâm Hạ.Giá hợp lý.97m2 mặt tiền 6m. Nhà 3 tầng cũ xác định bán đất,25500.0,97.0,262.88659793814435,P. Bồ Đề,Đăng 2 ngày trước,,https://batdongsan.com.vn/ban-nha-rieng-duong-lam-ha-1-phuong-bo-de-9/dat-gia-hop-ly-97m2-mat-tien-6m-3-tang-cu-xac-dinh-ban-dat-pr45133342
Long Biên,Building 8 nổi 1 hầm - view Vinhomes. 120m2 mặt tiền 10m cực hiếm. Giá tốt nhất trong phân khúc,52000.0,120.0,433.3333333333333,P. Phúc Đồng (P. Phúc Lợi mới),Đăng 3 ngày trước,,https://batdongsan.com.vn/ban-nha-rieng-duong-chu-huy-man-phuong-phuc-dong-9/building-8-noi-1-ham-view-vinhomes-120m2-mat-tien-10m-cuc-hiem-gia-tot-nhat-trong-phan-khuc-pr45132936
Long Biên,"Chị gái tôi cần bán gấp căn 89.5m2, tầng đẹp K123, đã có sổ đỏ. Giá chỉ 7.0x tỷ, bao thuế phí",7050.0,89.5,78.77094972067039,P. Ngọc Thụy (P. Bồ Đề mới),Đăng 3 ngày trước,Có,https://batdongsan.com.vn/ban-can-ho-chung-cu-phuong-ngoc-thuy-khai-son-city/chinh-chu-ban-nhanh-trong-tuan-101m-3pn-2vs-tang-trung-bc-dong-nam-view-dieu-hoa-pr43852594
Long Biên,"BIỆT THỰ VIỆT HƯNG LÔ GÓC 4 THOÁNG ĐẲNG CẤP KĐT Việt Hưng, Long Biên khu biệt thự VIP",,249.5,,P. Sài Đồng (P. Phúc Lợi mới),Đăng 4 ngày trước,,https://batdongsan.com.vn/ban-nha-rieng-duong-vu-xuan-thieu-phuong-sai-dong-9/88tr-m-x-2-tang-dan-xay-tai-ong-long-bien-can-ban-gap-giam-chao-2-ty-pr45479864
Hoài Đức,Chỉ từ 79tr/m2 - CK khủng 13.7% TTS - HTLS 0% 29 tháng - Quỹ căn view đẹp Imperia Sky Park,4560.0,55.56,82.07343412526997,·X. An Khánh,Đăng hôm nay,,https://batdongsan.com.vn/ban-can-ho-chung-cu-duong-dai-lo-thang-long-xa-an-khanh-4-imperia-sky-park/chi-81tr-m2-ck-khung-13-7-tts-quy-hang-sang-ngay-vinhomes-smart-city-pr45489512
Hoài Đức,"Quỹ Căn 1N+ 2PN giá tốt nhất Imperia Sky Park chỉ từ 3,45 tỷ, thanh khoản cao, hỗ trợ LS 24 tháng",3430.0,44.0,77.95454545454545,·X. An Khánh,Đăng hôm nay,,https://batdongsan.com.vn/ban-can-ho-chung-cu-duong-dai-lo-thang-long-xa-an-khanh-4-imperia-sky-park/quy-1n-2pn-gia-tot-nhat-chi-tu-3-45-ty-thanh-khoan-cao-tro-ls-24-thang-pr45515077
Hoài Đức,"Danh sách căn hộ chuyển nhượng tại The Wisteria loại 2 - 3 - 4PN và Duplex - Sẵn sổ _ Giá từ 5,8 tỷ",5900.0,73.0,80.82191780821918,·X. Di Trạch (X. Hoài Đức mới),Đăng hôm qua,,https://batdongsan.com.vn/ban-can-ho-chung-cu-duong-32-xa-di-trach-chung-cu-the-wisteria/danh-sach-chuyen-nhuong-tai-loai-2-3-4pn-va-duplex-san-so-gia-tu-5-8-ty-pr45498157
Hoài Đức,"Hàng chủ đầu tư - sổ đỏ chuyển nhượng dự án đấu giá Đông Dương, Đức Thượng",11850.0,80.0,148.125,X. Đức Thượng (X. Hoài Đức mới),Đăng hôm nay,,https://batdongsan.com.vn/ban-nha-biet-thu-lien-ke-duong-quoc-lo-32-xa-duc-thuong-dong-duong-residence/hang-chu-dau-tu-so-do-chuyen-nhuong-du-an-dau-gia-thuong-pr44097550
Hoài Đức,Biệt thự Khu đô thị Lideco 222m2 giá 25 tỷ. Cơ hội đầu tư giữ tiền hiếm,25000.0,222.0,112.61261261261261,TT. Trạm Trôi (X. Hoài Đức mới),Đăng hôm qua,,https://batdongsan.com.vn/ban-nha-biet-thu-lien-ke-duong-quoc-lo-32-thi-tran-tram-troi-khu-do-thi-moi-lideco-bac-quoc-lo-32/hang-oc-quyen-vuon-ang-cap-gia-sieu-hap-dan-98tr-m2-s-288m2-full-gia-28-ty-pr45378566
Hoài Đức,"Chính chủ gửi bán BT đơn lập gần hồ, giá đầu tư tại Vinhomes Thăng Long",36120.0,172.0,210.0,X. An Khánh,Đăng hôm nay,,https://batdongsan.com.vn/ban-nha-biet-thu-lien-ke-xa-an-khanh-4-vinhomes-thang-long/chinh-chu-gui-ban-bt-on-lap-gan-ho-gia-au-tu-tai-long-pr45511089
Hoài Đức,Gia đình cần tiền bán cắt lỗ lô đất mặt đường LK8 giá tốt,14420.0,62.7,229.98405103668262,X. An Khánh,Đăng 2 ngày trước,Có,https://batdongsan.com.vn/ban-dat-duong-an-thuong-xa-an-khanh-4-21/gia-inh-can-tien-ban-cat-lo-lo-at-mat-uong-lk8-gia-tot-pr45439725
Hoài Đức,"Bán nhà chung cư The Golden An Khánh, tòa 32T, căn góc, 93m2, 3PN, 2VS",6000.0,93.4,64.23982869379014,X. An Khánh,Đăng 3 ngày trước,,https://batdongsan.com.vn/ban-can-ho-chung-cu-xa-an-khanh-4-the-golden-an-khanh-32t/ban-nha-toa-goc-93m2-3pn-2vs-pr45392656
Hoài Đức,BT Vinhomes Thăng Long Lô góc - BT 177.1m2 giá rẻ,37190.0,177.1,209.99435347261434,X. An Khánh,Đăng 3 ngày trước,Có,https://batdongsan.com.vn/ban-nha-biet-thu-lien-ke-duong-long-khanh-xa-an-khanh-4-vinhomes-thang-long/cap-nhat-20-02-gia-chi-tu-160-trieu-m-full-noi-that-pr42218032
Hoài Đức,"Hiếm nhà La Phù 3 mặt thoáng, trung tâm La Phù. DT 31.3m2 x 4 tầng. Đường thông",5130.0,31.3,163.89776357827475,X. La Phù (X. An Khánh mới),Đăng 3 ngày trước,,https://batdongsan.com.vn/ban-nha-rieng-duong-la-phu-xa-la-phu-21/hiem-3-mat-thoang-trung-tam-dt-31-3m2-x-4-tang-uong-thong-pr45464577
Hoài Đức,"Chính chủ chuyển nhượng biệt thự Vista Lago, view hồ 7ha Vista Nam An Khánh giá tốt nhất thị trường",92040.0,497.5,185.00502512562815,X. An Khánh,Đăng 4 ngày trước,,https://batdongsan.com.vn/ban-nha-biet-thu-lien-ke-duong-lang-hoa-lac-xa-an-khanh-4-khu-do-thi-nam-an-khanh/chinh-chu-chuyen-nhuong-vista-lago-view-ho-7ha-vista-gia-tot-nhat-truong-pr43961279
Hoài Đức,Bán biệt thự Phương Viên E29-BT02 giá tốt nhất thị trường chỉ 146 triệu/m2 Mailand Hanoi City,40620.0,278.2,146.0100647016535,X. An Khánh (X. Sơn Đồng mới),Đăng 4 ngày trước,,https://batdongsan.com.vn/ban-nha-biet-thu-lien-ke-duong-dai-lo-thang-long-xa-an-khanh-4-mailand-hanoi-city/ban-phuong-vien-e29-bt02-gia-tot-nhat-thi-truong-chi-146-trieu-m2-city-pr44221702
Hoài Đức,"Bán liền kề đường 24m dự án đấu giá Đông Dương, Đức Thượng",13700.0,80.0,171.25,X. Đức Thượng (X. Hoài Đức mới),Đăng hôm nay,,https://batdongsan.com.vn/ban-nha-biet-thu-lien-ke-duong-quoc-lo-32-xa-duc-thuong-dong-duong-residence/hang-chu-dau-tu-so-do-chuyen-nhuong-du-an-dau-gia-thuong-pr44597673
